{
 "name": "Programmer Jokes",
 "type": "public_channel",
 "id": 1001142398,
 "messages": [
  {
   "id": 1,
   "type": "service",
   "date": "2015-09-26T06:04:30",
   "date_unixtime": "1443222270",
   "actor": "Programmer Jokes",
   "actor_id": "channel1001142398",
   "action": "create_channel",
   "title": "Programmer Jokes",
   "text": "",
   "text_entities": []
  },
  {
   "id": 3,
   "type": "message",
   "date": "2015-09-26T13:30:48",
   "date_unixtime": "1443249048",
   "from": "Programmer Jokes",
   "from_id": "channel1001142398",
   "photo": "photos/photo_1@26-09-2015_13-30-48.jpg",
   "width": 640,
   "height": 1136,
   "text": "",
   "text_entities": []
  },
  {
   "id": 4,
   "type": "message",
   "date": "2015-09-26T13:51:06",
   "date_unixtime": "1443250266",
   "from": "Programmer Jokes",
   "from_id": "channel1001142398",
   "photo": "photos/photo_2@26-09-2015_13-51-06.jpg",
   "width": 459,
   "height": 330,
   "text": "",
   "text_entities": []
  },
  {
   "id": 5,
   "type": "message",
   "date": "2015-09-27T04:21:41",
   "date_unixtime": "1443302501",
   "from": "Programmer Jokes",
   "from_id": "channel1001142398",
   "photo": "photos/photo_3@27-09-2015_04-21-41.jpg",
   "width": 640,
   "height": 1136,
   "text": "",
   "text_entities": []
  },
  {
   "id": 6,
   "type": "message",
   "date": "2015-09-27T06:56:11",
   "date_unixtime": "1443311771",
   "from": "Programmer Jokes",
   "from_id": "channel1001142398",
   "photo": "photos/photo_4@27-09-2015_06-56-11.jpg",
   "width": 700,
   "height": 420,
   "text": "",
   "text_entities": []
  },
  {
   "id": 7,
   "type": "message",
   "date": "2015-09-28T02:47:40",
   "date_unixtime": "1443383260",
   "from": "Programmer Jokes",
   "from_id": "channel1001142398",
   "photo": "photos/photo_5@28-09-2015_02-47-40.jpg",
   "width": 360,
   "height": 299,
   "text": "",
   "text_entities": []
  },
  {
   "id": 8,
   "type": "message",
   "date": "2015-09-28T03:06:24",
   "date_unixtime": "1443384384",
   "from": "Programmer Jokes",
   "from_id": "channel1001142398",
   "photo": "photos/photo_6@28-09-2015_03-06-24.jpg",
   "width": 485,
   "height": 679,
   "text": "",
   "text_entities": []
  },
  {
   "id": 12,
   "type": "service",
   "date": "2015-09-28T03:35:48",
   "date_unixtime": "1443386148",
   "actor": "Programmer Jokes",
   "actor_id": "channel1001142398",
   "action": "edit_group_photo",
   "photo": "photos/photo_7@28-09-2015_03-35-48.jpg",
   "width": 640,
   "height": 640,
   "text": "",
   "text_entities": []
  },
  {
   "id": 14,
   "type": "message",
   "date": "2015-09-28T12:14:56",
   "date_unixtime": "1443417296",
   "from": "Programmer Jokes",
   "from_id": "channel1001142398",
   "photo": "photos/photo_8@28-09-2015_12-14-56.jpg",
   "width": 960,
   "height": 615,
   "text": "",
   "text_entities": []
  },
  {
   "id": 15,
   "type": "service",
   "date": "2015-09-28T12:19:40",
   "date_unixtime": "1443417580",
   "actor": "Programmer Jokes",
   "actor_id": "channel1001142398",
   "action": "edit_group_photo",
   "photo": "photos/photo_9@28-09-2015_12-19-40.jpg",
   "width": 640,
   "height": 640,
   "text": "",
   "text_entities": []
  },
  {
   "id": 16,
   "type": "message",
   "date": "2015-09-28T14:36:41",
   "date_unixtime": "1443425801",
   "from": "Programmer Jokes",
   "from_id": "channel1001142398",
   "photo": "photos/photo_10@28-09-2015_14-36-41.jpg",
   "width": 720,
   "height": 888,
   "text": "",
   "text_entities": []
  },
  {
   "id": 17,
   "type": "message",
   "date": "2015-09-28T20:38:16",
   "date_unixtime": "1443447496",
   "from": "Programmer Jokes",
   "from_id": "channel1001142398",
   "photo": "photos/photo_11@28-09-2015_20-38-16.jpg",
   "width": 467,
   "height": 312,
   "text": "",
   "text_entities": []
  },
  {
   "id": 18,
   "type": "message",
   "date": "2015-09-28T20:39:47",
   "date_unixtime": "1443447587",
   "from": "Programmer Jokes",
   "from_id": "channel1001142398",
   "photo": "photos/photo_12@28-09-2015_20-39-47.jpg",
   "width": 350,
   "height": 382,
   "text": "",
   "text_entities": []
  },
  {
   "id": 19,
   "type": "message",
   "date": "2015-09-28T20:42:20",
   "date_unixtime": "1443447740",
   "from": "Programmer Jokes",
   "from_id": "channel1001142398",
   "photo": "photos/photo_13@28-09-2015_20-42-20.jpg",
   "width": 960,
   "height": 863,
   "text": "",
   "text_entities": []
  },
  {
   "id": 20,
   "type": "message",
   "date": "2015-09-28T20:55:00",
   "date_unixtime": "1443448500",
   "from": "Programmer Jokes",
   "from_id": "channel1001142398",
   "photo": "photos/photo_14@28-09-2015_20-55-00.jpg",
   "width": 456,
   "height": 314,
   "text": "",
   "text_entities": []
  },
  {
   "id": 21,
   "type": "message",
   "date": "2015-09-28T20:57:48",
   "date_unixtime": "1443448668",
   "from": "Programmer Jokes",
   "from_id": "channel1001142398",
   "text": "Mysql was going to a nosql party\nGuess what.?.?!!\n\nNo tables",
   "text_entities": [
    {
     "type": "plain",
     "text": "Mysql was going to a nosql party\nGuess what.?.?!!\n\nNo tables"
    }
   ]
  },
  {
   "id": 22,
   "type": "message",
   "date": "2015-09-29T18:22:52",
   "date_unixtime": "1443525772",
   "from": "Programmer Jokes",
   "from_id": "channel1001142398",
   "photo": "photos/photo_15@29-09-2015_18-22-52.jpg",
   "width": 500,
   "height": 275,
   "text": "",
   "text_entities": []
  },
  {
   "id": 23,
   "type": "message",
   "date": "2015-09-29T18:25:08",
   "date_unixtime": "1443525908",
   "from": "Programmer Jokes",
   "from_id": "channel1001142398",
   "photo": "photos/photo_16@29-09-2015_18-25-08.jpg",
   "width": 413,
   "height": 360,
   "text": "",
   "text_entities": []
  },
  {
   "id": 24,
   "type": "message",
   "date": "2015-09-29T23:57:32",
   "date_unixtime": "1443545852",
   "from": "Programmer Jokes",
   "from_id": "channel1001142398",
   "photo": "photos/photo_17@29-09-2015_23-57-32.jpg",
   "width": 640,
   "height": 1136,
   "text": "",
   "text_entities": []
  },
  {
   "id": 25,
   "type": "message",
   "date": "2015-09-30T03:12:32",
   "date_unixtime": "1443557552",
   "from": "Programmer Jokes",
   "from_id": "channel1001142398",
   "photo": "photos/photo_18@30-09-2015_03-12-32.jpg",
   "width": 570,
   "height": 300,
   "text": "",
   "text_entities": []
  },
  {
   "id": 26,
   "type": "message",
   "date": "2015-09-30T03:52:12",
   "date_unixtime": "1443559932",
   "from": "Programmer Jokes",
   "from_id": "channel1001142398",
   "photo": "photos/photo_19@30-09-2015_03-52-12.jpg",
   "width": 374,
   "height": 433,
   "text": "",
   "text_entities": []
  },
  {
   "id": 27,
   "type": "message",
   "date": "2015-09-30T04:10:40",
   "date_unixtime": "1443561040",
   "from": "Programmer Jokes",
   "from_id": "channel1001142398",
   "text": "There are 10 types of people. People who understand binary and people who don't.",
   "text_entities": [
    {
     "type": "plain",
     "text": "There are 10 types of people. People who understand binary and people who don't."
    }
   ]
  },
  {
   "id": 28,
   "type": "message",
   "date": "2015-09-30T13:24:28",
   "date_unixtime": "1443594268",
   "from": "Programmer Jokes",
   "from_id": "channel1001142398",
   "photo": "photos/photo_20@30-09-2015_13-24-28.jpg",
   "width": 625,
   "height": 477,
   "text": "",
   "text_entities": []
  },
  {
   "id": 29,
   "type": "message",
   "date": "2015-09-30T13:24:28",
   "date_unixtime": "1443594268",
   "from": "Programmer Jokes",
   "from_id": "channel1001142398",
   "photo": "photos/photo_21@30-09-2015_13-24-28.jpg",
   "width": 485,
   "height": 272,
   "text": "",
   "text_entities": []
  },
  {
   "id": 30,
   "type": "message",
   "date": "2015-09-30T16:27:04",
   "date_unixtime": "1443605224",
   "from": "Programmer Jokes",
   "from_id": "channel1001142398",
   "photo": "photos/photo_22@30-09-2015_16-27-04.jpg",
   "width": 640,
   "height": 1136,
   "text": "",
   "text_entities": []
  },
  {
   "id": 31,
   "type": "message",
   "date": "2015-09-30T16:48:48",
   "date_unixtime": "1443606528",
   "from": "Programmer Jokes",
   "from_id": "channel1001142398",
   "photo": "photos/photo_23@30-09-2015_16-48-48.jpg",
   "width": 640,
   "height": 1136,
   "text": "",
   "text_entities": []
  },
  {
   "id": 32,
   "type": "message",
   "date": "2015-10-01T12:57:52",
   "date_unixtime": "1443679072",
   "from": "Programmer Jokes",
   "from_id": "channel1001142398",
   "photo": "photos/photo_24@01-10-2015_12-57-52.jpg",
   "width": 455,
   "height": 695,
   "text": "",
   "text_entities": []
  },
  {
   "id": 33,
   "type": "message",
   "date": "2015-10-01T18:10:04",
   "date_unixtime": "1443697804",
   "from": "Programmer Jokes",
   "from_id": "channel1001142398",
   "photo": "photos/photo_25@01-10-2015_18-10-04.jpg",
   "width": 640,
   "height": 1136,
   "text": "",
   "text_entities": []
  },
  {
   "id": 34,
   "type": "message",
   "date": "2015-10-02T05:17:40",
   "date_unixtime": "1443737860",
   "from": "Programmer Jokes",
   "from_id": "channel1001142398",
   "photo": "photos/photo_26@02-10-2015_05-17-40.jpg",
   "width": 640,
   "height": 1136,
   "text": "",
   "text_entities": []
  },
  {
   "id": 35,
   "type": "message",
   "date": "2015-10-02T05:50:08",
   "date_unixtime": "1443739808",
   "from": "Programmer Jokes",
   "from_id": "channel1001142398",
   "photo": "photos/photo_27@02-10-2015_05-50-08.jpg",
   "width": 640,
   "height": 1136,
   "text": "",
   "text_entities": []
  },
  {
   "id": 36,
   "type": "message",
   "date": "2015-10-02T05:50:28",
   "date_unixtime": "1443739828",
   "from": "Programmer Jokes",
   "from_id": "channel1001142398",
   "photo": "photos/photo_28@02-10-2015_05-50-28.jpg",
   "width": 640,
   "height": 1136,
   "text": "",
   "text_entities": []
  },
  {
   "id": 37,
   "type": "message",
   "date": "2015-10-03T16:23:32",
   "date_unixtime": "1443864212",
   "from": "Programmer Jokes",
   "from_id": "channel1001142398",
   "photo": "photos/photo_29@03-10-2015_16-23-32.jpg",
   "width": 640,
   "height": 1136,
   "text": "",
   "text_entities": []
  },
  {
   "id": 38,
   "type": "message",
   "date": "2015-10-04T14:04:12",
   "date_unixtime": "1443942252",
   "from": "Programmer Jokes",
   "from_id": "channel1001142398",
   "text": "Q: How do you tell an introverted computer scientist from an extroverted computer scientist?\n\nA: An extroverted computer scientist looks atyour shoes when he talks to you.",
   "text_entities": [
    {
     "type": "plain",
     "text": "Q: How do you tell an introverted computer scientist from an extroverted computer scientist?\n\nA: An extroverted computer scientist looks atyour shoes when he talks to you."
    }
   ]
  },
  {
   "id": 39,
   "type": "message",
   "date": "2015-10-05T00:18:24",
   "date_unixtime": "1443979104",
   "from": "Programmer Jokes",
   "from_id": "channel1001142398",
   "photo": "photos/photo_30@05-10-2015_00-18-24.jpg",
   "width": 597,
   "height": 807,
   "text": "",
   "text_entities": []
  },
  {
   "id": 40,
   "type": "message",
   "date": "2015-10-05T01:27:56",
   "date_unixtime": "1443983276",
   "from": "Programmer Jokes",
   "from_id": "channel1001142398",
   "photo": "photos/photo_31@05-10-2015_01-27-56.jpg",
   "width": 640,
   "height": 1136,
   "text": "",
   "text_entities": []
  },
  {
   "id": 41,
   "type": "message",
   "date": "2015-10-05T20:12:40",
   "date_unixtime": "1444050760",
   "from": "Programmer Jokes",
   "from_id": "channel1001142398",
   "text": "Q: \"Whats the object-oriented way to become wealthy?\"\n\nA: Inheritance",
   "text_entities": [
    {
     "type": "plain",
     "text": "Q: \"Whats the object-oriented way to become wealthy?\"\n\nA: Inheritance"
    }
   ]
  },
  {
   "id": 42,
   "type": "message",
   "date": "2015-10-05T20:34:48",
   "date_unixtime": "1444052088",
   "from": "Programmer Jokes",
   "from_id": "channel1001142398",
   "photo": "photos/photo_32@05-10-2015_20-34-48.jpg",
   "width": 400,
   "height": 338,
   "text": "",
   "text_entities": []
  },
  {
   "id": 43,
   "type": "message",
   "date": "2015-10-06T06:00:20",
   "date_unixtime": "1444086020",
   "from": "Programmer Jokes",
   "from_id": "channel1001142398",
   "text": "Q: how many programmers does it take to change a light bulb?\n\nA: none, that's a hardware problem",
   "text_entities": [
    {
     "type": "plain",
     "text": "Q: how many programmers does it take to change a light bulb?\n\nA: none, that's a hardware problem"
    }
   ]
  },
  {
   "id": 44,
   "type": "message",
   "date": "2015-10-06T06:02:44",
   "date_unixtime": "1444086164",
   "from": "Programmer Jokes",
   "from_id": "channel1001142398",
   "photo": "photos/photo_33@06-10-2015_06-02-44.jpg",
   "width": 675,
   "height": 577,
   "text": "",
   "text_entities": []
  },
  {
   "id": 45,
   "type": "message",
   "date": "2015-10-06T17:22:28",
   "date_unixtime": "1444126948",
   "from": "Programmer Jokes",
   "from_id": "channel1001142398",
   "photo": "photos/photo_34@06-10-2015_17-22-28.jpg",
   "width": 460,
   "height": 460,
   "text": "",
   "text_entities": []
  },
  {
   "id": 46,
   "type": "message",
   "date": "2015-10-08T13:18:26",
   "date_unixtime": "1444285106",
   "from": "Programmer Jokes",
   "from_id": "channel1001142398",
   "photo": "photos/photo_35@08-10-2015_13-18-26.jpg",
   "width": 640,
   "height": 1136,
   "text": "",
   "text_entities": []
  },
  {
   "id": 47,
   "type": "message",
   "date": "2015-10-08T13:26:12",
   "date_unixtime": "1444285572",
   "from": "Programmer Jokes",
   "from_id": "channel1001142398",
   "text": "100 members already :) we try to serve you the best jokes :)",
   "text_entities": [
    {
     "type": "plain",
     "text": "100 members already :) we try to serve you the best jokes :)"
    }
   ]
  },
  {
   "id": 48,
   "type": "message",
   "date": "2015-10-08T13:44:12",
   "date_unixtime": "1444286652",
   "from": "Programmer Jokes",
   "from_id": "channel1001142398",
   "photo": "photos/photo_36@08-10-2015_13-44-12.jpg",
   "width": 700,
   "height": 467,
   "text": "",
   "text_entities": []
  },
  {
   "id": 49,
   "type": "message",
   "date": "2015-10-08T19:01:20",
   "date_unixtime": "1444305680",
   "from": "Programmer Jokes",
   "from_id": "channel1001142398",
   "text": [
    {
     "type": "link",
     "text": "https://medium.com/@webseanhickey/the-evolution-of-a-software-engineer-db854689243"
    }
   ],
   "text_entities": [
    {
     "type": "link",
     "text": "https://medium.com/@webseanhickey/the-evolution-of-a-software-engineer-db854689243"
    }
   ]
  },
  {
   "id": 51,
   "type": "service",
   "date": "2015-10-08T20:03:16",
   "date_unixtime": "1444309396",
   "actor": "Programmer Jokes",
   "actor_id": "channel1001142398",
   "action": "edit_group_photo",
   "photo": "photos/photo_37@08-10-2015_20-03-16.jpg",
   "width": 640,
   "height": 640,
   "text": "",
   "text_entities": []
  },
  {
   "id": 52,
   "type": "message",
   "date": "2015-10-09T14:39:16",
   "date_unixtime": "1444376356",
   "from": "Programmer Jokes",
   "from_id": "channel1001142398",
   "photo": "photos/photo_38@09-10-2015_14-39-16.jpg",
   "width": 561,
   "height": 592,
   "text": "",
   "text_entities": []
  },
  {
   "id": 53,
   "type": "message",
   "date": "2015-10-09T22:39:32",
   "date_unixtime": "1444405172",
   "from": "Programmer Jokes",
   "from_id": "channel1001142398",
   "text": "Unix is user friendly. It's just very particular about who its friends are.",
   "text_entities": [
    {
     "type": "plain",
     "text": "Unix is user friendly. It's just very particular about who its friends are."
    }
   ]
  },
  {
   "id": 54,
   "type": "message",
   "date": "2015-10-10T22:32:32",
   "date_unixtime": "1444491152",
   "from": "Programmer Jokes",
   "from_id": "channel1001142398",
   "photo": "photos/photo_39@10-10-2015_22-32-32.jpg",
   "width": 720,
   "height": 720,
   "text": "",
   "text_entities": []
  },
  {
   "id": 55,
   "type": "message",
   "date": "2015-10-10T23:20:20",
   "date_unixtime": "1444494020",
   "from": "Programmer Jokes",
   "from_id": "channel1001142398",
   "photo": "photos/photo_40@10-10-2015_23-20-20.jpg",
   "width": 640,
   "height": 1136,
   "text": "",
   "text_entities": []
  },
  {
   "id": 59,
   "type": "message",
   "date": "2015-10-11T04:40:40",
   "date_unixtime": "1444513240",
   "from": "Programmer Jokes",
   "from_id": "channel1001142398",
   "photo": "photos/photo_41@11-10-2015_04-40-40.jpg",
   "width": 1280,
   "height": 720,
   "text": "",
   "text_entities": []
  },
  {
   "id": 60,
   "type": "message",
   "date": "2015-10-11T17:05:32",
   "date_unixtime": "1444557932",
   "from": "Programmer Jokes",
   "from_id": "channel1001142398",
   "photo": "photos/photo_42@11-10-2015_17-05-32.jpg",
   "width": 500,
   "height": 649,
   "text": "",
   "text_entities": []
  },
  {
   "id": 61,
   "type": "message",
   "date": "2015-10-11T19:34:49",
   "date_unixtime": "1444566889",
   "from": "Programmer Jokes",
   "from_id": "channel1001142398",
   "photo": "photos/photo_43@11-10-2015_19-34-49.jpg",
   "width": 480,
   "height": 480,
   "text": "",
   "text_entities": []
  },
  {
   "id": 62,
   "type": "message",
   "date": "2015-10-11T19:45:53",
   "date_unixtime": "1444567553",
   "from": "Programmer Jokes",
   "from_id": "channel1001142398",
   "photo": "photos/photo_44@11-10-2015_19-45-53.jpg",
   "width": 418,
   "height": 368,
   "text": "",
   "text_entities": []
  },
  {
   "id": 63,
   "type": "message",
   "date": "2015-10-11T20:45:04",
   "date_unixtime": "1444571104",
   "from": "Programmer Jokes",
   "from_id": "channel1001142398",
   "photo": "photos/photo_45@11-10-2015_20-45-04.jpg",
   "width": 800,
   "height": 550,
   "text": "",
   "text_entities": []
  },
  {
   "id": 64,
   "type": "message",
   "date": "2015-10-12T00:49:38",
   "date_unixtime": "1444585778",
   "from": "Programmer Jokes",
   "from_id": "channel1001142398",
   "photo": "photos/photo_46@12-10-2015_00-49-38.jpg",
   "width": 480,
   "height": 527,
   "text": "",
   "text_entities": []
  },
  {
   "id": 66,
   "type": "message",
   "date": "2015-10-12T13:01:08",
   "date_unixtime": "1444629668",
   "from": "Programmer Jokes",
   "from_id": "channel1001142398",
   "photo": "photos/photo_47@12-10-2015_13-01-08.jpg",
   "width": 600,
   "height": 612,
   "text": "",
   "text_entities": []
  },
  {
   "id": 67,
   "type": "message",
   "date": "2015-10-12T13:59:40",
   "date_unixtime": "1444633180",
   "from": "Programmer Jokes",
   "from_id": "channel1001142398",
   "photo": "photos/photo_48@12-10-2015_13-59-40.jpg",
   "width": 580,
   "height": 508,
   "text": "",
   "text_entities": []
  },
  {
   "id": 68,
   "type": "message",
   "date": "2015-10-12T15:06:24",
   "date_unixtime": "1444637184",
   "from": "Programmer Jokes",
   "from_id": "channel1001142398",
   "photo": "photos/photo_49@12-10-2015_15-06-24.jpg",
   "width": 634,
   "height": 602,
   "text": "",
   "text_entities": []
  },
  {
   "id": 69,
   "type": "message",
   "date": "2015-10-12T20:12:20",
   "date_unixtime": "1444655540",
   "from": "Programmer Jokes",
   "from_id": "channel1001142398",
   "forwarded_from": "ProgrammerExcuses",
   "text": "The sales department asked for it to be that way",
   "text_entities": [
    {
     "type": "plain",
     "text": "The sales department asked for it to be that way"
    }
   ]
  },
  {
   "id": 70,
   "type": "message",
   "date": "2015-10-12T21:08:12",
   "date_unixtime": "1444658892",
   "from": "Programmer Jokes",
   "from_id": "channel1001142398",
   "photo": "photos/photo_50@12-10-2015_21-08-12.jpg",
   "width": 480,
   "height": 288,
   "text": "",
   "text_entities": []
  },
  {
   "id": 71,
   "type": "message",
   "date": "2015-10-12T21:14:52",
   "date_unixtime": "1444659292",
   "from": "Programmer Jokes",
   "from_id": "channel1001142398",
   "photo": "photos/photo_51@12-10-2015_21-14-52.jpg",
   "width": 720,
   "height": 451,
   "text": "",
   "text_entities": []
  },
  {
   "id": 74,
   "type": "message",
   "date": "2015-10-13T20:19:51",
   "date_unixtime": "1444742391",
   "from": "Programmer Jokes",
   "from_id": "channel1001142398",
   "forwarded_from": "ProgrammerExcuses",
   "text": "I didn't write that part of the system",
   "text_entities": [
    {
     "type": "plain",
     "text": "I didn't write that part of the system"
    }
   ]
  },
  {
   "id": 75,
   "type": "message",
   "date": "2015-10-14T12:53:44",
   "date_unixtime": "1444802024",
   "from": "Programmer Jokes",
   "from_id": "channel1001142398",
   "text": "Q: What is the difference between a programmer and a non-programmer ?\n\nA: The non-programmer thinks a kilobyte is 1000 bytes while a programmer is convinced that a kilometer is 1024 meters",
   "text_entities": [
    {
     "type": "plain",
     "text": "Q: What is the difference between a programmer and a non-programmer ?\n\nA: The non-programmer thinks a kilobyte is 1000 bytes while a programmer is convinced that a kilometer is 1024 meters"
    }
   ]
  },
  {
   "id": 77,
   "type": "message",
   "date": "2015-10-15T02:59:03",
   "date_unixtime": "1444852743",
   "from": "Programmer Jokes",
   "from_id": "channel1001142398",
   "text": "If you listen to a UNIX shell, can you hear the C?",
   "text_entities": [
    {
     "type": "plain",
     "text": "If you listen to a UNIX shell, can you hear the C?"
    }
   ]
  },
  {
   "id": 79,
   "type": "message",
   "date": "2015-10-15T03:43:36",
   "date_unixtime": "1444855416",
   "from": "Programmer Jokes",
   "from_id": "channel1001142398",
   "photo": "photos/photo_52@15-10-2015_03-43-36.jpg",
   "width": 312,
   "height": 928,
   "text": "",
   "text_entities": []
  },
  {
   "id": 80,
   "type": "message",
   "date": "2015-10-15T03:45:04",
   "date_unixtime": "1444855504",
   "from": "Programmer Jokes",
   "from_id": "channel1001142398",
   "photo": "photos/photo_53@15-10-2015_03-45-04.jpg",
   "width": 460,
   "height": 720,
   "text": "",
   "text_entities": []
  },
  {
   "id": 81,
   "type": "message",
   "date": "2015-10-15T04:01:57",
   "date_unixtime": "1444856517",
   "from": "Programmer Jokes",
   "from_id": "channel1001142398",
   "photo": "photos/photo_54@15-10-2015_04-01-57.jpg",
   "width": 800,
   "height": 800,
   "text": "",
   "text_entities": []
  },
  {
   "id": 82,
   "type": "message",
   "date": "2015-10-15T04:17:51",
   "date_unixtime": "1444857471",
   "from": "Programmer Jokes",
   "from_id": "channel1001142398",
   "photo": "photos/photo_55@15-10-2015_04-17-51.jpg",
   "width": 480,
   "height": 308,
   "text": "",
   "text_entities": []
  },
  {
   "id": 83,
   "type": "message",
   "date": "2015-10-15T04:58:20",
   "date_unixtime": "1444859900",
   "from": "Programmer Jokes",
   "from_id": "channel1001142398",
   "photo": "photos/photo_56@15-10-2015_04-58-20.jpg",
   "width": 640,
   "height": 1136,
   "text": "",
   "text_entities": []
  },
  {
   "id": 84,
   "type": "message",
   "date": "2015-10-15T05:51:00",
   "date_unixtime": "1444863060",
   "from": "Programmer Jokes",
   "from_id": "channel1001142398",
   "text": "Eight bytes walk into a bar. The bartender asks, “Can I get you anything?”\n\n“Yeah,” reply the bytes. “Make us a double.”",
   "text_entities": [
    {
     "type": "plain",
     "text": "Eight bytes walk into a bar. The bartender asks, “Can I get you anything?”\n\n“Yeah,” reply the bytes. “Make us a double.”"
    }
   ]
  },
  {
   "id": 85,
   "type": "message",
   "date": "2015-10-15T13:06:12",
   "date_unixtime": "1444889172",
   "from": "Programmer Jokes",
   "from_id": "channel1001142398",
   "photo": "photos/photo_57@15-10-2015_13-06-12.jpg",
   "width": 640,
   "height": 1136,
   "text": "",
   "text_entities": []
  },
  {
   "id": 86,
   "type": "message",
   "date": "2015-10-15T13:43:20",
   "date_unixtime": "1444891400",
   "from": "Programmer Jokes",
   "from_id": "channel1001142398",
   "photo": "photos/photo_58@15-10-2015_13-43-20.jpg",
   "width": 700,
   "height": 630,
   "text": "",
   "text_entities": []
  },
  {
   "id": 87,
   "type": "message",
   "date": "2015-10-15T13:44:28",
   "date_unixtime": "1444891468",
   "from": "Programmer Jokes",
   "from_id": "channel1001142398",
   "photo": "photos/photo_59@15-10-2015_13-44-28.jpg",
   "width": 800,
   "height": 1192,
   "text": "",
   "text_entities": []
  },
  {
   "id": 88,
   "type": "message",
   "date": "2015-10-16T22:13:56",
   "date_unixtime": "1445008436",
   "from": "Programmer Jokes",
   "from_id": "channel1001142398",
   "photo": "photos/photo_60@16-10-2015_22-13-56.jpg",
   "width": 640,
   "height": 1136,
   "text": "",
   "text_entities": []
  },
  {
   "id": 89,
   "type": "message",
   "date": "2015-10-17T00:43:29",
   "date_unixtime": "1445017409",
   "from": "Programmer Jokes",
   "from_id": "channel1001142398",
   "photo": "photos/photo_61@17-10-2015_00-43-29.jpg",
   "width": 640,
   "height": 1136,
   "text": "",
   "text_entities": []
  },
  {
   "id": 90,
   "type": "message",
   "date": "2015-10-17T02:00:53",
   "date_unixtime": "1445022053",
   "from": "Programmer Jokes",
   "from_id": "channel1001142398",
   "photo": "photos/photo_62@17-10-2015_02-00-53.jpg",
   "width": 662,
   "height": 639,
   "text": "",
   "text_entities": []
  },
  {
   "id": 91,
   "type": "message",
   "date": "2015-10-17T03:56:20",
   "date_unixtime": "1445028980",
   "from": "Programmer Jokes",
   "from_id": "channel1001142398",
   "photo": "photos/photo_63@17-10-2015_03-56-20.jpg",
   "width": 640,
   "height": 1136,
   "text": "",
   "text_entities": []
  },
  {
   "id": 92,
   "type": "message",
   "date": "2015-10-17T15:02:20",
   "date_unixtime": "1445068940",
   "from": "Programmer Jokes",
   "from_id": "channel1001142398",
   "file": "(File not included. Change data exporting settings to download.)",
   "thumbnail": "(File not included. Change data exporting settings to download.)",
   "media_type": "video_file",
   "mime_type": "video/mp4",
   "duration_seconds": 2,
   "width": 460,
   "height": 258,
   "text": "",
   "text_entities": []
  },
  {
   "id": 93,
   "type": "message",
   "date": "2015-10-17T19:40:04",
   "date_unixtime": "1445085604",
   "from": "Programmer Jokes",
   "from_id": "channel1001142398",
   "photo": "photos/photo_64@17-10-2015_19-40-04.jpg",
   "width": 1600,
   "height": 1588,
   "text": "",
   "text_entities": []
  },
  {
   "id": 94,
   "type": "message",
   "date": "2015-10-19T23:48:23",
   "date_unixtime": "1445273303",
   "from": "Programmer Jokes",
   "from_id": "channel1001142398",
   "photo": "photos/photo_65@19-10-2015_23-48-23.jpg",
   "width": 640,
   "height": 274,
   "text": "",
   "text_entities": []
  },
  {
   "id": 95,
   "type": "message",
   "date": "2015-10-19T23:49:23",
   "date_unixtime": "1445273363",
   "from": "Programmer Jokes",
   "from_id": "channel1001142398",
   "photo": "photos/photo_66@19-10-2015_23-49-23.jpg",
   "width": 606,
   "height": 606,
   "text": "",
   "text_entities": []
  },
  {
   "id": 96,
   "type": "message",
   "date": "2015-10-20T05:01:52",
   "date_unixtime": "1445292112",
   "from": "Programmer Jokes",
   "from_id": "channel1001142398",
   "text": "Two bytes meet.  The first byte asks, “Are you ill?”  \nThe second byte replies, “No, just feeling a bit off.”",
   "text_entities": [
    {
     "type": "plain",
     "text": "Two bytes meet.  The first byte asks, “Are you ill?”  \nThe second byte replies, “No, just feeling a bit off.”"
    }
   ]
  },
  {
   "id": 97,
   "type": "message",
   "date": "2015-10-20T05:40:24",
   "date_unixtime": "1445294424",
   "from": "Programmer Jokes",
   "from_id": "channel1001142398",
   "photo": "photos/photo_67@20-10-2015_05-40-24.jpg",
   "width": 640,
   "height": 1136,
   "text": "",
   "text_entities": []
  },
  {
   "id": 99,
   "type": "message",
   "date": "2015-10-20T06:10:00",
   "date_unixtime": "1445296200",
   "from": "Programmer Jokes",
   "from_id": "channel1001142398",
   "text": [
    "If you like this channel, please give us the stars you believe we deserve here: ",
    {
     "type": "link",
     "text": "https://telegram.me/tchannelsbot?start=programmerjokes"
    }
   ],
   "text_entities": [
    {
     "type": "plain",
     "text": "If you like this channel, please give us the stars you believe we deserve here: "
    },
    {
     "type": "link",
     "text": "https://telegram.me/tchannelsbot?start=programmerjokes"
    }
   ]
  },
  {
   "id": 100,
   "type": "message",
   "date": "2015-10-20T16:57:03",
   "date_unixtime": "1445335023",
   "from": "Programmer Jokes",
   "from_id": "channel1001142398",
   "photo": "photos/photo_68@20-10-2015_16-57-03.jpg",
   "width": 444,
   "height": 373,
   "text": "",
   "text_entities": []
  },
  {
   "id": 101,
   "type": "message",
   "date": "2015-10-20T23:06:00",
   "date_unixtime": "1445357160",
   "from": "Programmer Jokes",
   "from_id": "channel1001142398",
   "photo": "photos/photo_69@20-10-2015_23-06-00.jpg",
   "width": 601,
   "height": 993,
   "text": "",
   "text_entities": []
  },
  {
   "id": 102,
   "type": "message",
   "date": "2015-10-20T23:09:12",
   "date_unixtime": "1445357352",
   "from": "Programmer Jokes",
   "from_id": "channel1001142398",
   "photo": "photos/photo_70@20-10-2015_23-09-12.jpg",
   "width": 400,
   "height": 400,
   "text": "",
   "text_entities": []
  },
  {
   "id": 103,
   "type": "message",
   "date": "2015-10-21T19:54:17",
   "date_unixtime": "1445432057",
   "from": "Programmer Jokes",
   "from_id": "channel1001142398",
   "photo": "photos/photo_71@21-10-2015_19-54-17.jpg",
   "width": 570,
   "height": 636,
   "text": "",
   "text_entities": []
  },
  {
   "id": 104,
   "type": "message",
   "date": "2015-10-22T16:58:35",
   "date_unixtime": "1445507915",
   "from": "Programmer Jokes",
   "from_id": "channel1001142398",
   "photo": "photos/photo_72@22-10-2015_16-58-35.jpg",
   "width": 400,
   "height": 400,
   "text": "",
   "text_entities": []
  },
  {
   "id": 105,
   "type": "message",
   "date": "2015-10-24T14:56:32",
   "date_unixtime": "1445673392",
   "from": "Programmer Jokes",
   "from_id": "channel1001142398",
   "photo": "photos/photo_73@24-10-2015_14-56-32.jpg",
   "width": 267,
   "height": 400,
   "text": "",
   "text_entities": []
  },
  {
   "id": 107,
   "type": "message",
   "date": "2015-10-24T15:43:40",
   "date_unixtime": "1445676220",
   "from": "Programmer Jokes",
   "from_id": "channel1001142398",
   "photo": "photos/photo_74@24-10-2015_15-43-40.jpg",
   "width": 493,
   "height": 277,
   "text": "",
   "text_entities": []
  },
  {
   "id": 109,
   "type": "message",
   "date": "2015-10-25T21:19:00",
   "date_unixtime": "1445782740",
   "from": "Programmer Jokes",
   "from_id": "channel1001142398",
   "photo": "photos/photo_75@25-10-2015_21-19-00.jpg",
   "width": 700,
   "height": 602,
   "text": "",
   "text_entities": []
  },
  {
   "id": 110,
   "type": "message",
   "date": "2015-10-26T02:47:42",
   "date_unixtime": "1445802462",
   "from": "Programmer Jokes",
   "from_id": "channel1001142398",
   "photo": "photos/photo_76@26-10-2015_02-47-42.jpg",
   "width": 640,
   "height": 1136,
   "text": "",
   "text_entities": []
  },
  {
   "id": 111,
   "type": "message",
   "date": "2015-10-26T07:35:44",
   "date_unixtime": "1445819744",
   "from": "Programmer Jokes",
   "from_id": "channel1001142398",
   "photo": "photos/photo_77@26-10-2015_07-35-44.jpg",
   "width": 552,
   "height": 347,
   "text": "",
   "text_entities": []
  },
  {
   "id": 112,
   "type": "message",
   "date": "2015-10-26T08:02:56",
   "date_unixtime": "1445821376",
   "from": "Programmer Jokes",
   "from_id": "channel1001142398",
   "photo": "photos/photo_78@26-10-2015_08-02-56.jpg",
   "width": 597,
   "height": 570,
   "text": "",
   "text_entities": []
  },
  {
   "id": 114,
   "type": "message",
   "date": "2015-10-27T08:36:00",
   "date_unixtime": "1445909760",
   "from": "Programmer Jokes",
   "from_id": "channel1001142398",
   "photo": "photos/photo_79@27-10-2015_08-36-00.jpg",
   "width": 300,
   "height": 300,
   "text": "",
   "text_entities": []
  },
  {
   "id": 115,
   "type": "message",
   "date": "2015-10-28T00:44:33",
   "date_unixtime": "1445967873",
   "from": "Programmer Jokes",
   "from_id": "channel1001142398",
   "text": "When Shakespeare asked, \"To be, or not to be?\", he did not provide the answer. But programmers can. The answer is FF.\n\n2B |~ 2B = FF",
   "text_entities": [
    {
     "type": "plain",
     "text": "When Shakespeare asked, \"To be, or not to be?\", he did not provide the answer. But programmers can. The answer is FF.\n\n2B |~ 2B = FF"
    }
   ]
  },
  {
   "id": 116,
   "type": "message",
   "date": "2015-10-28T06:53:48",
   "date_unixtime": "1445990028",
   "from": "Programmer Jokes",
   "from_id": "channel1001142398",
   "photo": "photos/photo_80@28-10-2015_06-53-48.jpg",
   "width": 639,
   "height": 400,
   "text": "",
   "text_entities": []
  },
  {
   "id": 118,
   "type": "message",
   "date": "2015-10-28T10:05:36",
   "date_unixtime": "1446001536",
   "from": "Programmer Jokes",
   "from_id": "channel1001142398",
   "photo": "photos/photo_81@28-10-2015_10-05-36.jpg",
   "width": 740,
   "height": 191,
   "text": [
    {
     "type": "link",
     "text": "xkcd.com/644/"
    }
   ],
   "text_entities": [
    {
     "type": "link",
     "text": "xkcd.com/644/"
    }
   ]
  },
  {
   "id": 119,
   "type": "message",
   "date": "2015-10-28T21:26:02",
   "date_unixtime": "1446042362",
   "from": "Programmer Jokes",
   "from_id": "channel1001142398",
   "photo": "photos/photo_82@28-10-2015_21-26-02.jpg",
   "width": 400,
   "height": 144,
   "text": "",
   "text_entities": []
  },
  {
   "id": 120,
   "type": "message",
   "date": "2015-10-28T21:31:31",
   "date_unixtime": "1446042691",
   "from": "Programmer Jokes",
   "from_id": "channel1001142398",
   "photo": "photos/photo_83@28-10-2015_21-31-31.jpg",
   "width": 460,
   "height": 345,
   "text": "",
   "text_entities": []
  },
  {
   "id": 121,
   "type": "message",
   "date": "2015-10-28T23:24:42",
   "date_unixtime": "1446049482",
   "from": "Programmer Jokes",
   "from_id": "channel1001142398",
   "photo": "photos/photo_84@28-10-2015_23-24-42.jpg",
   "width": 604,
   "height": 185,
   "text": "",
   "text_entities": []
  },
  {
   "id": 122,
   "type": "message",
   "date": "2015-10-28T23:32:40",
   "date_unixtime": "1446049960",
   "from": "Programmer Jokes",
   "from_id": "channel1001142398",
   "text": "This channel now has over 500 members. You are awesome :)",
   "text_entities": [
    {
     "type": "plain",
     "text": "This channel now has over 500 members. You are awesome :)"
    }
   ]
  },
  {
   "id": 123,
   "type": "message",
   "date": "2015-10-28T23:38:53",
   "date_unixtime": "1446050333",
   "from": "Programmer Jokes",
   "from_id": "channel1001142398",
   "reply_to_message_id": 115,
   "photo": "photos/photo_85@28-10-2015_23-38-53.jpg",
   "width": 480,
   "height": 270,
   "text": "",
   "text_entities": []
  },
  {
   "id": 124,
   "type": "message",
   "date": "2015-10-29T04:58:42",
   "date_unixtime": "1446069522",
   "from": "Programmer Jokes",
   "from_id": "channel1001142398",
   "photo": "photos/photo_86@29-10-2015_04-58-42.jpg",
   "width": 640,
   "height": 1136,
   "text": "",
   "text_entities": []
  },
  {
   "id": 125,
   "type": "message",
   "date": "2015-10-30T02:30:32",
   "date_unixtime": "1446147032",
   "from": "Programmer Jokes",
   "from_id": "channel1001142398",
   "photo": "photos/photo_87@30-10-2015_02-30-32.jpg",
   "width": 640,
   "height": 1136,
   "text": "",
   "text_entities": []
  },
  {
   "id": 126,
   "type": "message",
   "date": "2015-10-30T02:36:08",
   "date_unixtime": "1446147368",
   "from": "Programmer Jokes",
   "from_id": "channel1001142398",
   "photo": "photos/photo_88@30-10-2015_02-36-08.jpg",
   "width": 735,
   "height": 431,
   "text": "",
   "text_entities": []
  },
  {
   "id": 127,
   "type": "message",
   "date": "2015-10-30T21:22:41",
   "date_unixtime": "1446214961",
   "from": "Programmer Jokes",
   "from_id": "channel1001142398",
   "photo": "photos/photo_89@30-10-2015_21-22-41.jpg",
   "width": 330,
   "height": 478,
   "text": "",
   "text_entities": []
  },
  {
   "id": 128,
   "type": "message",
   "date": "2015-10-31T00:39:17",
   "date_unixtime": "1446226757",
   "from": "Programmer Jokes",
   "from_id": "channel1001142398",
   "text": "In 2 days from 500 to 600 members. You are more than awesome!",
   "text_entities": [
    {
     "type": "plain",
     "text": "In 2 days from 500 to 600 members. You are more than awesome!"
    }
   ]
  },
  {
   "id": 129,
   "type": "message",
   "date": "2015-10-31T02:28:05",
   "date_unixtime": "1446233285",
   "from": "Programmer Jokes",
   "from_id": "channel1001142398",
   "photo": "photos/photo_90@31-10-2015_02-28-05.jpg",
   "width": 480,
   "height": 446,
   "text": "",
   "text_entities": []
  },
  {
   "id": 130,
   "type": "message",
   "date": "2015-11-01T10:44:56",
   "date_unixtime": "1446349496",
   "from": "Programmer Jokes",
   "from_id": "channel1001142398",
   "photo": "photos/photo_91@01-11-2015_10-44-56.jpg",
   "width": 600,
   "height": 212,
   "text": "",
   "text_entities": []
  },
  {
   "id": 131,
   "type": "message",
   "date": "2015-11-02T18:44:43",
   "date_unixtime": "1446464683",
   "from": "Programmer Jokes",
   "from_id": "channel1001142398",
   "photo": "photos/photo_92@02-11-2015_18-44-43.jpg",
   "width": 512,
   "height": 512,
   "text": "",
   "text_entities": []
  },
  {
   "id": 132,
   "type": "message",
   "date": "2015-11-03T00:04:07",
   "date_unixtime": "1446483847",
   "from": "Programmer Jokes",
   "from_id": "channel1001142398",
   "photo": "photos/photo_93@03-11-2015_00-04-07.jpg",
   "width": 485,
   "height": 364,
   "text": "",
   "text_entities": []
  },
  {
   "id": 133,
   "type": "message",
   "date": "2015-11-04T03:00:27",
   "date_unixtime": "1446580827",
   "from": "Programmer Jokes",
   "from_id": "channel1001142398",
   "photo": "photos/photo_94@04-11-2015_03-00-27.jpg",
   "width": 585,
   "height": 589,
   "text": "",
   "text_entities": []
  },
  {
   "id": 134,
   "type": "message",
   "date": "2015-11-04T03:31:36",
   "date_unixtime": "1446582696",
   "from": "Programmer Jokes",
   "from_id": "channel1001142398",
   "photo": "photos/photo_95@04-11-2015_03-31-36.jpg",
   "width": 548,
   "height": 334,
   "text": "",
   "text_entities": []
  },
  {
   "id": 136,
   "type": "message",
   "date": "2015-11-04T23:11:10",
   "date_unixtime": "1446653470",
   "from": "Programmer Jokes",
   "from_id": "channel1001142398",
   "photo": "photos/photo_96@04-11-2015_23-11-10.jpg",
   "width": 500,
   "height": 497,
   "text": "",
   "text_entities": []
  },
  {
   "id": 137,
   "type": "message",
   "date": "2015-11-04T23:14:35",
   "date_unixtime": "1446653675",
   "from": "Programmer Jokes",
   "from_id": "channel1001142398",
   "photo": "photos/photo_97@04-11-2015_23-14-35.jpg",
   "width": 821,
   "height": 150,
   "text": "",
   "text_entities": []
  },
  {
   "id": 138,
   "type": "message",
   "date": "2015-11-04T23:14:52",
   "date_unixtime": "1446653692",
   "from": "Programmer Jokes",
   "from_id": "channel1001142398",
   "photo": "photos/photo_98@04-11-2015_23-14-52.jpg",
   "width": 495,
   "height": 276,
   "text": "",
   "text_entities": []
  },
  {
   "id": 139,
   "type": "message",
   "date": "2015-11-07T00:13:19",
   "date_unixtime": "1446829999",
   "from": "Programmer Jokes",
   "from_id": "channel1001142398",
   "photo": "photos/photo_99@07-11-2015_00-13-19.jpg",
   "width": 600,
   "height": 600,
   "text": "",
   "text_entities": []
  },
  {
   "id": 140,
   "type": "message",
   "date": "2015-11-07T01:02:32",
   "date_unixtime": "1446832952",
   "from": "Programmer Jokes",
   "from_id": "channel1001142398",
   "photo": "photos/photo_100@07-11-2015_01-02-32.jpg",
   "width": 700,
   "height": 501,
   "text": "",
   "text_entities": []
  },
  {
   "id": 141,
   "type": "message",
   "date": "2015-11-07T19:07:31",
   "date_unixtime": "1446898051",
   "from": "Programmer Jokes",
   "from_id": "channel1001142398",
   "photo": "photos/photo_101@07-11-2015_19-07-31.jpg",
   "width": 640,
   "height": 843,
   "text": "",
   "text_entities": []
  },
  {
   "id": 142,
   "type": "message",
   "date": "2015-11-09T05:17:15",
   "date_unixtime": "1447021035",
   "from": "Programmer Jokes",
   "from_id": "channel1001142398",
   "forwarded_from": "ProgrammerExcuses",
   "text": "We didn't have the budget to build it properly",
   "text_entities": [
    {
     "type": "plain",
     "text": "We didn't have the budget to build it properly"
    }
   ]
  },
  {
   "id": 143,
   "type": "message",
   "date": "2015-11-09T07:47:44",
   "date_unixtime": "1447030064",
   "from": "Programmer Jokes",
   "from_id": "channel1001142398",
   "photo": "photos/photo_102@09-11-2015_07-47-44.jpg",
   "width": 500,
   "height": 499,
   "text": "",
   "text_entities": []
  },
  {
   "id": 145,
   "type": "message",
   "date": "2015-11-10T15:19:54",
   "date_unixtime": "1447143594",
   "from": "Programmer Jokes",
   "from_id": "channel1001142398",
   "photo": "photos/photo_103@10-11-2015_15-19-54.jpg",
   "width": 409,
   "height": 409,
   "text": "",
   "text_entities": []
  },
  {
   "id": 146,
   "type": "message",
   "date": "2015-11-11T00:59:12",
   "date_unixtime": "1447178352",
   "from": "Programmer Jokes",
   "from_id": "channel1001142398",
   "photo": "photos/photo_104@11-11-2015_00-59-12.jpg",
   "width": 640,
   "height": 1136,
   "text": "",
   "text_entities": []
  },
  {
   "id": 147,
   "type": "message",
   "date": "2015-11-11T14:21:00",
   "date_unixtime": "1447226460",
   "from": "Programmer Jokes",
   "from_id": "channel1001142398",
   "forwarded_from": "Dilbert",
   "text": [
    {
     "type": "link",
     "text": "http://dilbert.com/strip/2015-11-11"
    }
   ],
   "text_entities": [
    {
     "type": "link",
     "text": "http://dilbert.com/strip/2015-11-11"
    }
   ]
  },
  {
   "id": 148,
   "type": "message",
   "date": "2015-11-11T23:07:24",
   "date_unixtime": "1447258044",
   "from": "Programmer Jokes",
   "from_id": "channel1001142398",
   "photo": "photos/photo_105@11-11-2015_23-07-24.jpg",
   "width": 274,
   "height": 298,
   "text": "",
   "text_entities": []
  },
  {
   "id": 149,
   "type": "message",
   "date": "2015-11-12T06:15:56",
   "date_unixtime": "1447283756",
   "from": "Programmer Jokes",
   "from_id": "channel1001142398",
   "text": [
    "If you like this channel, please give us the stars you believe we deserve here: ",
    {
     "type": "link",
     "text": "https://telegram.me/tchannelsbot?start=programmerjokes"
    },
    "\nIt won't take long and we want to know what you think about this channel."
   ],
   "text_entities": [
    {
     "type": "plain",
     "text": "If you like this channel, please give us the stars you believe we deserve here: "
    },
    {
     "type": "link",
     "text": "https://telegram.me/tchannelsbot?start=programmerjokes"
    },
    {
     "type": "plain",
     "text": "\nIt won't take long and we want to know what you think about this channel."
    }
   ]
  },
  {
   "id": 150,
   "type": "message",
   "date": "2015-11-12T14:23:24",
   "date_unixtime": "1447313004",
   "from": "Programmer Jokes",
   "from_id": "channel1001142398",
   "text": [
    "Thank you for your votes!\nThis time no image, but a link. Make sure you take a look:\n",
    {
     "type": "link",
     "text": "https://www.addedbytes.com/blog/if-php-were-british/"
    }
   ],
   "text_entities": [
    {
     "type": "plain",
     "text": "Thank you for your votes!\nThis time no image, but a link. Make sure you take a look:\n"
    },
    {
     "type": "link",
     "text": "https://www.addedbytes.com/blog/if-php-were-british/"
    }
   ]
  },
  {
   "id": 151,
   "type": "message",
   "date": "2015-11-12T20:01:44",
   "date_unixtime": "1447333304",
   "from": "Programmer Jokes",
   "from_id": "channel1001142398",
   "photo": "photos/photo_106@12-11-2015_20-01-44.jpg",
   "width": 240,
   "height": 595,
   "text": "",
   "text_entities": []
  },
  {
   "id": 154,
   "type": "message",
   "date": "2015-11-12T21:56:28",
   "date_unixtime": "1447340188",
   "from": "Programmer Jokes",
   "from_id": "channel1001142398",
   "photo": "photos/photo_107@12-11-2015_21-56-28.jpg",
   "width": 550,
   "height": 550,
   "text": "",
   "text_entities": []
  },
  {
   "id": 155,
   "type": "message",
   "date": "2015-11-13T01:42:52",
   "date_unixtime": "1447353772",
   "from": "Programmer Jokes",
   "from_id": "channel1001142398",
   "photo": "photos/photo_108@13-11-2015_01-42-52.jpg",
   "width": 823,
   "height": 186,
   "text": "",
   "text_entities": []
  },
  {
   "id": 156,
   "type": "message",
   "date": "2015-11-13T11:03:20",
   "date_unixtime": "1447387400",
   "from": "Programmer Jokes",
   "from_id": "channel1001142398",
   "photo": "photos/photo_109@13-11-2015_11-03-20.jpg",
   "width": 480,
   "height": 360,
   "text": "",
   "text_entities": []
  },
  {
   "id": 157,
   "type": "message",
   "date": "2015-11-13T17:00:36",
   "date_unixtime": "1447408836",
   "from": "Programmer Jokes",
   "from_id": "channel1001142398",
   "photo": "photos/photo_110@13-11-2015_17-00-36.jpg",
   "width": 650,
   "height": 615,
   "text": "",
   "text_entities": []
  },
  {
   "id": 158,
   "type": "message",
   "date": "2015-11-15T18:50:24",
   "date_unixtime": "1447588224",
   "from": "Programmer Jokes",
   "from_id": "channel1001142398",
   "text": "We strongly condemn the violence that took place in Paris. 😟\nOur thoughts and prayers are with the loved ones of those killed and injured and with all of France.😔",
   "text_entities": [
    {
     "type": "plain",
     "text": "We strongly condemn the violence that took place in Paris. 😟\nOur thoughts and prayers are with the loved ones of those killed and injured and with all of France.😔"
    }
   ]
  },
  {
   "id": 159,
   "type": "message",
   "date": "2015-11-15T22:42:08",
   "date_unixtime": "1447602128",
   "from": "Programmer Jokes",
   "from_id": "channel1001142398",
   "photo": "photos/photo_111@15-11-2015_22-42-08.jpg",
   "width": 500,
   "height": 503,
   "text": "",
   "text_entities": []
  },
  {
   "id": 160,
   "type": "message",
   "date": "2015-11-16T14:47:16",
   "date_unixtime": "1447660036",
   "from": "Programmer Jokes",
   "from_id": "channel1001142398",
   "text": [
    {
     "type": "link",
     "text": "http://saijogeorge.com/css-puns/"
    }
   ],
   "text_entities": [
    {
     "type": "link",
     "text": "http://saijogeorge.com/css-puns/"
    }
   ]
  },
  {
   "id": 161,
   "type": "message",
   "date": "2015-11-16T20:10:36",
   "date_unixtime": "1447679436",
   "from": "Programmer Jokes",
   "from_id": "channel1001142398",
   "photo": "photos/photo_112@16-11-2015_20-10-36.jpg",
   "width": 476,
   "height": 960,
   "text": "",
   "text_entities": []
  },
  {
   "id": 162,
   "type": "message",
   "date": "2015-11-17T19:45:00",
   "date_unixtime": "1447764300",
   "from": "Programmer Jokes",
   "from_id": "channel1001142398",
   "photo": "photos/photo_113@17-11-2015_19-45-00.jpg",
   "width": 1280,
   "height": 1280,
   "text": "",
   "text_entities": []
  },
  {
   "id": 163,
   "type": "message",
   "date": "2015-11-17T23:23:28",
   "date_unixtime": "1447777408",
   "from": "Programmer Jokes",
   "from_id": "channel1001142398",
   "photo": "photos/photo_114@17-11-2015_23-23-28.jpg",
   "width": 626,
   "height": 960,
   "text": "",
   "text_entities": []
  },
  {
   "id": 165,
   "type": "message",
   "date": "2015-11-18T16:55:20",
   "date_unixtime": "1447840520",
   "from": "Programmer Jokes",
   "from_id": "channel1001142398",
   "photo": "photos/photo_115@18-11-2015_16-55-20.jpg",
   "width": 658,
   "height": 523,
   "text": "",
   "text_entities": []
  },
  {
   "id": 166,
   "type": "message",
   "date": "2015-11-18T23:13:24",
   "date_unixtime": "1447863204",
   "from": "Programmer Jokes",
   "from_id": "channel1001142398",
   "forwarded_from": "xkcd",
   "photo": "photos/photo_116@18-11-2015_23-13-24.jpg",
   "width": 701,
   "height": 323,
   "text": "",
   "text_entities": []
  },
  {
   "id": 167,
   "type": "message",
   "date": "2015-11-19T22:08:12",
   "date_unixtime": "1447945692",
   "from": "Programmer Jokes",
   "from_id": "channel1001142398",
   "forwarded_from": "Dilbert",
   "text": [
    {
     "type": "link",
     "text": "http://dilbert.com/strip/2015-11-19"
    }
   ],
   "text_entities": [
    {
     "type": "link",
     "text": "http://dilbert.com/strip/2015-11-19"
    }
   ]
  },
  {
   "id": 168,
   "type": "message",
   "date": "2015-11-19T23:02:08",
   "date_unixtime": "1447948928",
   "from": "Programmer Jokes",
   "from_id": "channel1001142398",
   "photo": "photos/photo_117@19-11-2015_23-02-08.jpg",
   "width": 664,
   "height": 960,
   "text": "",
   "text_entities": []
  },
  {
   "id": 169,
   "type": "message",
   "date": "2015-11-21T03:29:12",
   "date_unixtime": "1448051352",
   "from": "Programmer Jokes",
   "from_id": "channel1001142398",
   "photo": "photos/photo_118@21-11-2015_03-29-12.jpg",
   "width": 549,
   "height": 495,
   "text": "",
   "text_entities": []
  },
  {
   "id": 170,
   "type": "message",
   "date": "2015-11-23T04:37:08",
   "date_unixtime": "1448228228",
   "from": "Programmer Jokes",
   "from_id": "channel1001142398",
   "photo": "photos/photo_119@23-11-2015_04-37-08.jpg",
   "width": 640,
   "height": 1136,
   "text": "",
   "text_entities": []
  },
  {
   "id": 171,
   "type": "message",
   "date": "2015-11-23T20:42:48",
   "date_unixtime": "1448286168",
   "from": "Programmer Jokes",
   "from_id": "channel1001142398",
   "text": "Why did the programmer quit his job?\nHe didn't get arrays.",
   "text_entities": [
    {
     "type": "plain",
     "text": "Why did the programmer quit his job?\nHe didn't get arrays."
    }
   ]
  },
  {
   "id": 172,
   "type": "message",
   "date": "2015-11-23T22:06:28",
   "date_unixtime": "1448291188",
   "from": "Programmer Jokes",
   "from_id": "channel1001142398",
   "photo": "photos/photo_120@23-11-2015_22-06-28.jpg",
   "width": 550,
   "height": 511,
   "text": "",
   "text_entities": []
  },
  {
   "id": 173,
   "type": "message",
   "date": "2015-11-24T14:22:20",
   "date_unixtime": "1448349740",
   "from": "Programmer Jokes",
   "from_id": "channel1001142398",
   "text": "Why did the integer drown?\nBecause it couldn't float!",
   "text_entities": [
    {
     "type": "plain",
     "text": "Why did the integer drown?\nBecause it couldn't float!"
    }
   ]
  },
  {
   "id": 174,
   "type": "message",
   "date": "2015-11-24T20:12:52",
   "date_unixtime": "1448370772",
   "from": "Programmer Jokes",
   "from_id": "channel1001142398",
   "photo": "photos/photo_121@24-11-2015_20-12-52.jpg",
   "width": 403,
   "height": 300,
   "text": "",
   "text_entities": []
  },
  {
   "id": 175,
   "type": "message",
   "date": "2015-11-25T01:45:07",
   "date_unixtime": "1448390707",
   "from": "Programmer Jokes",
   "from_id": "channel1001142398",
   "photo": "photos/photo_122@25-11-2015_01-45-07.jpg",
   "width": 659,
   "height": 688,
   "text": "",
   "text_entities": []
  },
  {
   "id": 176,
   "type": "message",
   "date": "2015-11-25T07:04:16",
   "date_unixtime": "1448409856",
   "from": "Programmer Jokes",
   "from_id": "channel1001142398",
   "forwarded_from": "ProgrammerExcuses",
   "text": "Management insisted we wouldn't need to waste our time writing unit tests",
   "text_entities": [
    {
     "type": "plain",
     "text": "Management insisted we wouldn't need to waste our time writing unit tests"
    }
   ]
  },
  {
   "id": 177,
   "type": "message",
   "date": "2015-11-26T10:17:44",
   "date_unixtime": "1448507864",
   "from": "Programmer Jokes",
   "from_id": "channel1001142398",
   "photo": "photos/photo_123@26-11-2015_10-17-44.jpg",
   "width": 600,
   "height": 210,
   "text": "",
   "text_entities": []
  },
  {
   "id": 178,
   "type": "message",
   "date": "2015-11-27T08:18:12",
   "date_unixtime": "1448587092",
   "from": "Programmer Jokes",
   "from_id": "channel1001142398",
   "photo": "photos/photo_124@27-11-2015_08-18-12.jpg",
   "width": 760,
   "height": 378,
   "text": "",
   "text_entities": []
  },
  {
   "id": 179,
   "type": "message",
   "date": "2015-11-27T11:16:20",
   "date_unixtime": "1448597780",
   "from": "Programmer Jokes",
   "from_id": "channel1001142398",
   "file": "(File not included. Change data exporting settings to download.)",
   "thumbnail": "(File not included. Change data exporting settings to download.)",
   "media_type": "video_file",
   "mime_type": "video/mp4",
   "duration_seconds": 8,
   "width": 410,
   "height": 230,
   "text": "Debugging",
   "text_entities": [
    {
     "type": "plain",
     "text": "Debugging"
    }
   ]
  },
  {
   "id": 180,
   "type": "message",
   "date": "2015-11-27T20:50:00",
   "date_unixtime": "1448632200",
   "from": "Programmer Jokes",
   "from_id": "channel1001142398",
   "photo": "photos/photo_125@27-11-2015_20-50-00.jpg",
   "width": 600,
   "height": 450,
   "text": "",
   "text_entities": []
  },
  {
   "id": 181,
   "type": "message",
   "date": "2015-11-28T12:41:16",
   "date_unixtime": "1448689276",
   "from": "Programmer Jokes",
   "from_id": "channel1001142398",
   "photo": "photos/photo_126@28-11-2015_12-41-16.jpg",
   "width": 700,
   "height": 525,
   "text": "Learning CSS",
   "text_entities": [
    {
     "type": "plain",
     "text": "Learning CSS"
    }
   ]
  },
  {
   "id": 182,
   "type": "message",
   "date": "2015-11-29T10:06:08",
   "date_unixtime": "1448766368",
   "from": "Programmer Jokes",
   "from_id": "channel1001142398",
   "file": "(File not included. Change data exporting settings to download.)",
   "thumbnail": "(File not included. Change data exporting settings to download.)",
   "mime_type": "image/jpeg",
   "width": 640,
   "height": 3652,
   "text": "",
   "text_entities": []
  },
  {
   "id": 183,
   "type": "message",
   "date": "2015-11-29T10:06:16",
   "date_unixtime": "1448766376",
   "from": "Programmer Jokes",
   "from_id": "channel1001142398",
   "file": "(File not included. Change data exporting settings to download.)",
   "thumbnail": "(File not included. Change data exporting settings to download.)",
   "mime_type": "image/jpeg",
   "width": 640,
   "height": 2252,
   "text": "",
   "text_entities": []
  },
  {
   "id": 184,
   "type": "message",
   "date": "2015-11-30T03:41:40",
   "date_unixtime": "1448829700",
   "from": "Programmer Jokes",
   "from_id": "channel1001142398",
   "text": [
    "Over 3000 members already. We are growing fast! To celebrate this, we created another channel: Animal Jokes\n",
    {
     "type": "link",
     "text": "https://telegram.me/animaljokes"
    },
    "\nThank you all for your feedback in the Telegram channels bot\n(",
    {
     "type": "link",
     "text": "https://telegram.me/tchannelsbot?start=programmerjokes"
    },
    ")"
   ],
   "text_entities": [
    {
     "type": "plain",
     "text": "Over 3000 members already. We are growing fast! To celebrate this, we created another channel: Animal Jokes\n"
    },
    {
     "type": "link",
     "text": "https://telegram.me/animaljokes"
    },
    {
     "type": "plain",
     "text": "\nThank you all for your feedback in the Telegram channels bot\n("
    },
    {
     "type": "link",
     "text": "https://telegram.me/tchannelsbot?start=programmerjokes"
    },
    {
     "type": "plain",
     "text": ")"
    }
   ]
  },
  {
   "id": 185,
   "type": "message",
   "date": "2015-11-30T05:11:56",
   "date_unixtime": "1448835116",
   "from": "Programmer Jokes",
   "from_id": "channel1001142398",
   "photo": "photos/photo_127@30-11-2015_05-11-56.jpg",
   "width": 236,
   "height": 196,
   "text": "",
   "text_entities": []
  },
  {
   "id": 186,
   "type": "message",
   "date": "2015-11-30T10:50:16",
   "date_unixtime": "1448855416",
   "from": "Programmer Jokes",
   "from_id": "channel1001142398",
   "file": "(File not included. Change data exporting settings to download.)",
   "thumbnail": "(File not included. Change data exporting settings to download.)",
   "media_type": "video_file",
   "mime_type": "video/mp4",
   "duration_seconds": 7,
   "width": 252,
   "height": 184,
   "text": "",
   "text_entities": []
  },
  {
   "id": 187,
   "type": "message",
   "date": "2015-11-30T10:55:48",
   "date_unixtime": "1448855748",
   "from": "Programmer Jokes",
   "from_id": "channel1001142398",
   "photo": "photos/photo_128@30-11-2015_10-55-48.jpg",
   "width": 650,
   "height": 485,
   "text": "",
   "text_entities": []
  },
  {
   "id": 188,
   "type": "message",
   "date": "2015-11-30T16:33:38",
   "date_unixtime": "1448876018",
   "from": "Programmer Jokes",
   "from_id": "channel1001142398",
   "photo": "photos/photo_129@30-11-2015_16-33-38.jpg",
   "width": 550,
   "height": 390,
   "text": "",
   "text_entities": []
  },
  {
   "id": 189,
   "type": "message",
   "date": "2015-12-01T02:45:17",
   "date_unixtime": "1448912717",
   "from": "Programmer Jokes",
   "from_id": "channel1001142398",
   "photo": "photos/photo_130@01-12-2015_02-45-17.jpg",
   "width": 640,
   "height": 1136,
   "text": "",
   "text_entities": []
  },
  {
   "id": 190,
   "type": "message",
   "date": "2015-12-01T17:01:07",
   "date_unixtime": "1448964067",
   "from": "Programmer Jokes",
   "from_id": "channel1001142398",
   "photo": "photos/photo_131@01-12-2015_17-01-07.jpg",
   "width": 928,
   "height": 376,
   "text": "",
   "text_entities": []
  },
  {
   "id": 191,
   "type": "message",
   "date": "2015-12-02T00:47:04",
   "date_unixtime": "1448992024",
   "from": "Programmer Jokes",
   "from_id": "channel1001142398",
   "photo": "photos/photo_132@02-12-2015_00-47-04.jpg",
   "width": 433,
   "height": 601,
   "text": "",
   "text_entities": []
  },
  {
   "id": 192,
   "type": "message",
   "date": "2015-12-03T06:04:56",
   "date_unixtime": "1449097496",
   "from": "Programmer Jokes",
   "from_id": "channel1001142398",
   "photo": "photos/photo_133@03-12-2015_06-04-56.jpg",
   "width": 900,
   "height": 283,
   "text": "",
   "text_entities": []
  },
  {
   "id": 193,
   "type": "message",
   "date": "2015-12-03T13:01:20",
   "date_unixtime": "1449122480",
   "from": "Programmer Jokes",
   "from_id": "channel1001142398",
   "photo": "photos/photo_134@03-12-2015_13-01-20.jpg",
   "width": 700,
   "height": 1102,
   "text": "",
   "text_entities": []
  },
  {
   "id": 194,
   "type": "message",
   "date": "2015-12-03T16:17:43",
   "date_unixtime": "1449134263",
   "from": "Programmer Jokes",
   "from_id": "channel1001142398",
   "photo": "photos/photo_135@03-12-2015_16-17-43.jpg",
   "width": 640,
   "height": 1136,
   "text": "",
   "text_entities": []
  },
  {
   "id": 195,
   "type": "message",
   "date": "2015-12-04T14:48:10",
   "date_unixtime": "1449215290",
   "from": "Programmer Jokes",
   "from_id": "channel1001142398",
   "photo": "photos/photo_136@04-12-2015_14-48-10.jpg",
   "width": 887,
   "height": 483,
   "text": "",
   "text_entities": []
  },
  {
   "id": 196,
   "type": "message",
   "date": "2015-12-06T02:04:29",
   "date_unixtime": "1449342269",
   "from": "Programmer Jokes",
   "from_id": "channel1001142398",
   "photo": "photos/photo_137@06-12-2015_02-04-29.jpg",
   "width": 640,
   "height": 1136,
   "text": "",
   "text_entities": []
  },
  {
   "id": 197,
   "type": "message",
   "date": "2015-12-06T03:11:34",
   "date_unixtime": "1449346294",
   "from": "Programmer Jokes",
   "from_id": "channel1001142398",
   "forwarded_from": "ProgrammerExcuses",
   "text": "There must be a problem with the virtual machine",
   "text_entities": [
    {
     "type": "plain",
     "text": "There must be a problem with the virtual machine"
    }
   ]
  },
  {
   "id": 198,
   "type": "message",
   "date": "2015-12-06T14:58:00",
   "date_unixtime": "1449388680",
   "from": "Programmer Jokes",
   "from_id": "channel1001142398",
   "photo": "photos/photo_138@06-12-2015_14-58-00.jpg",
   "width": 640,
   "height": 1136,
   "text": "",
   "text_entities": []
  },
  {
   "id": 199,
   "type": "message",
   "date": "2015-12-07T04:56:28",
   "date_unixtime": "1449438988",
   "from": "Programmer Jokes",
   "from_id": "channel1001142398",
   "photo": "photos/photo_139@07-12-2015_04-56-28.jpg",
   "width": 640,
   "height": 1136,
   "text": "",
   "text_entities": []
  },
  {
   "id": 200,
   "type": "message",
   "date": "2015-12-07T16:58:18",
   "date_unixtime": "1449482298",
   "from": "Programmer Jokes",
   "from_id": "channel1001142398",
   "photo": "photos/photo_140@07-12-2015_16-58-18.jpg",
   "width": 639,
   "height": 626,
   "text": "",
   "text_entities": []
  },
  {
   "id": 201,
   "type": "message",
   "date": "2015-12-08T02:44:22",
   "date_unixtime": "1449517462",
   "from": "Programmer Jokes",
   "from_id": "channel1001142398",
   "photo": "photos/photo_141@08-12-2015_02-44-22.jpg",
   "width": 449,
   "height": 1240,
   "text": "",
   "text_entities": []
  },
  {
   "id": 202,
   "type": "message",
   "date": "2015-12-08T12:03:44",
   "date_unixtime": "1449551024",
   "from": "Programmer Jokes",
   "from_id": "channel1001142398",
   "file": "(File not included. Change data exporting settings to download.)",
   "thumbnail": "(File not included. Change data exporting settings to download.)",
   "media_type": "video_file",
   "mime_type": "video/mp4",
   "duration_seconds": 3,
   "width": 240,
   "height": 264,
   "text": "",
   "text_entities": []
  },
  {
   "id": 204,
   "type": "message",
   "date": "2015-12-09T11:32:20",
   "date_unixtime": "1449635540",
   "from": "Programmer Jokes",
   "from_id": "channel1001142398",
   "photo": "photos/photo_142@09-12-2015_11-32-20.jpg",
   "width": 600,
   "height": 756,
   "text": "",
   "text_entities": []
  },
  {
   "id": 205,
   "type": "message",
   "date": "2015-12-10T05:40:32",
   "date_unixtime": "1449700832",
   "from": "Programmer Jokes",
   "from_id": "channel1001142398",
   "photo": "photos/photo_143@10-12-2015_05-40-32.jpg",
   "width": 640,
   "height": 1136,
   "text": "",
   "text_entities": []
  },
  {
   "id": 206,
   "type": "message",
   "date": "2015-12-11T10:12:39",
   "date_unixtime": "1449803559",
   "from": "Programmer Jokes",
   "from_id": "channel1001142398",
   "photo": "photos/photo_144@11-12-2015_10-12-39.jpg",
   "width": 550,
   "height": 779,
   "text": "",
   "text_entities": []
  },
  {
   "id": 207,
   "type": "message",
   "date": "2015-12-11T10:12:47",
   "date_unixtime": "1449803567",
   "from": "Programmer Jokes",
   "from_id": "channel1001142398",
   "photo": "photos/photo_145@11-12-2015_10-12-47.jpg",
   "width": 499,
   "height": 704,
   "text": "",
   "text_entities": []
  },
  {
   "id": 208,
   "type": "message",
   "date": "2015-12-11T10:12:47",
   "date_unixtime": "1449803567",
   "from": "Programmer Jokes",
   "from_id": "channel1001142398",
   "photo": "photos/photo_146@11-12-2015_10-12-47.jpg",
   "width": 620,
   "height": 565,
   "text": "",
   "text_entities": []
  },
  {
   "id": 209,
   "type": "message",
   "date": "2015-12-11T21:50:33",
   "date_unixtime": "1449845433",
   "from": "Programmer Jokes",
   "from_id": "channel1001142398",
   "photo": "photos/photo_147@11-12-2015_21-50-33.jpg",
   "width": 597,
   "height": 695,
   "text": "",
   "text_entities": []
  },
  {
   "id": 210,
   "type": "message",
   "date": "2015-12-13T06:10:40",
   "date_unixtime": "1449961840",
   "from": "Programmer Jokes",
   "from_id": "channel1001142398",
   "photo": "photos/photo_148@13-12-2015_06-10-40.jpg",
   "width": 579,
   "height": 780,
   "text": "",
   "text_entities": []
  },
  {
   "id": 211,
   "type": "message",
   "date": "2015-12-13T06:56:32",
   "date_unixtime": "1449964592",
   "from": "Programmer Jokes",
   "from_id": "channel1001142398",
   "photo": "photos/photo_149@13-12-2015_06-56-32.jpg",
   "width": 800,
   "height": 800,
   "text": "",
   "text_entities": []
  },
  {
   "id": 212,
   "type": "message",
   "date": "2015-12-13T07:30:00",
   "date_unixtime": "1449966600",
   "from": "Programmer Jokes",
   "from_id": "channel1001142398",
   "photo": "photos/photo_150@13-12-2015_07-30-00.jpg",
   "width": 600,
   "height": 491,
   "text": "",
   "text_entities": []
  },
  {
   "id": 213,
   "type": "message",
   "date": "2015-12-13T07:40:52",
   "date_unixtime": "1449967252",
   "from": "Programmer Jokes",
   "from_id": "channel1001142398",
   "photo": "photos/photo_151@13-12-2015_07-40-52.jpg",
   "width": 600,
   "height": 438,
   "text": "",
   "text_entities": []
  },
  {
   "id": 214,
   "type": "message",
   "date": "2015-12-14T01:16:09",
   "date_unixtime": "1450030569",
   "from": "Programmer Jokes",
   "from_id": "channel1001142398",
   "text": [
    "Almost 4k members! Awesome :) This time we didn't create a new channel, but we merged and combined our strengths. This is the next channel you want to follow: ",
    {
     "type": "mention",
     "text": "@gamerjokes"
    },
    "\n\nWith the 3 channels we now have, we call ourselves the United Joke Channels of Telegram (UJCT). We will update you soon enough if we are to create a new jokes channel.\n\n",
    {
     "type": "mention",
     "text": "@programmerjokes"
    },
    ", ",
    {
     "type": "mention",
     "text": "@gamerjokes"
    },
    ", ",
    {
     "type": "mention",
     "text": "@animaljokes"
    }
   ],
   "text_entities": [
    {
     "type": "plain",
     "text": "Almost 4k members! Awesome :) This time we didn't create a new channel, but we merged and combined our strengths. This is the next channel you want to follow: "
    },
    {
     "type": "mention",
     "text": "@gamerjokes"
    },
    {
     "type": "plain",
     "text": "\n\nWith the 3 channels we now have, we call ourselves the United Joke Channels of Telegram (UJCT). We will update you soon enough if we are to create a new jokes channel.\n\n"
    },
    {
     "type": "mention",
     "text": "@programmerjokes"
    },
    {
     "type": "plain",
     "text": ", "
    },
    {
     "type": "mention",
     "text": "@gamerjokes"
    },
    {
     "type": "plain",
     "text": ", "
    },
    {
     "type": "mention",
     "text": "@animaljokes"
    }
   ]
  },
  {
   "id": 215,
   "type": "message",
   "date": "2015-12-14T01:48:41",
   "date_unixtime": "1450032521",
   "from": "Programmer Jokes",
   "from_id": "channel1001142398",
   "photo": "photos/photo_152@14-12-2015_01-48-41.jpg",
   "width": 625,
   "height": 350,
   "text": "",
   "text_entities": []
  },
  {
   "id": 216,
   "type": "message",
   "date": "2015-12-15T09:42:28",
   "date_unixtime": "1450147348",
   "from": "Programmer Jokes",
   "from_id": "channel1001142398",
   "photo": "photos/photo_153@15-12-2015_09-42-28.jpg",
   "width": 575,
   "height": 564,
   "text": "",
   "text_entities": []
  },
  {
   "id": 217,
   "type": "message",
   "date": "2015-12-16T07:24:00",
   "date_unixtime": "1450225440",
   "from": "Programmer Jokes",
   "from_id": "channel1001142398",
   "photo": "photos/photo_154@16-12-2015_07-24-00.jpg",
   "width": 640,
   "height": 640,
   "text": "",
   "text_entities": []
  },
  {
   "id": 218,
   "type": "message",
   "date": "2015-12-16T22:43:30",
   "date_unixtime": "1450280610",
   "from": "Programmer Jokes",
   "from_id": "channel1001142398",
   "file": "(File not included. Change data exporting settings to download.)",
   "thumbnail": "(File not included. Change data exporting settings to download.)",
   "mime_type": "image/gif",
   "width": 444,
   "height": 250,
   "text": "",
   "text_entities": []
  },
  {
   "id": 219,
   "type": "message",
   "date": "2015-12-17T06:34:12",
   "date_unixtime": "1450308852",
   "from": "Programmer Jokes",
   "from_id": "channel1001142398",
   "text": "Did you know?\nThe first programmer was a woman.",
   "text_entities": [
    {
     "type": "plain",
     "text": "Did you know?\nThe first programmer was a woman."
    }
   ]
  },
  {
   "id": 220,
   "type": "message",
   "date": "2015-12-18T17:48:24",
   "date_unixtime": "1450435704",
   "from": "Programmer Jokes",
   "from_id": "channel1001142398",
   "photo": "photos/photo_155@18-12-2015_17-48-24.jpg",
   "width": 748,
   "height": 831,
   "text": "",
   "text_entities": []
  },
  {
   "id": 221,
   "type": "message",
   "date": "2015-12-19T18:15:42",
   "date_unixtime": "1450523742",
   "from": "Programmer Jokes",
   "from_id": "channel1001142398",
   "photo": "photos/photo_156@19-12-2015_18-15-42.jpg",
   "width": 1098,
   "height": 638,
   "text": "",
   "text_entities": []
  },
  {
   "id": 222,
   "type": "message",
   "date": "2015-12-21T04:51:49",
   "date_unixtime": "1450648309",
   "from": "Programmer Jokes",
   "from_id": "channel1001142398",
   "photo": "photos/photo_157@21-12-2015_04-51-49.jpg",
   "width": 639,
   "height": 409,
   "text": "",
   "text_entities": []
  },
  {
   "id": 223,
   "type": "message",
   "date": "2015-12-22T15:22:08",
   "date_unixtime": "1450772528",
   "from": "Programmer Jokes",
   "from_id": "channel1001142398",
   "photo": "photos/photo_158@22-12-2015_15-22-08.jpg",
   "width": 639,
   "height": 502,
   "text": "",
   "text_entities": []
  },
  {
   "id": 224,
   "type": "message",
   "date": "2015-12-24T07:14:24",
   "date_unixtime": "1450916064",
   "from": "Programmer Jokes",
   "from_id": "channel1001142398",
   "photo": "photos/photo_159@24-12-2015_07-14-24.jpg",
   "width": 750,
   "height": 563,
   "text": "",
   "text_entities": []
  },
  {
   "id": 225,
   "type": "message",
   "date": "2015-12-25T02:40:42",
   "date_unixtime": "1450986042",
   "from": "Programmer Jokes",
   "from_id": "channel1001142398",
   "photo": "photos/photo_160@25-12-2015_02-40-42.jpg",
   "width": 1031,
   "height": 586,
   "text": "",
   "text_entities": []
  },
  {
   "id": 226,
   "type": "message",
   "date": "2015-12-27T07:36:28",
   "date_unixtime": "1451176588",
   "from": "Programmer Jokes",
   "from_id": "channel1001142398",
   "photo": "photos/photo_161@27-12-2015_07-36-28.jpg",
   "width": 585,
   "height": 449,
   "text": "",
   "text_entities": []
  },
  {
   "id": 228,
   "type": "message",
   "date": "2015-12-28T07:06:12",
   "date_unixtime": "1451261172",
   "from": "Programmer Jokes",
   "from_id": "channel1001142398",
   "photo": "photos/photo_162@28-12-2015_07-06-12.jpg",
   "width": 640,
   "height": 1136,
   "text": "",
   "text_entities": []
  },
  {
   "id": 229,
   "type": "message",
   "date": "2015-12-29T15:06:55",
   "date_unixtime": "1451376415",
   "from": "Programmer Jokes",
   "from_id": "channel1001142398",
   "photo": "photos/photo_163@29-12-2015_15-06-55.jpg",
   "width": 639,
   "height": 430,
   "text": "",
   "text_entities": []
  },
  {
   "id": 230,
   "type": "message",
   "date": "2015-12-30T16:21:20",
   "date_unixtime": "1451467280",
   "from": "Programmer Jokes",
   "from_id": "channel1001142398",
   "photo": "photos/photo_164@30-12-2015_16-21-20.jpg",
   "width": 640,
   "height": 1136,
   "text": "",
   "text_entities": []
  },
  {
   "id": 231,
   "type": "message",
   "date": "2016-01-01T19:45:43",
   "date_unixtime": "1451652343",
   "from": "Programmer Jokes",
   "from_id": "channel1001142398",
   "photo": "photos/photo_165@01-01-2016_19-45-43.jpg",
   "width": 1136,
   "height": 640,
   "text": "",
   "text_entities": []
  },
  {
   "id": 233,
   "type": "message",
   "date": "2016-01-01T23:23:17",
   "date_unixtime": "1451665397",
   "from": "Programmer Jokes",
   "from_id": "channel1001142398",
   "photo": "photos/photo_166@01-01-2016_23-23-17.jpg",
   "width": 640,
   "height": 1222,
   "text": "",
   "text_entities": []
  },
  {
   "id": 234,
   "type": "message",
   "date": "2016-01-03T07:48:48",
   "date_unixtime": "1451782128",
   "from": "Programmer Jokes",
   "from_id": "channel1001142398",
   "photo": "photos/photo_167@03-01-2016_07-48-48.jpg",
   "width": 993,
   "height": 437,
   "text": "",
   "text_entities": []
  },
  {
   "id": 235,
   "type": "message",
   "date": "2016-01-04T03:04:05",
   "date_unixtime": "1451851445",
   "from": "Programmer Jokes",
   "from_id": "channel1001142398",
   "photo": "photos/photo_168@04-01-2016_03-04-05.jpg",
   "width": 1136,
   "height": 640,
   "text": "",
   "text_entities": []
  },
  {
   "id": 236,
   "type": "message",
   "date": "2016-01-05T16:06:41",
   "date_unixtime": "1451984801",
   "from": "Programmer Jokes",
   "from_id": "channel1001142398",
   "photo": "photos/photo_169@05-01-2016_16-06-41.jpg",
   "width": 460,
   "height": 302,
   "text": "",
   "text_entities": []
  },
  {
   "id": 237,
   "type": "message",
   "date": "2016-01-06T04:20:34",
   "date_unixtime": "1452028834",
   "from": "Programmer Jokes",
   "from_id": "channel1001142398",
   "file": "(File not included. Change data exporting settings to download.)",
   "thumbnail": "stickers/sticker.webp_thumb.jpg",
   "media_type": "sticker",
   "sticker_emoji": "👍",
   "width": 512,
   "height": 148,
   "text": "",
   "text_entities": []
  },
  {
   "id": 238,
   "type": "message",
   "date": "2016-01-06T07:02:24",
   "date_unixtime": "1452038544",
   "from": "Programmer Jokes",
   "from_id": "channel1001142398",
   "photo": "photos/photo_170@06-01-2016_07-02-24.jpg",
   "width": 639,
   "height": 326,
   "text": "",
   "text_entities": []
  },
  {
   "id": 239,
   "type": "message",
   "date": "2016-01-07T07:47:45",
   "date_unixtime": "1452127665",
   "from": "Programmer Jokes",
   "from_id": "channel1001142398",
   "photo": "photos/photo_171@07-01-2016_07-47-45.jpg",
   "width": 811,
   "height": 532,
   "text": "",
   "text_entities": []
  },
  {
   "id": 240,
   "type": "message",
   "date": "2016-01-07T15:39:25",
   "date_unixtime": "1452155965",
   "from": "Programmer Jokes",
   "from_id": "channel1001142398",
   "photo": "photos/photo_172@07-01-2016_15-39-25.jpg",
   "width": 640,
   "height": 1136,
   "text": "",
   "text_entities": []
  },
  {
   "id": 241,
   "type": "message",
   "date": "2016-01-10T14:30:02",
   "date_unixtime": "1452411002",
   "from": "Programmer Jokes",
   "from_id": "channel1001142398",
   "photo": "photos/photo_173@10-01-2016_14-30-02.jpg",
   "width": 640,
   "height": 1136,
   "text": "",
   "text_entities": []
  },
  {
   "id": 242,
   "type": "message",
   "date": "2016-01-11T02:30:27",
   "date_unixtime": "1452454227",
   "from": "Programmer Jokes",
   "from_id": "channel1001142398",
   "photo": "photos/photo_174@11-01-2016_02-30-27.jpg",
   "width": 640,
   "height": 476,
   "text": "",
   "text_entities": []
  },
  {
   "id": 243,
   "type": "message",
   "date": "2016-01-11T20:35:35",
   "date_unixtime": "1452519335",
   "from": "Programmer Jokes",
   "from_id": "channel1001142398",
   "forwarded_from": "ProgrammerExcuses",
   "text": "That's not a bug it's a configuration issue",
   "text_entities": [
    {
     "type": "plain",
     "text": "That's not a bug it's a configuration issue"
    }
   ]
  },
  {
   "id": 244,
   "type": "message",
   "date": "2016-01-11T23:23:50",
   "date_unixtime": "1452529430",
   "from": "Programmer Jokes",
   "from_id": "channel1001142398",
   "photo": "photos/photo_175@11-01-2016_23-23-50.jpg",
   "width": 480,
   "height": 338,
   "text": "",
   "text_entities": []
  },
  {
   "id": 245,
   "type": "message",
   "date": "2016-01-12T08:19:28",
   "date_unixtime": "1452561568",
   "from": "Programmer Jokes",
   "from_id": "channel1001142398",
   "photo": "photos/photo_176@12-01-2016_08-19-28.jpg",
   "width": 604,
   "height": 568,
   "text": "",
   "text_entities": []
  },
  {
   "id": 246,
   "type": "message",
   "date": "2016-01-13T08:54:00",
   "date_unixtime": "1452650040",
   "from": "Programmer Jokes",
   "from_id": "channel1001142398",
   "photo": "photos/photo_177@13-01-2016_08-54-00.jpg",
   "width": 322,
   "height": 457,
   "text": "",
   "text_entities": []
  },
  {
   "id": 247,
   "type": "message",
   "date": "2016-01-13T19:50:57",
   "date_unixtime": "1452689457",
   "from": "Programmer Jokes",
   "from_id": "channel1001142398",
   "photo": "photos/photo_178@13-01-2016_19-50-57.jpg",
   "width": 401,
   "height": 598,
   "text": "",
   "text_entities": []
  },
  {
   "id": 248,
   "type": "message",
   "date": "2016-01-15T04:59:18",
   "date_unixtime": "1452808758",
   "from": "Programmer Jokes",
   "from_id": "channel1001142398",
   "photo": "photos/photo_179@15-01-2016_04-59-18.jpg",
   "width": 324,
   "height": 324,
   "text": "",
   "text_entities": []
  },
  {
   "id": 249,
   "type": "message",
   "date": "2016-01-16T15:25:35",
   "date_unixtime": "1452932735",
   "from": "Programmer Jokes",
   "from_id": "channel1001142398",
   "forwarded_from": "Dilbert",
   "text": [
    {
     "type": "link",
     "text": "http://dilbert.com/strip/2016-1-16"
    }
   ],
   "text_entities": [
    {
     "type": "link",
     "text": "http://dilbert.com/strip/2016-1-16"
    }
   ]
  },
  {
   "id": 250,
   "type": "message",
   "date": "2016-01-18T06:04:56",
   "date_unixtime": "1453071896",
   "from": "Programmer Jokes",
   "from_id": "channel1001142398",
   "text": "linux\nIf Operating Systems Ran The Airlines... \n\nUNIX Airways \n\nEveryone brings one piece of the plane along when they come to the airport. They all go out on the runway and put the plane together piece by piece, arguing non-stop about what kind of plane they are supposed to be building.\n\nAir DOS \n\nEverybody pushes the airplane until it glides, then they jump on and let the plane coast until it hits the ground again. Then they push again, jump on again, and so on... \n\nMac Airlines \n\nAll the stewards, captains, baggage handlers, and ticket agents look and act exactly the same. Every time you ask questions about details, you are gently but firmly told that you don't need to know, don't want to know, and everything will be done for you without your ever having to know, so just shut up.\n\nWindows Air \n\nThe terminal is pretty and colourful, with friendly stewards, easy baggage check and boarding, and a smooth take-off. After about 10 minutes in the air, the plane explodes with no warning whatsoever. \n\nWindows NT Air \n\nJust like Windows Air, but costs more, uses much bigger planes, and takes out all the other aircraft within a 40-mile radius when it explodes.\n\nWindows XP Air \n\nYou turn up at the airport,which is under contract to only allow XP Air planes. All the aircraft are identical, brightly coloured and three times as big as they need to be. The signs are huge and all point the same way. Whichever way you go, someone pops up dressed in a cloak and pointed hat insisting you follow him. Your luggage and clothes are taken off you and replaced with an XP Air suit and suitcase identical to everyone around you as this is included in the exorbitant ticket cost. The aircraft will not take off until you have signed a contract. The inflight entertainment promised turns out to be the same Mickey Mouse cartoon repeated over and over again. You have to phone your travel agent before you can have a meal or drink. You are searched regularly throughout the flight. If you go to the toilet twice or more you get charged for a new ticket. No matter what destination you booked you will always end up crash landing at Whistler in Canada.\n\nLinux Air \n\nDisgruntled employees of all the other OS airlines decide to start their own airline. They build the planes, ticket counters, and pave the runways themselves. They charge a small fee to cover the cost of printing the ticket, but you can also download and print the ticket yourself.\n\nWhen you board the plane, you are given a seat, four bolts, a wrench and a copy of the seat-HOWTO.html. Once settled, the fully adjustable seat is very comfortable, the plane leaves and arrives on time without a single problem, the in-flight meal is wonderful. You try to tell customers of the other airlines about the great trip, but all they can say is, \"You had to do what with the seat?\"\n\nExample:\nSorry, this is the best analogy on the subject of linux, has been around for a long time, and is anonymous.\n\nBTW, linux is the kernel, GNU/GPL software make up the rest of the OS and apps.  GNU/Linux is the way lawyers will say it in court.",
   "text_entities": [
    {
     "type": "plain",
     "text": "linux\nIf Operating Systems Ran The Airlines... \n\nUNIX Airways \n\nEveryone brings one piece of the plane along when they come to the airport. They all go out on the runway and put the plane together piece by piece, arguing non-stop about what kind of plane they are supposed to be building.\n\nAir DOS \n\nEverybody pushes the airplane until it glides, then they jump on and let the plane coast until it hits the ground again. Then they push again, jump on again, and so on... \n\nMac Airlines \n\nAll the stewards, captains, baggage handlers, and ticket agents look and act exactly the same. Every time you ask questions about details, you are gently but firmly told that you don't need to know, don't want to know, and everything will be done for you without your ever having to know, so just shut up.\n\nWindows Air \n\nThe terminal is pretty and colourful, with friendly stewards, easy baggage check and boarding, and a smooth take-off. After about 10 minutes in the air, the plane explodes with no warning whatsoever. \n\nWindows NT Air \n\nJust like Windows Air, but costs more, uses much bigger planes, and takes out all the other aircraft within a 40-mile radius when it explodes.\n\nWindows XP Air \n\nYou turn up at the airport,which is under contract to only allow XP Air planes. All the aircraft are identical, brightly coloured and three times as big as they need to be. The signs are huge and all point the same way. Whichever way you go, someone pops up dressed in a cloak and pointed hat insisting you follow him. Your luggage and clothes are taken off you and replaced with an XP Air suit and suitcase identical to everyone around you as this is included in the exorbitant ticket cost. The aircraft will not take off until you have signed a contract. The inflight entertainment promised turns out to be the same Mickey Mouse cartoon repeated over and over again. You have to phone your travel agent before you can have a meal or drink. You are searched regularly throughout the flight. If you go to the toilet twice or more you get charged for a new ticket. No matter what destination you booked you will always end up crash landing at Whistler in Canada.\n\nLinux Air \n\nDisgruntled employees of all the other OS airlines decide to start their own airline. They build the planes, ticket counters, and pave the runways themselves. They charge a small fee to cover the cost of printing the ticket, but you can also download and print the ticket yourself.\n\nWhen you board the plane, you are given a seat, four bolts, a wrench and a copy of the seat-HOWTO.html. Once settled, the fully adjustable seat is very comfortable, the plane leaves and arrives on time without a single problem, the in-flight meal is wonderful. You try to tell customers of the other airlines about the great trip, but all they can say is, \"You had to do what with the seat?\"\n\nExample:\nSorry, this is the best analogy on the subject of linux, has been around for a long time, and is anonymous.\n\nBTW, linux is the kernel, GNU/GPL software make up the rest of the OS and apps.  GNU/Linux is the way lawyers will say it in court."
    }
   ]
  },
  {
   "id": 251,
   "type": "message",
   "date": "2016-01-19T14:32:36",
   "date_unixtime": "1453188756",
   "from": "Programmer Jokes",
   "from_id": "channel1001142398",
   "photo": "photos/photo_180@19-01-2016_14-32-36.jpg",
   "width": 595,
   "height": 317,
   "text": "",
   "text_entities": []
  },
  {
   "id": 252,
   "type": "message",
   "date": "2016-01-19T23:47:55",
   "date_unixtime": "1453222075",
   "from": "Programmer Jokes",
   "from_id": "channel1001142398",
   "forwarded_from": "Reddit",
   "photo": "photos/photo_181@19-01-2016_23-47-55.jpg",
   "width": 858,
   "height": 1026,
   "text": [
    "The real guide to interpreting developer job ads\n",
    {
     "type": "link",
     "text": "http://redd.it/41nheh"
    }
   ],
   "text_entities": [
    {
     "type": "plain",
     "text": "The real guide to interpreting developer job ads\n"
    },
    {
     "type": "link",
     "text": "http://redd.it/41nheh"
    }
   ]
  },
  {
   "id": 253,
   "type": "message",
   "date": "2016-01-21T04:19:14",
   "date_unixtime": "1453324754",
   "from": "Programmer Jokes",
   "from_id": "channel1001142398",
   "photo": "photos/photo_182@21-01-2016_04-19-14.jpg",
   "width": 610,
   "height": 412,
   "text": "",
   "text_entities": []
  },
  {
   "id": 254,
   "type": "message",
   "date": "2016-01-21T15:06:53",
   "date_unixtime": "1453363613",
   "from": "Programmer Jokes",
   "from_id": "channel1001142398",
   "photo": "photos/photo_183@21-01-2016_15-06-53.jpg",
   "width": 400,
   "height": 356,
   "text": "",
   "text_entities": []
  },
  {
   "id": 255,
   "type": "message",
   "date": "2016-01-23T16:02:11",
   "date_unixtime": "1453539731",
   "from": "Programmer Jokes",
   "from_id": "channel1001142398",
   "photo": "photos/photo_184@23-01-2016_16-02-11.jpg",
   "width": 639,
   "height": 239,
   "text": "",
   "text_entities": []
  },
  {
   "id": 256,
   "type": "message",
   "date": "2016-01-24T11:34:30",
   "date_unixtime": "1453610070",
   "from": "Programmer Jokes",
   "from_id": "channel1001142398",
   "photo": "photos/photo_185@24-01-2016_11-34-30.jpg",
   "width": 747,
   "height": 1021,
   "text": "",
   "text_entities": []
  },
  {
   "id": 257,
   "type": "message",
   "date": "2016-01-25T14:47:03",
   "date_unixtime": "1453708023",
   "from": "Programmer Jokes",
   "from_id": "channel1001142398",
   "photo": "photos/photo_186@25-01-2016_14-47-03.jpg",
   "width": 880,
   "height": 475,
   "text": "",
   "text_entities": []
  },
  {
   "id": 258,
   "type": "message",
   "date": "2016-01-27T15:41:09",
   "date_unixtime": "1453884069",
   "from": "Programmer Jokes",
   "from_id": "channel1001142398",
   "photo": "photos/photo_187@27-01-2016_15-41-09.jpg",
   "width": 876,
   "height": 639,
   "text": "",
   "text_entities": []
  },
  {
   "id": 259,
   "type": "message",
   "date": "2016-01-29T05:41:54",
   "date_unixtime": "1454020914",
   "from": "Programmer Jokes",
   "from_id": "channel1001142398",
   "photo": "photos/photo_188@29-01-2016_05-41-54.jpg",
   "width": 438,
   "height": 436,
   "text": "",
   "text_entities": []
  },
  {
   "id": 260,
   "type": "message",
   "date": "2016-01-31T21:43:32",
   "date_unixtime": "1454251412",
   "from": "Programmer Jokes",
   "from_id": "channel1001142398",
   "photo": "photos/photo_189@31-01-2016_21-43-32.jpg",
   "width": 640,
   "height": 516,
   "text": "",
   "text_entities": []
  },
  {
   "id": 261,
   "type": "message",
   "date": "2016-02-01T19:50:17",
   "date_unixtime": "1454331017",
   "from": "Programmer Jokes",
   "from_id": "channel1001142398",
   "photo": "photos/photo_190@01-02-2016_19-50-17.jpg",
   "width": 500,
   "height": 500,
   "text": "",
   "text_entities": []
  },
  {
   "id": 263,
   "type": "message",
   "date": "2016-02-03T14:28:12",
   "date_unixtime": "1454484492",
   "from": "Programmer Jokes",
   "from_id": "channel1001142398",
   "photo": "photos/photo_191@03-02-2016_14-28-12.jpg",
   "width": 640,
   "height": 1136,
   "text": "",
   "text_entities": []
  },
  {
   "id": 264,
   "type": "message",
   "date": "2016-02-04T16:39:14",
   "date_unixtime": "1454578754",
   "from": "Programmer Jokes",
   "from_id": "channel1001142398",
   "file": "video_files/mxcpezgif-826109515.gif.mp4",
   "thumbnail": "video_files/mxcpezgif-826109515.gif.mp4_thumb.jpg",
   "media_type": "animation",
   "mime_type": "video/mp4",
   "duration_seconds": 23,
   "width": 320,
   "height": 180,
   "text": "",
   "text_entities": []
  },
  {
   "id": 265,
   "type": "message",
   "date": "2016-02-06T19:23:08",
   "date_unixtime": "1454761388",
   "from": "Programmer Jokes",
   "from_id": "channel1001142398",
   "photo": "photos/photo_192@06-02-2016_19-23-08.jpg",
   "width": 650,
   "height": 421,
   "text": "",
   "text_entities": []
  },
  {
   "id": 266,
   "type": "message",
   "date": "2016-02-07T05:46:23",
   "date_unixtime": "1454798783",
   "from": "Programmer Jokes",
   "from_id": "channel1001142398",
   "photo": "photos/photo_193@07-02-2016_05-46-23.jpg",
   "width": 640,
   "height": 1136,
   "text": "",
   "text_entities": []
  },
  {
   "id": 267,
   "type": "message",
   "date": "2016-02-08T03:39:31",
   "date_unixtime": "1454877571",
   "from": "Programmer Jokes",
   "from_id": "channel1001142398",
   "photo": "photos/photo_194@08-02-2016_03-39-31.jpg",
   "width": 599,
   "height": 296,
   "text": "",
   "text_entities": []
  },
  {
   "id": 268,
   "type": "message",
   "date": "2016-02-08T05:49:34",
   "date_unixtime": "1454885374",
   "from": "Programmer Jokes",
   "from_id": "channel1001142398",
   "text": [
    "Guys... awesome! Over 7000 members now! Thank you!\n\nIf you like this channel, please give us the stars you believe we deserve here: ",
    {
     "type": "link",
     "text": "https://telegram.me/tchannelsbot?start=programmerjokes"
    },
    "\nIt won't take long and we want to know what you think about this channel."
   ],
   "text_entities": [
    {
     "type": "plain",
     "text": "Guys... awesome! Over 7000 members now! Thank you!\n\nIf you like this channel, please give us the stars you believe we deserve here: "
    },
    {
     "type": "link",
     "text": "https://telegram.me/tchannelsbot?start=programmerjokes"
    },
    {
     "type": "plain",
     "text": "\nIt won't take long and we want to know what you think about this channel."
    }
   ]
  },
  {
   "id": 271,
   "type": "message",
   "date": "2016-02-09T07:04:08",
   "date_unixtime": "1454976248",
   "from": "Programmer Jokes",
   "from_id": "channel1001142398",
   "photo": "photos/photo_195@09-02-2016_07-04-08.jpg",
   "width": 1024,
   "height": 768,
   "text": "",
   "text_entities": []
  },
  {
   "id": 272,
   "type": "message",
   "date": "2016-02-10T13:30:54",
   "date_unixtime": "1455085854",
   "from": "Programmer Jokes",
   "from_id": "channel1001142398",
   "photo": "photos/photo_196@10-02-2016_13-30-54.jpg",
   "width": 1024,
   "height": 768,
   "text": "",
   "text_entities": []
  },
  {
   "id": 273,
   "type": "message",
   "date": "2016-02-11T07:27:12",
   "date_unixtime": "1455150432",
   "from": "Programmer Jokes",
   "from_id": "channel1001142398",
   "photo": "photos/photo_197@11-02-2016_07-27-12.jpg",
   "width": 1024,
   "height": 768,
   "text": "",
   "text_entities": []
  },
  {
   "id": 274,
   "type": "message",
   "date": "2016-02-12T06:10:07",
   "date_unixtime": "1455232207",
   "from": "Programmer Jokes",
   "from_id": "channel1001142398",
   "photo": "photos/photo_198@12-02-2016_06-10-07.jpg",
   "width": 1024,
   "height": 768,
   "text": "",
   "text_entities": []
  },
  {
   "id": 275,
   "type": "message",
   "date": "2016-02-13T17:06:25",
   "date_unixtime": "1455357985",
   "from": "Programmer Jokes",
   "from_id": "channel1001142398",
   "photo": "photos/photo_199@13-02-2016_17-06-25.jpg",
   "width": 1024,
   "height": 768,
   "text": "",
   "text_entities": []
  },
  {
   "id": 276,
   "type": "message",
   "date": "2016-02-14T06:02:10",
   "date_unixtime": "1455404530",
   "from": "Programmer Jokes",
   "from_id": "channel1001142398",
   "photo": "photos/photo_200@14-02-2016_06-02-10.jpg",
   "width": 650,
   "height": 650,
   "text": "",
   "text_entities": []
  },
  {
   "id": 277,
   "type": "message",
   "date": "2016-02-15T03:00:10",
   "date_unixtime": "1455480010",
   "from": "Programmer Jokes",
   "from_id": "channel1001142398",
   "photo": "photos/photo_201@15-02-2016_03-00-10.jpg",
   "width": 1022,
   "height": 639,
   "text": "",
   "text_entities": []
  },
  {
   "id": 278,
   "type": "message",
   "date": "2016-02-15T14:38:26",
   "date_unixtime": "1455521906",
   "from": "Programmer Jokes",
   "from_id": "channel1001142398",
   "photo": "photos/photo_202@15-02-2016_14-38-26.jpg",
   "width": 1024,
   "height": 768,
   "text": "",
   "text_entities": []
  },
  {
   "id": 279,
   "type": "message",
   "date": "2016-02-16T06:31:00",
   "date_unixtime": "1455579060",
   "from": "Programmer Jokes",
   "from_id": "channel1001142398",
   "photo": "photos/photo_203@16-02-2016_06-31-00.jpg",
   "width": 1024,
   "height": 768,
   "text": "",
   "text_entities": []
  },
  {
   "id": 280,
   "type": "message",
   "date": "2016-02-17T13:58:48",
   "date_unixtime": "1455692328",
   "from": "Programmer Jokes",
   "from_id": "channel1001142398",
   "photo": "photos/photo_204@17-02-2016_13-58-48.jpg",
   "width": 1024,
   "height": 768,
   "text": "",
   "text_entities": []
  },
  {
   "id": 281,
   "type": "message",
   "date": "2016-02-18T17:21:19",
   "date_unixtime": "1455790879",
   "from": "Programmer Jokes",
   "from_id": "channel1001142398",
   "photo": "photos/photo_205@18-02-2016_17-21-19.jpg",
   "width": 1024,
   "height": 768,
   "text": "",
   "text_entities": []
  },
  {
   "id": 282,
   "type": "message",
   "date": "2016-02-18T17:22:17",
   "date_unixtime": "1455790937",
   "from": "Programmer Jokes",
   "from_id": "channel1001142398",
   "photo": "photos/photo_206@18-02-2016_17-22-17.jpg",
   "width": 539,
   "height": 406,
   "text": "",
   "text_entities": []
  },
  {
   "id": 283,
   "type": "message",
   "date": "2016-02-19T18:59:44",
   "date_unixtime": "1455883184",
   "from": "Programmer Jokes",
   "from_id": "channel1001142398",
   "photo": "photos/photo_207@19-02-2016_18-59-44.jpg",
   "width": 1024,
   "height": 768,
   "text": "",
   "text_entities": []
  },
  {
   "id": 284,
   "type": "message",
   "date": "2016-02-21T02:41:08",
   "date_unixtime": "1455997268",
   "from": "Programmer Jokes",
   "from_id": "channel1001142398",
   "photo": "photos/photo_208@21-02-2016_02-41-08.jpg",
   "width": 1024,
   "height": 768,
   "text": "",
   "text_entities": []
  },
  {
   "id": 285,
   "type": "message",
   "date": "2016-02-22T15:30:24",
   "date_unixtime": "1456129824",
   "from": "Programmer Jokes",
   "from_id": "channel1001142398",
   "photo": "photos/photo_209@22-02-2016_15-30-24.jpg",
   "width": 1024,
   "height": 768,
   "text": "",
   "text_entities": []
  },
  {
   "id": 286,
   "type": "message",
   "date": "2016-02-23T13:19:05",
   "date_unixtime": "1456208345",
   "from": "Programmer Jokes",
   "from_id": "channel1001142398",
   "photo": "photos/photo_210@23-02-2016_13-19-05.jpg",
   "width": 1024,
   "height": 768,
   "text": "",
   "text_entities": []
  },
  {
   "id": 287,
   "type": "message",
   "date": "2016-02-23T13:55:33",
   "date_unixtime": "1456210533",
   "from": "Programmer Jokes",
   "from_id": "channel1001142398",
   "photo": "photos/photo_211@23-02-2016_13-55-33.jpg",
   "width": 749,
   "height": 686,
   "text": "",
   "text_entities": []
  },
  {
   "id": 288,
   "type": "message",
   "date": "2016-02-24T19:27:47",
   "date_unixtime": "1456316867",
   "from": "Programmer Jokes",
   "from_id": "channel1001142398",
   "forwarded_from": "Dilbert",
   "text": [
    {
     "type": "link",
     "text": "http://dilbert.com/strip/2016-02-21"
    }
   ],
   "text_entities": [
    {
     "type": "link",
     "text": "http://dilbert.com/strip/2016-02-21"
    }
   ]
  },
  {
   "id": 289,
   "type": "message",
   "date": "2016-02-26T21:44:22",
   "date_unixtime": "1456497862",
   "from": "Programmer Jokes",
   "from_id": "channel1001142398",
   "photo": "photos/photo_212@26-02-2016_21-44-22.jpg",
   "width": 1024,
   "height": 768,
   "text": "",
   "text_entities": []
  },
  {
   "id": 290,
   "type": "message",
   "date": "2016-02-27T15:34:43",
   "date_unixtime": "1456562083",
   "from": "Programmer Jokes",
   "from_id": "channel1001142398",
   "photo": "photos/photo_213@27-02-2016_15-34-43.jpg",
   "width": 1024,
   "height": 768,
   "text": "",
   "text_entities": []
  },
  {
   "id": 291,
   "type": "message",
   "date": "2016-02-28T00:26:48",
   "date_unixtime": "1456594008",
   "from": "Programmer Jokes",
   "from_id": "channel1001142398",
   "photo": "photos/photo_214@28-02-2016_00-26-48.jpg",
   "width": 639,
   "height": 818,
   "text": "",
   "text_entities": []
  },
  {
   "id": 292,
   "type": "message",
   "date": "2016-02-29T03:01:50",
   "date_unixtime": "1456689710",
   "from": "Programmer Jokes",
   "from_id": "channel1001142398",
   "photo": "photos/photo_215@29-02-2016_03-01-50.jpg",
   "width": 639,
   "height": 555,
   "text": "",
   "text_entities": []
  },
  {
   "id": 293,
   "type": "message",
   "date": "2016-02-29T22:23:59",
   "date_unixtime": "1456759439",
   "from": "Programmer Jokes",
   "from_id": "channel1001142398",
   "photo": "photos/photo_216@29-02-2016_22-23-59.jpg",
   "width": 480,
   "height": 480,
   "text": "",
   "text_entities": []
  },
  {
   "id": 294,
   "type": "message",
   "date": "2016-03-03T22:37:28",
   "date_unixtime": "1457019448",
   "from": "Programmer Jokes",
   "from_id": "channel1001142398",
   "photo": "photos/photo_217@03-03-2016_22-37-28.jpg",
   "width": 800,
   "height": 858,
   "text": "",
   "text_entities": []
  },
  {
   "id": 295,
   "type": "message",
   "date": "2016-03-05T02:19:41",
   "date_unixtime": "1457119181",
   "from": "Programmer Jokes",
   "from_id": "channel1001142398",
   "photo": "photos/photo_218@05-03-2016_02-19-41.jpg",
   "width": 604,
   "height": 558,
   "text": "",
   "text_entities": []
  },
  {
   "id": 296,
   "type": "message",
   "date": "2016-03-06T14:30:40",
   "date_unixtime": "1457249440",
   "from": "Programmer Jokes",
   "from_id": "channel1001142398",
   "photo": "photos/photo_219@06-03-2016_14-30-40.jpg",
   "width": 743,
   "height": 790,
   "text": "",
   "text_entities": []
  },
  {
   "id": 297,
   "type": "message",
   "date": "2016-03-07T15:44:26",
   "date_unixtime": "1457340266",
   "from": "Programmer Jokes",
   "from_id": "channel1001142398",
   "photo": "photos/photo_220@07-03-2016_15-44-26.jpg",
   "width": 700,
   "height": 525,
   "text": "",
   "text_entities": []
  },
  {
   "id": 298,
   "type": "message",
   "date": "2016-03-08T20:28:21",
   "date_unixtime": "1457443701",
   "from": "Programmer Jokes",
   "from_id": "channel1001142398",
   "photo": "photos/photo_221@08-03-2016_20-28-21.jpg",
   "width": 700,
   "height": 686,
   "text": "",
   "text_entities": []
  },
  {
   "id": 299,
   "type": "message",
   "date": "2016-03-09T16:27:49",
   "date_unixtime": "1457515669",
   "from": "Programmer Jokes",
   "from_id": "channel1001142398",
   "photo": "photos/photo_222@09-03-2016_16-27-49.jpg",
   "width": 602,
   "height": 249,
   "text": "",
   "text_entities": []
  },
  {
   "id": 300,
   "type": "message",
   "date": "2016-03-10T22:11:24",
   "date_unixtime": "1457622684",
   "from": "Programmer Jokes",
   "from_id": "channel1001142398",
   "photo": "photos/photo_223@10-03-2016_22-11-24.jpg",
   "width": 1048,
   "height": 1280,
   "text": "",
   "text_entities": []
  },
  {
   "id": 302,
   "type": "message",
   "date": "2016-03-11T21:23:02",
   "date_unixtime": "1457706182",
   "from": "Programmer Jokes",
   "from_id": "channel1001142398",
   "forwarded_from": "Animal Jokes",
   "photo": "photos/photo_224@11-03-2016_21-23-02.jpg",
   "width": 500,
   "height": 370,
   "text": "",
   "text_entities": []
  },
