{
 "name": "Love of Food",
 "type": "public_channel",
 "id": 1005880654,
 "messages": [
  {
   "id": 1,
   "type": "service",
   "date": "2015-12-12T14:53:41",
   "date_unixtime": "1449906821",
   "actor": "Love of Food",
   "actor_id": "channel1005880654",
   "action": "create_channel",
   "title": "Food",
   "text": "",
   "text_entities": []
  },
  {
   "id": 2,
   "type": "service",
   "date": "2015-12-15T12:31:29",
   "date_unixtime": "1450157489",
   "actor": "Love of Food",
   "actor_id": "channel1005880654",
   "action": "edit_group_photo",
   "photo": "photos/photo_1@15-12-2015_12-31-29.jpg",
   "width": 640,
   "height": 640,
   "text": "",
   "text_entities": []
  },
  {
   "id": 3,
   "type": "message",
   "date": "2015-12-15T12:39:52",
   "date_unixtime": "1450157992",
   "from": "Love of Food",
   "from_id": "channel1005880654",
   "photo": "photos/photo_2@15-12-2015_12-39-52.jpg",
   "width": 480,
   "height": 480,
   "text": "",
   "text_entities": []
  },
  {
   "id": 4,
   "type": "message",
   "date": "2015-12-15T12:39:56",
   "date_unixtime": "1450157996",
   "from": "Love of Food",
   "from_id": "channel1005880654",
   "photo": "photos/photo_3@15-12-2015_12-39-56.jpg",
   "width": 640,
   "height": 640,
   "text": "",
   "text_entities": []
  },
  {
   "id": 5,
   "type": "message",
   "date": "2015-12-15T12:40:04",
   "date_unixtime": "1450158004",
   "from": "Love of Food",
   "from_id": "channel1005880654",
   "photo": "photos/photo_4@15-12-2015_12-40-04.jpg",
   "width": 1080,
   "height": 1080,
   "text": "",
   "text_entities": []
  },
  {
   "id": 6,
   "type": "message",
   "date": "2015-12-15T12:40:08",
   "date_unixtime": "1450158008",
   "from": "Love of Food",
   "from_id": "channel1005880654",
   "photo": "photos/photo_5@15-12-2015_12-40-08.jpg",
   "width": 640,
   "height": 478,
   "text": "",
   "text_entities": []
  },
  {
   "id": 7,
   "type": "message",
   "date": "2015-12-15T12:40:08",
   "date_unixtime": "1450158008",
   "from": "Love of Food",
   "from_id": "channel1005880654",
   "photo": "photos/photo_6@15-12-2015_12-40-08.jpg",
   "width": 640,
   "height": 640,
   "text": "",
   "text_entities": []
  },
  {
   "id": 8,
   "type": "message",
   "date": "2015-12-15T12:40:32",
   "date_unixtime": "1450158032",
   "from": "Love of Food",
   "from_id": "channel1005880654",
   "photo": "photos/photo_7@15-12-2015_12-40-32.jpg",
   "width": 640,
   "height": 640,
   "text": "",
   "text_entities": []
  },
  {
   "id": 9,
   "type": "message",
   "date": "2015-12-15T12:40:32",
   "date_unixtime": "1450158032",
   "from": "Love of Food",
   "from_id": "channel1005880654",
   "photo": "photos/photo_8@15-12-2015_12-40-32.jpg",
   "width": 640,
   "height": 640,
   "text": "",
   "text_entities": []
  },
  {
   "id": 10,
   "type": "message",
   "date": "2015-12-15T12:40:32",
   "date_unixtime": "1450158032",
   "from": "Love of Food",
   "from_id": "channel1005880654",
   "photo": "photos/photo_9@15-12-2015_12-40-32.jpg",
   "width": 640,
   "height": 382,
   "text": "",
   "text_entities": []
  },
  {
   "id": 11,
   "type": "message",
   "date": "2015-12-15T12:40:36",
   "date_unixtime": "1450158036",
   "from": "Love of Food",
   "from_id": "channel1005880654",
   "photo": "photos/photo_10@15-12-2015_12-40-36.jpg",
   "width": 640,
   "height": 640,
   "text": "",
   "text_entities": []
  },
  {
   "id": 12,
   "type": "message",
   "date": "2015-12-15T12:40:36",
   "date_unixtime": "1450158036",
   "from": "Love of Food",
   "from_id": "channel1005880654",
   "photo": "photos/photo_11@15-12-2015_12-40-36.jpg",
   "width": 960,
   "height": 960,
   "text": "",
   "text_entities": []
  },
  {
   "id": 13,
   "type": "message",
   "date": "2015-12-15T12:40:36",
   "date_unixtime": "1450158036",
   "from": "Love of Food",
   "from_id": "channel1005880654",
   "photo": "photos/photo_12@15-12-2015_12-40-36.jpg",
   "width": 500,
   "height": 522,
   "text": "",
   "text_entities": []
  },
  {
   "id": 14,
   "type": "message",
   "date": "2015-12-15T12:40:36",
   "date_unixtime": "1450158036",
   "from": "Love of Food",
   "from_id": "channel1005880654",
   "photo": "photos/photo_13@15-12-2015_12-40-36.jpg",
   "width": 640,
   "height": 426,
   "text": "",
   "text_entities": []
  },
  {
   "id": 15,
   "type": "message",
   "date": "2015-12-15T12:40:40",
   "date_unixtime": "1450158040",
   "from": "Love of Food",
   "from_id": "channel1005880654",
   "photo": "photos/photo_14@15-12-2015_12-40-40.jpg",
   "width": 640,
   "height": 744,
   "text": "",
   "text_entities": []
  },
  {
   "id": 16,
   "type": "message",
   "date": "2015-12-15T12:40:40",
   "date_unixtime": "1450158040",
   "from": "Love of Food",
   "from_id": "channel1005880654",
   "photo": "photos/photo_15@15-12-2015_12-40-40.jpg",
   "width": 1080,
   "height": 1080,
   "text": "",
   "text_entities": []
  },
  {
   "id": 17,
   "type": "message",
   "date": "2015-12-15T12:40:40",
   "date_unixtime": "1450158040",
   "from": "Love of Food",
   "from_id": "channel1005880654",
   "photo": "photos/photo_16@15-12-2015_12-40-40.jpg",
   "width": 640,
   "height": 640,
   "text": "",
   "text_entities": []
  },
  {
   "id": 18,
   "type": "message",
   "date": "2015-12-15T12:40:40",
   "date_unixtime": "1450158040",
   "from": "Love of Food",
   "from_id": "channel1005880654",
   "photo": "photos/photo_17@15-12-2015_12-40-40.jpg",
   "width": 640,
   "height": 426,
   "text": "",
   "text_entities": []
  },
  {
   "id": 19,
   "type": "message",
   "date": "2015-12-15T12:40:40",
   "date_unixtime": "1450158040",
   "from": "Love of Food",
   "from_id": "channel1005880654",
   "photo": "photos/photo_18@15-12-2015_12-40-40.jpg",
   "width": 640,
   "height": 640,
   "text": "",
   "text_entities": []
  },
  {
   "id": 20,
   "type": "message",
   "date": "2015-12-15T12:40:44",
   "date_unixtime": "1450158044",
   "from": "Love of Food",
   "from_id": "channel1005880654",
   "photo": "photos/photo_19@15-12-2015_12-40-44.jpg",
   "width": 640,
   "height": 640,
   "text": "",
   "text_entities": []
  },
  {
   "id": 21,
   "type": "message",
   "date": "2015-12-15T12:40:44",
   "date_unixtime": "1450158044",
   "from": "Love of Food",
   "from_id": "channel1005880654",
   "photo": "photos/photo_20@15-12-2015_12-40-44.jpg",
   "width": 640,
   "height": 640,
   "text": "",
   "text_entities": []
  },
  {
   "id": 22,
   "type": "message",
   "date": "2015-12-15T12:40:44",
   "date_unixtime": "1450158044",
   "from": "Love of Food",
   "from_id": "channel1005880654",
   "photo": "photos/photo_21@15-12-2015_12-40-44.jpg",
   "width": 600,
   "height": 900,
   "text": "",
   "text_entities": []
  },
  {
   "id": 24,
   "type": "message",
   "date": "2015-12-15T12:40:52",
   "date_unixtime": "1450158052",
   "from": "Love of Food",
   "from_id": "channel1005880654",
   "photo": "photos/photo_22@15-12-2015_12-40-52.jpg",
   "width": 640,
   "height": 640,
   "text": "",
   "text_entities": []
  },
  {
   "id": 27,
   "type": "message",
   "date": "2015-12-15T12:42:20",
   "date_unixtime": "1450158140",
   "from": "Love of Food",
   "from_id": "channel1005880654",
   "photo": "photos/photo_23@15-12-2015_12-42-20.jpg",
   "width": 400,
   "height": 600,
   "text": "",
   "text_entities": []
  },
  {
   "id": 28,
   "type": "message",
   "date": "2015-12-15T12:42:24",
   "date_unixtime": "1450158144",
   "from": "Love of Food",
   "from_id": "channel1005880654",
   "photo": "photos/photo_24@15-12-2015_12-42-24.jpg",
   "width": 465,
   "height": 604,
   "text": "",
   "text_entities": []
  },
  {
   "id": 29,
   "type": "message",
   "date": "2015-12-15T12:42:32",
   "date_unixtime": "1450158152",
   "from": "Love of Food",
   "from_id": "channel1005880654",
   "photo": "photos/photo_25@15-12-2015_12-42-32.jpg",
   "width": 604,
   "height": 465,
   "text": "",
   "text_entities": []
  },
  {
   "id": 31,
   "type": "message",
   "date": "2015-12-15T17:33:48",
   "date_unixtime": "1450175628",
   "from": "Love of Food",
   "from_id": "channel1005880654",
   "photo": "photos/photo_26@15-12-2015_17-33-48.jpg",
   "width": 333,
   "height": 502,
   "text": "",
   "text_entities": []
  },
  {
   "id": 32,
   "type": "message",
   "date": "2015-12-15T17:33:48",
   "date_unixtime": "1450175628",
   "from": "Love of Food",
   "from_id": "channel1005880654",
   "photo": "photos/photo_27@15-12-2015_17-33-48.jpg",
   "width": 640,
   "height": 640,
   "text": "",
   "text_entities": []
  },
  {
   "id": 33,
   "type": "message",
   "date": "2015-12-15T17:33:48",
   "date_unixtime": "1450175628",
   "from": "Love of Food",
   "from_id": "channel1005880654",
   "photo": "photos/photo_28@15-12-2015_17-33-48.jpg",
   "width": 640,
   "height": 640,
   "text": "",
   "text_entities": []
  },
  {
   "id": 34,
   "type": "message",
   "date": "2015-12-15T17:33:52",
   "date_unixtime": "1450175632",
   "from": "Love of Food",
   "from_id": "channel1005880654",
   "photo": "photos/photo_29@15-12-2015_17-33-52.jpg",
   "width": 640,
   "height": 800,
   "text": "",
   "text_entities": []
  },
  {
   "id": 35,
   "type": "message",
   "date": "2015-12-15T17:33:52",
   "date_unixtime": "1450175632",
   "from": "Love of Food",
   "from_id": "channel1005880654",
   "photo": "photos/photo_30@15-12-2015_17-33-52.jpg",
   "width": 640,
   "height": 640,
   "text": "",
   "text_entities": []
  },
  {
   "id": 36,
   "type": "message",
   "date": "2015-12-15T17:34:00",
   "date_unixtime": "1450175640",
   "from": "Love of Food",
   "from_id": "channel1005880654",
   "photo": "photos/photo_31@15-12-2015_17-34-00.jpg",
   "width": 640,
   "height": 640,
   "text": "",
   "text_entities": []
  },
  {
   "id": 37,
   "type": "message",
   "date": "2015-12-15T17:34:16",
   "date_unixtime": "1450175656",
   "from": "Love of Food",
   "from_id": "channel1005880654",
   "photo": "photos/photo_32@15-12-2015_17-34-16.jpg",
   "width": 640,
   "height": 640,
   "text": "",
   "text_entities": []
  },
  {
   "id": 38,
   "type": "message",
   "date": "2015-12-16T13:30:00",
   "date_unixtime": "1450247400",
   "from": "Love of Food",
   "from_id": "channel1005880654",
   "photo": "photos/photo_33@16-12-2015_13-30-00.jpg",
   "width": 640,
   "height": 640,
   "text": "",
   "text_entities": []
  },
  {
   "id": 39,
   "type": "message",
   "date": "2015-12-16T13:30:00",
   "date_unixtime": "1450247400",
   "from": "Love of Food",
   "from_id": "channel1005880654",
   "photo": "photos/photo_34@16-12-2015_13-30-00.jpg",
   "width": 640,
   "height": 640,
   "text": "",
   "text_entities": []
  },
  {
   "id": 40,
   "type": "message",
   "date": "2015-12-16T13:30:00",
   "date_unixtime": "1450247400",
   "from": "Love of Food",
   "from_id": "channel1005880654",
   "photo": "photos/photo_35@16-12-2015_13-30-00.jpg",
   "width": 640,
   "height": 700,
   "text": "",
   "text_entities": []
  },
  {
   "id": 41,
   "type": "message",
   "date": "2015-12-16T13:30:00",
   "date_unixtime": "1450247400",
   "from": "Love of Food",
   "from_id": "channel1005880654",
   "photo": "photos/photo_36@16-12-2015_13-30-00.jpg",
   "width": 640,
   "height": 640,
   "text": "",
   "text_entities": []
  },
  {
   "id": 42,
   "type": "message",
   "date": "2015-12-16T13:30:04",
   "date_unixtime": "1450247404",
   "from": "Love of Food",
   "from_id": "channel1005880654",
   "photo": "photos/photo_37@16-12-2015_13-30-04.jpg",
   "width": 640,
   "height": 427,
   "text": "",
   "text_entities": []
  },
  {
   "id": 43,
   "type": "message",
   "date": "2015-12-17T13:30:12",
   "date_unixtime": "1450333812",
   "from": "Love of Food",
   "from_id": "channel1005880654",
   "photo": "photos/photo_38@17-12-2015_13-30-12.jpg",
   "width": 640,
   "height": 640,
   "text": "",
   "text_entities": []
  },
  {
   "id": 44,
   "type": "message",
   "date": "2015-12-17T13:30:12",
   "date_unixtime": "1450333812",
   "from": "Love of Food",
   "from_id": "channel1005880654",
   "photo": "photos/photo_39@17-12-2015_13-30-12.jpg",
   "width": 640,
   "height": 426,
   "text": "",
   "text_entities": []
  },
  {
   "id": 45,
   "type": "message",
   "date": "2015-12-17T13:30:16",
   "date_unixtime": "1450333816",
   "from": "Love of Food",
   "from_id": "channel1005880654",
   "photo": "photos/photo_40@17-12-2015_13-30-16.jpg",
   "width": 640,
   "height": 640,
   "text": "",
   "text_entities": []
  },
  {
   "id": 46,
   "type": "message",
   "date": "2015-12-17T13:30:16",
   "date_unixtime": "1450333816",
   "from": "Love of Food",
   "from_id": "channel1005880654",
   "photo": "photos/photo_41@17-12-2015_13-30-16.jpg",
   "width": 640,
   "height": 640,
   "text": "",
   "text_entities": []
  },
  {
   "id": 47,
   "type": "message",
   "date": "2015-12-17T13:30:16",
   "date_unixtime": "1450333816",
   "from": "Love of Food",
   "from_id": "channel1005880654",
   "photo": "photos/photo_42@17-12-2015_13-30-16.jpg",
   "width": 640,
   "height": 640,
   "text": "",
   "text_entities": []
  },
  {
   "id": 48,
   "type": "message",
   "date": "2015-12-18T13:30:00",
   "date_unixtime": "1450420200",
   "from": "Love of Food",
   "from_id": "channel1005880654",
   "photo": "photos/photo_43@18-12-2015_13-30-00.jpg",
   "width": 480,
   "height": 480,
   "text": "",
   "text_entities": []
  },
  {
   "id": 49,
   "type": "message",
   "date": "2015-12-18T13:30:00",
   "date_unixtime": "1450420200",
   "from": "Love of Food",
   "from_id": "channel1005880654",
   "photo": "photos/photo_44@18-12-2015_13-30-00.jpg",
   "width": 640,
   "height": 640,
   "text": "",
   "text_entities": []
  },
  {
   "id": 50,
   "type": "message",
   "date": "2015-12-18T13:30:04",
   "date_unixtime": "1450420204",
   "from": "Love of Food",
   "from_id": "channel1005880654",
   "photo": "photos/photo_45@18-12-2015_13-30-04.jpg",
   "width": 640,
   "height": 547,
   "text": "",
   "text_entities": []
  },
  {
   "id": 51,
   "type": "message",
   "date": "2015-12-18T13:30:04",
   "date_unixtime": "1450420204",
   "from": "Love of Food",
   "from_id": "channel1005880654",
   "photo": "photos/photo_46@18-12-2015_13-30-04.jpg",
   "width": 872,
   "height": 1080,
   "text": "",
   "text_entities": []
  },
  {
   "id": 52,
   "type": "message",
   "date": "2015-12-18T13:30:04",
   "date_unixtime": "1450420204",
   "from": "Love of Food",
   "from_id": "channel1005880654",
   "photo": "photos/photo_47@18-12-2015_13-30-04.jpg",
   "width": 1280,
   "height": 800,
   "text": "",
   "text_entities": []
  },
  {
   "id": 53,
   "type": "message",
   "date": "2015-12-19T13:30:00",
   "date_unixtime": "1450506600",
   "from": "Love of Food",
   "from_id": "channel1005880654",
   "photo": "photos/photo_48@19-12-2015_13-30-00.jpg",
   "width": 640,
   "height": 640,
   "text": "",
   "text_entities": []
  },
  {
   "id": 54,
   "type": "message",
   "date": "2015-12-19T13:30:00",
   "date_unixtime": "1450506600",
   "from": "Love of Food",
   "from_id": "channel1005880654",
   "photo": "photos/photo_49@19-12-2015_13-30-00.jpg",
   "width": 640,
   "height": 404,
   "text": "",
   "text_entities": []
  },
  {
   "id": 55,
   "type": "message",
   "date": "2015-12-19T13:30:04",
   "date_unixtime": "1450506604",
   "from": "Love of Food",
   "from_id": "channel1005880654",
   "photo": "photos/photo_50@19-12-2015_13-30-04.jpg",
   "width": 640,
   "height": 640,
   "text": "",
   "text_entities": []
  },
  {
   "id": 56,
   "type": "message",
   "date": "2015-12-19T13:30:04",
   "date_unixtime": "1450506604",
   "from": "Love of Food",
   "from_id": "channel1005880654",
   "photo": "photos/photo_51@19-12-2015_13-30-04.jpg",
   "width": 1080,
   "height": 608,
   "text": "",
   "text_entities": []
  },
  {
   "id": 57,
   "type": "message",
   "date": "2015-12-19T13:30:04",
   "date_unixtime": "1450506604",
   "from": "Love of Food",
   "from_id": "channel1005880654",
   "photo": "photos/photo_52@19-12-2015_13-30-04.jpg",
   "width": 500,
   "height": 500,
   "text": "",
   "text_entities": []
  },
  {
   "id": 58,
   "type": "message",
   "date": "2015-12-20T13:30:00",
   "date_unixtime": "1450593000",
   "from": "Love of Food",
   "from_id": "channel1005880654",
   "photo": "photos/photo_53@20-12-2015_13-30-00.jpg",
   "width": 640,
   "height": 426,
   "text": "",
   "text_entities": []
  },
  {
   "id": 59,
   "type": "message",
   "date": "2015-12-20T13:30:00",
   "date_unixtime": "1450593000",
   "from": "Love of Food",
   "from_id": "channel1005880654",
   "photo": "photos/photo_54@20-12-2015_13-30-00.jpg",
   "width": 750,
   "height": 750,
   "text": "",
   "text_entities": []
  },
  {
   "id": 60,
   "type": "message",
   "date": "2015-12-20T13:30:04",
   "date_unixtime": "1450593004",
   "from": "Love of Food",
   "from_id": "channel1005880654",
   "photo": "photos/photo_55@20-12-2015_13-30-04.jpg",
   "width": 500,
   "height": 498,
   "text": "",
   "text_entities": []
  },
  {
   "id": 61,
   "type": "message",
   "date": "2015-12-20T13:30:04",
   "date_unixtime": "1450593004",
   "from": "Love of Food",
   "from_id": "channel1005880654",
   "photo": "photos/photo_56@20-12-2015_13-30-04.jpg",
   "width": 604,
   "height": 401,
   "text": "",
   "text_entities": []
  },
  {
   "id": 62,
   "type": "message",
   "date": "2015-12-20T13:30:04",
   "date_unixtime": "1450593004",
   "from": "Love of Food",
   "from_id": "channel1005880654",
   "photo": "photos/photo_57@20-12-2015_13-30-04.jpg",
   "width": 403,
   "height": 604,
   "text": "",
   "text_entities": []
  },
  {
   "id": 63,
   "type": "message",
   "date": "2015-12-21T13:30:00",
   "date_unixtime": "1450679400",
   "from": "Love of Food",
   "from_id": "channel1005880654",
   "photo": "photos/photo_58@21-12-2015_13-30-00.jpg",
   "width": 403,
   "height": 604,
   "text": "",
   "text_entities": []
  },
  {
   "id": 64,
   "type": "message",
   "date": "2015-12-21T13:30:04",
   "date_unixtime": "1450679404",
   "from": "Love of Food",
   "from_id": "channel1005880654",
   "photo": "photos/photo_59@21-12-2015_13-30-04.jpg",
   "width": 500,
   "height": 476,
   "text": "",
   "text_entities": []
  },
  {
   "id": 65,
   "type": "message",
   "date": "2015-12-21T13:30:04",
   "date_unixtime": "1450679404",
   "from": "Love of Food",
   "from_id": "channel1005880654",
   "photo": "photos/photo_60@21-12-2015_13-30-04.jpg",
   "width": 500,
   "height": 473,
   "text": "",
   "text_entities": []
  },
  {
   "id": 66,
   "type": "message",
   "date": "2015-12-21T13:30:04",
   "date_unixtime": "1450679404",
   "from": "Love of Food",
   "from_id": "channel1005880654",
   "photo": "photos/photo_61@21-12-2015_13-30-04.jpg",
   "width": 500,
   "height": 375,
   "text": "",
   "text_entities": []
  },
  {
   "id": 67,
   "type": "message",
   "date": "2015-12-21T13:30:04",
   "date_unixtime": "1450679404",
   "from": "Love of Food",
   "from_id": "channel1005880654",
   "photo": "photos/photo_62@21-12-2015_13-30-04.jpg",
   "width": 403,
   "height": 604,
   "text": "",
   "text_entities": []
  },
  {
   "id": 68,
   "type": "message",
   "date": "2015-12-23T13:30:28",
   "date_unixtime": "1450852228",
   "from": "Love of Food",
   "from_id": "channel1005880654",
   "photo": "photos/photo_63@23-12-2015_13-30-28.jpg",
   "width": 350,
   "height": 246,
   "text": "",
   "text_entities": []
  },
  {
   "id": 69,
   "type": "message",
   "date": "2015-12-23T13:30:28",
   "date_unixtime": "1450852228",
   "from": "Love of Food",
   "from_id": "channel1005880654",
   "photo": "photos/photo_64@23-12-2015_13-30-28.jpg",
   "width": 1260,
   "height": 770,
   "text": "",
   "text_entities": []
  },
  {
   "id": 70,
   "type": "message",
   "date": "2015-12-23T13:30:28",
   "date_unixtime": "1450852228",
   "from": "Love of Food",
   "from_id": "channel1005880654",
   "photo": "photos/photo_65@23-12-2015_13-30-28.jpg",
   "width": 640,
   "height": 640,
   "text": "",
   "text_entities": []
  },
  {
   "id": 71,
   "type": "message",
   "date": "2015-12-23T13:30:28",
   "date_unixtime": "1450852228",
   "from": "Love of Food",
   "from_id": "channel1005880654",
   "photo": "photos/photo_66@23-12-2015_13-30-28.jpg",
   "width": 604,
   "height": 604,
   "text": "",
   "text_entities": []
  },
  {
   "id": 72,
   "type": "message",
   "date": "2015-12-23T13:30:28",
   "date_unixtime": "1450852228",
   "from": "Love of Food",
   "from_id": "channel1005880654",
   "photo": "photos/photo_67@23-12-2015_13-30-28.jpg",
   "width": 456,
   "height": 604,
   "text": "",
   "text_entities": []
  },
  {
   "id": 73,
   "type": "message",
   "date": "2015-12-24T13:30:36",
   "date_unixtime": "1450938636",
   "from": "Love of Food",
   "from_id": "channel1005880654",
   "photo": "photos/photo_68@24-12-2015_13-30-36.jpg",
   "width": 403,
   "height": 604,
   "text": "",
   "text_entities": []
  },
  {
   "id": 74,
   "type": "message",
   "date": "2015-12-24T13:30:36",
   "date_unixtime": "1450938636",
   "from": "Love of Food",
   "from_id": "channel1005880654",
   "photo": "photos/photo_69@24-12-2015_13-30-36.jpg",
   "width": 478,
   "height": 480,
   "text": "",
   "text_entities": []
  },
  {
   "id": 75,
   "type": "message",
   "date": "2015-12-24T13:30:36",
   "date_unixtime": "1450938636",
   "from": "Love of Food",
   "from_id": "channel1005880654",
   "photo": "photos/photo_70@24-12-2015_13-30-36.jpg",
   "width": 720,
   "height": 1067,
   "text": "",
   "text_entities": []
  },
  {
   "id": 76,
   "type": "message",
   "date": "2015-12-24T13:30:36",
   "date_unixtime": "1450938636",
   "from": "Love of Food",
   "from_id": "channel1005880654",
   "photo": "photos/photo_71@24-12-2015_13-30-36.jpg",
   "width": 1280,
   "height": 800,
   "text": "",
   "text_entities": []
  },
  {
   "id": 77,
   "type": "message",
   "date": "2015-12-24T13:30:36",
   "date_unixtime": "1450938636",
   "from": "Love of Food",
   "from_id": "channel1005880654",
   "photo": "photos/photo_72@24-12-2015_13-30-36.jpg",
   "width": 500,
   "height": 500,
   "text": "",
   "text_entities": []
  },
  {
   "id": 78,
   "type": "message",
   "date": "2015-12-25T13:30:40",
   "date_unixtime": "1451025040",
   "from": "Love of Food",
   "from_id": "channel1005880654",
   "photo": "photos/photo_73@25-12-2015_13-30-40.jpg",
   "width": 768,
   "height": 1024,
   "text": "",
   "text_entities": []
  },
  {
   "id": 79,
   "type": "message",
   "date": "2015-12-25T13:30:40",
   "date_unixtime": "1451025040",
   "from": "Love of Food",
   "from_id": "channel1005880654",
   "photo": "photos/photo_74@25-12-2015_13-30-40.jpg",
   "width": 720,
   "height": 716,
   "text": "",
   "text_entities": []
  },
  {
   "id": 80,
   "type": "message",
   "date": "2015-12-25T13:30:40",
   "date_unixtime": "1451025040",
   "from": "Love of Food",
   "from_id": "channel1005880654",
   "photo": "photos/photo_75@25-12-2015_13-30-40.jpg",
   "width": 720,
   "height": 950,
   "text": "",
   "text_entities": []
  },
  {
   "id": 81,
   "type": "message",
   "date": "2015-12-25T13:30:40",
   "date_unixtime": "1451025040",
   "from": "Love of Food",
   "from_id": "channel1005880654",
   "photo": "photos/photo_76@25-12-2015_13-30-40.jpg",
   "width": 1280,
   "height": 853,
   "text": "",
   "text_entities": []
  },
  {
   "id": 82,
   "type": "message",
   "date": "2015-12-25T13:30:40",
   "date_unixtime": "1451025040",
   "from": "Love of Food",
   "from_id": "channel1005880654",
   "photo": "photos/photo_77@25-12-2015_13-30-40.jpg",
   "width": 720,
   "height": 1048,
   "text": "",
   "text_entities": []
  },
  {
   "id": 83,
   "type": "message",
   "date": "2015-12-26T13:30:44",
   "date_unixtime": "1451111444",
   "from": "Love of Food",
   "from_id": "channel1005880654",
   "photo": "photos/photo_78@26-12-2015_13-30-44.jpg",
   "width": 720,
   "height": 1045,
   "text": "",
   "text_entities": []
  },
  {
   "id": 84,
   "type": "message",
   "date": "2015-12-26T13:30:48",
   "date_unixtime": "1451111448",
   "from": "Love of Food",
   "from_id": "channel1005880654",
   "photo": "photos/photo_79@26-12-2015_13-30-48.jpg",
   "width": 720,
   "height": 1051,
   "text": "",
   "text_entities": []
  },
  {
   "id": 85,
   "type": "message",
   "date": "2015-12-26T13:30:48",
   "date_unixtime": "1451111448",
   "from": "Love of Food",
   "from_id": "channel1005880654",
   "photo": "photos/photo_80@26-12-2015_13-30-48.jpg",
   "width": 720,
   "height": 1068,
   "text": "",
   "text_entities": []
  },
  {
   "id": 86,
   "type": "message",
   "date": "2015-12-26T13:30:48",
   "date_unixtime": "1451111448",
   "from": "Love of Food",
   "from_id": "channel1005880654",
   "photo": "photos/photo_81@26-12-2015_13-30-48.jpg",
   "width": 640,
   "height": 640,
   "text": "",
   "text_entities": []
  },
  {
   "id": 87,
   "type": "message",
   "date": "2015-12-26T13:30:49",
   "date_unixtime": "1451111449",
   "from": "Love of Food",
   "from_id": "channel1005880654",
   "photo": "photos/photo_82@26-12-2015_13-30-49.jpg",
   "width": 500,
   "height": 500,
   "text": "",
   "text_entities": []
  },
  {
   "id": 88,
   "type": "message",
   "date": "2015-12-27T13:30:32",
   "date_unixtime": "1451197832",
   "from": "Love of Food",
   "from_id": "channel1005880654",
   "photo": "photos/photo_83@27-12-2015_13-30-32.jpg",
   "width": 500,
   "height": 625,
   "text": "",
   "text_entities": []
  },
  {
   "id": 89,
   "type": "message",
   "date": "2015-12-27T13:30:32",
   "date_unixtime": "1451197832",
   "from": "Love of Food",
   "from_id": "channel1005880654",
   "photo": "photos/photo_84@27-12-2015_13-30-32.jpg",
   "width": 683,
   "height": 1024,
   "text": "",
   "text_entities": []
  },
  {
   "id": 90,
   "type": "message",
   "date": "2015-12-27T13:30:36",
   "date_unixtime": "1451197836",
   "from": "Love of Food",
   "from_id": "channel1005880654",
   "photo": "photos/photo_85@27-12-2015_13-30-36.jpg",
   "width": 600,
   "height": 903,
   "text": "",
   "text_entities": []
  },
  {
   "id": 91,
   "type": "message",
   "date": "2015-12-27T13:30:36",
   "date_unixtime": "1451197836",
   "from": "Love of Food",
   "from_id": "channel1005880654",
   "photo": "photos/photo_86@27-12-2015_13-30-36.jpg",
   "width": 600,
   "height": 900,
   "text": "",
   "text_entities": []
  },
  {
   "id": 92,
   "type": "message",
   "date": "2015-12-27T13:30:36",
   "date_unixtime": "1451197836",
   "from": "Love of Food",
   "from_id": "channel1005880654",
   "photo": "photos/photo_87@27-12-2015_13-30-36.jpg",
   "width": 636,
   "height": 740,
   "text": "",
   "text_entities": []
  },
  {
   "id": 93,
   "type": "message",
   "date": "2015-12-28T13:30:40",
   "date_unixtime": "1451284240",
   "from": "Love of Food",
   "from_id": "channel1005880654",
   "photo": "photos/photo_88@28-12-2015_13-30-40.jpg",
   "width": 600,
   "height": 837,
   "text": "",
   "text_entities": []
  },
  {
   "id": 94,
   "type": "message",
   "date": "2015-12-28T13:30:40",
   "date_unixtime": "1451284240",
   "from": "Love of Food",
   "from_id": "channel1005880654",
   "photo": "photos/photo_89@28-12-2015_13-30-40.jpg",
   "width": 500,
   "height": 750,
   "text": "",
   "text_entities": []
  },
  {
   "id": 95,
   "type": "message",
   "date": "2015-12-28T13:30:40",
   "date_unixtime": "1451284240",
   "from": "Love of Food",
   "from_id": "channel1005880654",
   "photo": "photos/photo_90@28-12-2015_13-30-40.jpg",
   "width": 427,
   "height": 587,
   "text": "",
   "text_entities": []
  },
  {
   "id": 96,
   "type": "message",
   "date": "2015-12-28T13:30:40",
   "date_unixtime": "1451284240",
   "from": "Love of Food",
   "from_id": "channel1005880654",
   "photo": "photos/photo_91@28-12-2015_13-30-40.jpg",
   "width": 540,
   "height": 810,
   "text": "",
   "text_entities": []
  },
  {
   "id": 97,
   "type": "message",
   "date": "2015-12-28T13:30:40",
   "date_unixtime": "1451284240",
   "from": "Love of Food",
   "from_id": "channel1005880654",
   "photo": "photos/photo_92@28-12-2015_13-30-40.jpg",
   "width": 1080,
   "height": 1080,
   "text": "",
   "text_entities": []
  },
  {
   "id": 98,
   "type": "message",
   "date": "2015-12-29T13:30:40",
   "date_unixtime": "1451370640",
   "from": "Love of Food",
   "from_id": "channel1005880654",
   "photo": "photos/photo_93@29-12-2015_13-30-40.jpg",
   "width": 640,
   "height": 640,
   "text": "",
   "text_entities": []
  },
  {
   "id": 99,
   "type": "message",
   "date": "2015-12-29T13:30:40",
   "date_unixtime": "1451370640",
   "from": "Love of Food",
   "from_id": "channel1005880654",
   "photo": "photos/photo_94@29-12-2015_13-30-40.jpg",
   "width": 500,
   "height": 633,
   "text": "",
   "text_entities": []
  },
  {
   "id": 100,
   "type": "message",
   "date": "2015-12-29T13:30:40",
   "date_unixtime": "1451370640",
   "from": "Love of Food",
   "from_id": "channel1005880654",
   "photo": "photos/photo_95@29-12-2015_13-30-40.jpg",
   "width": 717,
   "height": 1080,
   "text": "",
   "text_entities": []
  },
  {
   "id": 101,
   "type": "message",
   "date": "2015-12-29T13:30:40",
   "date_unixtime": "1451370640",
   "from": "Love of Food",
   "from_id": "channel1005880654",
   "photo": "photos/photo_96@29-12-2015_13-30-40.jpg",
   "width": 525,
   "height": 788,
   "text": "",
   "text_entities": []
  },
  {
   "id": 102,
   "type": "message",
   "date": "2015-12-29T13:30:40",
   "date_unixtime": "1451370640",
   "from": "Love of Food",
   "from_id": "channel1005880654",
   "photo": "photos/photo_97@29-12-2015_13-30-40.jpg",
   "width": 1080,
   "height": 1080,
   "text": "",
   "text_entities": []
  },
  {
   "id": 103,
   "type": "message",
   "date": "2015-12-30T13:30:36",
   "date_unixtime": "1451457036",
   "from": "Love of Food",
   "from_id": "channel1005880654",
   "photo": "photos/photo_98@30-12-2015_13-30-36.jpg",
   "width": 1080,
   "height": 1080,
   "text": "",
   "text_entities": []
  },
  {
   "id": 104,
   "type": "message",
   "date": "2015-12-30T13:30:40",
   "date_unixtime": "1451457040",
   "from": "Love of Food",
   "from_id": "channel1005880654",
   "photo": "photos/photo_99@30-12-2015_13-30-40.jpg",
   "width": 600,
   "height": 800,
   "text": "",
   "text_entities": []
  },
  {
   "id": 105,
   "type": "message",
   "date": "2015-12-30T13:30:40",
   "date_unixtime": "1451457040",
   "from": "Love of Food",
   "from_id": "channel1005880654",
   "photo": "photos/photo_100@30-12-2015_13-30-40.jpg",
   "width": 499,
   "height": 483,
   "text": "",
   "text_entities": []
  },
  {
   "id": 106,
   "type": "message",
   "date": "2015-12-30T13:30:40",
   "date_unixtime": "1451457040",
   "from": "Love of Food",
   "from_id": "channel1005880654",
   "photo": "photos/photo_101@30-12-2015_13-30-40.jpg",
   "width": 500,
   "height": 635,
   "text": "",
   "text_entities": []
  },
  {
   "id": 107,
   "type": "message",
   "date": "2015-12-30T13:30:40",
   "date_unixtime": "1451457040",
   "from": "Love of Food",
   "from_id": "channel1005880654",
   "photo": "photos/photo_102@30-12-2015_13-30-40.jpg",
   "width": 401,
   "height": 604,
   "text": "",
   "text_entities": []
  },
  {
   "id": 108,
   "type": "message",
   "date": "2015-12-31T13:30:36",
   "date_unixtime": "1451543436",
   "from": "Love of Food",
   "from_id": "channel1005880654",
   "photo": "photos/photo_103@31-12-2015_13-30-36.jpg",
   "width": 897,
   "height": 1080,
   "text": "",
   "text_entities": []
  },
  {
   "id": 109,
   "type": "message",
   "date": "2015-12-31T13:30:36",
   "date_unixtime": "1451543436",
   "from": "Love of Food",
   "from_id": "channel1005880654",
   "photo": "photos/photo_104@31-12-2015_13-30-36.jpg",
   "width": 960,
   "height": 960,
   "text": "",
   "text_entities": []
  },
  {
   "id": 110,
   "type": "message",
   "date": "2015-12-31T13:30:36",
   "date_unixtime": "1451543436",
   "from": "Love of Food",
   "from_id": "channel1005880654",
   "photo": "photos/photo_105@31-12-2015_13-30-36.jpg",
   "width": 960,
   "height": 960,
   "text": "",
   "text_entities": []
  },
  {
   "id": 111,
   "type": "message",
   "date": "2015-12-31T13:30:36",
   "date_unixtime": "1451543436",
   "from": "Love of Food",
   "from_id": "channel1005880654",
   "photo": "photos/photo_106@31-12-2015_13-30-36.jpg",
   "width": 604,
   "height": 604,
   "text": "",
   "text_entities": []
  },
  {
   "id": 112,
   "type": "message",
   "date": "2015-12-31T13:30:36",
   "date_unixtime": "1451543436",
   "from": "Love of Food",
   "from_id": "channel1005880654",
   "photo": "photos/photo_107@31-12-2015_13-30-36.jpg",
   "width": 900,
   "height": 900,
   "text": "",
   "text_entities": []
  },
  {
   "id": 113,
   "type": "message",
   "date": "2016-01-01T13:30:40",
   "date_unixtime": "1451629840",
   "from": "Love of Food",
   "from_id": "channel1005880654",
   "photo": "photos/photo_108@01-01-2016_13-30-40.jpg",
   "width": 1280,
   "height": 852,
   "text": "",
   "text_entities": []
  },
  {
   "id": 114,
   "type": "message",
   "date": "2016-01-01T13:30:40",
   "date_unixtime": "1451629840",
   "from": "Love of Food",
   "from_id": "channel1005880654",
   "photo": "photos/photo_109@01-01-2016_13-30-40.jpg",
   "width": 1280,
   "height": 851,
   "text": "",
   "text_entities": []
  },
  {
   "id": 115,
   "type": "message",
   "date": "2016-01-01T13:30:40",
   "date_unixtime": "1451629840",
   "from": "Love of Food",
   "from_id": "channel1005880654",
   "photo": "photos/photo_110@01-01-2016_13-30-40.jpg",
   "width": 1080,
   "height": 1080,
   "text": "",
   "text_entities": []
  },
  {
   "id": 116,
   "type": "message",
   "date": "2016-01-01T13:30:44",
   "date_unixtime": "1451629844",
   "from": "Love of Food",
   "from_id": "channel1005880654",
   "photo": "photos/photo_111@01-01-2016_13-30-44.jpg",
   "width": 500,
   "height": 500,
   "text": "",
   "text_entities": []
  },
  {
   "id": 117,
   "type": "message",
   "date": "2016-01-01T13:30:44",
   "date_unixtime": "1451629844",
   "from": "Love of Food",
   "from_id": "channel1005880654",
   "photo": "photos/photo_112@01-01-2016_13-30-44.jpg",
   "width": 640,
   "height": 640,
   "text": "",
   "text_entities": []
  },
  {
   "id": 118,
   "type": "message",
   "date": "2016-01-08T04:48:36",
   "date_unixtime": "1452203316",
   "from": "Love of Food",
   "from_id": "channel1005880654",
   "photo": "photos/photo_113@08-01-2016_04-48-36.jpg",
   "width": 640,
   "height": 640,
   "text": "",
   "text_entities": []
  },
  {
   "id": 119,
   "type": "message",
   "date": "2016-01-08T17:55:16",
   "date_unixtime": "1452250516",
   "from": "Love of Food",
   "from_id": "channel1005880654",
   "photo": "photos/photo_114@08-01-2016_17-55-16.jpg",
   "width": 604,
   "height": 604,
   "text": "",
   "text_entities": []
  },
  {
   "id": 120,
   "type": "message",
   "date": "2016-01-08T20:47:28",
   "date_unixtime": "1452260848",
   "from": "Love of Food",
   "from_id": "channel1005880654",
   "photo": "photos/photo_115@08-01-2016_20-47-28.jpg",
   "width": 480,
   "height": 480,
   "text": "",
   "text_entities": []
  },
  {
   "id": 121,
   "type": "message",
   "date": "2016-01-09T13:30:40",
   "date_unixtime": "1452321040",
   "from": "Love of Food",
   "from_id": "channel1005880654",
   "photo": "photos/photo_116@09-01-2016_13-30-40.jpg",
   "width": 500,
   "height": 506,
   "text": "",
   "text_entities": []
  },
  {
   "id": 122,
   "type": "message",
   "date": "2016-01-09T13:30:40",
   "date_unixtime": "1452321040",
   "from": "Love of Food",
   "from_id": "channel1005880654",
   "photo": "photos/photo_117@09-01-2016_13-30-40.jpg",
   "width": 604,
   "height": 604,
   "text": "",
   "text_entities": []
  },
  {
   "id": 123,
   "type": "message",
   "date": "2016-01-09T13:30:40",
   "date_unixtime": "1452321040",
   "from": "Love of Food",
   "from_id": "channel1005880654",
   "photo": "photos/photo_118@09-01-2016_13-30-40.jpg",
   "width": 600,
   "height": 600,
   "text": "",
   "text_entities": []
  },
  {
   "id": 124,
   "type": "message",
   "date": "2016-01-09T13:30:40",
   "date_unixtime": "1452321040",
   "from": "Love of Food",
   "from_id": "channel1005880654",
   "photo": "photos/photo_119@09-01-2016_13-30-40.jpg",
   "width": 640,
   "height": 426,
   "text": "",
   "text_entities": []
  },
  {
   "id": 125,
   "type": "message",
   "date": "2016-01-09T13:30:40",
   "date_unixtime": "1452321040",
   "from": "Love of Food",
   "from_id": "channel1005880654",
   "photo": "photos/photo_120@09-01-2016_13-30-40.jpg",
   "width": 640,
   "height": 640,
   "text": "",
   "text_entities": []
  },
  {
   "id": 126,
   "type": "message",
   "date": "2016-01-24T13:31:08",
   "date_unixtime": "1453617068",
   "from": "Love of Food",
   "from_id": "channel1005880654",
   "photo": "photos/photo_121@24-01-2016_13-31-08.jpg",
   "width": 721,
   "height": 1080,
   "text": "",
   "text_entities": []
  },
  {
   "id": 127,
   "type": "message",
   "date": "2016-01-24T13:31:08",
   "date_unixtime": "1453617068",
   "from": "Love of Food",
   "from_id": "channel1005880654",
   "photo": "photos/photo_122@24-01-2016_13-31-08.jpg",
   "width": 640,
   "height": 638,
   "text": "",
   "text_entities": []
  },
  {
   "id": 128,
   "type": "message",
   "date": "2016-01-24T13:31:12",
   "date_unixtime": "1453617072",
   "from": "Love of Food",
   "from_id": "channel1005880654",
   "photo": "photos/photo_123@24-01-2016_13-31-12.jpg",
   "width": 640,
   "height": 480,
   "text": "",
   "text_entities": []
  },
  {
   "id": 129,
   "type": "message",
   "date": "2016-01-24T13:31:12",
   "date_unixtime": "1453617072",
   "from": "Love of Food",
   "from_id": "channel1005880654",
   "photo": "photos/photo_124@24-01-2016_13-31-12.jpg",
   "width": 395,
   "height": 600,
   "text": "",
   "text_entities": []
  },
  {
   "id": 130,
   "type": "message",
   "date": "2016-01-24T13:31:12",
   "date_unixtime": "1453617072",
   "from": "Love of Food",
   "from_id": "channel1005880654",
   "photo": "photos/photo_125@24-01-2016_13-31-12.jpg",
   "width": 640,
   "height": 683,
   "text": "",
   "text_entities": []
  },
  {
   "id": 131,
   "type": "message",
   "date": "2016-01-25T13:30:32",
   "date_unixtime": "1453703432",
   "from": "Love of Food",
   "from_id": "channel1005880654",
   "photo": "photos/photo_126@25-01-2016_13-30-32.jpg",
   "width": 640,
   "height": 640,
   "text": "",
   "text_entities": []
  },
  {
   "id": 132,
   "type": "message",
   "date": "2016-01-25T13:30:32",
   "date_unixtime": "1453703432",
   "from": "Love of Food",
   "from_id": "channel1005880654",
   "photo": "photos/photo_127@25-01-2016_13-30-32.jpg",
   "width": 640,
   "height": 640,
   "text": "",
   "text_entities": []
  },
  {
   "id": 133,
   "type": "message",
   "date": "2016-01-25T13:30:32",
   "date_unixtime": "1453703432",
   "from": "Love of Food",
   "from_id": "channel1005880654",
   "photo": "photos/photo_128@25-01-2016_13-30-32.jpg",
   "width": 412,
   "height": 618,
   "text": "",
   "text_entities": []
  },
  {
   "id": 134,
   "type": "message",
   "date": "2016-01-25T13:30:36",
   "date_unixtime": "1453703436",
   "from": "Love of Food",
   "from_id": "channel1005880654",
   "photo": "photos/photo_129@25-01-2016_13-30-36.jpg",
   "width": 640,
   "height": 400,
   "text": "",
   "text_entities": []
  },
  {
   "id": 135,
   "type": "message",
   "date": "2016-01-25T13:30:36",
   "date_unixtime": "1453703436",
   "from": "Love of Food",
   "from_id": "channel1005880654",
   "photo": "photos/photo_130@25-01-2016_13-30-36.jpg",
   "width": 667,
   "height": 951,
   "text": "",
   "text_entities": []
  },
  {
   "id": 136,
   "type": "message",
   "date": "2016-01-30T16:48:20",
   "date_unixtime": "1454147300",
   "from": "Love of Food",
   "from_id": "channel1005880654",
   "text": [
    "A selection of interesting channels in the telegram: \n\n🐶 Animals: \n",
    {
     "type": "mention",
     "text": "@cutedogs"
    },
    "\n",
    {
     "type": "mention",
     "text": "@nya_cats"
    },
    "\n",
    {
     "type": "mention",
     "text": "@worldzoo"
    },
    "\n\n🎨 Art: \n",
    {
     "type": "mention",
     "text": "@animeart"
    },
    "\n",
    {
     "type": "mention",
     "text": "@artplanet"
    },
    "\n",
    {
     "type": "mention",
     "text": "@Dota2Art"
    },
    "\n",
    {
     "type": "mention",
     "text": "@iamdreamer"
    },
    "\n",
    {
     "type": "mention",
     "text": "@surrealpics"
    },
    "\n",
    {
     "type": "mention",
     "text": "@hennapainting"
    },
    "\n",
    {
     "type": "mention",
     "text": "@steampunks"
    },
    "\n\n🗻 Beautiful photos: \n",
    {
     "type": "mention",
     "text": "@Darkspace"
    },
    "\n",
    {
     "type": "mention",
     "text": "@motolife"
    },
    " \n",
    {
     "type": "mention",
     "text": "@my_cars"
    },
    " \n",
    {
     "type": "mention",
     "text": "@naturus"
    },
    " \n",
    {
     "type": "mention",
     "text": "@onlyfood"
    },
    "\n",
    {
     "type": "mention",
     "text": "@worldmap"
    },
    "\n",
    {
     "type": "mention",
     "text": "@travelpics"
    },
    "\n",
    {
     "type": "mention",
     "text": "@smokegirls"
    },
    "\n",
    {
     "type": "mention",
     "text": "@sportgirls"
    },
    "\n",
    {
     "type": "mention",
     "text": "@restaurantfood"
    },
    "\n",
    {
     "type": "mention",
     "text": "@alcoholics"
    },
    "\n\n🎼 Music: \n",
    {
     "type": "mention",
     "text": "@allrock"
    },
    "\n",
    {
     "type": "mention",
     "text": "@indierock"
    },
    "\n",
    {
     "type": "mention",
     "text": "@powermetal"
    },
    "\n",
    {
     "type": "mention",
     "text": "@myrecords"
    },
    "\n",
    {
     "type": "mention",
     "text": "@myplay"
    },
    " \n\n👔 Fashion: \n",
    {
     "type": "mention",
     "text": "@justdecor"
    },
    " \n",
    {
     "type": "mention",
     "text": "@ideasforhome"
    },
    "\n",
    {
     "type": "mention",
     "text": "@womenslook"
    },
    "\n",
    {
     "type": "mention",
     "text": "@menslooks"
    },
    "\n\n🔞 Erotica:\n",
    {
     "type": "mention",
     "text": "@bwgirls"
    },
    " \n",
    {
     "type": "mention",
     "text": "@erotism"
    },
    "\n",
    {
     "type": "mention",
     "text": "@kissedbyfire"
    },
    "\n",
    {
     "type": "mention",
     "text": "@sexjust"
    },
    "\n",
    {
     "type": "mention",
     "text": "@sexyassian"
    },
    "\n",
    {
     "type": "mention",
     "text": "@sexyblonde"
    },
    "\n",
    {
     "type": "mention",
     "text": "@sexybruneette"
    },
    " \n",
    {
     "type": "mention",
     "text": "@myerotic"
    },
    "\n",
    {
     "type": "mention",
     "text": "@sexpeople"
    },
    "\n",
    {
     "type": "mention",
     "text": "@tattoos"
    },
    "\n\n😂 Humor:\n",
    {
     "type": "mention",
     "text": "@bestmemes"
    },
    "\n\n🛍 Shops:\n",
    {
     "type": "mention",
     "text": "@aliexpress_best"
    },
    "\n",
    {
     "type": "mention",
     "text": "@aliexpress_items"
    },
    ""
   ],
   "text_entities": [
    {
     "type": "plain",
     "text": "A selection of interesting channels in the telegram: \n\n🐶 Animals: \n"
    },
    {
     "type": "mention",
     "text": "@cutedogs"
    },
    {
     "type": "plain",
     "text": "\n"
    },
    {
     "type": "mention",
     "text": "@nya_cats"
    },
    {
     "type": "plain",
     "text": "\n"
    },
    {
     "type": "mention",
     "text": "@worldzoo"
    },
    {
     "type": "plain",
     "text": "\n\n🎨 Art: \n"
    },
    {
     "type": "mention",
     "text": "@animeart"
    },
    {
     "type": "plain",
     "text": "\n"
    },
    {
     "type": "mention",
     "text": "@artplanet"
    },
    {
     "type": "plain",
     "text": "\n"
    },
    {
     "type": "mention",
     "text": "@Dota2Art"
    },
    {
     "type": "plain",
     "text": "\n"
    },
    {
     "type": "mention",
     "text": "@iamdreamer"
    },
    {
     "type": "plain",
     "text": "\n"
    },
    {
     "type": "mention",
     "text": "@surrealpics"
    },
    {
     "type": "plain",
     "text": "\n"
    },
    {
     "type": "mention",
     "text": "@hennapainting"
    },
    {
     "type": "plain",
     "text": "\n"
    },
    {
     "type": "mention",
     "text": "@steampunks"
    },
    {
     "type": "plain",
     "text": "\n\n🗻 Beautiful photos: \n"
    },
    {
     "type": "mention",
     "text": "@Darkspace"
    },
    {
     "type": "plain",
     "text": "\n"
    },
    {
     "type": "mention",
     "text": "@motolife"
    },
    {
     "type": "plain",
     "text": " \n"
    },
    {
     "type": "mention",
     "text": "@my_cars"
    },
    {
     "type": "plain",
     "text": " \n"
    },
    {
     "type": "mention",
     "text": "@naturus"
    },
    {
     "type": "plain",
     "text": " \n"
    },
    {
     "type": "mention",
     "text": "@onlyfood"
    },
    {
     "type": "plain",
     "text": "\n"
    },
    {
     "type": "mention",
     "text": "@worldmap"
    },
    {
     "type": "plain",
     "text": "\n"
    },
    {
     "type": "mention",
     "text": "@travelpics"
    },
    {
     "type": "plain",
     "text": "\n"
    },
    {
     "type": "mention",
     "text": "@smokegirls"
    },
    {
     "type": "plain",
     "text": "\n"
    },
    {
     "type": "mention",
     "text": "@sportgirls"
    },
    {
     "type": "plain",
     "text": "\n"
    },
    {
     "type": "mention",
     "text": "@restaurantfood"
    },
    {
     "type": "plain",
     "text": "\n"
    },
    {
     "type": "mention",
     "text": "@alcoholics"
    },
    {
     "type": "plain",
     "text": "\n\n🎼 Music: \n"
    },
    {
     "type": "mention",
     "text": "@allrock"
    },
    {
     "type": "plain",
     "text": "\n"
    },
    {
     "type": "mention",
     "text": "@indierock"
    },
    {
     "type": "plain",
     "text": "\n"
    },
    {
     "type": "mention",
     "text": "@powermetal"
    },
    {
     "type": "plain",
     "text": "\n"
    },
    {
     "type": "mention",
     "text": "@myrecords"
    },
    {
     "type": "plain",
     "text": "\n"
    },
    {
     "type": "mention",
     "text": "@myplay"
    },
    {
     "type": "plain",
     "text": " \n\n👔 Fashion: \n"
    },
    {
     "type": "mention",
     "text": "@justdecor"
    },
    {
     "type": "plain",
     "text": " \n"
    },
    {
     "type": "mention",
     "text": "@ideasforhome"
    },
    {
     "type": "plain",
     "text": "\n"
    },
    {
     "type": "mention",
     "text": "@womenslook"
    },
    {
     "type": "plain",
     "text": "\n"
    },
    {
     "type": "mention",
     "text": "@menslooks"
    },
    {
     "type": "plain",
     "text": "\n\n🔞 Erotica:\n"
    },
    {
     "type": "mention",
     "text": "@bwgirls"
    },
    {
     "type": "plain",
     "text": " \n"
    },
    {
     "type": "mention",
     "text": "@erotism"
    },
    {
     "type": "plain",
     "text": "\n"
    },
    {
     "type": "mention",
     "text": "@kissedbyfire"
    },
    {
     "type": "plain",
     "text": "\n"
    },
    {
     "type": "mention",
     "text": "@sexjust"
    },
    {
     "type": "plain",
     "text": "\n"
    },
    {
     "type": "mention",
     "text": "@sexyassian"
    },
    {
     "type": "plain",
     "text": "\n"
    },
    {
     "type": "mention",
     "text": "@sexyblonde"
    },
    {
     "type": "plain",
     "text": "\n"
    },
    {
     "type": "mention",
     "text": "@sexybruneette"
    },
    {
     "type": "plain",
     "text": " \n"
    },
    {
     "type": "mention",
     "text": "@myerotic"
    },
    {
     "type": "plain",
     "text": "\n"
    },
    {
     "type": "mention",
     "text": "@sexpeople"
    },
    {
     "type": "plain",
     "text": "\n"
    },
    {
     "type": "mention",
     "text": "@tattoos"
    },
    {
     "type": "plain",
     "text": "\n\n😂 Humor:\n"
    },
    {
     "type": "mention",
     "text": "@bestmemes"
    },
    {
     "type": "plain",
     "text": "\n\n🛍 Shops:\n"
    },
    {
     "type": "mention",
     "text": "@aliexpress_best"
    },
    {
     "type": "plain",
     "text": "\n"
    },
    {
     "type": "mention",
     "text": "@aliexpress_items"
    },
    {
     "type": "plain",
     "text": ""
    }
   ]
  },
  {
   "id": 137,
   "type": "message",
   "date": "2016-01-30T18:57:52",
   "date_unixtime": "1454155072",
   "from": "Love of Food",
   "from_id": "channel1005880654",
   "photo": "photos/photo_131@30-01-2016_18-57-52.jpg",
   "width": 830,
   "height": 741,
   "text": "",
   "text_entities": []
  },
  {
   "id": 138,
   "type": "message",
   "date": "2016-01-31T13:31:00",
   "date_unixtime": "1454221860",
   "from": "Love of Food",
   "from_id": "channel1005880654",
   "photo": "photos/photo_132@31-01-2016_13-31-00.jpg",
   "width": 640,
   "height": 640,
   "text": "",
   "text_entities": []
  },
  {
   "id": 139,
   "type": "message",
   "date": "2016-01-31T13:31:00",
   "date_unixtime": "1454221860",
   "from": "Love of Food",
   "from_id": "channel1005880654",
   "photo": "photos/photo_133@31-01-2016_13-31-00.jpg",
   "width": 640,
   "height": 640,
   "text": "",
   "text_entities": []
  },
  {
   "id": 140,
   "type": "message",
   "date": "2016-01-31T13:31:00",
   "date_unixtime": "1454221860",
   "from": "Love of Food",
   "from_id": "channel1005880654",
   "photo": "photos/photo_134@31-01-2016_13-31-00.jpg",
   "width": 500,
   "height": 500,
   "text": "",
   "text_entities": []
  },
  {
   "id": 141,
   "type": "message",
   "date": "2016-01-31T13:31:04",
   "date_unixtime": "1454221864",
   "from": "Love of Food",
   "from_id": "channel1005880654",
   "photo": "photos/photo_135@31-01-2016_13-31-04.jpg",
   "width": 640,
   "height": 640,
   "text": "",
   "text_entities": []
  },
  {
   "id": 142,
   "type": "message",
   "date": "2016-01-31T13:31:04",
   "date_unixtime": "1454221864",
   "from": "Love of Food",
   "from_id": "channel1005880654",
   "photo": "photos/photo_136@31-01-2016_13-31-04.jpg",
   "width": 640,
   "height": 640,
   "text": "",
   "text_entities": []
  },
  {
   "id": 143,
   "type": "message",
   "date": "2016-02-02T13:30:08",
   "date_unixtime": "1454394608",
   "from": "Love of Food",
   "from_id": "channel1005880654",
   "photo": "photos/photo_137@02-02-2016_13-30-08.jpg",
   "width": 640,
   "height": 640,
   "text": "",
   "text_entities": []
  },
  {
   "id": 144,
   "type": "message",
   "date": "2016-02-02T13:30:08",
   "date_unixtime": "1454394608",
   "from": "Love of Food",
   "from_id": "channel1005880654",
   "photo": "photos/photo_138@02-02-2016_13-30-08.jpg",
   "width": 363,
   "height": 604,
   "text": "",
   "text_entities": []
  },
  {
   "id": 145,
   "type": "message",
   "date": "2016-02-02T13:30:08",
   "date_unixtime": "1454394608",
   "from": "Love of Food",
   "from_id": "channel1005880654",
   "photo": "photos/photo_139@02-02-2016_13-30-08.jpg",
   "width": 525,
   "height": 790,
   "text": "",
   "text_entities": []
  },
  {
   "id": 146,
   "type": "message",
   "date": "2016-02-02T13:30:12",
   "date_unixtime": "1454394612",
   "from": "Love of Food",
   "from_id": "channel1005880654",
   "photo": "photos/photo_140@02-02-2016_13-30-12.jpg",
   "width": 500,
   "height": 500,
   "text": "",
   "text_entities": []
  },
  {
   "id": 147,
   "type": "message",
   "date": "2016-02-02T13:30:12",
   "date_unixtime": "1454394612",
   "from": "Love of Food",
   "from_id": "channel1005880654",
   "photo": "photos/photo_141@02-02-2016_13-30-12.jpg",
   "width": 604,
   "height": 604,
   "text": "",
   "text_entities": []
  },
  {
   "id": 148,
   "type": "message",
   "date": "2016-02-03T13:30:24",
   "date_unixtime": "1454481024",
   "from": "Love of Food",
   "from_id": "channel1005880654",
   "photo": "photos/photo_142@03-02-2016_13-30-24.jpg",
   "width": 640,
   "height": 788,
   "text": "",
   "text_entities": []
  },
  {
   "id": 149,
   "type": "message",
   "date": "2016-02-03T13:30:24",
   "date_unixtime": "1454481024",
   "from": "Love of Food",
   "from_id": "channel1005880654",
   "photo": "photos/photo_143@03-02-2016_13-30-24.jpg",
   "width": 500,
   "height": 333,
   "text": "",
   "text_entities": []
  },
  {
   "id": 150,
   "type": "message",
   "date": "2016-02-03T13:30:24",
   "date_unixtime": "1454481024",
   "from": "Love of Food",
   "from_id": "channel1005880654",
   "photo": "photos/photo_144@03-02-2016_13-30-24.jpg",
   "width": 640,
   "height": 640,
   "text": "",
   "text_entities": []
  },
  {
   "id": 151,
   "type": "message",
   "date": "2016-02-03T13:30:24",
   "date_unixtime": "1454481024",
   "from": "Love of Food",
   "from_id": "channel1005880654",
   "photo": "photos/photo_145@03-02-2016_13-30-24.jpg",
   "width": 640,
   "height": 640,
   "text": "",
   "text_entities": []
  },
  {
   "id": 152,
   "type": "message",
   "date": "2016-02-03T13:30:24",
   "date_unixtime": "1454481024",
   "from": "Love of Food",
   "from_id": "channel1005880654",
   "photo": "photos/photo_146@03-02-2016_13-30-24.jpg",
   "width": 640,
   "height": 640,
   "text": "",
   "text_entities": []
  },
  {
   "id": 153,
   "type": "message",
   "date": "2016-02-03T16:18:04",
   "date_unixtime": "1454491084",
   "from": "Love of Food",
   "from_id": "channel1005880654",
   "text": [
    "A selection of interesting channels in the telegram: \n\n🐶 Animals: \n",
    {
     "type": "mention",
     "text": "@cutedogs"
    },
    "\n",
    {
     "type": "mention",
     "text": "@nya_cats"
    },
    "\n",
    {
     "type": "mention",
     "text": "@worldzoo"
    },
    "\n\n🎨 Art: \n",
    {
     "type": "mention",
     "text": "@animeart"
    },
    "\n",
    {
     "type": "mention",
     "text": "@artplanet"
    },
    "\n",
    {
     "type": "mention",
     "text": "@Dota2Art"
    },
    "\n",
    {
     "type": "mention",
     "text": "@iamdreamer"
    },
    "\n",
    {
     "type": "mention",
     "text": "@surrealpics"
    },
    "\n",
    {
     "type": "mention",
     "text": "@hennapainting"
    },
    "\n",
    {
     "type": "mention",
     "text": "@steampunks"
    },
    "\n\n🗻 Beautiful photos: \n",
    {
     "type": "mention",
     "text": "@Darkspace"
    },
    "\n",
    {
     "type": "mention",
     "text": "@motolife"
    },
    " \n",
    {
     "type": "mention",
     "text": "@my_cars"
    },
    " \n",
    {
     "type": "mention",
     "text": "@naturus"
    },
    " \n",
    {
     "type": "mention",
     "text": "@onlyfood"
    },
    "\n",
    {
     "type": "mention",
     "text": "@worldmap"
    },
    "\n",
    {
     "type": "mention",
     "text": "@travelpics"
    },
    "\n",
    {
     "type": "mention",
     "text": "@smokegirls"
    },
    "\n",
    {
     "type": "mention",
     "text": "@sportgirls"
    },
    "\n",
    {
     "type": "mention",
     "text": "@restaurantfood"
    },
    "\n",
    {
     "type": "mention",
     "text": "@alcoholics"
    },
    "\n\n🎼 Music: \n",
    {
     "type": "mention",
     "text": "@allrock"
    },
    "\n",
    {
     "type": "mention",
     "text": "@indierock"
    },
    "\n",
    {
     "type": "mention",
     "text": "@powermetal"
    },
    "\n",
    {
     "type": "mention",
     "text": "@myrecords"
    },
    "\n",
    {
     "type": "mention",
     "text": "@myplay"
    },
    " \n\n👔 Fashion: \n",
    {
     "type": "mention",
     "text": "@justdecor"
    },
    " \n",
    {
     "type": "mention",
     "text": "@ideasforhome"
    },
    "\n",
    {
     "type": "mention",
     "text": "@womenslook"
    },
    "\n",
    {
     "type": "mention",
     "text": "@menslooks"
    },
    "\n\n🔞 Erotica:\n",
    {
     "type": "mention",
     "text": "@bwgirls"
    },
    " \n",
    {
     "type": "mention",
     "text": "@erotism"
    },
    "\n",
    {
     "type": "mention",
     "text": "@kissedbyfire"
    },
    "\n",
    {
     "type": "mention",
     "text": "@sexjust"
    },
    "\n",
    {
     "type": "mention",
     "text": "@sexyasian"
    },
    "\n",
    {
     "type": "mention",
     "text": "@sexyblonde"
    },
    "\n",
    {
     "type": "mention",
     "text": "@sexybruneette"
    },
    " \n",
    {
     "type": "mention",
     "text": "@myerotic"
    },
    "\n",
    {
     "type": "mention",
     "text": "@sexpeople"
    },
    "\n",
    {
     "type": "mention",
     "text": "@tattoos"
    },
    "\n\n😂 Humor:\n",
    {
     "type": "mention",
     "text": "@bestmemes"
    },
    "\n\n🛍 Shops:\n",
    {
     "type": "mention",
     "text": "@aliexpress_best"
    },
    "\n",
    {
     "type": "mention",
     "text": "@aliexpress_items"
    },
    ""
   ],
   "text_entities": [
    {
     "type": "plain",
     "text": "A selection of interesting channels in the telegram: \n\n🐶 Animals: \n"
    },
    {
     "type": "mention",
     "text": "@cutedogs"
    },
    {
     "type": "plain",
     "text": "\n"
    },
    {
     "type": "mention",
     "text": "@nya_cats"
    },
    {
     "type": "plain",
     "text": "\n"
    },
    {
     "type": "mention",
     "text": "@worldzoo"
    },
    {
     "type": "plain",
     "text": "\n\n🎨 Art: \n"
    },
    {
     "type": "mention",
     "text": "@animeart"
    },
    {
     "type": "plain",
     "text": "\n"
    },
    {
     "type": "mention",
     "text": "@artplanet"
    },
    {
     "type": "plain",
     "text": "\n"
    },
    {
     "type": "mention",
     "text": "@Dota2Art"
    },
    {
     "type": "plain",
     "text": "\n"
    },
    {
     "type": "mention",
     "text": "@iamdreamer"
    },
    {
     "type": "plain",
     "text": "\n"
    },
    {
     "type": "mention",
     "text": "@surrealpics"
    },
    {
     "type": "plain",
     "text": "\n"
    },
    {
     "type": "mention",
     "text": "@hennapainting"
    },
    {
     "type": "plain",
     "text": "\n"
    },
    {
     "type": "mention",
     "text": "@steampunks"
    },
    {
     "type": "plain",
     "text": "\n\n🗻 Beautiful photos: \n"
    },
    {
     "type": "mention",
     "text": "@Darkspace"
    },
    {
     "type": "plain",
     "text": "\n"
    },
    {
     "type": "mention",
     "text": "@motolife"
    },
    {
     "type": "plain",
     "text": " \n"
    },
    {
     "type": "mention",
     "text": "@my_cars"
    },
    {
     "type": "plain",
     "text": " \n"
    },
    {
     "type": "mention",
     "text": "@naturus"
    },
    {
     "type": "plain",
     "text": " \n"
    },
    {
     "type": "mention",
     "text": "@onlyfood"
    },
    {
     "type": "plain",
     "text": "\n"
    },
    {
     "type": "mention",
     "text": "@worldmap"
    },
    {
     "type": "plain",
     "text": "\n"
    },
    {
     "type": "mention",
     "text": "@travelpics"
    },
    {
     "type": "plain",
     "text": "\n"
    },
    {
     "type": "mention",
     "text": "@smokegirls"
    },
    {
     "type": "plain",
     "text": "\n"
    },
    {
     "type": "mention",
     "text": "@sportgirls"
    },
    {
     "type": "plain",
     "text": "\n"
    },
    {
     "type": "mention",
     "text": "@restaurantfood"
    },
    {
     "type": "plain",
     "text": "\n"
    },
    {
     "type": "mention",
     "text": "@alcoholics"
    },
    {
     "type": "plain",
     "text": "\n\n🎼 Music: \n"
    },
    {
     "type": "mention",
     "text": "@allrock"
    },
    {
     "type": "plain",
     "text": "\n"
    },
    {
     "type": "mention",
     "text": "@indierock"
    },
    {
     "type": "plain",
     "text": "\n"
    },
    {
     "type": "mention",
     "text": "@powermetal"
    },
    {
     "type": "plain",
     "text": "\n"
    },
    {
     "type": "mention",
     "text": "@myrecords"
    },
    {
     "type": "plain",
     "text": "\n"
    },
    {
     "type": "mention",
     "text": "@myplay"
    },
    {
     "type": "plain",
     "text": " \n\n👔 Fashion: \n"
    },
    {
     "type": "mention",
     "text": "@justdecor"
    },
    {
     "type": "plain",
     "text": " \n"
    },
    {
     "type": "mention",
     "text": "@ideasforhome"
    },
    {
     "type": "plain",
     "text": "\n"
    },
    {
     "type": "mention",
     "text": "@womenslook"
    },
    {
     "type": "plain",
     "text": "\n"
    },
    {
     "type": "mention",
     "text": "@menslooks"
    },
    {
     "type": "plain",
     "text": "\n\n🔞 Erotica:\n"
    },
    {
     "type": "mention",
     "text": "@bwgirls"
    },
    {
     "type": "plain",
     "text": " \n"
    },
    {
     "type": "mention",
     "text": "@erotism"
    },
    {
     "type": "plain",
     "text": "\n"
    },
    {
     "type": "mention",
     "text": "@kissedbyfire"
    },
    {
     "type": "plain",
     "text": "\n"
    },
    {
     "type": "mention",
     "text": "@sexjust"
    },
    {
     "type": "plain",
     "text": "\n"
    },
    {
     "type": "mention",
     "text": "@sexyasian"
    },
    {
     "type": "plain",
     "text": "\n"
    },
    {
     "type": "mention",
     "text": "@sexyblonde"
    },
    {
     "type": "plain",
     "text": "\n"
    },
    {
     "type": "mention",
     "text": "@sexybruneette"
    },
    {
     "type": "plain",
     "text": " \n"
    },
    {
     "type": "mention",
     "text": "@myerotic"
    },
    {
     "type": "plain",
     "text": "\n"
    },
    {
     "type": "mention",
     "text": "@sexpeople"
    },
    {
     "type": "plain",
     "text": "\n"
    },
    {
     "type": "mention",
     "text": "@tattoos"
    },
    {
     "type": "plain",
     "text": "\n\n😂 Humor:\n"
    },
    {
     "type": "mention",
     "text": "@bestmemes"
    },
    {
     "type": "plain",
     "text": "\n\n🛍 Shops:\n"
    },
    {
     "type": "mention",
     "text": "@aliexpress_best"
    },
    {
     "type": "plain",
     "text": "\n"
    },
    {
     "type": "mention",
     "text": "@aliexpress_items"
    },
    {
     "type": "plain",
     "text": ""
    }
   ]
  },
  {
   "id": 154,
   "type": "message",
   "date": "2016-02-03T19:28:00",
   "date_unixtime": "1454502480",
   "from": "Love of Food",
   "from_id": "channel1005880654",
   "photo": "photos/photo_147@03-02-2016_19-28-00.jpg",
   "width": 640,
   "height": 360,
   "text": "",
   "text_entities": []
  },
  {
   "id": 155,
   "type": "message",
   "date": "2016-02-05T13:30:24",
   "date_unixtime": "1454653824",
   "from": "Love of Food",
   "from_id": "channel1005880654",
   "photo": "photos/photo_148@05-02-2016_13-30-24.jpg",
   "width": 640,
   "height": 640,
   "text": "",
   "text_entities": []
  },
  {
   "id": 156,
   "type": "message",
   "date": "2016-02-05T13:30:24",
   "date_unixtime": "1454653824",
   "from": "Love of Food",
   "from_id": "channel1005880654",
   "photo": "photos/photo_149@05-02-2016_13-30-24.jpg",
   "width": 640,
   "height": 640,
   "text": "",
   "text_entities": []
  },
  {
   "id": 157,
   "type": "message",
   "date": "2016-02-05T13:30:24",
   "date_unixtime": "1454653824",
   "from": "Love of Food",
   "from_id": "channel1005880654",
   "photo": "photos/photo_150@05-02-2016_13-30-24.jpg",
   "width": 640,
   "height": 800,
   "text": "",
   "text_entities": []
  },
  {
   "id": 158,
   "type": "message",
   "date": "2016-02-05T13:30:24",
   "date_unixtime": "1454653824",
   "from": "Love of Food",
   "from_id": "channel1005880654",
   "photo": "photos/photo_151@05-02-2016_13-30-24.jpg",
   "width": 640,
   "height": 627,
   "text": "",
   "text_entities": []
  },
  {
   "id": 159,
   "type": "message",
   "date": "2016-02-05T13:30:24",
   "date_unixtime": "1454653824",
   "from": "Love of Food",
   "from_id": "channel1005880654",
   "photo": "photos/photo_152@05-02-2016_13-30-24.jpg",
   "width": 536,
   "height": 800,
   "text": "",
   "text_entities": []
  },
  {
   "id": 160,
   "type": "message",
   "date": "2016-02-06T13:30:24",
   "date_unixtime": "1454740224",
   "from": "Love of Food",
   "from_id": "channel1005880654",
   "photo": "photos/photo_153@06-02-2016_13-30-24.jpg",
   "width": 640,
   "height": 800,
   "text": "",
   "text_entities": []
  },
  {
   "id": 161,
   "type": "message",
   "date": "2016-02-06T13:30:24",
   "date_unixtime": "1454740224",
   "from": "Love of Food",
   "from_id": "channel1005880654",
   "photo": "photos/photo_154@06-02-2016_13-30-24.jpg",
   "width": 500,
   "height": 746,
   "text": "",
   "text_entities": []
  },
  {
   "id": 162,
   "type": "message",
   "date": "2016-02-06T13:30:24",
   "date_unixtime": "1454740224",
   "from": "Love of Food",
   "from_id": "channel1005880654",
   "photo": "photos/photo_155@06-02-2016_13-30-24.jpg",
   "width": 640,
   "height": 640,
   "text": "",
   "text_entities": []
  },
  {
   "id": 163,
   "type": "message",
   "date": "2016-02-06T13:30:24",
   "date_unixtime": "1454740224",
   "from": "Love of Food",
   "from_id": "channel1005880654",
   "photo": "photos/photo_156@06-02-2016_13-30-24.jpg",
   "width": 500,
   "height": 500,
   "text": "",
   "text_entities": []
  },
  {
   "id": 164,
   "type": "message",
   "date": "2016-02-06T13:30:28",
   "date_unixtime": "1454740228",
   "from": "Love of Food",
   "from_id": "channel1005880654",
   "photo": "photos/photo_157@06-02-2016_13-30-28.jpg",
   "width": 500,
   "height": 750,
   "text": "",
   "text_entities": []
  },
  {
   "id": 165,
   "type": "message",
   "date": "2016-02-07T13:30:20",
   "date_unixtime": "1454826620",
   "from": "Love of Food",
   "from_id": "channel1005880654",
   "photo": "photos/photo_158@07-02-2016_13-30-20.jpg",
   "width": 640,
   "height": 640,
   "text": "",
   "text_entities": []
  },
  {
   "id": 166,
   "type": "message",
   "date": "2016-02-07T13:30:24",
   "date_unixtime": "1454826624",
   "from": "Love of Food",
   "from_id": "channel1005880654",
   "photo": "photos/photo_159@07-02-2016_13-30-24.jpg",
   "width": 500,
   "height": 653,
   "text": "",
   "text_entities": []
  },
  {
   "id": 167,
   "type": "message",
   "date": "2016-02-07T13:30:24",
   "date_unixtime": "1454826624",
   "from": "Love of Food",
   "from_id": "channel1005880654",
   "photo": "photos/photo_160@07-02-2016_13-30-24.jpg",
   "width": 640,
   "height": 788,
   "text": "",
   "text_entities": []
  },
  {
   "id": 168,
   "type": "message",
   "date": "2016-02-07T13:30:24",
   "date_unixtime": "1454826624",
   "from": "Love of Food",
   "from_id": "channel1005880654",
   "photo": "photos/photo_161@07-02-2016_13-30-24.jpg",
   "width": 640,
   "height": 640,
   "text": "",
   "text_entities": []
  },
  {
   "id": 169,
   "type": "message",
   "date": "2016-02-07T13:30:24",
   "date_unixtime": "1454826624",
   "from": "Love of Food",
   "from_id": "channel1005880654",
   "photo": "photos/photo_162@07-02-2016_13-30-24.jpg",
   "width": 640,
   "height": 640,
   "text": "",
   "text_entities": []
  },
  {
   "id": 170,
   "type": "message",
   "date": "2016-02-08T13:30:28",
   "date_unixtime": "1454913028",
   "from": "Love of Food",
   "from_id": "channel1005880654",
   "photo": "photos/photo_163@08-02-2016_13-30-28.jpg",
   "width": 749,
   "height": 1000,
   "text": "",
   "text_entities": []
  },
  {
   "id": 171,
   "type": "message",
   "date": "2016-02-08T13:30:32",
   "date_unixtime": "1454913032",
   "from": "Love of Food",
   "from_id": "channel1005880654",
   "photo": "photos/photo_164@08-02-2016_13-30-32.jpg",
   "width": 640,
   "height": 640,
   "text": "",
   "text_entities": []
  },
  {
   "id": 172,
   "type": "message",
   "date": "2016-02-08T13:30:32",
   "date_unixtime": "1454913032",
   "from": "Love of Food",
   "from_id": "channel1005880654",
   "photo": "photos/photo_165@08-02-2016_13-30-32.jpg",
   "width": 480,
   "height": 480,
   "text": "",
   "text_entities": []
  },
  {
   "id": 173,
   "type": "message",
   "date": "2016-02-08T13:30:32",
   "date_unixtime": "1454913032",
   "from": "Love of Food",
   "from_id": "channel1005880654",
   "photo": "photos/photo_166@08-02-2016_13-30-32.jpg",
   "width": 640,
   "height": 800,
   "text": "",
   "text_entities": []
  },
  {
   "id": 174,
   "type": "message",
   "date": "2016-02-08T13:30:32",
   "date_unixtime": "1454913032",
   "from": "Love of Food",
   "from_id": "channel1005880654",
   "photo": "photos/photo_167@08-02-2016_13-30-32.jpg",
   "width": 640,
   "height": 640,
   "text": "",
   "text_entities": []
  },
  {
   "id": 175,
   "type": "message",
   "date": "2016-02-09T13:30:08",
   "date_unixtime": "1454999408",
   "from": "Love of Food",
   "from_id": "channel1005880654",
   "photo": "photos/photo_168@09-02-2016_13-30-08.jpg",
   "width": 640,
   "height": 639,
   "text": "",
   "text_entities": []
  },
  {
   "id": 176,
   "type": "message",
   "date": "2016-02-09T13:30:08",
   "date_unixtime": "1454999408",
   "from": "Love of Food",
   "from_id": "channel1005880654",
   "photo": "photos/photo_169@09-02-2016_13-30-08.jpg",
   "width": 500,
   "height": 750,
   "text": "",
   "text_entities": []
  },
  {
   "id": 177,
   "type": "message",
   "date": "2016-02-09T13:30:08",
   "date_unixtime": "1454999408",
   "from": "Love of Food",
   "from_id": "channel1005880654",
   "photo": "photos/photo_170@09-02-2016_13-30-08.jpg",
   "width": 899,
   "height": 562,
   "text": "",
   "text_entities": []
  },
  {
   "id": 178,
   "type": "message",
   "date": "2016-02-09T13:30:08",
   "date_unixtime": "1454999408",
   "from": "Love of Food",
   "from_id": "channel1005880654",
   "photo": "photos/photo_171@09-02-2016_13-30-08.jpg",
   "width": 1280,
   "height": 852,
   "text": "",
   "text_entities": []
  },
  {
   "id": 179,
   "type": "message",
   "date": "2016-02-09T13:30:08",
   "date_unixtime": "1454999408",
   "from": "Love of Food",
   "from_id": "channel1005880654",
   "photo": "photos/photo_172@09-02-2016_13-30-08.jpg",
   "width": 540,
   "height": 540,
   "text": "",
   "text_entities": []
  },
  {
   "id": 180,
   "type": "message",
   "date": "2016-02-10T13:30:08",
   "date_unixtime": "1455085808",
   "from": "Love of Food",
   "from_id": "channel1005880654",
   "photo": "photos/photo_173@10-02-2016_13-30-08.jpg",
   "width": 604,
   "height": 453,
   "text": "",
   "text_entities": []
  },
  {
   "id": 181,
   "type": "message",
   "date": "2016-02-10T13:30:08",
   "date_unixtime": "1455085808",
   "from": "Love of Food",
   "from_id": "channel1005880654",
   "photo": "photos/photo_174@10-02-2016_13-30-08.jpg",
   "width": 1080,
   "height": 1080,
   "text": "",
   "text_entities": []
  },
  {
   "id": 182,
   "type": "message",
   "date": "2016-02-10T13:30:08",
   "date_unixtime": "1455085808",
   "from": "Love of Food",
   "from_id": "channel1005880654",
   "photo": "photos/photo_175@10-02-2016_13-30-08.jpg",
   "width": 540,
   "height": 540,
   "text": "",
   "text_entities": []
  },
  {
   "id": 183,
   "type": "message",
   "date": "2016-02-10T13:30:08",
   "date_unixtime": "1455085808",
   "from": "Love of Food",
   "from_id": "channel1005880654",
   "photo": "photos/photo_176@10-02-2016_13-30-08.jpg",
   "width": 1080,
   "height": 1080,
   "text": "",
   "text_entities": []
  },
  {
   "id": 184,
   "type": "message",
   "date": "2016-02-10T13:30:08",
   "date_unixtime": "1455085808",
   "from": "Love of Food",
   "from_id": "channel1005880654",
   "photo": "photos/photo_177@10-02-2016_13-30-08.jpg",
   "width": 1280,
   "height": 720,
   "text": "",
   "text_entities": []
  },
  {
   "id": 185,
   "type": "message",
   "date": "2016-02-11T13:30:08",
   "date_unixtime": "1455172208",
   "from": "Love of Food",
   "from_id": "channel1005880654",
   "photo": "photos/photo_178@11-02-2016_13-30-08.jpg",
   "width": 540,
   "height": 534,
   "text": "",
   "text_entities": []
  },
  {
   "id": 186,
   "type": "message",
   "date": "2016-02-11T13:30:08",
   "date_unixtime": "1455172208",
   "from": "Love of Food",
   "from_id": "channel1005880654",
   "photo": "photos/photo_179@11-02-2016_13-30-08.jpg",
   "width": 851,
   "height": 853,
   "text": "",
   "text_entities": []
  },
  {
   "id": 187,
   "type": "message",
   "date": "2016-02-11T13:30:08",
   "date_unixtime": "1455172208",
   "from": "Love of Food",
   "from_id": "channel1005880654",
   "photo": "photos/photo_180@11-02-2016_13-30-08.jpg",
   "width": 500,
   "height": 500,
   "text": "",
   "text_entities": []
  },
  {
   "id": 188,
   "type": "message",
   "date": "2016-02-11T13:30:08",
   "date_unixtime": "1455172208",
   "from": "Love of Food",
   "from_id": "channel1005880654",
   "photo": "photos/photo_181@11-02-2016_13-30-08.jpg",
   "width": 650,
   "height": 981,
   "text": "",
   "text_entities": []
  },
  {
   "id": 189,
   "type": "message",
   "date": "2016-02-11T13:30:08",
   "date_unixtime": "1455172208",
   "from": "Love of Food",
   "from_id": "channel1005880654",
   "photo": "photos/photo_182@11-02-2016_13-30-08.jpg",
   "width": 640,
   "height": 640,
   "text": "",
   "text_entities": []
  },
  {
   "id": 190,
   "type": "message",
   "date": "2016-02-12T13:30:08",
   "date_unixtime": "1455258608",
   "from": "Love of Food",
   "from_id": "channel1005880654",
   "photo": "photos/photo_183@12-02-2016_13-30-08.jpg",
   "width": 640,
   "height": 640,
   "text": "",
   "text_entities": []
  },
  {
   "id": 191,
   "type": "message",
   "date": "2016-02-12T13:30:08",
   "date_unixtime": "1455258608",
   "from": "Love of Food",
   "from_id": "channel1005880654",
   "photo": "photos/photo_184@12-02-2016_13-30-08.jpg",
   "width": 1280,
   "height": 960,
   "text": "",
   "text_entities": []
  },
  {
   "id": 192,
   "type": "message",
   "date": "2016-02-12T13:30:08",
   "date_unixtime": "1455258608",
   "from": "Love of Food",
   "from_id": "channel1005880654",
   "photo": "photos/photo_185@12-02-2016_13-30-08.jpg",
   "width": 1280,
   "height": 800,
   "text": "",
   "text_entities": []
  },
  {
   "id": 193,
   "type": "message",
   "date": "2016-02-12T13:30:08",
   "date_unixtime": "1455258608",
   "from": "Love of Food",
   "from_id": "channel1005880654",
   "photo": "photos/photo_186@12-02-2016_13-30-08.jpg",
   "width": 440,
   "height": 300,
   "text": "",
   "text_entities": []
  },
  {
   "id": 194,
   "type": "message",
   "date": "2016-02-12T13:30:08",
   "date_unixtime": "1455258608",
   "from": "Love of Food",
   "from_id": "channel1005880654",
   "photo": "photos/photo_187@12-02-2016_13-30-08.jpg",
   "width": 1280,
   "height": 908,
   "text": "",
   "text_entities": []
  },
  {
   "id": 195,
   "type": "message",
   "date": "2016-02-13T13:30:08",
   "date_unixtime": "1455345008",
   "from": "Love of Food",
   "from_id": "channel1005880654",
   "photo": "photos/photo_188@13-02-2016_13-30-08.jpg",
   "width": 600,
   "height": 400,
   "text": "",
   "text_entities": []
  },
  {
   "id": 196,
   "type": "message",
   "date": "2016-02-13T13:30:08",
   "date_unixtime": "1455345008",
   "from": "Love of Food",
   "from_id": "channel1005880654",
   "photo": "photos/photo_189@13-02-2016_13-30-08.jpg",
   "width": 440,
   "height": 400,
   "text": "",
   "text_entities": []
  },
  {
   "id": 197,
   "type": "message",
   "date": "2016-02-13T13:30:08",
   "date_unixtime": "1455345008",
   "from": "Love of Food",
   "from_id": "channel1005880654",
   "photo": "photos/photo_190@13-02-2016_13-30-08.jpg",
   "width": 403,
   "height": 604,
   "text": "",
   "text_entities": []
  },
  {
   "id": 198,
   "type": "message",
   "date": "2016-02-13T13:30:08",
   "date_unixtime": "1455345008",
   "from": "Love of Food",
   "from_id": "channel1005880654",
   "photo": "photos/photo_191@13-02-2016_13-30-08.jpg",
   "width": 550,
   "height": 550,
   "text": "",
   "text_entities": []
  },
  {
   "id": 199,
   "type": "message",
   "date": "2016-02-13T13:30:08",
   "date_unixtime": "1455345008",
   "from": "Love of Food",
   "from_id": "channel1005880654",
   "photo": "photos/photo_192@13-02-2016_13-30-08.jpg",
   "width": 480,
   "height": 720,
   "text": "",
   "text_entities": []
  },
  {
   "id": 200,
   "type": "message",
   "date": "2016-02-13T18:41:24",
   "date_unixtime": "1455363684",
   "from": "Love of Food",
   "from_id": "channel1005880654",
   "text": [
    "A selection of interesting channels in the telegram: \n\n🐶 Animals: \n",
    {
     "type": "mention",
     "text": "@cutedogs"
    },
    " \n",
    {
     "type": "mention",
     "text": "@nya_cats"
    },
    " \n",
    {
     "type": "mention",
     "text": "@worldzoo"
    },
    " \n\n🎨 Art: \n",
    {
     "type": "mention",
     "text": "@animeart"
    },
    " \n",
    {
     "type": "mention",
     "text": "@artplanet"
    },
    " \n",
    {
     "type": "mention",
     "text": "@Dota2Art"
    },
    " \n",
    {
     "type": "mention",
     "text": "@iamdreamer"
    },
    " \n",
    {
     "type": "mention",
     "text": "@surrealpics"
    },
    " \n",
    {
     "type": "mention",
     "text": "@hennapainting"
    },
    " \n",
    {
     "type": "mention",
     "text": "@steampunks"
    },
    " \n\n🗻 Beautiful photos: \n",
    {
     "type": "mention",
     "text": "@Darkspace"
    },
    " \n",
    {
     "type": "mention",
     "text": "@motolife"
    },
    " \n",
    {
     "type": "mention",
     "text": "@my_cars"
    },
    " \n",
    {
     "type": "mention",
     "text": "@naturus"
    },
    " \n",
    {
     "type": "mention",
     "text": "@onlyfood"
    },
    " \n",
    {
     "type": "mention",
     "text": "@worldmap"
    },
    " \n",
    {
     "type": "mention",
     "text": "@travelpics"
    },
    " \n",
    {
     "type": "mention",
     "text": "@smokegirls"
    },
    " \n",
    {
     "type": "mention",
     "text": "@sportgirls"
    },
    " \n",
    {
     "type": "mention",
     "text": "@restaurantfood"
    },
    " \n",
    {
     "type": "mention",
     "text": "@alcoholics"
    },
    " \n\n🎼 Music: \n",
    {
     "type": "mention",
     "text": "@allrock"
    },
    " \n",
    {
     "type": "mention",
     "text": "@indierock"
    },
    " \n",
    {
     "type": "mention",
     "text": "@powermetal"
    },
    " \n",
    {
     "type": "mention",
     "text": "@myrecords"
    },
    " \n",
    {
     "type": "mention",
     "text": "@myplay"
    },
    " \n\n👔 Fashion: \n",
    {
     "type": "mention",
     "text": "@justdecor"
    },
    " \n",
    {
     "type": "mention",
     "text": "@ideasforhome"
    },
    " \n",
    {
     "type": "mention",
     "text": "@womenslook"
    },
    " \n",
    {
     "type": "mention",
     "text": "@menslooks"
    },
    " \n\n🔞 Erotica: \n",
    {
     "type": "mention",
     "text": "@bwgirls"
    },
    " \n",
    {
     "type": "mention",
     "text": "@erotism"
    },
    " \n",
    {
     "type": "mention",
     "text": "@kissedbyfire"
    },
    " \n",
    {
     "type": "mention",
     "text": "@sexjust"
    },
    " \n",
    {
     "type": "mention",
     "text": "@sexyasian"
    },
    " \n",
    {
     "type": "mention",
     "text": "@sexyblonde"
    },
    " \n",
    {
     "type": "mention",
     "text": "@sexybrunette"
    },
    " \n",
    {
     "type": "mention",
     "text": "@myerotic"
    },
    " \n",
    {
     "type": "mention",
     "text": "@sexpeople"
    },
    " \n",
    {
     "type": "mention",
     "text": "@tattoos"
    },
    " \n\n📽Movies:\n",
    {
     "type": "mention",
     "text": "@toptvseries"
    },
    "\n\n😂 Humor: \n",
    {
     "type": "mention",
     "text": "@bestmemes"
    },
    " \n\n🛍 Shops: \n",
    {
     "type": "mention",
     "text": "@aliexpress_best"
    },
    " \n",
    {
     "type": "mention",
     "text": "@aliexpress_items"
    },
    ""
   ],
   "text_entities": [
    {
     "type": "plain",
     "text": "A selection of interesting channels in the telegram: \n\n🐶 Animals: \n"
    },
    {
     "type": "mention",
     "text": "@cutedogs"
    },
    {
     "type": "plain",
     "text": " \n"
    },
    {
     "type": "mention",
     "text": "@nya_cats"
    },
    {
     "type": "plain",
     "text": " \n"
    },
    {
     "type": "mention",
     "text": "@worldzoo"
    },
    {
     "type": "plain",
     "text": " \n\n🎨 Art: \n"
    },
    {
     "type": "mention",
     "text": "@animeart"
    },
    {
     "type": "plain",
     "text": " \n"
    },
    {
     "type": "mention",
     "text": "@artplanet"
    },
    {
     "type": "plain",
     "text": " \n"
    },
    {
     "type": "mention",
     "text": "@Dota2Art"
    },
    {
     "type": "plain",
     "text": " \n"
    },
    {
     "type": "mention",
     "text": "@iamdreamer"
    },
    {
     "type": "plain",
     "text": " \n"
    },
    {
     "type": "mention",
     "text": "@surrealpics"
    },
    {
     "type": "plain",
     "text": " \n"
    },
    {
     "type": "mention",
     "text": "@hennapainting"
    },
    {
     "type": "plain",
     "text": " \n"
    },
    {
     "type": "mention",
     "text": "@steampunks"
    },
    {
     "type": "plain",
     "text": " \n\n🗻 Beautiful photos: \n"
    },
    {
     "type": "mention",
     "text": "@Darkspace"
    },
    {
     "type": "plain",
     "text": " \n"
    },
    {
     "type": "mention",
     "text": "@motolife"
    },
    {
     "type": "plain",
     "text": " \n"
    },
    {
     "type": "mention",
     "text": "@my_cars"
    },
    {
     "type": "plain",
     "text": " \n"
    },
    {
     "type": "mention",
     "text": "@naturus"
    },
    {
     "type": "plain",
     "text": " \n"
    },
    {
     "type": "mention",
     "text": "@onlyfood"
    },
    {
     "type": "plain",
     "text": " \n"
    },
    {
     "type": "mention",
     "text": "@worldmap"
    },
    {
     "type": "plain",
     "text": " \n"
    },
    {
     "type": "mention",
     "text": "@travelpics"
    },
    {
     "type": "plain",
     "text": " \n"
    },
    {
     "type": "mention",
     "text": "@smokegirls"
    },
    {
     "type": "plain",
     "text": " \n"
    },
    {
     "type": "mention",
     "text": "@sportgirls"
    },
    {
     "type": "plain",
     "text": " \n"
    },
    {
     "type": "mention",
     "text": "@restaurantfood"
    },
    {
     "type": "plain",
     "text": " \n"
    },
    {
     "type": "mention",
     "text": "@alcoholics"
    },
    {
     "type": "plain",
     "text": " \n\n🎼 Music: \n"
    },
    {
     "type": "mention",
     "text": "@allrock"
    },
    {
     "type": "plain",
     "text": " \n"
    },
    {
     "type": "mention",
     "text": "@indierock"
    },
    {
     "type": "plain",
     "text": " \n"
    },
    {
     "type": "mention",
     "text": "@powermetal"
    },
    {
     "type": "plain",
     "text": " \n"
    },
    {
     "type": "mention",
     "text": "@myrecords"
    },
    {
     "type": "plain",
     "text": " \n"
    },
    {
     "type": "mention",
     "text": "@myplay"
    },
    {
     "type": "plain",
     "text": " \n\n👔 Fashion: \n"
    },
    {
     "type": "mention",
     "text": "@justdecor"
    },
    {
     "type": "plain",
     "text": " \n"
    },
    {
     "type": "mention",
     "text": "@ideasforhome"
    },
    {
     "type": "plain",
     "text": " \n"
    },
    {
     "type": "mention",
     "text": "@womenslook"
    },
    {
     "type": "plain",
     "text": " \n"
    },
    {
     "type": "mention",
     "text": "@menslooks"
    },
    {
     "type": "plain",
     "text": " \n\n🔞 Erotica: \n"
    },
    {
     "type": "mention",
     "text": "@bwgirls"
    },
    {
     "type": "plain",
     "text": " \n"
    },
    {
     "type": "mention",
     "text": "@erotism"
    },
    {
     "type": "plain",
     "text": " \n"
    },
    {
     "type": "mention",
     "text": "@kissedbyfire"
    },
    {
     "type": "plain",
     "text": " \n"
    },
    {
     "type": "mention",
     "text": "@sexjust"
    },
    {
     "type": "plain",
     "text": " \n"
    },
    {
     "type": "mention",
     "text": "@sexyasian"
    },
    {
     "type": "plain",
     "text": " \n"
    },
    {
     "type": "mention",
     "text": "@sexyblonde"
    },
    {
     "type": "plain",
     "text": " \n"
    },
    {
     "type": "mention",
     "text": "@sexybrunette"
    },
    {
     "type": "plain",
     "text": " \n"
    },
    {
     "type": "mention",
     "text": "@myerotic"
    },
    {
     "type": "plain",
     "text": " \n"
    },
    {
     "type": "mention",
     "text": "@sexpeople"
    },
    {
     "type": "plain",
     "text": " \n"
    },
    {
     "type": "mention",
     "text": "@tattoos"
    },
    {
     "type": "plain",
     "text": " \n\n📽Movies:\n"
    },
    {
     "type": "mention",
     "text": "@toptvseries"
    },
    {
     "type": "plain",
     "text": "\n\n😂 Humor: \n"
    },
    {
     "type": "mention",
     "text": "@bestmemes"
    },
    {
     "type": "plain",
     "text": " \n\n🛍 Shops: \n"
    },
    {
     "type": "mention",
     "text": "@aliexpress_best"
    },
    {
     "type": "plain",
     "text": " \n"
    },
    {
     "type": "mention",
     "text": "@aliexpress_items"
    },
    {
     "type": "plain",
     "text": ""
    }
   ]
  },
  {
   "id": 201,
   "type": "message",
   "date": "2016-02-14T13:30:08",
   "date_unixtime": "1455431408",
   "from": "Love of Food",
   "from_id": "channel1005880654",
   "photo": "photos/photo_193@14-02-2016_13-30-08.jpg",
   "width": 427,
   "height": 640,
   "text": "",
   "text_entities": []
  },
  {
   "id": 202,
   "type": "message",
   "date": "2016-02-14T13:30:08",
   "date_unixtime": "1455431408",
   "from": "Love of Food",
   "from_id": "channel1005880654",
   "photo": "photos/photo_194@14-02-2016_13-30-08.jpg",
   "width": 736,
   "height": 981,
   "text": "",
   "text_entities": []
  },
  {
   "id": 203,
   "type": "message",
   "date": "2016-02-14T13:30:08",
   "date_unixtime": "1455431408",
   "from": "Love of Food",
   "from_id": "channel1005880654",
   "photo": "photos/photo_195@14-02-2016_13-30-08.jpg",
   "width": 402,
   "height": 604,
   "text": "",
   "text_entities": []
  },
  {
   "id": 204,
   "type": "message",
   "date": "2016-02-14T13:30:08",
   "date_unixtime": "1455431408",
   "from": "Love of Food",
   "from_id": "channel1005880654",
   "photo": "photos/photo_196@14-02-2016_13-30-08.jpg",
   "width": 410,
   "height": 577,
   "text": "",
   "text_entities": []
  },
  {
   "id": 205,
   "type": "message",
   "date": "2016-02-14T13:30:08",
   "date_unixtime": "1455431408",
   "from": "Love of Food",
   "from_id": "channel1005880654",
   "photo": "photos/photo_197@14-02-2016_13-30-08.jpg",
   "width": 600,
   "height": 400,
   "text": "",
   "text_entities": []
  },
  {
   "id": 206,
   "type": "message",
   "date": "2016-02-15T13:30:08",
   "date_unixtime": "1455517808",
   "from": "Love of Food",
   "from_id": "channel1005880654",
   "photo": "photos/photo_198@15-02-2016_13-30-08.jpg",
   "width": 453,
   "height": 604,
   "text": "",
   "text_entities": []
  },
  {
   "id": 207,
   "type": "message",
   "date": "2016-02-15T13:30:08",
   "date_unixtime": "1455517808",
   "from": "Love of Food",
   "from_id": "channel1005880654",
   "photo": "photos/photo_199@15-02-2016_13-30-08.jpg",
   "width": 595,
   "height": 595,
   "text": "",
   "text_entities": []
  },
  {
   "id": 208,
   "type": "message",
   "date": "2016-02-15T13:30:08",
   "date_unixtime": "1455517808",
   "from": "Love of Food",
   "from_id": "channel1005880654",
   "photo": "photos/photo_200@15-02-2016_13-30-08.jpg",
   "width": 500,
   "height": 625,
   "text": "",
   "text_entities": []
  },
  {
   "id": 209,
   "type": "message",
   "date": "2016-02-15T13:30:08",
   "date_unixtime": "1455517808",
   "from": "Love of Food",
   "from_id": "channel1005880654",
   "photo": "photos/photo_201@15-02-2016_13-30-08.jpg",
   "width": 400,
   "height": 604,
   "text": "",
   "text_entities": []
  },
  {
   "id": 210,
   "type": "message",
   "date": "2016-02-15T13:30:12",
   "date_unixtime": "1455517812",
   "from": "Love of Food",
   "from_id": "channel1005880654",
   "photo": "photos/photo_202@15-02-2016_13-30-12.jpg",
   "width": 604,
   "height": 453,
   "text": "",
   "text_entities": []
  },
  {
   "id": 211,
   "type": "message",
   "date": "2016-02-16T13:30:08",
   "date_unixtime": "1455604208",
   "from": "Love of Food",
   "from_id": "channel1005880654",
   "photo": "photos/photo_203@16-02-2016_13-30-08.jpg",
   "width": 640,
   "height": 640,
   "text": "",
   "text_entities": []
  },
  {
   "id": 212,
   "type": "message",
   "date": "2016-02-16T13:30:08",
   "date_unixtime": "1455604208",
   "from": "Love of Food",
   "from_id": "channel1005880654",
   "photo": "photos/photo_204@16-02-2016_13-30-08.jpg",
   "width": 533,
   "height": 771,
   "text": "",
   "text_entities": []
  },
  {
   "id": 213,
   "type": "message",
   "date": "2016-02-16T13:30:08",
   "date_unixtime": "1455604208",
   "from": "Love of Food",
   "from_id": "channel1005880654",
   "photo": "photos/photo_205@16-02-2016_13-30-08.jpg",
   "width": 550,
   "height": 824,
   "text": "",
   "text_entities": []
  },
  {
   "id": 214,
   "type": "message",
   "date": "2016-02-16T13:30:08",
   "date_unixtime": "1455604208",
   "from": "Love of Food",
   "from_id": "channel1005880654",
   "photo": "photos/photo_206@16-02-2016_13-30-08.jpg",
   "width": 1280,
   "height": 930,
   "text": "",
   "text_entities": []
  },
  {
   "id": 215,
   "type": "message",
   "date": "2016-02-16T13:30:08",
   "date_unixtime": "1455604208",
   "from": "Love of Food",
   "from_id": "channel1005880654",
   "photo": "photos/photo_207@16-02-2016_13-30-08.jpg",
   "width": 380,
   "height": 572,
   "text": "",
   "text_entities": []
  },
  {
   "id": 216,
   "type": "message",
   "date": "2016-02-17T13:30:08",
   "date_unixtime": "1455690608",
   "from": "Love of Food",
   "from_id": "channel1005880654",
   "photo": "photos/photo_208@17-02-2016_13-30-08.jpg",
   "width": 698,
   "height": 960,
   "text": "",
   "text_entities": []
  },
  {
   "id": 217,
   "type": "message",
   "date": "2016-02-17T13:30:08",
   "date_unixtime": "1455690608",
   "from": "Love of Food",
   "from_id": "channel1005880654",
   "photo": "photos/photo_209@17-02-2016_13-30-08.jpg",
   "width": 716,
   "height": 960,
   "text": "",
   "text_entities": []
  },
  {
   "id": 218,
   "type": "message",
   "date": "2016-02-17T13:30:08",
   "date_unixtime": "1455690608",
   "from": "Love of Food",
   "from_id": "channel1005880654",
   "photo": "photos/photo_210@17-02-2016_13-30-08.jpg",
   "width": 604,
   "height": 426,
   "text": "",
   "text_entities": []
  },
  {
   "id": 219,
   "type": "message",
   "date": "2016-02-17T13:30:08",
   "date_unixtime": "1455690608",
   "from": "Love of Food",
   "from_id": "channel1005880654",
   "photo": "photos/photo_211@17-02-2016_13-30-08.jpg",
   "width": 700,
   "height": 651,
   "text": "",
   "text_entities": []
  },
  {
   "id": 220,
   "type": "message",
   "date": "2016-02-17T13:30:08",
   "date_unixtime": "1455690608",
   "from": "Love of Food",
   "from_id": "channel1005880654",
   "photo": "photos/photo_212@17-02-2016_13-30-08.jpg",
   "width": 427,
   "height": 640,
   "text": "",
   "text_entities": []
  },
  {
   "id": 221,
   "type": "message",
   "date": "2016-02-18T13:30:08",
   "date_unixtime": "1455777008",
   "from": "Love of Food",
   "from_id": "channel1005880654",
   "photo": "photos/photo_213@18-02-2016_13-30-08.jpg",
   "width": 550,
   "height": 825,
   "text": "",
   "text_entities": []
  },
  {
   "id": 222,
   "type": "message",
   "date": "2016-02-18T13:30:08",
   "date_unixtime": "1455777008",
   "from": "Love of Food",
   "from_id": "channel1005880654",
   "photo": "photos/photo_214@18-02-2016_13-30-08.jpg",
   "width": 640,
   "height": 633,
   "text": "",
   "text_entities": []
  },
  {
   "id": 223,
   "type": "message",
   "date": "2016-02-18T13:30:08",
   "date_unixtime": "1455777008",
   "from": "Love of Food",
   "from_id": "channel1005880654",
   "photo": "photos/photo_215@18-02-2016_13-30-08.jpg",
   "width": 640,
   "height": 631,
   "text": "",
   "text_entities": []
  },
  {
   "id": 224,
   "type": "message",
   "date": "2016-02-18T13:30:08",
   "date_unixtime": "1455777008",
   "from": "Love of Food",
   "from_id": "channel1005880654",
   "photo": "photos/photo_216@18-02-2016_13-30-08.jpg",
   "width": 400,
   "height": 600,
   "text": "",
   "text_entities": []
  },
  {
   "id": 225,
   "type": "message",
   "date": "2016-02-18T13:30:08",
   "date_unixtime": "1455777008",
   "from": "Love of Food",
   "from_id": "channel1005880654",
   "photo": "photos/photo_217@18-02-2016_13-30-08.jpg",
   "width": 500,
   "height": 400,
   "text": "",
   "text_entities": []
  },
  {
   "id": 226,
   "type": "message",
   "date": "2016-02-19T13:30:08",
   "date_unixtime": "1455863408",
   "from": "Love of Food",
   "from_id": "channel1005880654",
   "photo": "photos/photo_218@19-02-2016_13-30-08.jpg",
   "width": 550,
   "height": 683,
   "text": "",
   "text_entities": []
  },
  {
   "id": 227,
   "type": "message",
   "date": "2016-02-19T13:30:08",
   "date_unixtime": "1455863408",
   "from": "Love of Food",
   "from_id": "channel1005880654",
   "photo": "photos/photo_219@19-02-2016_13-30-08.jpg",
   "width": 550,
   "height": 825,
   "text": "",
   "text_entities": []
  },
  {
   "id": 228,
   "type": "message",
   "date": "2016-02-19T13:30:08",
   "date_unixtime": "1455863408",
   "from": "Love of Food",
   "from_id": "channel1005880654",
   "photo": "photos/photo_220@19-02-2016_13-30-08.jpg",
   "width": 545,
   "height": 761,
   "text": "",
   "text_entities": []
  },
  {
   "id": 229,
   "type": "message",
   "date": "2016-02-19T13:30:08",
   "date_unixtime": "1455863408",
   "from": "Love of Food",
   "from_id": "channel1005880654",
   "photo": "photos/photo_221@19-02-2016_13-30-08.jpg",
   "width": 600,
   "height": 916,
   "text": "",
   "text_entities": []
  },
  {
   "id": 230,
   "type": "message",
   "date": "2016-02-19T13:30:08",
   "date_unixtime": "1455863408",
   "from": "Love of Food",
   "from_id": "channel1005880654",
   "photo": "photos/photo_222@19-02-2016_13-30-08.jpg",
   "width": 550,
   "height": 402,
   "text": "",
   "text_entities": []
  },
  {
   "id": 231,
   "type": "message",
   "date": "2016-02-20T13:30:08",
   "date_unixtime": "1455949808",
   "from": "Love of Food",
   "from_id": "channel1005880654",
   "photo": "photos/photo_223@20-02-2016_13-30-08.jpg",
   "width": 550,
   "height": 825,
   "text": "",
   "text_entities": []
  },
  {
   "id": 232,
   "type": "message",
   "date": "2016-02-20T13:30:08",
   "date_unixtime": "1455949808",
   "from": "Love of Food",
   "from_id": "channel1005880654",
   "photo": "photos/photo_224@20-02-2016_13-30-08.jpg",
   "width": 500,
   "height": 750,
   "text": "",
   "text_entities": []
  },
  {
   "id": 233,
   "type": "message",
   "date": "2016-02-20T13:30:08",
   "date_unixtime": "1455949808",
   "from": "Love of Food",
   "from_id": "channel1005880654",
   "photo": "photos/photo_225@20-02-2016_13-30-08.jpg",
   "width": 533,
   "height": 509,
   "text": "",
   "text_entities": []
  },
  {
   "id": 234,
   "type": "message",
   "date": "2016-02-20T13:30:08",
   "date_unixtime": "1455949808",
   "from": "Love of Food",
   "from_id": "channel1005880654",
   "photo": "photos/photo_226@20-02-2016_13-30-08.jpg",
   "width": 432,
   "height": 600,
   "text": "",
   "text_entities": []
  },
  {
   "id": 235,
   "type": "message",
   "date": "2016-02-20T13:30:08",
   "date_unixtime": "1455949808",
   "from": "Love of Food",
   "from_id": "channel1005880654",
   "photo": "photos/photo_227@20-02-2016_13-30-08.jpg",
   "width": 550,
   "height": 812,
   "text": "",
   "text_entities": []
  },
  {
   "id": 236,
   "type": "message",
   "date": "2016-02-21T13:30:08",
   "date_unixtime": "1456036208",
   "from": "Love of Food",
   "from_id": "channel1005880654",
   "photo": "photos/photo_228@21-02-2016_13-30-08.jpg",
   "width": 294,
   "height": 440,
   "text": "",
   "text_entities": []
  },
  {
   "id": 237,
   "type": "message",
   "date": "2016-02-21T13:30:08",
   "date_unixtime": "1456036208",
   "from": "Love of Food",
   "from_id": "channel1005880654",
   "photo": "photos/photo_229@21-02-2016_13-30-08.jpg",
   "width": 400,
   "height": 571,
   "text": "",
   "text_entities": []
  },
  {
   "id": 238,
   "type": "message",
   "date": "2016-02-21T13:30:08",
   "date_unixtime": "1456036208",
   "from": "Love of Food",
   "from_id": "channel1005880654",
   "photo": "photos/photo_230@21-02-2016_13-30-08.jpg",
   "width": 550,
   "height": 733,
   "text": "",
   "text_entities": []
  },
  {
   "id": 239,
   "type": "message",
   "date": "2016-02-21T13:30:08",
   "date_unixtime": "1456036208",
   "from": "Love of Food",
   "from_id": "channel1005880654",
   "photo": "photos/photo_231@21-02-2016_13-30-08.jpg",
   "width": 450,
   "height": 375,
   "text": "",
   "text_entities": []
  },
  {
   "id": 240,
   "type": "message",
   "date": "2016-02-21T13:30:08",
   "date_unixtime": "1456036208",
   "from": "Love of Food",
   "from_id": "channel1005880654",
   "photo": "photos/photo_232@21-02-2016_13-30-08.jpg",
   "width": 403,
   "height": 604,
   "text": "",
   "text_entities": []
  },
  {
   "id": 241,
   "type": "message",
   "date": "2016-02-22T13:30:08",
   "date_unixtime": "1456122608",
   "from": "Love of Food",
   "from_id": "channel1005880654",
   "photo": "photos/photo_233@22-02-2016_13-30-08.jpg",
   "width": 474,
   "height": 640,
   "text": "",
   "text_entities": []
  },
  {
   "id": 242,
   "type": "message",
   "date": "2016-02-22T13:30:08",
   "date_unixtime": "1456122608",
   "from": "Love of Food",
   "from_id": "channel1005880654",
   "photo": "photos/photo_234@22-02-2016_13-30-08.jpg",
   "width": 435,
   "height": 658,
   "text": "",
   "text_entities": []
  },
  {
   "id": 243,
   "type": "message",
   "date": "2016-02-22T13:30:08",
   "date_unixtime": "1456122608",
   "from": "Love of Food",
   "from_id": "channel1005880654",
   "photo": "photos/photo_235@22-02-2016_13-30-08.jpg",
   "width": 410,
   "height": 577,
   "text": "",
   "text_entities": []
  },
  {
   "id": 244,
   "type": "message",
   "date": "2016-02-22T13:30:08",
   "date_unixtime": "1456122608",
   "from": "Love of Food",
   "from_id": "channel1005880654",
   "photo": "photos/photo_236@22-02-2016_13-30-08.jpg",
   "width": 500,
   "height": 333,
   "text": "",
   "text_entities": []
  },
  {
   "id": 245,
   "type": "message",
   "date": "2016-02-22T13:30:08",
   "date_unixtime": "1456122608",
   "from": "Love of Food",
   "from_id": "channel1005880654",
   "photo": "photos/photo_237@22-02-2016_13-30-08.jpg",
   "width": 420,
   "height": 604,
   "text": "",
   "text_entities": []
  },
  {
   "id": 246,
   "type": "message",
   "date": "2016-02-23T13:30:08",
   "date_unixtime": "1456209008",
   "from": "Love of Food",
   "from_id": "channel1005880654",
   "photo": "photos/photo_238@23-02-2016_13-30-08.jpg",
   "width": 776,
   "height": 960,
   "text": "",
   "text_entities": []
  },
  {
   "id": 247,
   "type": "message",
   "date": "2016-02-23T13:30:08",
   "date_unixtime": "1456209008",
   "from": "Love of Food",
   "from_id": "channel1005880654",
   "photo": "photos/photo_239@23-02-2016_13-30-08.jpg",
   "width": 570,
   "height": 807,
   "text": "",
   "text_entities": []
  },
  {
   "id": 248,
   "type": "message",
   "date": "2016-02-23T13:30:08",
   "date_unixtime": "1456209008",
   "from": "Love of Food",
   "from_id": "channel1005880654",
   "photo": "photos/photo_240@23-02-2016_13-30-08.jpg",
   "width": 500,
   "height": 750,
   "text": "",
   "text_entities": []
  },
  {
   "id": 249,
   "type": "message",
   "date": "2016-02-23T13:30:08",
   "date_unixtime": "1456209008",
   "from": "Love of Food",
