{
 "name": "English grammar n vocabulary",
 "type": "public_channel",
 "id": 1248828831,
 "messages": [
  {
   "id": 1,
   "type": "service",
   "date": "2019-01-25T21:53:22",
   "date_unixtime": "1548428002",
   "actor": "English grammar n vocabulary",
   "actor_id": "channel1248828831",
   "action": "create_channel",
   "title": "English grammar & vocabulary",
   "text": "",
   "text_entities": []
  },
  {
   "id": 2,
   "type": "service",
   "date": "2019-01-25T22:02:39",
   "date_unixtime": "1548428559",
   "actor": "English grammar n vocabulary",
   "actor_id": "channel1248828831",
   "action": "edit_group_photo",
   "photo": "photos/photo_1@25-01-2019_22-02-39.jpg",
   "width": 640,
   "height": 640,
   "text": "",
   "text_entities": []
  },
  {
   "id": 3,
   "type": "message",
   "date": "2019-01-25T22:05:47",
   "date_unixtime": "1548428747",
   "from": "English grammar n vocabulary",
   "from_id": "channel1248828831",
   "photo": "photos/photo_2@25-01-2019_22-05-47.jpg",
   "width": 681,
   "height": 681,
   "text": "",
   "text_entities": []
  },
  {
   "id": 5,
   "type": "message",
   "date": "2019-01-25T22:06:12",
   "date_unixtime": "1548428772",
   "from": "English grammar n vocabulary",
   "from_id": "channel1248828831",
   "photo": "photos/photo_3@25-01-2019_22-06-12.jpg",
   "width": 670,
   "height": 670,
   "text": "",
   "text_entities": []
  },
  {
   "id": 6,
   "type": "message",
   "date": "2019-01-25T22:06:53",
   "date_unixtime": "1548428813",
   "from": "English grammar n vocabulary",
   "from_id": "channel1248828831",
   "photo": "photos/photo_4@25-01-2019_22-06-53.jpg",
   "width": 712,
   "height": 676,
   "text": "",
   "text_entities": []
  },
  {
   "id": 7,
   "type": "message",
   "date": "2019-01-25T22:07:03",
   "date_unixtime": "1548428823",
   "from": "English grammar n vocabulary",
   "from_id": "channel1248828831",
   "photo": "photos/photo_5@25-01-2019_22-07-03.jpg",
   "width": 712,
   "height": 675,
   "text": "",
   "text_entities": []
  },
  {
   "id": 8,
   "type": "message",
   "date": "2019-01-25T22:07:16",
   "date_unixtime": "1548428836",
   "from": "English grammar n vocabulary",
   "from_id": "channel1248828831",
   "photo": "photos/photo_6@25-01-2019_22-07-16.jpg",
   "width": 712,
   "height": 671,
   "text": "",
   "text_entities": []
  },
  {
   "id": 9,
   "type": "message",
   "date": "2019-01-25T22:07:24",
   "date_unixtime": "1548428844",
   "from": "English grammar n vocabulary",
   "from_id": "channel1248828831",
   "photo": "photos/photo_5@25-01-2019_22-07-03.jpg",
   "width": 712,
   "height": 675,
   "text": "",
   "text_entities": []
  },
  {
   "id": 10,
   "type": "message",
   "date": "2019-01-25T22:07:46",
   "date_unixtime": "1548428866",
   "from": "English grammar n vocabulary",
   "from_id": "channel1248828831",
   "photo": "photos/photo_8@25-01-2019_22-07-46.jpg",
   "width": 720,
   "height": 678,
   "text": "",
   "text_entities": []
  },
  {
   "id": 11,
   "type": "message",
   "date": "2019-01-25T22:07:56",
   "date_unixtime": "1548428876",
   "from": "English grammar n vocabulary",
   "from_id": "channel1248828831",
   "photo": "photos/photo_9@25-01-2019_22-07-56.jpg",
   "width": 720,
   "height": 683,
   "text": "",
   "text_entities": []
  },
  {
   "id": 12,
   "type": "message",
   "date": "2019-01-25T22:08:14",
   "date_unixtime": "1548428894",
   "from": "English grammar n vocabulary",
   "from_id": "channel1248828831",
   "photo": "photos/photo_10@25-01-2019_22-08-14.jpg",
   "width": 684,
   "height": 684,
   "text": "",
   "text_entities": []
  },
  {
   "id": 13,
   "type": "message",
   "date": "2019-01-25T22:08:29",
   "date_unixtime": "1548428909",
   "from": "English grammar n vocabulary",
   "from_id": "channel1248828831",
   "photo": "photos/photo_11@25-01-2019_22-08-29.jpg",
   "width": 712,
   "height": 665,
   "text": "",
   "text_entities": []
  },
  {
   "id": 14,
   "type": "message",
   "date": "2019-01-25T22:08:59",
   "date_unixtime": "1548428939",
   "from": "English grammar n vocabulary",
   "from_id": "channel1248828831",
   "photo": "photos/photo_12@25-01-2019_22-08-59.jpg",
   "width": 669,
   "height": 669,
   "text": "",
   "text_entities": []
  },
  {
   "id": 15,
   "type": "message",
   "date": "2019-01-25T22:09:08",
   "date_unixtime": "1548428948",
   "from": "English grammar n vocabulary",
   "from_id": "channel1248828831",
   "photo": "photos/photo_13@25-01-2019_22-09-08.jpg",
   "width": 677,
   "height": 677,
   "text": "",
   "text_entities": []
  },
  {
   "id": 16,
   "type": "message",
   "date": "2019-01-25T22:09:16",
   "date_unixtime": "1548428956",
   "from": "English grammar n vocabulary",
   "from_id": "channel1248828831",
   "photo": "photos/photo_14@25-01-2019_22-09-16.jpg",
   "width": 675,
   "height": 675,
   "text": "",
   "text_entities": []
  },
  {
   "id": 17,
   "type": "message",
   "date": "2019-01-25T22:09:27",
   "date_unixtime": "1548428967",
   "from": "English grammar n vocabulary",
   "from_id": "channel1248828831",
   "photo": "photos/photo_15@25-01-2019_22-09-27.jpg",
   "width": 674,
   "height": 674,
   "text": "",
   "text_entities": []
  },
  {
   "id": 18,
   "type": "message",
   "date": "2019-01-25T22:09:37",
   "date_unixtime": "1548428977",
   "from": "English grammar n vocabulary",
   "from_id": "channel1248828831",
   "photo": "photos/photo_16@25-01-2019_22-09-37.jpg",
   "width": 675,
   "height": 675,
   "text": "",
   "text_entities": []
  },
  {
   "id": 19,
   "type": "message",
   "date": "2019-01-25T22:09:51",
   "date_unixtime": "1548428991",
   "from": "English grammar n vocabulary",
   "from_id": "channel1248828831",
   "photo": "photos/photo_17@25-01-2019_22-09-51.jpg",
   "width": 673,
   "height": 673,
   "text": "",
   "text_entities": []
  },
  {
   "id": 20,
   "type": "message",
   "date": "2019-01-25T22:10:15",
   "date_unixtime": "1548429015",
   "from": "English grammar n vocabulary",
   "from_id": "channel1248828831",
   "photo": "photos/photo_18@25-01-2019_22-10-15.jpg",
   "width": 708,
   "height": 708,
   "text": "",
   "text_entities": []
  },
  {
   "id": 21,
   "type": "message",
   "date": "2019-01-25T22:10:26",
   "date_unixtime": "1548429026",
   "from": "English grammar n vocabulary",
   "from_id": "channel1248828831",
   "photo": "photos/photo_19@25-01-2019_22-10-26.jpg",
   "width": 708,
   "height": 708,
   "text": "",
   "text_entities": []
  },
  {
   "id": 25,
   "type": "message",
   "date": "2019-01-26T13:21:58",
   "date_unixtime": "1548483718",
   "from": "English grammar n vocabulary",
   "from_id": "channel1248828831",
   "photo": "photos/photo_20@26-01-2019_13-21-58.jpg",
   "width": 712,
   "height": 669,
   "text": "",
   "text_entities": []
  },
  {
   "id": 26,
   "type": "message",
   "date": "2019-01-27T11:19:57",
   "date_unixtime": "1548562797",
   "from": "English grammar n vocabulary",
   "from_id": "channel1248828831",
   "photo": "photos/photo_21@27-01-2019_11-19-57.jpg",
   "width": 720,
   "height": 642,
   "text": "",
   "text_entities": []
  },
  {
   "id": 28,
   "type": "message",
   "date": "2019-01-27T21:29:44",
   "date_unixtime": "1548599384",
   "from": "English grammar n vocabulary",
   "from_id": "channel1248828831",
   "photo": "photos/photo_22@27-01-2019_21-29-44.jpg",
   "width": 649,
   "height": 649,
   "text": "",
   "text_entities": []
  },
  {
   "id": 29,
   "type": "message",
   "date": "2019-01-27T21:29:44",
   "date_unixtime": "1548599384",
   "from": "English grammar n vocabulary",
   "from_id": "channel1248828831",
   "photo": "photos/photo_23@27-01-2019_21-29-44.jpg",
   "width": 670,
   "height": 670,
   "text": "",
   "text_entities": []
  },
  {
   "id": 30,
   "type": "message",
   "date": "2019-01-28T21:08:06",
   "date_unixtime": "1548684486",
   "from": "English grammar n vocabulary",
   "from_id": "channel1248828831",
   "photo": "photos/photo_24@28-01-2019_21-08-06.jpg",
   "width": 720,
   "height": 676,
   "text": "",
   "text_entities": []
  },
  {
   "id": 31,
   "type": "message",
   "date": "2019-01-30T09:16:50",
   "date_unixtime": "1548814610",
   "from": "English grammar n vocabulary",
   "from_id": "channel1248828831",
   "photo": "photos/photo_25@30-01-2019_09-16-50.jpg",
   "width": 720,
   "height": 675,
   "text": "",
   "text_entities": []
  },
  {
   "id": 34,
   "type": "message",
   "date": "2019-01-31T14:24:05",
   "date_unixtime": "1548919445",
   "from": "English grammar n vocabulary",
   "from_id": "channel1248828831",
   "text": [
    "Hi guys, if you like our knowledgeable posts, please invite your friends to join us. Let'em learn. thanks💕\n\n",
    {
     "type": "link",
     "text": "https://t.me/EnglishgrammarVocabulary"
    },
    ""
   ],
   "text_entities": [
    {
     "type": "plain",
     "text": "Hi guys, if you like our knowledgeable posts, please invite your friends to join us. Let'em learn. thanks💕\n\n"
    },
    {
     "type": "link",
     "text": "https://t.me/EnglishgrammarVocabulary"
    },
    {
     "type": "plain",
     "text": ""
    }
   ]
  },
  {
   "id": 35,
   "type": "message",
   "date": "2019-01-31T14:24:29",
   "date_unixtime": "1548919469",
   "from": "English grammar n vocabulary",
   "from_id": "channel1248828831",
   "photo": "photos/photo_26@31-01-2019_14-24-29.jpg",
   "width": 720,
   "height": 515,
   "text": "",
   "text_entities": []
  },
  {
   "id": 36,
   "type": "message",
   "date": "2019-01-31T14:27:35",
   "date_unixtime": "1548919655",
   "from": "English grammar n vocabulary",
   "from_id": "channel1248828831",
   "text": "Share please",
   "text_entities": [
    {
     "type": "plain",
     "text": "Share please"
    }
   ]
  },
  {
   "id": 38,
   "type": "message",
   "date": "2019-02-01T10:25:12",
   "date_unixtime": "1548991512",
   "from": "English grammar n vocabulary",
   "from_id": "channel1248828831",
   "photo": "photos/photo_27@01-02-2019_10-25-12.jpg",
   "width": 720,
   "height": 617,
   "text": "",
   "text_entities": []
  },
  {
   "id": 39,
   "type": "message",
   "date": "2019-02-02T12:39:35",
   "date_unixtime": "1549085975",
   "from": "English grammar n vocabulary",
   "from_id": "channel1248828831",
   "photo": "photos/photo_28@02-02-2019_12-39-35.jpg",
   "width": 678,
   "height": 678,
   "text": "",
   "text_entities": []
  },
  {
   "id": 41,
   "type": "message",
   "date": "2019-02-02T19:05:22",
   "date_unixtime": "1549109122",
   "from": "English grammar n vocabulary",
   "from_id": "channel1248828831",
   "photo": "photos/photo_29@02-02-2019_19-05-22.jpg",
   "width": 675,
   "height": 675,
   "text": "",
   "text_entities": []
  },
  {
   "id": 42,
   "type": "message",
   "date": "2019-02-03T14:42:21",
   "date_unixtime": "1549179741",
   "from": "English grammar n vocabulary",
   "from_id": "channel1248828831",
   "photo": "photos/photo_30@03-02-2019_14-42-21.jpg",
   "width": 712,
   "height": 673,
   "text": "",
   "text_entities": []
  },
  {
   "id": 43,
   "type": "message",
   "date": "2019-02-03T23:10:51",
   "date_unixtime": "1549210251",
   "from": "English grammar n vocabulary",
   "from_id": "channel1248828831",
   "photo": "photos/photo_31@03-02-2019_23-10-51.jpg",
   "width": 712,
   "height": 677,
   "text": "Share please",
   "text_entities": [
    {
     "type": "plain",
     "text": "Share please"
    }
   ]
  },
  {
   "id": 45,
   "type": "message",
   "date": "2019-02-04T21:40:42",
   "date_unixtime": "1549291242",
   "from": "English grammar n vocabulary",
   "from_id": "channel1248828831",
   "photo": "photos/photo_32@04-02-2019_21-40-42.jpg",
   "width": 720,
   "height": 683,
   "text": "",
   "text_entities": []
  },
  {
   "id": 46,
   "type": "message",
   "date": "2019-02-04T21:42:22",
   "date_unixtime": "1549291342",
   "from": "English grammar n vocabulary",
   "from_id": "channel1248828831",
   "photo": "photos/photo_33@04-02-2019_21-42-22.jpg",
   "width": 712,
   "height": 847,
   "text": "",
   "text_entities": []
  },
  {
   "id": 47,
   "type": "message",
   "date": "2019-02-04T21:42:55",
   "date_unixtime": "1549291375",
   "from": "English grammar n vocabulary",
   "from_id": "channel1248828831",
   "text": "Guys, share please ❤❤",
   "text_entities": [
    {
     "type": "plain",
     "text": "Guys, share please ❤❤"
    }
   ]
  },
  {
   "id": 48,
   "type": "message",
   "date": "2019-02-05T12:08:37",
   "date_unixtime": "1549343317",
   "from": "English grammar n vocabulary",
   "from_id": "channel1248828831",
   "photo": "photos/photo_34@05-02-2019_12-08-37.jpg",
   "width": 712,
   "height": 678,
   "text": "",
   "text_entities": []
  },
  {
   "id": 49,
   "type": "message",
   "date": "2019-02-08T08:52:08",
   "date_unixtime": "1549590728",
   "from": "English grammar n vocabulary",
   "from_id": "channel1248828831",
   "photo": "photos/photo_35@08-02-2019_08-52-08.jpg",
   "width": 720,
   "height": 900,
   "text": "",
   "text_entities": []
  },
  {
   "id": 50,
   "type": "message",
   "date": "2019-02-09T16:09:19",
   "date_unixtime": "1549703359",
   "from": "English grammar n vocabulary",
   "from_id": "channel1248828831",
   "photo": "photos/photo_36@09-02-2019_16-09-19.jpg",
   "width": 655,
   "height": 655,
   "text": "",
   "text_entities": []
  },
  {
   "id": 51,
   "type": "message",
   "date": "2019-02-09T16:09:19",
   "date_unixtime": "1549703359",
   "from": "English grammar n vocabulary",
   "from_id": "channel1248828831",
   "photo": "photos/photo_37@09-02-2019_16-09-19.jpg",
   "width": 655,
   "height": 655,
   "text": "",
   "text_entities": []
  },
  {
   "id": 52,
   "type": "message",
   "date": "2019-02-09T16:09:19",
   "date_unixtime": "1549703359",
   "from": "English grammar n vocabulary",
   "from_id": "channel1248828831",
   "photo": "photos/photo_38@09-02-2019_16-09-19.jpg",
   "width": 655,
   "height": 655,
   "text": "",
   "text_entities": []
  },
  {
   "id": 53,
   "type": "message",
   "date": "2019-02-09T16:09:19",
   "date_unixtime": "1549703359",
   "from": "English grammar n vocabulary",
   "from_id": "channel1248828831",
   "photo": "photos/photo_39@09-02-2019_16-09-19.jpg",
   "width": 655,
   "height": 655,
   "text": "",
   "text_entities": []
  },
  {
   "id": 54,
   "type": "message",
   "date": "2019-02-09T16:09:19",
   "date_unixtime": "1549703359",
   "from": "English grammar n vocabulary",
   "from_id": "channel1248828831",
   "photo": "photos/photo_40@09-02-2019_16-09-19.jpg",
   "width": 655,
   "height": 655,
   "text": "",
   "text_entities": []
  },
  {
   "id": 55,
   "type": "message",
   "date": "2019-02-09T21:43:46",
   "date_unixtime": "1549723426",
   "from": "English grammar n vocabulary",
   "from_id": "channel1248828831",
   "photo": "photos/photo_41@09-02-2019_21-43-46.jpg",
   "width": 712,
   "height": 677,
   "text": "",
   "text_entities": []
  },
  {
   "id": 56,
   "type": "message",
   "date": "2019-02-10T16:26:52",
   "date_unixtime": "1549790812",
   "from": "English grammar n vocabulary",
   "from_id": "channel1248828831",
   "photo": "photos/photo_42@10-02-2019_16-26-52.jpg",
   "width": 720,
   "height": 731,
   "text": "",
   "text_entities": []
  },
  {
   "id": 58,
   "type": "message",
   "date": "2019-02-12T10:31:38",
   "date_unixtime": "1549942298",
   "from": "English grammar n vocabulary",
   "from_id": "channel1248828831",
   "photo": "photos/photo_43@12-02-2019_10-31-38.jpg",
   "width": 720,
   "height": 883,
   "text": "",
   "text_entities": []
  },
  {
   "id": 59,
   "type": "message",
   "date": "2019-02-13T14:40:51",
   "date_unixtime": "1550043651",
   "from": "English grammar n vocabulary",
   "from_id": "channel1248828831",
   "photo": "photos/photo_44@13-02-2019_14-40-51.jpg",
   "width": 712,
   "height": 890,
   "text": "",
   "text_entities": []
  },
  {
   "id": 60,
   "type": "message",
   "date": "2019-02-14T21:47:34",
   "date_unixtime": "1550155654",
   "from": "English grammar n vocabulary",
   "from_id": "channel1248828831",
   "photo": "photos/photo_45@14-02-2019_21-47-34.jpg",
   "width": 712,
   "height": 657,
   "text": "",
   "text_entities": []
  },
  {
   "id": 61,
   "type": "message",
   "date": "2019-02-16T16:53:44",
   "date_unixtime": "1550310824",
   "from": "English grammar n vocabulary",
   "from_id": "channel1248828831",
   "photo": "photos/photo_46@16-02-2019_16-53-44.jpg",
   "width": 712,
   "height": 536,
   "text": "",
   "text_entities": []
  },
  {
   "id": 62,
   "type": "message",
   "date": "2019-02-17T10:55:10",
   "date_unixtime": "1550375710",
   "from": "English grammar n vocabulary",
   "from_id": "channel1248828831",
   "photo": "photos/photo_47@17-02-2019_10-55-10.jpg",
   "width": 720,
   "height": 900,
   "text": "",
   "text_entities": []
  },
  {
   "id": 64,
   "type": "message",
   "date": "2019-02-19T14:30:26",
   "date_unixtime": "1550561426",
   "from": "English grammar n vocabulary",
   "from_id": "channel1248828831",
   "photo": "photos/photo_48@19-02-2019_14-30-26.jpg",
   "width": 720,
   "height": 880,
   "text": "",
   "text_entities": []
  },
  {
   "id": 65,
   "type": "message",
   "date": "2019-02-23T12:20:14",
   "date_unixtime": "1550899214",
   "from": "English grammar n vocabulary",
   "from_id": "channel1248828831",
   "photo": "photos/photo_49@23-02-2019_12-20-14.jpg",
   "width": 720,
   "height": 743,
   "text": "",
   "text_entities": []
  },
  {
   "id": 66,
   "type": "message",
   "date": "2019-02-24T19:28:55",
   "date_unixtime": "1551011335",
   "from": "English grammar n vocabulary",
   "from_id": "channel1248828831",
   "photo": "photos/photo_50@24-02-2019_19-28-55.jpg",
   "width": 720,
   "height": 785,
   "text": "",
   "text_entities": []
  },
  {
   "id": 67,
   "type": "message",
   "date": "2019-02-25T22:12:27",
   "date_unixtime": "1551107547",
   "from": "English grammar n vocabulary",
   "from_id": "channel1248828831",
   "photo": "photos/photo_51@25-02-2019_22-12-27.jpg",
   "width": 712,
   "height": 675,
   "text": "",
   "text_entities": []
  },
  {
   "id": 68,
   "type": "message",
   "date": "2019-02-26T20:43:50",
   "date_unixtime": "1551188630",
   "from": "English grammar n vocabulary",
   "from_id": "channel1248828831",
   "photo": "photos/photo_52@26-02-2019_20-43-50.jpg",
   "width": 720,
   "height": 765,
   "text": "",
   "text_entities": []
  },
  {
   "id": 69,
   "type": "message",
   "date": "2019-02-28T22:30:36",
   "date_unixtime": "1551367836",
   "from": "English grammar n vocabulary",
   "from_id": "channel1248828831",
   "photo": "photos/photo_53@28-02-2019_22-30-36.jpg",
   "width": 720,
   "height": 900,
   "text": "",
   "text_entities": []
  },
  {
   "id": 70,
   "type": "message",
   "date": "2019-03-02T15:48:04",
   "date_unixtime": "1551516484",
   "from": "English grammar n vocabulary",
   "from_id": "channel1248828831",
   "photo": "photos/photo_54@02-03-2019_15-48-04.jpg",
   "width": 720,
   "height": 801,
   "text": "",
   "text_entities": []
  },
  {
   "id": 71,
   "type": "message",
   "date": "2019-03-03T22:47:27",
   "date_unixtime": "1551628047",
   "from": "English grammar n vocabulary",
   "from_id": "channel1248828831",
   "photo": "photos/photo_55@03-03-2019_22-47-27.jpg",
   "width": 720,
   "height": 733,
   "text": "",
   "text_entities": []
  },
  {
   "id": 72,
   "type": "message",
   "date": "2019-03-05T22:53:28",
   "date_unixtime": "1551801208",
   "from": "English grammar n vocabulary",
   "from_id": "channel1248828831",
   "photo": "photos/photo_56@05-03-2019_22-53-28.jpg",
   "width": 1107,
   "height": 720,
   "text": "",
   "text_entities": []
  },
  {
   "id": 73,
   "type": "message",
   "date": "2019-03-06T22:29:11",
   "date_unixtime": "1551886151",
   "from": "English grammar n vocabulary",
   "from_id": "channel1248828831",
   "photo": "photos/photo_57@06-03-2019_22-29-11.jpg",
   "width": 1126,
   "height": 1126,
   "text": "",
   "text_entities": []
  },
  {
   "id": 74,
   "type": "message",
   "date": "2019-03-08T16:43:44",
   "date_unixtime": "1552038224",
   "from": "English grammar n vocabulary",
   "from_id": "channel1248828831",
   "photo": "photos/photo_58@08-03-2019_16-43-44.jpg",
   "width": 1280,
   "height": 1280,
   "text": "",
   "text_entities": []
  },
  {
   "id": 75,
   "type": "message",
   "date": "2019-03-10T18:05:23",
   "date_unixtime": "1552215923",
   "from": "English grammar n vocabulary",
   "from_id": "channel1248828831",
   "photo": "photos/photo_59@10-03-2019_18-05-23.jpg",
   "width": 640,
   "height": 640,
   "text": "",
   "text_entities": []
  },
  {
   "id": 76,
   "type": "message",
   "date": "2019-03-10T18:07:29",
   "date_unixtime": "1552216049",
   "from": "English grammar n vocabulary",
   "from_id": "channel1248828831",
   "text": "Word of the day- vainglorious\n.\nShare with your friends if you like it.",
   "text_entities": [
    {
     "type": "plain",
     "text": "Word of the day- vainglorious\n.\nShare with your friends if you like it."
    }
   ]
  },
  {
   "id": 77,
   "type": "message",
   "date": "2019-03-11T22:43:07",
   "date_unixtime": "1552318987",
   "from": "English grammar n vocabulary",
   "from_id": "channel1248828831",
   "photo": "photos/photo_60@11-03-2019_22-43-07.jpg",
   "width": 1280,
   "height": 1280,
   "text": "",
   "text_entities": []
  },
  {
   "id": 79,
   "type": "message",
   "date": "2019-03-13T13:17:12",
   "date_unixtime": "1552457832",
   "from": "English grammar n vocabulary",
   "from_id": "channel1248828831",
   "photo": "photos/photo_61@13-03-2019_13-17-12.jpg",
   "width": 1280,
   "height": 1280,
   "text": "",
   "text_entities": []
  },
  {
   "id": 80,
   "type": "message",
   "date": "2019-03-13T13:17:39",
   "date_unixtime": "1552457859",
   "from": "English grammar n vocabulary",
   "from_id": "channel1248828831",
   "text": "Word of the day- scorn",
   "text_entities": [
    {
     "type": "plain",
     "text": "Word of the day- scorn"
    }
   ]
  },
  {
   "id": 83,
   "type": "message",
   "date": "2019-03-17T15:40:37",
   "date_unixtime": "1552812037",
   "from": "English grammar n vocabulary",
   "from_id": "channel1248828831",
   "photo": "photos/photo_62@17-03-2019_15-40-37.jpg",
   "width": 768,
   "height": 768,
   "text": "",
   "text_entities": []
  },
  {
   "id": 84,
   "type": "message",
   "date": "2019-03-18T15:47:47",
   "date_unixtime": "1552898867",
   "from": "English grammar n vocabulary",
   "from_id": "channel1248828831",
   "photo": "photos/photo_63@18-03-2019_15-47-47.jpg",
   "width": 712,
   "height": 704,
   "text": "",
   "text_entities": []
  },
  {
   "id": 85,
   "type": "message",
   "date": "2019-04-28T09:28:23",
   "date_unixtime": "1556418503",
   "from": "English grammar n vocabulary",
   "from_id": "channel1248828831",
   "photo": "photos/photo_64@28-04-2019_09-28-23.jpg",
   "width": 1280,
   "height": 1280,
   "text": "",
   "text_entities": []
  },
  {
   "id": 86,
   "type": "message",
   "date": "2019-04-28T09:29:38",
   "date_unixtime": "1556418578",
   "from": "English grammar n vocabulary",
   "from_id": "channel1248828831",
   "photo": "photos/photo_65@28-04-2019_09-29-38.jpg",
   "width": 496,
   "height": 502,
   "text": "",
   "text_entities": []
  },
  {
   "id": 87,
   "type": "message",
   "date": "2019-04-30T21:44:28",
   "date_unixtime": "1556635468",
   "from": "English grammar n vocabulary",
   "from_id": "channel1248828831",
   "photo": "photos/photo_66@30-04-2019_21-44-28.jpg",
   "width": 1280,
   "height": 1280,
   "text": "",
   "text_entities": []
  },
  {
   "id": 88,
   "type": "message",
   "date": "2019-05-02T17:11:51",
   "date_unixtime": "1556791911",
   "from": "English grammar n vocabulary",
   "from_id": "channel1248828831",
   "photo": "photos/photo_67@02-05-2019_17-11-51.jpg",
   "width": 1280,
   "height": 1280,
   "text": "",
   "text_entities": []
  },
  {
   "id": 90,
   "type": "message",
   "date": "2019-05-06T10:39:10",
   "date_unixtime": "1557113950",
   "from": "English grammar n vocabulary",
   "from_id": "channel1248828831",
   "photo": "photos/photo_68@06-05-2019_10-39-10.jpg",
   "width": 1280,
   "height": 1280,
   "text": "",
   "text_entities": []
  },
  {
   "id": 91,
   "type": "message",
   "date": "2019-05-07T14:36:56",
   "date_unixtime": "1557214616",
   "from": "English grammar n vocabulary",
   "from_id": "channel1248828831",
   "photo": "photos/photo_69@07-05-2019_14-36-56.jpg",
   "width": 1280,
   "height": 1280,
   "text": "",
   "text_entities": []
  },
  {
   "id": 92,
   "type": "message",
   "date": "2019-05-09T14:13:54",
   "date_unixtime": "1557386034",
   "from": "English grammar n vocabulary",
   "from_id": "channel1248828831",
   "photo": "photos/photo_70@09-05-2019_14-13-54.jpg",
   "width": 502,
   "height": 499,
   "text": "",
   "text_entities": []
  },
  {
   "id": 93,
   "type": "message",
   "date": "2019-05-09T22:00:15",
   "date_unixtime": "1557414015",
   "from": "English grammar n vocabulary",
   "from_id": "channel1248828831",
   "photo": "photos/photo_71@09-05-2019_22-00-15.jpg",
   "width": 556,
   "height": 486,
   "text": "",
   "text_entities": []
  },
  {
   "id": 96,
   "type": "message",
   "date": "2019-05-10T22:01:31",
   "date_unixtime": "1557500491",
   "from": "English grammar n vocabulary",
   "from_id": "channel1248828831",
   "photo": "photos/photo_72@10-05-2019_22-01-31.jpg",
   "width": 480,
   "height": 480,
   "text": "",
   "text_entities": []
  },
  {
   "id": 97,
   "type": "message",
   "date": "2019-05-10T22:01:36",
   "date_unixtime": "1557500496",
   "from": "English grammar n vocabulary",
   "from_id": "channel1248828831",
   "photo": "photos/photo_73@10-05-2019_22-01-36.jpg",
   "width": 480,
   "height": 480,
   "text": "",
   "text_entities": []
  },
  {
   "id": 98,
   "type": "message",
   "date": "2019-05-12T10:21:04",
   "date_unixtime": "1557631264",
   "from": "English grammar n vocabulary",
   "from_id": "channel1248828831",
   "photo": "photos/photo_74@12-05-2019_10-21-04.jpg",
   "width": 470,
   "height": 470,
   "text": "",
   "text_entities": []
  },
  {
   "id": 100,
   "type": "message",
   "date": "2019-05-13T21:39:15",
   "date_unixtime": "1557758355",
   "from": "English grammar n vocabulary",
   "from_id": "channel1248828831",
   "photo": "photos/photo_75@13-05-2019_21-39-15.jpg",
   "width": 453,
   "height": 453,
   "text": "",
   "text_entities": []
  },
  {
   "id": 101,
   "type": "message",
   "date": "2019-06-06T17:44:13",
   "date_unixtime": "1559817853",
   "from": "English grammar n vocabulary",
   "from_id": "channel1248828831",
   "photo": "photos/photo_76@06-06-2019_17-44-13.jpg",
   "width": 1280,
   "height": 1280,
   "text": "",
   "text_entities": []
  },
  {
   "id": 102,
   "type": "message",
   "date": "2019-06-06T18:09:55",
   "date_unixtime": "1559819395",
   "from": "English grammar n vocabulary",
   "from_id": "channel1248828831",
   "photo": "photos/photo_77@06-06-2019_18-09-55.jpg",
   "width": 720,
   "height": 587,
   "text": "",
   "text_entities": []
  },
  {
   "id": 103,
   "type": "message",
   "date": "2019-06-06T18:11:19",
   "date_unixtime": "1559819479",
   "from": "English grammar n vocabulary",
   "from_id": "channel1248828831",
   "photo": "photos/photo_78@06-06-2019_18-11-19.jpg",
   "width": 712,
   "height": 996,
   "text": "",
   "text_entities": []
  },
  {
   "id": 104,
   "type": "message",
   "date": "2019-06-07T14:13:59",
   "date_unixtime": "1559891639",
   "from": "English grammar n vocabulary",
   "from_id": "channel1248828831",
   "photo": "photos/photo_79@07-06-2019_14-13-59.jpg",
   "width": 663,
   "height": 494,
   "text": "",
   "text_entities": []
  },
  {
   "id": 105,
   "type": "message",
   "date": "2019-06-09T21:55:40",
   "date_unixtime": "1560092140",
   "from": "English grammar n vocabulary",
   "from_id": "channel1248828831",
   "photo": "photos/photo_80@09-06-2019_21-55-40.jpg",
   "width": 1280,
   "height": 1280,
   "text": "",
   "text_entities": []
  },
  {
   "id": 106,
   "type": "message",
   "date": "2019-06-17T14:07:12",
   "date_unixtime": "1560755232",
   "from": "English grammar n vocabulary",
   "from_id": "channel1248828831",
   "photo": "photos/photo_81@17-06-2019_14-07-12.jpg",
   "width": 667,
   "height": 490,
   "text": "",
   "text_entities": []
  },
  {
   "id": 107,
   "type": "message",
   "date": "2019-06-20T17:49:16",
   "date_unixtime": "1561027756",
   "from": "English grammar n vocabulary",
   "from_id": "channel1248828831",
   "photo": "photos/photo_82@20-06-2019_17-49-16.jpg",
   "width": 1280,
   "height": 1280,
   "text": "",
   "text_entities": []
  },
  {
   "id": 108,
   "type": "message",
   "date": "2019-06-20T23:05:11",
   "date_unixtime": "1561046711",
   "from": "English grammar n vocabulary",
   "from_id": "channel1248828831",
   "photo": "photos/photo_83@20-06-2019_23-05-11.jpg",
   "width": 712,
   "height": 704,
   "text": "",
   "text_entities": []
  },
  {
   "id": 109,
   "type": "message",
   "date": "2019-06-20T23:05:40",
   "date_unixtime": "1561046740",
   "from": "English grammar n vocabulary",
   "from_id": "channel1248828831",
   "photo": "photos/photo_84@20-06-2019_23-05-40.jpg",
   "width": 712,
   "height": 657,
   "text": "",
   "text_entities": []
  },
  {
   "id": 110,
   "type": "message",
   "date": "2019-06-26T13:59:27",
   "date_unixtime": "1561532367",
   "from": "English grammar n vocabulary",
   "from_id": "channel1248828831",
   "photo": "photos/photo_85@26-06-2019_13-59-27.jpg",
   "width": 1280,
   "height": 1280,
   "text": "",
   "text_entities": []
  },
  {
   "id": 111,
   "type": "message",
   "date": "2019-06-28T21:51:03",
   "date_unixtime": "1561733463",
   "from": "English grammar n vocabulary",
   "from_id": "channel1248828831",
   "photo": "photos/photo_86@28-06-2019_21-51-03.jpg",
   "width": 636,
   "height": 465,
   "text": "",
   "text_entities": []
  },
  {
   "id": 112,
   "type": "message",
   "date": "2019-07-01T21:50:59",
   "date_unixtime": "1561992659",
   "from": "English grammar n vocabulary",
   "from_id": "channel1248828831",
   "poll": {
    "question": "Quiz time\n\n•The Fox crawled _________ the fence.",
    "closed": false,
    "total_voters": 187,
    "answers": [
     {
      "text": "On",
      "voters": 0,
      "chosen": false
     },
     {
      "text": "In",
      "voters": 0,
      "chosen": false
     },
     {
      "text": "Under",
      "voters": 0,
      "chosen": false
     },
     {
      "text": "At",
      "voters": 0,
      "chosen": false
     }
    ]
   },
   "text": "",
   "text_entities": []
  },
  {
   "id": 113,
   "type": "message",
   "date": "2019-07-02T17:23:32",
   "date_unixtime": "1562063012",
   "from": "English grammar n vocabulary",
   "from_id": "channel1248828831",
   "photo": "photos/photo_87@02-07-2019_17-23-32.jpg",
   "width": 736,
   "height": 452,
   "text": "",
   "text_entities": []
  },
  {
   "id": 114,
   "type": "message",
   "date": "2019-07-04T15:12:24",
   "date_unixtime": "1562227944",
   "from": "English grammar n vocabulary",
   "from_id": "channel1248828831",
   "photo": "photos/photo_88@04-07-2019_15-12-24.jpg",
   "width": 479,
   "height": 479,
   "text": "",
   "text_entities": []
  },
  {
   "id": 115,
   "type": "message",
   "date": "2019-07-04T15:12:36",
   "date_unixtime": "1562227956",
   "from": "English grammar n vocabulary",
   "from_id": "channel1248828831",
   "photo": "photos/photo_89@04-07-2019_15-12-36.jpg",
   "width": 480,
   "height": 480,
   "text": "",
   "text_entities": []
  },
  {
   "id": 116,
   "type": "message",
   "date": "2019-07-05T14:29:27",
   "date_unixtime": "1562311767",
   "from": "English grammar n vocabulary",
   "from_id": "channel1248828831",
   "photo": "photos/photo_90@05-07-2019_14-29-27.jpg",
   "width": 757,
   "height": 452,
   "text": "",
   "text_entities": []
  },
  {
   "id": 117,
   "type": "message",
   "date": "2019-07-06T17:55:52",
   "date_unixtime": "1562410552",
   "from": "English grammar n vocabulary",
   "from_id": "channel1248828831",
   "photo": "photos/photo_91@06-07-2019_17-55-52.jpg",
   "width": 626,
   "height": 480,
   "text": "",
   "text_entities": []
  },
  {
   "id": 118,
   "type": "message",
   "date": "2019-07-09T17:47:07",
   "date_unixtime": "1562669227",
   "from": "English grammar n vocabulary",
   "from_id": "channel1248828831",
   "photo": "photos/photo_92@09-07-2019_17-47-07.jpg",
   "width": 474,
   "height": 593,
   "text": "",
   "text_entities": []
  },
  {
   "id": 119,
   "type": "message",
   "date": "2019-07-09T22:00:09",
   "date_unixtime": "1562684409",
   "from": "English grammar n vocabulary",
   "from_id": "channel1248828831",
   "photo": "photos/photo_93@09-07-2019_22-00-09.jpg",
   "width": 480,
   "height": 517,
   "text": "",
   "text_entities": []
  },
  {
   "id": 120,
   "type": "message",
   "date": "2019-07-14T14:46:10",
   "date_unixtime": "1563090370",
   "from": "English grammar n vocabulary",
   "from_id": "channel1248828831",
   "photo": "photos/photo_94@14-07-2019_14-46-10.jpg",
   "width": 480,
   "height": 480,
   "text": "",
   "text_entities": []
  },
  {
   "id": 121,
   "type": "message",
   "date": "2019-07-14T14:46:14",
   "date_unixtime": "1563090374",
   "from": "English grammar n vocabulary",
   "from_id": "channel1248828831",
   "photo": "photos/photo_95@14-07-2019_14-46-14.jpg",
   "width": 480,
   "height": 537,
   "text": "",
   "text_entities": []
  },
  {
   "id": 122,
   "type": "message",
   "date": "2019-07-16T12:51:29",
   "date_unixtime": "1563256289",
   "from": "English grammar n vocabulary",
   "from_id": "channel1248828831",
   "photo": "photos/photo_96@16-07-2019_12-51-29.jpg",
   "width": 480,
   "height": 584,
   "text": "",
   "text_entities": []
  },
  {
   "id": 123,
   "type": "message",
   "date": "2019-07-21T22:37:31",
   "date_unixtime": "1563723451",
   "from": "English grammar n vocabulary",
   "from_id": "channel1248828831",
   "photo": "photos/photo_97@21-07-2019_22-37-31.jpg",
   "width": 480,
   "height": 480,
   "text": "",
   "text_entities": []
  },
  {
   "id": 124,
   "type": "message",
   "date": "2019-07-21T22:37:43",
   "date_unixtime": "1563723463",
   "from": "English grammar n vocabulary",
   "from_id": "channel1248828831",
   "photo": "photos/photo_98@21-07-2019_22-37-43.jpg",
   "width": 754,
   "height": 452,
   "text": "",
   "text_entities": []
  },
  {
   "id": 125,
   "type": "message",
   "date": "2019-07-25T14:18:16",
   "date_unixtime": "1564039096",
   "from": "English grammar n vocabulary",
   "from_id": "channel1248828831",
   "photo": "photos/photo_99@25-07-2019_14-18-16.jpg",
   "width": 474,
   "height": 528,
   "text": "",
   "text_entities": []
  },
  {
   "id": 126,
   "type": "message",
   "date": "2019-07-29T23:48:15",
   "date_unixtime": "1564418895",
   "from": "English grammar n vocabulary",
   "from_id": "channel1248828831",
   "photo": "photos/photo_100@29-07-2019_23-48-15.jpg",
   "width": 754,
   "height": 466,
   "text": "",
   "text_entities": []
  },
  {
   "id": 128,
   "type": "message",
   "date": "2019-08-07T14:37:07",
   "date_unixtime": "1565163427",
   "from": "English grammar n vocabulary",
   "from_id": "channel1248828831",
   "photo": "photos/photo_101@07-08-2019_14-37-07.jpg",
   "width": 480,
   "height": 532,
   "text": "",
   "text_entities": []
  },
  {
   "id": 129,
   "type": "message",
   "date": "2019-08-07T23:09:13",
   "date_unixtime": "1565194153",
   "from": "English grammar n vocabulary",
   "from_id": "channel1248828831",
   "poll": {
    "question": "Quiz time\n\nThat car belongs ____ my father.",
    "closed": false,
    "total_voters": 237,
    "answers": [
     {
      "text": "From",
      "voters": 0,
      "chosen": false
     },
     {
      "text": "To",
      "voters": 0,
      "chosen": false
     },
     {
      "text": "With",
      "voters": 0,
      "chosen": false
     },
     {
      "text": "At",
      "voters": 0,
      "chosen": false
     }
    ]
   },
   "text": "",
   "text_entities": []
  },
  {
   "id": 130,
   "type": "message",
   "date": "2019-08-09T23:00:57",
   "date_unixtime": "1565366457",
   "from": "English grammar n vocabulary",
   "from_id": "channel1248828831",
   "reply_to_message_id": 129,
   "text": "Answer ---- to",
   "text_entities": [
    {
     "type": "plain",
     "text": "Answer ---- to"
    }
   ]
  },
  {
   "id": 132,
   "type": "message",
   "date": "2019-08-09T23:01:47",
   "date_unixtime": "1565366507",
   "from": "English grammar n vocabulary",
   "from_id": "channel1248828831",
   "photo": "photos/photo_102@09-08-2019_23-01-47.jpg",
   "width": 607,
   "height": 466,
   "text": "",
   "text_entities": []
  },
  {
   "id": 133,
   "type": "message",
   "date": "2019-08-16T13:57:32",
   "date_unixtime": "1565938652",
   "from": "English grammar n vocabulary",
   "from_id": "channel1248828831",
   "photo": "photos/photo_103@16-08-2019_13-57-32.jpg",
   "width": 709,
   "height": 371,
   "text": "",
   "text_entities": []
  },
  {
   "id": 134,
   "type": "message",
   "date": "2019-08-16T14:00:22",
   "date_unixtime": "1565938822",
   "from": "English grammar n vocabulary",
   "from_id": "channel1248828831",
   "poll": {
    "question": "Quiz time \n\nHow ______ flour do you need for recipe?",
    "closed": false,
    "total_voters": 273,
    "answers": [
     {
      "text": "A little",
      "voters": 0,
      "chosen": false
     },
     {
      "text": "Much",
      "voters": 0,
      "chosen": false
     },
     {
      "text": "Many",
      "voters": 0,
      "chosen": false
     },
     {
      "text": "Few",
      "voters": 0,
      "chosen": false
     }
    ]
   },
   "text": "",
   "text_entities": []
  },
  {
   "id": 135,
   "type": "message",
   "date": "2019-09-09T21:06:34",
   "date_unixtime": "1568037994",
   "from": "English grammar n vocabulary",
   "from_id": "channel1248828831",
   "photo": "photos/photo_104@09-09-2019_21-06-34.jpg",
   "width": 456,
   "height": 456,
   "text": "",
   "text_entities": []
  },
  {
   "id": 136,
   "type": "message",
   "date": "2019-09-09T21:06:45",
   "date_unixtime": "1568038005",
   "from": "English grammar n vocabulary",
   "from_id": "channel1248828831",
   "photo": "photos/photo_105@09-09-2019_21-06-45.jpg",
   "width": 474,
   "height": 552,
   "text": "",
   "text_entities": []
  },
  {
   "id": 137,
   "type": "message",
   "date": "2019-09-12T18:43:02",
   "date_unixtime": "1568288582",
   "from": "English grammar n vocabulary",
   "from_id": "channel1248828831",
   "photo": "photos/photo_106@12-09-2019_18-43-02.jpg",
   "width": 474,
   "height": 426,
   "text": "",
   "text_entities": []
  },
  {
   "id": 138,
   "type": "message",
   "date": "2019-09-15T22:25:37",
   "date_unixtime": "1568561137",
   "from": "English grammar n vocabulary",
   "from_id": "channel1248828831",
   "photo": "photos/photo_107@15-09-2019_22-25-37.jpg",
   "width": 465,
   "height": 460,
   "text": "",
   "text_entities": []
  },
  {
   "id": 139,
   "type": "message",
   "date": "2019-09-17T00:00:15",
   "date_unixtime": "1568653215",
   "from": "English grammar n vocabulary",
   "from_id": "channel1248828831",
   "photo": "photos/photo_108@17-09-2019_00-00-15.jpg",
   "width": 480,
   "height": 582,
   "text": "",
   "text_entities": []
  },
  {
   "id": 140,
   "type": "message",
   "date": "2019-09-17T00:00:25",
   "date_unixtime": "1568653225",
   "from": "English grammar n vocabulary",
   "from_id": "channel1248828831",
   "photo": "photos/photo_109@17-09-2019_00-00-25.jpg",
   "width": 480,
   "height": 517,
   "text": "",
   "text_entities": []
  },
  {
   "id": 143,
   "type": "message",
   "date": "2019-09-17T23:32:03",
   "date_unixtime": "1568737923",
   "from": "English grammar n vocabulary",
   "from_id": "channel1248828831",
   "photo": "photos/photo_110@17-09-2019_23-32-03.jpg",
   "width": 480,
   "height": 480,
   "text": "",
   "text_entities": []
  },
  {
   "id": 144,
   "type": "message",
   "date": "2019-09-17T23:32:03",
   "date_unixtime": "1568737923",
   "from": "English grammar n vocabulary",
   "from_id": "channel1248828831",
   "photo": "photos/photo_111@17-09-2019_23-32-03.jpg",
   "width": 480,
   "height": 480,
   "text": "",
   "text_entities": []
  },
  {
   "id": 145,
   "type": "message",
   "date": "2019-09-17T23:32:03",
   "date_unixtime": "1568737923",
   "from": "English grammar n vocabulary",
   "from_id": "channel1248828831",
   "photo": "photos/photo_112@17-09-2019_23-32-03.jpg",
   "width": 480,
   "height": 480,
   "text": "",
   "text_entities": []
  },
  {
   "id": 146,
   "type": "message",
   "date": "2019-09-17T23:32:03",
   "date_unixtime": "1568737923",
   "from": "English grammar n vocabulary",
   "from_id": "channel1248828831",
   "photo": "photos/photo_113@17-09-2019_23-32-03.jpg",
   "width": 480,
   "height": 480,
   "text": "",
   "text_entities": []
  },
  {
   "id": 147,
   "type": "message",
   "date": "2019-09-17T23:32:03",
   "date_unixtime": "1568737923",
   "from": "English grammar n vocabulary",
   "from_id": "channel1248828831",
   "photo": "photos/photo_114@17-09-2019_23-32-03.jpg",
   "width": 480,
   "height": 480,
   "text": "",
   "text_entities": []
  },
  {
   "id": 148,
   "type": "message",
   "date": "2019-09-17T23:32:03",
   "date_unixtime": "1568737923",
   "from": "English grammar n vocabulary",
   "from_id": "channel1248828831",
   "photo": "photos/photo_115@17-09-2019_23-32-03.jpg",
   "width": 480,
   "height": 480,
   "text": "",
   "text_entities": []
  },
  {
   "id": 151,
   "type": "message",
   "date": "2019-09-18T10:31:37",
   "date_unixtime": "1568777497",
   "from": "English grammar n vocabulary",
   "from_id": "channel1248828831",
   "photo": "photos/photo_116@18-09-2019_10-31-37.jpg",
   "width": 564,
   "height": 705,
   "text": "",
   "text_entities": []
  },
  {
   "id": 152,
   "type": "message",
   "date": "2019-09-18T15:34:55",
   "date_unixtime": "1568795695",
   "from": "English grammar n vocabulary",
   "from_id": "channel1248828831",
   "photo": "photos/photo_117@18-09-2019_15-34-55.jpg",
   "width": 712,
   "height": 712,
   "text": "",
   "text_entities": []
  },
  {
   "id": 153,
   "type": "message",
   "date": "2019-09-18T15:35:13",
   "date_unixtime": "1568795713",
   "from": "English grammar n vocabulary",
   "from_id": "channel1248828831",
   "photo": "photos/photo_118@18-09-2019_15-35-13.jpg",
   "width": 480,
   "height": 600,
   "text": "",
   "text_entities": []
  },
  {
   "id": 155,
   "type": "message",
   "date": "2019-09-19T15:08:53",
   "date_unixtime": "1568880533",
   "from": "English grammar n vocabulary",
   "from_id": "channel1248828831",
   "photo": "photos/photo_119@19-09-2019_15-08-53.jpg",
   "width": 1280,
   "height": 1107,
   "text": "",
   "text_entities": []
  },
  {
   "id": 158,
   "type": "message",
   "date": "2019-09-20T22:38:01",
   "date_unixtime": "1568993881",
   "from": "English grammar n vocabulary",
   "from_id": "channel1248828831",
   "photo": "photos/photo_120@20-09-2019_22-38-01.jpg",
   "width": 506,
   "height": 499,
   "text": "",
   "text_entities": []
  },
  {
   "id": 159,
   "type": "message",
   "date": "2019-09-21T15:15:37",
   "date_unixtime": "1569053737",
   "from": "English grammar n vocabulary",
   "from_id": "channel1248828831",
   "photo": "photos/photo_121@21-09-2019_15-15-37.jpg",
   "width": 1152,
   "height": 1153,
   "text": "",
   "text_entities": []
  },
  {
   "id": 160,
   "type": "message",
   "date": "2019-09-22T21:56:11",
   "date_unixtime": "1569164171",
   "from": "English grammar n vocabulary",
   "from_id": "channel1248828831",
   "photo": "photos/photo_122@22-09-2019_21-56-11.jpg",
   "width": 1152,
   "height": 1013,
   "text": "",
   "text_entities": []
  },
  {
   "id": 161,
   "type": "message",
   "date": "2019-09-22T21:56:28",
   "date_unixtime": "1569164188",
   "from": "English grammar n vocabulary",
   "from_id": "channel1248828831",
   "photo": "photos/photo_123@22-09-2019_21-56-28.jpg",
   "width": 1144,
   "height": 1124,
   "text": "",
   "text_entities": []
  },
  {
   "id": 162,
   "type": "message",
   "date": "2019-09-23T23:15:07",
   "date_unixtime": "1569255307",
   "from": "English grammar n vocabulary",
   "from_id": "channel1248828831",
   "photo": "photos/photo_124@23-09-2019_23-15-07.jpg",
   "width": 1101,
   "height": 1101,
   "text": "",
   "text_entities": []
  },
  {
   "id": 163,
   "type": "message",
   "date": "2019-09-23T23:37:38",
   "date_unixtime": "1569256658",
   "from": "English grammar n vocabulary",
   "from_id": "channel1248828831",
   "photo": "photos/photo_125@23-09-2019_23-37-38.jpg",
   "width": 1144,
   "height": 1152,
   "text": "",
   "text_entities": []
  },
  {
   "id": 164,
   "type": "message",
   "date": "2019-09-23T23:37:55",
   "date_unixtime": "1569256675",
   "from": "English grammar n vocabulary",
   "from_id": "channel1248828831",
   "photo": "photos/photo_126@23-09-2019_23-37-55.jpg",
   "width": 1055,
   "height": 1280,
   "text": "",
   "text_entities": []
  },
  {
   "id": 165,
   "type": "message",
   "date": "2019-09-23T23:38:20",
   "date_unixtime": "1569256700",
   "from": "English grammar n vocabulary",
   "from_id": "channel1248828831",
   "photo": "photos/photo_127@23-09-2019_23-38-20.jpg",
   "width": 1132,
   "height": 1259,
   "text": "",
   "text_entities": []
  },
  {
   "id": 166,
   "type": "message",
   "date": "2019-09-25T15:02:01",
   "date_unixtime": "1569398521",
   "from": "English grammar n vocabulary",
   "from_id": "channel1248828831",
   "photo": "photos/photo_128@25-09-2019_15-02-01.jpg",
   "width": 1078,
   "height": 1243,
   "text": "",
   "text_entities": []
  },
  {
   "id": 167,
   "type": "message",
   "date": "2019-09-27T16:08:01",
   "date_unixtime": "1569575281",
   "from": "English grammar n vocabulary",
   "from_id": "channel1248828831",
   "photo": "photos/photo_129@27-09-2019_16-08-01.jpg",
   "width": 1144,
   "height": 1097,
   "text": "",
   "text_entities": []
  },
  {
   "id": 168,
   "type": "message",
   "date": "2019-09-27T16:08:09",
   "date_unixtime": "1569575289",
   "from": "English grammar n vocabulary",
   "from_id": "channel1248828831",
   "photo": "photos/photo_130@27-09-2019_16-08-09.jpg",
   "width": 1144,
   "height": 1127,
   "text": "",
   "text_entities": []
  },
  {
   "id": 169,
   "type": "message",
   "date": "2019-09-28T14:25:30",
   "date_unixtime": "1569655530",
   "from": "English grammar n vocabulary",
   "from_id": "channel1248828831",
   "photo": "photos/photo_131@28-09-2019_14-25-30.jpg",
   "width": 1132,
   "height": 1023,
   "text": "",
   "text_entities": []
  },
  {
   "id": 170,
   "type": "message",
   "date": "2019-09-29T20:18:56",
   "date_unixtime": "1569763136",
   "from": "English grammar n vocabulary",
   "from_id": "channel1248828831",
   "photo": "photos/photo_132@29-09-2019_20-18-56.jpg",
   "width": 1144,
   "height": 1067,
   "text": "",
   "text_entities": []
  },
  {
   "id": 171,
   "type": "message",
   "date": "2019-09-29T21:30:57",
   "date_unixtime": "1569767457",
   "from": "English grammar n vocabulary",
   "from_id": "channel1248828831",
   "photo": "photos/photo_133@29-09-2019_21-30-57.jpg",
   "width": 1078,
   "height": 1069,
   "text": "",
   "text_entities": []
  },
  {
   "id": 172,
   "type": "message",
   "date": "2019-10-01T13:39:26",
   "date_unixtime": "1569911966",
   "from": "English grammar n vocabulary",
   "from_id": "channel1248828831",
   "photo": "photos/photo_134@01-10-2019_13-39-26.jpg",
   "width": 1078,
   "height": 1067,
   "text": "",
   "text_entities": []
  },
  {
   "id": 173,
   "type": "message",
   "date": "2019-10-01T22:16:45",
   "date_unixtime": "1569943005",
   "from": "English grammar n vocabulary",
   "from_id": "channel1248828831",
   "photo": "photos/photo_135@01-10-2019_22-16-45.jpg",
   "width": 1078,
   "height": 1063,
   "text": "",
   "text_entities": []
  },
  {
   "id": 174,
   "type": "message",
   "date": "2019-10-01T22:16:47",
   "date_unixtime": "1569943007",
   "from": "English grammar n vocabulary",
   "from_id": "channel1248828831",
   "photo": "photos/photo_136@01-10-2019_22-16-47.jpg",
   "width": 1138,
   "height": 1133,
   "text": "",
   "text_entities": []
  },
  {
   "id": 175,
   "type": "message",
   "date": "2019-10-01T22:16:54",
   "date_unixtime": "1569943014",
   "from": "English grammar n vocabulary",
   "from_id": "channel1248828831",
   "photo": "photos/photo_137@01-10-2019_22-16-54.jpg",
   "width": 1116,
   "height": 1101,
   "text": "",
   "text_entities": []
  },
  {
   "id": 176,
   "type": "message",
   "date": "2019-10-02T15:34:19",
   "date_unixtime": "1570005259",
   "from": "English grammar n vocabulary",
   "from_id": "channel1248828831",
   "photo": "photos/photo_138@02-10-2019_15-34-19.jpg",
   "width": 1126,
   "height": 1103,
   "text": "",
   "text_entities": []
  },
  {
   "id": 177,
   "type": "message",
   "date": "2019-10-03T14:25:55",
   "date_unixtime": "1570087555",
   "from": "English grammar n vocabulary",
   "from_id": "channel1248828831",
   "photo": "photos/photo_139@03-10-2019_14-25-55.jpg",
   "width": 1078,
   "height": 1058,
   "text": "",
   "text_entities": []
  },
  {
   "id": 178,
   "type": "message",
   "date": "2019-10-03T14:26:00",
   "date_unixtime": "1570087560",
   "from": "English grammar n vocabulary",
   "from_id": "channel1248828831",
   "photo": "photos/photo_140@03-10-2019_14-26-00.jpg",
   "width": 1144,
   "height": 1111,
   "text": "",
   "text_entities": []
  },
  {
   "id": 179,
   "type": "message",
   "date": "2019-10-03T23:29:52",
   "date_unixtime": "1570120192",
   "from": "English grammar n vocabulary",
   "from_id": "channel1248828831",
   "photo": "photos/photo_141@03-10-2019_23-29-52.jpg",
   "width": 754,
   "height": 744,
   "text": "",
   "text_entities": []
  },
  {
   "id": 180,
   "type": "message",
   "date": "2019-10-03T23:40:33",
   "date_unixtime": "1570120833",
   "from": "English grammar n vocabulary",
   "from_id": "channel1248828831",
   "photo": "photos/photo_142@03-10-2019_23-40-33.jpg",
   "width": 758,
   "height": 765,
   "text": "",
   "text_entities": []
  },
  {
   "id": 181,
   "type": "message",
   "date": "2019-10-03T23:40:40",
   "date_unixtime": "1570120840",
   "from": "English grammar n vocabulary",
   "from_id": "channel1248828831",
   "photo": "photos/photo_143@03-10-2019_23-40-40.jpg",
   "width": 772,
   "height": 774,
   "text": "",
   "text_entities": []
  },
  {
   "id": 182,
   "type": "message",
   "date": "2019-10-06T12:30:07",
   "date_unixtime": "1570339807",
   "from": "English grammar n vocabulary",
   "from_id": "channel1248828831",
   "photo": "photos/photo_144@06-10-2019_12-30-07.jpg",
   "width": 762,
   "height": 756,
   "text": "",
   "text_entities": []
  },
  {
   "id": 183,
   "type": "message",
   "date": "2019-10-11T23:02:34",
   "date_unixtime": "1570809754",
   "from": "English grammar n vocabulary",
   "from_id": "channel1248828831",
   "photo": "photos/photo_145@11-10-2019_23-02-34.jpg",
   "width": 720,
   "height": 743,
   "text": "",
   "text_entities": []
  },
  {
   "id": 184,
   "type": "message",
   "date": "2019-10-12T14:43:44",
   "date_unixtime": "1570866224",
   "from": "English grammar n vocabulary",
   "from_id": "channel1248828831",
   "photo": "photos/photo_146@12-10-2019_14-43-44.jpg",
   "width": 1075,
   "height": 1075,
   "text": "",
   "text_entities": []
  },
  {
   "id": 185,
   "type": "message",
   "date": "2019-10-13T14:33:47",
   "date_unixtime": "1570952027",
   "from": "English grammar n vocabulary",
   "from_id": "channel1248828831",
   "photo": "photos/photo_147@13-10-2019_14-33-47.jpg",
   "width": 1057,
   "height": 1064,
   "text": "",
   "text_entities": []
  },
  {
   "id": 186,
   "type": "message",
   "date": "2019-10-13T16:54:15",
   "date_unixtime": "1570960455",
   "from": "English grammar n vocabulary",
   "from_id": "channel1248828831",
   "photo": "photos/photo_148@13-10-2019_16-54-15.jpg",
   "width": 1078,
   "height": 1060,
   "text": "",
   "text_entities": []
  },
  {
   "id": 187,
   "type": "message",
   "date": "2019-10-13T16:54:31",
   "date_unixtime": "1570960471",
   "from": "English grammar n vocabulary",
   "from_id": "channel1248828831",
   "photo": "photos/photo_149@13-10-2019_16-54-31.jpg",
   "width": 1078,
   "height": 1181,
   "text": "",
   "text_entities": []
  },
  {
   "id": 188,
   "type": "message",
   "date": "2019-10-13T21:21:40",
   "date_unixtime": "1570976500",
   "from": "English grammar n vocabulary",
   "from_id": "channel1248828831",
   "photo": "photos/photo_150@13-10-2019_21-21-40.jpg",
   "width": 1078,
   "height": 878,
   "text": "",
   "text_entities": []
  },
  {
   "id": 189,
   "type": "message",
   "date": "2019-10-15T14:23:48",
   "date_unixtime": "1571124228",
   "from": "English grammar n vocabulary",
   "from_id": "channel1248828831",
   "photo": "photos/photo_151@15-10-2019_14-23-48.jpg",
   "width": 1080,
   "height": 1080,
   "text": "",
   "text_entities": []
  },
  {
   "id": 190,
   "type": "message",
   "date": "2019-10-17T11:38:34",
   "date_unixtime": "1571287114",
   "from": "English grammar n vocabulary",
   "from_id": "channel1248828831",
   "photo": "photos/photo_152@17-10-2019_11-38-34.jpg",
   "width": 504,
   "height": 627,
   "text": "",
   "text_entities": []
  },
  {
   "id": 191,
   "type": "message",
   "date": "2019-10-17T21:04:11",
   "date_unixtime": "1571321051",
   "from": "English grammar n vocabulary",
   "from_id": "channel1248828831",
   "photo": "photos/photo_153@17-10-2019_21-04-11.jpg",
   "width": 512,
   "height": 495,
   "text": "",
   "text_entities": []
  },
  {
   "id": 192,
   "type": "message",
   "date": "2019-10-18T22:14:01",
   "date_unixtime": "1571411641",
   "from": "English grammar n vocabulary",
   "from_id": "channel1248828831",
   "photo": "photos/photo_154@18-10-2019_22-14-01.jpg",
   "width": 1088,
   "height": 1280,
   "text": "",
   "text_entities": []
  },
  {
   "id": 193,
   "type": "message",
   "date": "2019-10-18T22:14:31",
   "date_unixtime": "1571411671",
   "from": "English grammar n vocabulary",
   "from_id": "channel1248828831",
   "poll": {
    "question": "Select the answer below",
    "closed": false,
    "total_voters": 223,
    "answers": [
     {
      "text": "A",
      "voters": 0,
      "chosen": false
     },
     {
      "text": "B",
      "voters": 0,
      "chosen": false
     },
     {
      "text": "C",
      "voters": 0,
      "chosen": false
     },
     {
      "text": "D",
      "voters": 0,
      "chosen": false
     }
    ]
   },
   "text": "",
   "text_entities": []
  },
  {
   "id": 194,
   "type": "message",
   "date": "2019-10-20T17:50:08",
   "date_unixtime": "1571568608",
   "from": "English grammar n vocabulary",
   "from_id": "channel1248828831",
   "text": "Answer is A",
   "text_entities": [
    {
     "type": "plain",
     "text": "Answer is A"
    }
   ]
  },
  {
   "id": 195,
   "type": "message",
   "date": "2019-10-20T17:50:19",
   "date_unixtime": "1571568619",
   "from": "English grammar n vocabulary",
   "from_id": "channel1248828831",
   "photo": "photos/photo_155@20-10-2019_17-50-19.jpg",
   "width": 1031,
   "height": 1280,
   "text": "",
   "text_entities": []
  },
  {
   "id": 196,
   "type": "message",
   "date": "2019-10-21T22:40:39",
   "date_unixtime": "1571672439",
   "from": "English grammar n vocabulary",
   "from_id": "channel1248828831",
   "photo": "photos/photo_156@21-10-2019_22-40-39.jpg",
   "width": 510,
   "height": 544,
   "text": "",
   "text_entities": []
  },
  {
   "id": 197,
   "type": "message",
   "date": "2019-10-25T22:00:29",
   "date_unixtime": "1572015629",
   "from": "English grammar n vocabulary",
   "from_id": "channel1248828831",
   "photo": "photos/photo_157@25-10-2019_22-00-29.jpg",
   "width": 1280,
   "height": 1280,
   "text": "",
   "text_entities": []
  },
  {
   "id": 198,
   "type": "message",
   "date": "2019-10-26T09:19:34",
   "date_unixtime": "1572056374",
   "from": "English grammar n vocabulary",
   "from_id": "channel1248828831",
   "photo": "photos/photo_158@26-10-2019_09-19-34.jpg",
   "width": 1027,
   "height": 1280,
   "text": "",
   "text_entities": []
  },
  {
   "id": 199,
   "type": "message",
   "date": "2019-10-27T14:16:43",
   "date_unixtime": "1572160603",
   "from": "English grammar n vocabulary",
   "from_id": "channel1248828831",
   "photo": "photos/photo_159@27-10-2019_14-16-43.jpg",
   "width": 960,
   "height": 1280,
   "text": "",
   "text_entities": []
  },
  {
   "id": 200,
   "type": "message",
   "date": "2019-10-28T16:03:49",
   "date_unixtime": "1572253429",
   "from": "English grammar n vocabulary",
   "from_id": "channel1248828831",
   "photo": "photos/photo_160@28-10-2019_16-03-49.jpg",
   "width": 1080,
   "height": 1080,
   "text": "",
   "text_entities": []
  },
  {
   "id": 201,
   "type": "message",
   "date": "2019-10-28T16:04:18",
   "date_unixtime": "1572253458",
   "from": "English grammar n vocabulary",
   "from_id": "channel1248828831",
   "photo": "photos/photo_161@28-10-2019_16-04-18.jpg",
   "width": 497,
   "height": 497,
   "text": "",
   "text_entities": []
  },
  {
   "id": 202,
   "type": "message",
   "date": "2019-10-28T16:04:18",
   "date_unixtime": "1572253458",
   "from": "English grammar n vocabulary",
   "from_id": "channel1248828831",
   "photo": "photos/photo_162@28-10-2019_16-04-18.jpg",
   "width": 486,
   "height": 486,
   "text": "",
   "text_entities": []
  },
  {
   "id": 203,
   "type": "message",
   "date": "2019-10-31T09:13:46",
   "date_unixtime": "1572488026",
   "from": "English grammar n vocabulary",
   "from_id": "channel1248828831",
   "photo": "photos/photo_163@31-10-2019_09-13-46.jpg",
   "width": 1280,
   "height": 1280,
   "text": "",
   "text_entities": []
  },
  {
   "id": 204,
   "type": "message",
   "date": "2019-10-31T09:14:30",
   "date_unixtime": "1572488070",
   "from": "English grammar n vocabulary",
   "from_id": "channel1248828831",
   "photo": "photos/photo_164@31-10-2019_09-14-30.jpg",
   "width": 1250,
   "height": 1250,
   "text": "",
   "text_entities": []
  },
  {
   "id": 205,
   "type": "message",
   "date": "2019-10-31T17:37:25",
   "date_unixtime": "1572518245",
   "from": "English grammar n vocabulary",
   "from_id": "channel1248828831",
   "photo": "photos/photo_165@31-10-2019_17-37-25.jpg",
   "width": 1080,
   "height": 1080,
   "text": "",
   "text_entities": []
  },
  {
   "id": 206,
   "type": "message",
   "date": "2019-11-01T15:19:26",
   "date_unixtime": "1572596366",
   "from": "English grammar n vocabulary",
   "from_id": "channel1248828831",
   "photo": "photos/photo_166@01-11-2019_15-19-26.jpg",
   "width": 1250,
   "height": 1250,
   "text": "",
   "text_entities": []
  },
  {
   "id": 207,
   "type": "message",
   "date": "2019-11-02T21:17:08",
   "date_unixtime": "1572704228",
   "from": "English grammar n vocabulary",
   "from_id": "channel1248828831",
   "photo": "photos/photo_167@02-11-2019_21-17-08.jpg",
   "width": 1250,
   "height": 1250,
   "text": "",
   "text_entities": []
  },
  {
   "id": 208,
   "type": "message",
   "date": "2019-11-02T21:17:21",
   "date_unixtime": "1572704241",
   "from": "English grammar n vocabulary",
   "from_id": "channel1248828831",
   "photo": "photos/photo_168@02-11-2019_21-17-21.jpg",
   "width": 1080,
   "height": 1080,
   "text": "",
   "text_entities": []
  },
  {
   "id": 209,
   "type": "message",
   "date": "2019-11-03T19:34:19",
   "date_unixtime": "1572784459",
   "from": "English grammar n vocabulary",
   "from_id": "channel1248828831",
   "photo": "photos/photo_169@03-11-2019_19-34-19.jpg",
   "width": 1250,
   "height": 1250,
   "text": "",
   "text_entities": []
  },
  {
   "id": 210,
   "type": "message",
   "date": "2019-11-04T15:08:23",
   "date_unixtime": "1572854903",
   "from": "English grammar n vocabulary",
   "from_id": "channel1248828831",
   "photo": "photos/photo_170@04-11-2019_15-08-23.jpg",
   "width": 1280,
   "height": 1280,
   "text": "",
   "text_entities": []
  },
  {
   "id": 211,
   "type": "message",
   "date": "2019-11-08T12:22:39",
   "date_unixtime": "1573190559",
   "from": "English grammar n vocabulary",
   "from_id": "channel1248828831",
   "photo": "photos/photo_171@08-11-2019_12-22-39.jpg",
   "width": 1280,
   "height": 1280,
   "text": "",
   "text_entities": []
  },
  {
   "id": 212,
   "type": "message",
   "date": "2019-11-08T12:22:53",
   "date_unixtime": "1573190573",
   "from": "English grammar n vocabulary",
   "from_id": "channel1248828831",
   "photo": "photos/photo_172@08-11-2019_12-22-53.jpg",
   "width": 720,
   "height": 720,
   "text": "",
   "text_entities": []
  },
  {
   "id": 213,
   "type": "message",
   "date": "2019-11-08T12:22:53",
   "date_unixtime": "1573190573",
   "from": "English grammar n vocabulary",
   "from_id": "channel1248828831",
   "photo": "photos/photo_173@08-11-2019_12-22-53.jpg",
   "width": 720,
   "height": 720,
   "text": "",
   "text_entities": []
  },
  {
   "id": 214,
   "type": "message",
   "date": "2019-11-08T12:22:53",
   "date_unixtime": "1573190573",
   "from": "English grammar n vocabulary",
   "from_id": "channel1248828831",
   "photo": "photos/photo_174@08-11-2019_12-22-53.jpg",
   "width": 720,
   "height": 720,
   "text": "",
   "text_entities": []
  },
  {
   "id": 215,
   "type": "message",
   "date": "2019-11-08T12:22:53",
   "date_unixtime": "1573190573",
   "from": "English grammar n vocabulary",
   "from_id": "channel1248828831",
   "photo": "photos/photo_175@08-11-2019_12-22-53.jpg",
   "width": 697,
   "height": 697,
   "text": "",
   "text_entities": []
  },
  {
   "id": 216,
   "type": "message",
   "date": "2019-11-08T12:22:53",
   "date_unixtime": "1573190573",
   "from": "English grammar n vocabulary",
   "from_id": "channel1248828831",
   "photo": "photos/photo_176@08-11-2019_12-22-53.jpg",
   "width": 720,
   "height": 720,
   "text": "",
   "text_entities": []
  },
  {
   "id": 217,
   "type": "message",
   "date": "2019-11-08T12:22:53",
   "date_unixtime": "1573190573",
   "from": "English grammar n vocabulary",
   "from_id": "channel1248828831",
   "photo": "photos/photo_177@08-11-2019_12-22-53.jpg",
   "width": 720,
   "height": 720,
   "text": "",
   "text_entities": []
  },
  {
   "id": 218,
   "type": "message",
   "date": "2019-11-08T12:22:53",
   "date_unixtime": "1573190573",
   "from": "English grammar n vocabulary",
   "from_id": "channel1248828831",
   "photo": "photos/photo_178@08-11-2019_12-22-53.jpg",
   "width": 720,
   "height": 720,
   "text": "",
   "text_entities": []
  },
  {
   "id": 219,
   "type": "message",
   "date": "2019-11-10T10:20:19",
   "date_unixtime": "1573356019",
   "from": "English grammar n vocabulary",
   "from_id": "channel1248828831",
   "photo": "photos/photo_179@10-11-2019_10-20-19.jpg",
   "width": 1280,
   "height": 1280,
   "text": "",
   "text_entities": []
  },
  {
   "id": 220,
   "type": "message",
   "date": "2019-11-11T14:23:26",
   "date_unixtime": "1573457006",
   "from": "English grammar n vocabulary",
   "from_id": "channel1248828831",
   "photo": "photos/photo_180@11-11-2019_14-23-26.jpg",
   "width": 1080,
   "height": 1080,
   "text": "",
   "text_entities": []
  },
  {
   "id": 221,
   "type": "message",
   "date": "2019-11-12T14:24:31",
   "date_unixtime": "1573543471",
   "from": "English grammar n vocabulary",
   "from_id": "channel1248828831",
   "photo": "photos/photo_181@12-11-2019_14-24-31.jpg",
   "width": 1041,
   "height": 1041,
   "text": "",
   "text_entities": []
  },
  {
   "id": 222,
   "type": "message",
   "date": "2019-11-12T14:24:49",
   "date_unixtime": "1573543489",
   "from": "English grammar n vocabulary",
   "from_id": "channel1248828831",
   "photo": "photos/photo_182@12-11-2019_14-24-49.jpg",
   "width": 1024,
   "height": 1280,
   "text": "",
   "text_entities": []
  },
  {
   "id": 223,
   "type": "message",
   "date": "2019-11-14T12:11:14",
   "date_unixtime": "1573708274",
   "from": "English grammar n vocabulary",
   "from_id": "channel1248828831",
   "photo": "photos/photo_183@14-11-2019_12-11-14.jpg",
   "width": 1080,
   "height": 1080,
   "text": "",
   "text_entities": []
  },
  {
   "id": 224,
   "type": "message",
   "date": "2019-11-14T12:11:14",
   "date_unixtime": "1573708274",
   "from": "English grammar n vocabulary",
   "from_id": "channel1248828831",
   "photo": "photos/photo_184@14-11-2019_12-11-14.jpg",
   "width": 1080,
   "height": 1080,
   "text": "",
   "text_entities": []
  },
  {
   "id": 225,
   "type": "message",
   "date": "2019-11-15T19:42:16",
   "date_unixtime": "1573821736",
   "from": "English grammar n vocabulary",
   "from_id": "channel1248828831",
   "photo": "photos/photo_185@15-11-2019_19-42-16.jpg",
   "width": 1080,
   "height": 1080,
   "text": "",
   "text_entities": []
  },
  {
   "id": 226,
   "type": "message",
   "date": "2019-11-16T22:54:38",
   "date_unixtime": "1573919678",
   "from": "English grammar n vocabulary",
   "from_id": "channel1248828831",
   "photo": "photos/photo_186@16-11-2019_22-54-38.jpg",
   "width": 1058,
   "height": 1280,
   "text": "",
   "text_entities": []
  },
  {
   "id": 227,
   "type": "message",
   "date": "2019-11-17T21:46:27",
   "date_unixtime": "1574001987",
   "from": "English grammar n vocabulary",
   "from_id": "channel1248828831",
   "photo": "photos/photo_187@17-11-2019_21-46-27.jpg",
   "width": 432,
   "height": 604,
   "text": "",
   "text_entities": []
  },
  {
   "id": 228,
   "type": "message",
   "date": "2019-11-22T20:46:06",
   "date_unixtime": "1574430366",
   "from": "English grammar n vocabulary",
   "from_id": "channel1248828831",
   "photo": "photos/photo_188@22-11-2019_20-46-06.jpg",
   "width": 1024,
   "height": 1280,
   "text": "",
   "text_entities": []
  },
  {
   "id": 229,
   "type": "message",
   "date": "2019-11-22T20:46:26",
   "date_unixtime": "1574430386",
   "from": "English grammar n vocabulary",
   "from_id": "channel1248828831",
   "photo": "photos/photo_189@22-11-2019_20-46-26.jpg",
   "width": 1280,
   "height": 1280,
   "text": "",
   "text_entities": []
  },
  {
   "id": 230,
   "type": "message",
   "date": "2019-11-24T23:29:28",
   "date_unixtime": "1574612968",
   "from": "English grammar n vocabulary",
   "from_id": "channel1248828831",
   "photo": "photos/photo_190@24-11-2019_23-29-28.jpg",
   "width": 1080,
   "height": 1105,
   "text": "",
   "text_entities": []
  },
  {
   "id": 233,
   "type": "message",
   "date": "2019-11-24T23:31:55",
   "date_unixtime": "1574613115",
   "from": "English grammar n vocabulary",
   "from_id": "channel1248828831",
   "photo": "photos/photo_191@24-11-2019_23-31-55.jpg",
   "width": 1280,
   "height": 1280,
   "text": "😋😅😜😃",
   "text_entities": [
    {
     "type": "plain",
     "text": "😋😅😜😃"
    }
   ]
  },
  {
   "id": 234,
   "type": "message",
   "date": "2019-11-25T17:02:47",
   "date_unixtime": "1574676167",
   "from": "English grammar n vocabulary",
   "from_id": "channel1248828831",
   "photo": "photos/photo_192@25-11-2019_17-02-47.jpg",
   "width": 1080,
   "height": 1080,
   "text": "",
   "text_entities": []
  },
  {
   "id": 235,
   "type": "message",
   "date": "2019-11-25T17:03:04",
   "date_unixtime": "1574676184",
   "from": "English grammar n vocabulary",
   "from_id": "channel1248828831",
   "photo": "photos/photo_193@25-11-2019_17-03-04.jpg",
   "width": 1024,
   "height": 1280,
   "text": "",
   "text_entities": []
  },
  {
   "id": 236,
   "type": "message",
   "date": "2019-11-26T22:47:31",
   "date_unixtime": "1574783251",
   "from": "English grammar n vocabulary",
   "from_id": "channel1248828831",
   "photo": "photos/photo_194@26-11-2019_22-47-31.jpg",
   "width": 750,
   "height": 721,
   "text": "",
   "text_entities": []
  },
  {
   "id": 237,
   "type": "message",
   "date": "2019-12-01T16:47:19",
   "date_unixtime": "1575193639",
   "from": "English grammar n vocabulary",
   "from_id": "channel1248828831",
   "photo": "photos/photo_195@01-12-2019_16-47-19.jpg",
   "width": 1080,
   "height": 1080,
   "text": "",
   "text_entities": []
  },
  {
   "id": 238,
   "type": "message",
   "date": "2019-12-06T15:03:28",
   "date_unixtime": "1575619408",
   "from": "English grammar n vocabulary",
   "from_id": "channel1248828831",
   "photo": "photos/photo_196@06-12-2019_15-03-28.jpg",
   "width": 1280,
   "height": 1280,
   "text": "",
   "text_entities": []
  },
  {
   "id": 239,
   "type": "message",
   "date": "2019-12-07T14:29:27",
   "date_unixtime": "1575703767",
   "from": "English grammar n vocabulary",
   "from_id": "channel1248828831",
   "photo": "photos/photo_197@07-12-2019_14-29-27.jpg",
   "width": 1023,
   "height": 1280,
   "text": "",
   "text_entities": []
  },
  {
   "id": 240,
   "type": "message",
   "date": "2019-12-08T11:39:49",
   "date_unixtime": "1575779989",
   "from": "English grammar n vocabulary",
   "from_id": "channel1248828831",
   "photo": "photos/photo_198@08-12-2019_11-39-49.jpg",
   "width": 1250,
   "height": 1250,
   "text": "",
   "text_entities": []
  },
  {
   "id": 241,
   "type": "message",
   "date": "2019-12-10T22:03:00",
   "date_unixtime": "1575990180",
   "from": "English grammar n vocabulary",
   "from_id": "channel1248828831",
   "photo": "photos/photo_199@10-12-2019_22-03-00.jpg",
   "width": 1078,
   "height": 997,
   "text": "",
   "text_entities": []
  },
  {
   "id": 242,
   "type": "message",
   "date": "2019-12-12T21:59:35",
   "date_unixtime": "1576162775",
   "from": "English grammar n vocabulary",
   "from_id": "channel1248828831",
   "photo": "photos/photo_200@12-12-2019_21-59-35.jpg",
   "width": 1078,
   "height": 1047,
   "text": "",
   "text_entities": []
  },
  {
   "id": 243,
   "type": "message",
   "date": "2019-12-13T13:40:11",
   "date_unixtime": "1576219211",
   "from": "English grammar n vocabulary",
   "from_id": "channel1248828831",
   "photo": "photos/photo_201@13-12-2019_13-40-11.jpg",
   "width": 1078,
   "height": 872,
   "text": "",
   "text_entities": []
  },
  {
   "id": 244,
   "type": "message",
   "date": "2019-12-13T22:43:55",
   "date_unixtime": "1576251835",
   "from": "English grammar n vocabulary",
   "from_id": "channel1248828831",
   "photo": "photos/photo_202@13-12-2019_22-43-55.jpg",
   "width": 1078,
   "height": 1146,
   "text": "",
   "text_entities": []
  },
  {
   "id": 245,
   "type": "message",
   "date": "2019-12-17T22:20:56",
   "date_unixtime": "1576596056",
   "from": "English grammar n vocabulary",
   "from_id": "channel1248828831",
   "photo": "photos/photo_203@17-12-2019_22-20-56.jpg",
   "width": 1037,
   "height": 1280,
   "text": "",
   "text_entities": []
  },
  {
   "id": 246,
   "type": "message",
   "date": "2019-12-24T10:51:10",
   "date_unixtime": "1577159470",
   "from": "English grammar n vocabulary",
   "from_id": "channel1248828831",
   "photo": "photos/photo_204@24-12-2019_10-51-10.jpg",
   "width": 1056,
   "height": 1280,
   "text": "",
   "text_entities": []
  },
  {
   "id": 247,
   "type": "message",
   "date": "2019-12-24T10:51:18",
   "date_unixtime": "1577159478",
   "from": "English grammar n vocabulary",
   "from_id": "channel1248828831",
   "photo": "photos/photo_205@24-12-2019_10-51-18.jpg",
   "width": 516,
   "height": 568,
   "text": "",
   "text_entities": []
  },
  {
   "id": 248,
   "type": "message",
   "date": "2019-12-27T19:53:22",
   "date_unixtime": "1577451202",
   "from": "English grammar n vocabulary",
   "from_id": "channel1248828831",
   "photo": "photos/photo_206@27-12-2019_19-53-22.jpg",
   "width": 1138,
   "height": 1138,
   "text": "",
   "text_entities": []
  },
  {
   "id": 249,
   "type": "message",
   "date": "2019-12-27T19:53:30",
   "date_unixtime": "1577451210",
   "from": "English grammar n vocabulary",
   "from_id": "channel1248828831",
   "photo": "photos/photo_207@27-12-2019_19-53-30.jpg",
   "width": 1078,
   "height": 1196,
   "text": "",
   "text_entities": []
  },
  {
   "id": 250,
   "type": "message",
   "date": "2019-12-31T16:22:39",
   "date_unixtime": "1577784159",
   "from": "English grammar n vocabulary",
   "from_id": "channel1248828831",
   "photo": "photos/photo_208@31-12-2019_16-22-39.jpg",
   "width": 1144,
   "height": 1128,
   "text": "",
   "text_entities": []
  },
  {
   "id": 251,
   "type": "message",
   "date": "2020-01-03T10:14:40",
   "date_unixtime": "1578021280",
   "from": "English grammar n vocabulary",
   "from_id": "channel1248828831",
   "photo": "photos/photo_209@03-01-2020_10-14-40.jpg",
   "width": 1078,
   "height": 970,
   "text": "",
   "text_entities": []
  },
  {
   "id": 252,
   "type": "message",
   "date": "2020-01-05T21:08:39",
   "date_unixtime": "1578233319",
   "from": "English grammar n vocabulary",
   "from_id": "channel1248828831",
   "photo": "photos/photo_210@05-01-2020_21-08-39.jpg",
   "width": 752,
   "height": 572,
   "text": "",
   "text_entities": []
  },
  {
   "id": 253,
   "type": "message",
   "date": "2020-01-08T23:05:42",
   "date_unixtime": "1578499542",
   "from": "English grammar n vocabulary",
   "from_id": "channel1248828831",
   "photo": "photos/photo_211@08-01-2020_23-05-42.jpg",
   "width": 1080,
   "height": 1080,
   "text": "",
   "text_entities": []
  },
  {
   "id": 254,
   "type": "message",
   "date": "2020-01-08T23:05:55",
   "date_unixtime": "1578499555",
   "from": "English grammar n vocabulary",
   "from_id": "channel1248828831",
   "photo": "photos/photo_212@08-01-2020_23-05-55.jpg",
   "width": 1080,
   "height": 1080,
   "text": "",
   "text_entities": []
  },
  {
   "id": 255,
   "type": "message",
   "date": "2020-01-15T17:10:55",
   "date_unixtime": "1579083055",
   "from": "English grammar n vocabulary",
   "from_id": "channel1248828831",
   "photo": "photos/photo_213@15-01-2020_17-10-55.jpg",
   "width": 768,
   "height": 761,
   "text": "",
   "text_entities": []
  },
  {
   "id": 256,
   "type": "message",
   "date": "2020-01-15T17:11:03",
   "date_unixtime": "1579083063",
   "from": "English grammar n vocabulary",
   "from_id": "channel1248828831",
   "photo": "photos/photo_214@15-01-2020_17-11-03.jpg",
   "width": 1250,
   "height": 1250,
   "text": "",
   "text_entities": []
  },
  {
   "id": 257,
   "type": "message",
   "date": "2020-01-15T17:11:11",
   "date_unixtime": "1579083071",
   "from": "English grammar n vocabulary",
   "from_id": "channel1248828831",
   "photo": "photos/photo_215@15-01-2020_17-11-11.jpg",
   "width": 1063,
   "height": 1280,
   "text": "",
   "text_entities": []
  },
  {
   "id": 258,
   "type": "message",
   "date": "2020-01-15T17:11:28",
   "date_unixtime": "1579083088",
   "from": "English grammar n vocabulary",
   "from_id": "channel1248828831",
   "photo": "photos/photo_216@15-01-2020_17-11-28.jpg",
   "width": 758,
   "height": 758,
   "text": "",
   "text_entities": []
  },
  {
   "id": 259,
   "type": "message",
   "date": "2020-01-16T12:24:13",
   "date_unixtime": "1579152253",
   "from": "English grammar n vocabulary",
   "from_id": "channel1248828831",
   "photo": "photos/photo_217@16-01-2020_12-24-13.jpg",
   "width": 743,
   "height": 743,
   "text": "",
   "text_entities": []
  },
  {
   "id": 260,
   "type": "message",
   "date": "2020-01-19T09:17:39",
   "date_unixtime": "1579400259",
   "from": "English grammar n vocabulary",
   "from_id": "channel1248828831",
   "photo": "photos/photo_218@19-01-2020_09-17-39.jpg",
   "width": 1280,
   "height": 1280,
   "text": "",
   "text_entities": []
  },
  {
   "id": 261,
   "type": "message",
   "date": "2020-01-19T09:17:42",
   "date_unixtime": "1579400262",
   "from": "English grammar n vocabulary",
   "from_id": "channel1248828831",
   "photo": "photos/photo_219@19-01-2020_09-17-42.jpg",
   "width": 1078,
   "height": 907,
   "text": "",
   "text_entities": []
  },
  {
   "id": 262,
   "type": "message",
   "date": "2020-01-20T15:59:35",
   "date_unixtime": "1579510775",
   "from": "English grammar n vocabulary",
   "from_id": "channel1248828831",
   "photo": "photos/photo_220@20-01-2020_15-59-35.jpg",
   "width": 1078,
   "height": 1084,
   "text": "",
   "text_entities": []
  },
  {
   "id": 263,
   "type": "message",
   "date": "2020-01-20T15:59:40",
   "date_unixtime": "1579510780",
   "from": "English grammar n vocabulary",
   "from_id": "channel1248828831",
   "photo": "photos/photo_221@20-01-2020_15-59-40.jpg",
   "width": 1144,
   "height": 1111,
   "text": "",
   "text_entities": []
  },
  {
   "id": 264,
   "type": "message",
   "date": "2020-01-23T22:10:12",
   "date_unixtime": "1579792212",
   "from": "English grammar n vocabulary",
   "from_id": "channel1248828831",
   "photo": "photos/photo_222@23-01-2020_22-10-12.jpg",
   "width": 1066,
   "height": 1066,
   "text": "",
   "text_entities": []
  },
  {
   "id": 265,
   "type": "message",
   "date": "2020-02-01T16:48:47",
   "date_unixtime": "1580550527",
   "from": "English grammar n vocabulary",
   "from_id": "channel1248828831",
   "photo": "photos/photo_223@01-02-2020_16-48-47.jpg",
   "width": 1200,
   "height": 1200,
   "text": "",
   "text_entities": []
  },
  {
   "id": 266,
   "type": "message",
   "date": "2020-02-01T16:48:59",
   "date_unixtime": "1580550539",
   "from": "English grammar n vocabulary",
   "from_id": "channel1248828831",
   "photo": "photos/photo_224@01-02-2020_16-48-59.jpg",
   "width": 1080,
   "height": 1080,
   "text": "",
   "text_entities": []
  },
  {
   "id": 267,
   "type": "message",
   "date": "2020-02-01T16:49:23",
   "date_unixtime": "1580550563",
   "from": "English grammar n vocabulary",
   "from_id": "channel1248828831",
   "photo": "photos/photo_225@01-02-2020_16-49-23.jpg",
   "width": 1200,
   "height": 1200,
   "text": "",
   "text_entities": []
  },
  {
   "id": 268,
   "type": "message",
   "date": "2020-02-04T20:49:25",
   "date_unixtime": "1580824165",
   "from": "English grammar n vocabulary",
   "from_id": "channel1248828831",
   "photo": "photos/photo_226@04-02-2020_20-49-25.jpg",
   "width": 1078,
   "height": 1078,
   "text": "",
   "text_entities": []
  },
  {
   "id": 269,
   "type": "message",
   "date": "2020-02-06T17:51:59",
   "date_unixtime": "1580986319",
   "from": "English grammar n vocabulary",
   "from_id": "channel1248828831",
   "photo": "photos/photo_227@06-02-2020_17-51-59.jpg",
   "width": 1080,
   "height": 1080,
   "text": "",
   "text_entities": []
  },
  {
   "id": 270,
   "type": "message",
   "date": "2020-02-09T12:41:28",
   "date_unixtime": "1581226888",
   "from": "English grammar n vocabulary",
   "from_id": "channel1248828831",
   "photo": "photos/photo_228@09-02-2020_12-41-28.jpg",
   "width": 1152,
   "height": 1134,
   "text": "",
   "text_entities": []
  },
  {
   "id": 271,
   "type": "message",
   "date": "2020-02-09T12:41:36",
   "date_unixtime": "1581226896",
   "from": "English grammar n vocabulary",
   "from_id": "channel1248828831",
   "photo": "photos/photo_229@09-02-2020_12-41-36.jpg",
   "width": 1126,
   "height": 1137,
   "text": "",
   "text_entities": []
  },
  {
   "id": 272,
   "type": "message",
   "date": "2020-02-10T16:31:26",
   "date_unixtime": "1581327086",
   "from": "English grammar n vocabulary",
   "from_id": "channel1248828831",
   "photo": "photos/photo_230@10-02-2020_16-31-26.jpg",
   "width": 1075,
   "height": 1280,
   "text": "",
   "text_entities": []
  },
  {
   "id": 273,
   "type": "message",
   "date": "2020-02-12T18:29:39",
   "date_unixtime": "1581506979",
   "from": "English grammar n vocabulary",
   "from_id": "channel1248828831",
   "photo": "photos/photo_231@12-02-2020_18-29-39.jpg",
   "width": 1078,
   "height": 1180,
   "text": "",
   "text_entities": []
  },
  {
   "id": 274,
   "type": "message",
   "date": "2020-02-12T18:30:05",
   "date_unixtime": "1581507005",
   "from": "English grammar n vocabulary",
   "from_id": "channel1248828831",
   "photo": "photos/photo_232@12-02-2020_18-30-05.jpg",
   "width": 1000,
   "height": 1280,
   "text": "",
   "text_entities": []
  },
  {
   "id": 276,
   "type": "message",
   "date": "2020-02-12T18:32:19",
   "date_unixtime": "1581507139",
   "from": "English grammar n vocabulary",
   "from_id": "channel1248828831",
   "photo": "photos/photo_233@12-02-2020_18-32-19.jpg",
   "width": 1078,
   "height": 1095,
   "text": "",
   "text_entities": []
  },
  {
   "id": 277,
   "type": "message",
   "date": "2020-02-12T18:32:36",
   "date_unixtime": "1581507156",
   "from": "English grammar n vocabulary",
   "from_id": "channel1248828831",
   "photo": "photos/photo_234@12-02-2020_18-32-36.jpg",
   "width": 1080,
   "height": 1080,
   "text": "",
   "text_entities": []
  },
  {
   "id": 278,
   "type": "message",
   "date": "2020-02-14T19:45:49",
   "date_unixtime": "1581684349",
   "from": "English grammar n vocabulary",
   "from_id": "channel1248828831",
   "photo": "photos/photo_235@14-02-2020_19-45-49.jpg",
   "width": 1280,
   "height": 1280,
   "text": "",
   "text_entities": []
  },
  {
   "id": 279,
   "type": "message",
   "date": "2020-02-18T09:43:21",
   "date_unixtime": "1581993801",
   "from": "English grammar n vocabulary",
   "from_id": "channel1248828831",
   "photo": "photos/photo_236@18-02-2020_09-43-21.jpg",
   "width": 1078,
   "height": 1087,
   "text": "",
   "text_entities": []
  },
  {
   "id": 280,
   "type": "message",
   "date": "2020-02-18T09:43:36",
   "date_unixtime": "1581993816",
   "from": "English grammar n vocabulary",
   "from_id": "channel1248828831",
   "photo": "photos/photo_237@18-02-2020_09-43-36.jpg",
   "width": 1078,
   "height": 1120,
   "text": "",
   "text_entities": []
  },
  {
   "id": 281,
   "type": "message",
   "date": "2020-02-19T14:51:34",
   "date_unixtime": "1582098694",
   "from": "English grammar n vocabulary",
   "from_id": "channel1248828831",
   "photo": "photos/photo_238@19-02-2020_14-51-34.jpg",
   "width": 1200,
   "height": 1200,
   "text": "",
   "text_entities": []
  },
  {
   "id": 282,
   "type": "message",
   "date": "2020-02-19T21:18:32",
   "date_unixtime": "1582121912",
   "from": "English grammar n vocabulary",
   "from_id": "channel1248828831",
   "photo": "photos/photo_239@19-02-2020_21-18-32.jpg",
   "width": 1070,
   "height": 1069,
   "text": "",
   "text_entities": []
  },
  {
   "id": 283,
   "type": "message",
   "date": "2020-02-21T15:01:07",
   "date_unixtime": "1582272067",
   "from": "English grammar n vocabulary",
   "from_id": "channel1248828831",
   "photo": "photos/photo_240@21-02-2020_15-01-07.jpg",
   "width": 1080,
   "height": 1080,
   "text": "",
   "text_entities": []
  },
  {
   "id": 284,
   "type": "message",
   "date": "2020-02-22T18:11:41",
   "date_unixtime": "1582369901",
   "from": "English grammar n vocabulary",
   "from_id": "channel1248828831",
   "photo": "photos/photo_241@22-02-2020_18-11-41.jpg",
   "width": 1078,
   "height": 1104,
   "text": "",
   "text_entities": []
  },
  {
   "id": 285,
   "type": "message",
   "date": "2020-02-24T10:22:28",
   "date_unixtime": "1582514548",
   "from": "English grammar n vocabulary",
   "from_id": "channel1248828831",
   "photo": "photos/photo_242@24-02-2020_10-22-28.jpg",
   "width": 1078,
   "height": 1268,
   "text": "",
   "text_entities": []
  },
  {
   "id": 286,
   "type": "message",
   "date": "2020-02-25T10:01:27",
   "date_unixtime": "1582599687",
   "from": "English grammar n vocabulary",
   "from_id": "channel1248828831",
   "photo": "photos/photo_243@25-02-2020_10-01-27.jpg",
   "width": 1024,
   "height": 1280,
   "text": "",
   "text_entities": []
  },
  {
   "id": 288,
   "type": "message",
   "date": "2020-02-26T10:15:15",
   "date_unixtime": "1582686915",
   "from": "English grammar n vocabulary",
   "from_id": "channel1248828831",
   "photo": "photos/photo_244@26-02-2020_10-15-15.jpg",
   "width": 1078,
   "height": 1087,
   "text": "",
   "text_entities": []
  },
  {
   "id": 289,
   "type": "message",
   "date": "2020-02-27T10:07:54",
   "date_unixtime": "1582772874",
   "from": "English grammar n vocabulary",
   "from_id": "channel1248828831",
   "photo": "photos/photo_245@27-02-2020_10-07-54.jpg",
   "width": 994,
   "height": 994,
   "text": "",
   "text_entities": []
  },
  {
   "id": 290,
   "type": "message",
   "date": "2020-02-27T20:53:11",
   "date_unixtime": "1582811591",
   "from": "English grammar n vocabulary",
   "from_id": "channel1248828831",
   "photo": "photos/photo_246@27-02-2020_20-53-11.jpg",
   "width": 1080,
   "height": 1080,
   "text": "",
   "text_entities": []
  },
  {
   "id": 291,
   "type": "message",
   "date": "2020-03-01T10:08:46",
   "date_unixtime": "1583032126",
   "from": "English grammar n vocabulary",
   "from_id": "channel1248828831",
   "photo": "photos/photo_247@01-03-2020_10-08-46.jpg",
   "width": 1046,
   "height": 1280,
   "text": "",
   "text_entities": []
  },
  {
   "id": 292,
   "type": "message",
   "date": "2020-03-01T21:27:57",
   "date_unixtime": "1583072877",
   "from": "English grammar n vocabulary",
   "from_id": "channel1248828831",
   "photo": "photos/photo_248@01-03-2020_21-27-57.jpg",
   "width": 1250,
   "height": 1250,
   "text": "",
   "text_entities": []
  },
  {
   "id": 293,
   "type": "message",
   "date": "2020-03-03T15:21:39",
   "date_unixtime": "1583223699",
   "from": "English grammar n vocabulary",
   "from_id": "channel1248828831",
   "photo": "photos/photo_249@03-03-2020_15-21-39.jpg",
   "width": 1078,
   "height": 1092,
   "text": "",
   "text_entities": []
  },
  {
   "id": 294,
   "type": "message",
   "date": "2020-03-03T22:53:14",
   "date_unixtime": "1583250794",
   "from": "English grammar n vocabulary",
   "from_id": "channel1248828831",
   "text": [
    "Hi everyone,\nSubject-verb agreement is a very important topic. Learn subject-verb agreement in detail.\n.\n",
    {
     "type": "link",
     "text": "https://englishchum.com/subject-verb-agreement/"
    }
   ],
   "text_entities": [
    {
     "type": "plain",
     "text": "Hi everyone,\nSubject-verb agreement is a very important topic. Learn subject-verb agreement in detail.\n.\n"
    },
    {
     "type": "link",
     "text": "https://englishchum.com/subject-verb-agreement/"
    }
   ]
  },
  {
   "id": 295,
   "type": "message",
   "date": "2020-03-04T23:33:57",
   "date_unixtime": "1583339637",
   "from": "English grammar n vocabulary",
   "from_id": "channel1248828831",
   "photo": "photos/photo_250@04-03-2020_23-33-57.jpg",
   "width": 354,
   "height": 442,
   "text": "",
   "text_entities": []
  },
  {
   "id": 296,
   "type": "message",
   "date": "2020-03-05T21:20:37",
   "date_unixtime": "1583418037",
   "from": "English grammar n vocabulary",
   "from_id": "channel1248828831",
   "photo": "photos/photo_251@05-03-2020_21-20-37.jpg",
   "width": 1049,
   "height": 1280,
   "text": "",
   "text_entities": []
  },
  {
   "id": 298,
   "type": "message",
   "date": "2020-03-06T10:36:17",
   "date_unixtime": "1583465777",
   "from": "English grammar n vocabulary",
   "from_id": "channel1248828831",
   "photo": "photos/photo_252@06-03-2020_10-36-17.jpg",
   "width": 1061,
   "height": 1280,
   "text": "",
   "text_entities": []
  },
  {
   "id": 299,
   "type": "message",
   "date": "2020-03-06T10:37:03",
   "date_unixtime": "1583465823",
   "from": "English grammar n vocabulary",
   "from_id": "channel1248828831",
   "text": [
    "Learn most important ANTONYMS for competitive exams and daily life.\n.\n.\n.\n.\n",
    {
     "type": "link",
     "text": "https://englishchum.com/important-200-antonyms/"
    }
   ],
   "text_entities": [
    {
     "type": "plain",
     "text": "Learn most important ANTONYMS for competitive exams and daily life.\n.\n.\n.\n.\n"
    },
    {
     "type": "link",
     "text": "https://englishchum.com/important-200-antonyms/"
    }
   ]
  },
  {
   "id": 300,
   "type": "message",
   "date": "2020-03-08T12:16:10",
   "date_unixtime": "1583644570",
   "from": "English grammar n vocabulary",
   "from_id": "channel1248828831",
   "photo": "photos/photo_253@08-03-2020_12-16-10.jpg",
   "width": 1025,
   "height": 1280,
   "text": "",
   "text_entities": []
  },
  {
   "id": 301,
   "type": "message",
   "date": "2020-03-08T12:16:18",
   "date_unixtime": "1583644578",
   "from": "English grammar n vocabulary",
   "from_id": "channel1248828831",
   "photo": "photos/photo_254@08-03-2020_12-16-18.jpg",
   "width": 1068,
   "height": 832,
   "text": "",
   "text_entities": []
  },
  {
   "id": 302,
   "type": "message",
   "date": "2020-03-08T12:19:42",
   "date_unixtime": "1583644782",
   "from": "English grammar n vocabulary",
   "from_id": "channel1248828831",
   "text": [
    "Do you want to play prepositions quiz?  Attempt this quiz 👇👇👇👇 and Comment your score there\n.\n.\n",
    {
     "type": "link",
     "text": "https://englishchum.com/prepositions-quiz/"
    },
    ""
   ],
   "text_entities": [
    {
     "type": "plain",
     "text": "Do you want to play prepositions quiz?  Attempt this quiz 👇👇👇👇 and Comment your score there\n.\n.\n"
    },
    {
     "type": "link",
     "text": "https://englishchum.com/prepositions-quiz/"
    },
    {
     "type": "plain",
     "text": ""
    }
   ]
  },
  {
   "id": 303,
   "type": "message",
   "date": "2020-03-09T09:52:38",
   "date_unixtime": "1583722358",
   "from": "English grammar n vocabulary",
   "from_id": "channel1248828831",
   "photo": "photos/photo_255@09-03-2020_09-52-38.jpg",
   "width": 1250,
   "height": 1250,
   "text": "",
   "text_entities": []
  },
  {
   "id": 304,
   "type": "message",
   "date": "2020-03-09T09:53:14",
   "date_unixtime": "1583722394",
   "from": "English grammar n vocabulary",
   "from_id": "channel1248828831",
   "file": "(File not included. Change data exporting settings to download.)",
   "thumbnail": "(File not included. Change data exporting settings to download.)",
   "media_type": "video_file",
   "mime_type": "video/mp4",
   "duration_seconds": 5,
   "width": 640,
   "height": 640,
   "text": "",
   "text_entities": []
  },
  {
   "id": 306,
   "type": "message",
   "date": "2020-03-09T09:53:37",
   "date_unixtime": "1583722417",
   "from": "English grammar n vocabulary",
   "from_id": "channel1248828831",
   "photo": "photos/photo_256@09-03-2020_09-53-37.jpg",
   "width": 1078,
   "height": 1070,
   "text": "",
   "text_entities": []
  },
  {
   "id": 307,
   "type": "message",
   "date": "2020-03-09T09:53:51",
   "date_unixtime": "1583722431",
   "from": "English grammar n vocabulary",
   "from_id": "channel1248828831",
   "photo": "photos/photo_257@09-03-2020_09-53-51.jpg",
   "width": 1078,
   "height": 1083,
   "text": "",
   "text_entities": []
  },
  {
   "id": 308,
   "type": "message",
   "date": "2020-03-10T09:14:05",
   "date_unixtime": "1583806445",
   "from": "English grammar n vocabulary",
   "from_id": "channel1248828831",
   "photo": "photos/photo_258@10-03-2020_09-14-05.jpg",
   "width": 1068,
   "height": 1058,
   "text": "",
   "text_entities": []
  },
  {
   "id": 309,
   "type": "message",
   "date": "2020-03-11T23:46:23",
   "date_unixtime": "1583945183",
   "from": "English grammar n vocabulary",
   "from_id": "channel1248828831",
   "photo": "photos/photo_259@11-03-2020_23-46-23.jpg",
   "width": 1078,
   "height": 1121,
   "text": "",
   "text_entities": []
  },
  {
   "id": 310,
   "type": "message",
   "date": "2020-03-12T18:52:59",
   "date_unixtime": "1584013979",
   "from": "English grammar n vocabulary",
   "from_id": "channel1248828831",
   "photo": "photos/photo_260@12-03-2020_18-52-59.jpg",
   "width": 1078,
   "height": 1079,
   "text": "",
   "text_entities": []
  },
  {
   "id": 311,
   "type": "message",
   "date": "2020-03-12T18:53:04",
   "date_unixtime": "1584013984",
   "from": "English grammar n vocabulary",
   "from_id": "channel1248828831",
   "photo": "photos/photo_261@12-03-2020_18-53-04.jpg",
   "width": 1080,
   "height": 1080,
   "text": "",
   "text_entities": []
  },
  {
   "id": 312,
   "type": "message",
   "date": "2020-03-13T14:19:03",
   "date_unixtime": "1584083943",
   "from": "English grammar n vocabulary",
   "from_id": "channel1248828831",
   "text": [
    "Hello guys,\nDo you want to learn most important ONE WORD SUBSTITUTIONS for your daily life and competitive exams? If yes must read this article. Get link below👇👇\n.\n.\n.\n.\n.\n.\n",
    {
     "type": "link",
     "text": "https://englishchum.com/250-one-word-substitutions/"
    },
    ""
   ],
   "text_entities": [
    {
     "type": "plain",
     "text": "Hello guys,\nDo you want to learn most important ONE WORD SUBSTITUTIONS for your daily life and competitive exams? If yes must read this article. Get link below👇👇\n.\n.\n.\n.\n.\n.\n"
    },
    {
     "type": "link",
     "text": "https://englishchum.com/250-one-word-substitutions/"
    },
    {
     "type": "plain",
     "text": ""
    }
   ]
  },
  {
   "id": 313,
   "type": "message",
   "date": "2020-03-14T18:15:38",
   "date_unixtime": "1584184538",
   "from": "English grammar n vocabulary",
   "from_id": "channel1248828831",
   "photo": "photos/photo_262@14-03-2020_18-15-38.jpg",
   "width": 476,
   "height": 476,
   "text": "",
   "text_entities": []
  },
  {
   "id": 314,
   "type": "message",
   "date": "2020-03-14T18:15:42",
   "date_unixtime": "1584184542",
   "from": "English grammar n vocabulary",
   "from_id": "channel1248828831",
   "photo": "photos/photo_263@14-03-2020_18-15-42.jpg",
   "width": 1078,
   "height": 1106,
   "text": "",
   "text_entities": []
  },
  {
   "id": 315,
   "type": "message",
   "date": "2020-03-14T18:15:48",
   "date_unixtime": "1584184548",
   "from": "English grammar n vocabulary",
   "from_id": "channel1248828831",
   "photo": "photos/photo_264@14-03-2020_18-15-48.jpg",
   "width": 1068,
   "height": 1052,
   "text": "",
   "text_entities": []
  },
  {
   "id": 316,
   "type": "message",
   "date": "2020-03-14T18:15:56",
   "date_unixtime": "1584184556",
   "from": "English grammar n vocabulary",
   "from_id": "channel1248828831",
   "photo": "photos/photo_265@14-03-2020_18-15-56.jpg",
   "width": 432,
   "height": 540,
   "text": "",
   "text_entities": []
  },
  {
   "id": 317,
   "type": "message",
   "date": "2020-03-15T00:25:42",
   "date_unixtime": "1584206742",
   "from": "English grammar n vocabulary",
   "from_id": "channel1248828831",
   "photo": "photos/photo_266@15-03-2020_00-25-42.jpg",
   "width": 1078,
   "height": 1107,
   "text": "",
   "text_entities": []
  },
  {
   "id": 318,
   "type": "message",
   "date": "2020-03-15T14:46:56",
   "date_unixtime": "1584258416",
   "from": "English grammar n vocabulary",
   "from_id": "channel1248828831",
   "text": [
    "Hi guys,\nLearn 100 most important Idioms and phrases that is used in daily life.\nClick below 👇👇👇👇\n.\n \n.\n.\n .\n",
    {
     "type": "link",
     "text": "https://englishchum.com/important-100-idioms-and-phrases/"
    },
    ""
   ],
   "text_entities": [
    {
     "type": "plain",
     "text": "Hi guys,\nLearn 100 most important Idioms and phrases that is used in daily life.\nClick below 👇👇👇👇\n.\n \n.\n.\n .\n"
    },
    {
     "type": "link",
     "text": "https://englishchum.com/important-100-idioms-and-phrases/"
    },
    {
     "type": "plain",
     "text": ""
    }
   ]
  },
  {
   "id": 319,
   "type": "message",
   "date": "2020-03-16T10:13:49",
   "date_unixtime": "1584328429",
   "from": "English grammar n vocabulary",
   "from_id": "channel1248828831",
   "photo": "photos/photo_267@16-03-2020_10-13-49.jpg",
   "width": 1023,
   "height": 1280,
   "text": "",
   "text_entities": []
  },
  {
   "id": 323,
   "type": "message",
   "date": "2020-03-16T10:17:22",
   "date_unixtime": "1584328642",
   "edited": "2020-03-16T10:18:51",
   "edited_unixtime": "1584328731",
   "from": "English grammar n vocabulary",
   "from_id": "channel1248828831",
   "text": [
    "Hello guys,\nLearn most important 200 SYNONYMS for daily life and asked in competitive exams.\n.\n.\n",
    {
     "type": "link",
     "text": "https://englishchum.com/important-200-synonyms-for-competitive-exams-ssc-bank-upsc-etc/"
    }
   ],
   "text_entities": [
    {
     "type": "plain",
     "text": "Hello guys,\nLearn most important 200 SYNONYMS for daily life and asked in competitive exams.\n.\n.\n"
    },
    {
     "type": "link",
     "text": "https://englishchum.com/important-200-synonyms-for-competitive-exams-ssc-bank-upsc-etc/"
    }
   ]
  },
  {
   "id": 324,
   "type": "message",
   "date": "2020-03-16T22:09:35",
   "date_unixtime": "1584371375",
   "from": "English grammar n vocabulary",
   "from_id": "channel1248828831",
   "photo": "photos/photo_268@16-03-2020_22-09-35.jpg",
   "width": 480,
   "height": 492,
   "text": "",
   "text_entities": []
  },
  {
   "id": 325,
   "type": "message",
   "date": "2020-03-17T11:39:09",
   "date_unixtime": "1584419949",
   "from": "English grammar n vocabulary",
   "from_id": "channel1248828831",
   "photo": "photos/photo_269@17-03-2020_11-39-09.jpg",
   "width": 651,
   "height": 488,
   "text": "",
   "text_entities": []
  },
  {
   "id": 328,
   "type": "message",
   "date": "2020-03-17T11:46:48",
   "date_unixtime": "1584420408",
   "edited": "2020-03-17T11:47:25",
   "edited_unixtime": "1584420445",
   "from": "English grammar n vocabulary",
   "from_id": "channel1248828831",
   "text": [
    "Learn 150 important words to use instead of \"\"very\"\". They are used in daily life and asked in competitive exams.👇👇\n. \n.\n",
    {
     "type": "link",
     "text": "https://englishchum.com/150-important-words-to-use-instead-of-very/"
    },
    ""
   ],
   "text_entities": [
    {
     "type": "plain",
     "text": "Learn 150 important words to use instead of \"\"very\"\". They are used in daily life and asked in competitive exams.👇👇\n. \n.\n"
    },
    {
     "type": "link",
     "text": "https://englishchum.com/150-important-words-to-use-instead-of-very/"
    },
    {
     "type": "plain",
     "text": ""
    }
   ]
  },
  {
   "id": 329,
   "type": "message",
   "date": "2020-03-18T12:14:26",
   "date_unixtime": "1584508466",
   "from": "English grammar n vocabulary",
   "from_id": "channel1248828831",
   "text": [
    "Do you know about Zero Conditional?\nLearn zero conditional in detail. Read and Increase your knowledge. 👇👇\n.\n.\n",
    {
     "type": "link",
     "text": "https://englishchum.com/zero-conditional/"
    },
    ""
   ],
   "text_entities": [
    {
     "type": "plain",
     "text": "Do you know about Zero Conditional?\nLearn zero conditional in detail. Read and Increase your knowledge. 👇👇\n.\n.\n"
    },
    {
     "type": "link",
     "text": "https://englishchum.com/zero-conditional/"
    },
    {
     "type": "plain",
     "text": ""
    }
   ]
  },
  {
   "id": 330,
   "type": "message",
   "date": "2020-03-18T21:02:25",
   "date_unixtime": "1584540145",
   "from": "English grammar n vocabulary",
   "from_id": "channel1248828831",
   "text": [
    "Hi guys,\nDo you know about first conditional? Learn first conditional in detail. It's a important topic.\n.\n.\n",
    {
     "type": "link",
     "text": "https://englishchum.com/first-conditional/"
    }
   ],
   "text_entities": [
    {
     "type": "plain",
     "text": "Hi guys,\nDo you know about first conditional? Learn first conditional in detail. It's a important topic.\n.\n.\n"
    },
    {
     "type": "link",
     "text": "https://englishchum.com/first-conditional/"
    }
   ]
  },
  {
   "id": 332,
   "type": "message",
   "date": "2020-03-19T12:30:04",
   "date_unixtime": "1584595804",
   "from": "English grammar n vocabulary",
   "from_id": "channel1248828831",
