{
 "name": "Asian foods",
 "type": "public_channel",
 "id": 1404403642,
 "messages": [
  {
   "id": 1,
   "type": "service",
   "date": "2019-08-09T15:27:02",
   "date_unixtime": "1565339222",
   "actor": "Asian foods",
   "actor_id": "channel1404403642",
   "action": "create_channel",
   "title": "Fish&Food",
   "text": "",
   "text_entities": []
  },
  {
   "id": 2,
   "type": "message",
   "date": "2019-08-09T18:20:41",
   "date_unixtime": "1565349641",
   "from": "Asian foods",
   "from_id": "channel1404403642",
   "text": [
    {
     "type": "link",
     "text": "https://youtu.be/se3ZLkETt1I"
    }
   ],
   "text_entities": [
    {
     "type": "link",
     "text": "https://youtu.be/se3ZLkETt1I"
    }
   ]
  },
  {
   "id": 3,
   "type": "message",
   "date": "2019-08-10T17:35:52",
   "date_unixtime": "1565433352",
   "from": "Asian foods",
   "from_id": "channel1404403642",
   "photo": "photos/photo_1@10-08-2019_17-35-52.jpg",
   "width": 960,
   "height": 720,
   "text": "",
   "text_entities": []
  },
  {
   "id": 4,
   "type": "message",
   "date": "2019-08-10T17:35:55",
   "date_unixtime": "1565433355",
   "from": "Asian foods",
   "from_id": "channel1404403642",
   "photo": "photos/photo_2@10-08-2019_17-35-55.jpg",
   "width": 960,
   "height": 720,
   "text": "",
   "text_entities": []
  },
  {
   "id": 5,
   "type": "message",
   "date": "2019-09-18T11:27:40",
   "date_unixtime": "1568780860",
   "from": "Asian foods",
   "from_id": "channel1404403642",
   "photo": "photos/photo_3@18-09-2019_11-27-40.jpg",
   "width": 720,
   "height": 540,
   "text": "",
   "text_entities": []
  },
  {
   "id": 7,
   "type": "message",
   "date": "2019-09-18T11:29:47",
   "date_unixtime": "1568780987",
   "from": "Asian foods",
   "from_id": "channel1404403642",
   "photo": "photos/photo_4@18-09-2019_11-29-47.jpg",
   "width": 960,
   "height": 640,
   "text": "",
   "text_entities": []
  },
  {
   "id": 12,
   "type": "message",
   "date": "2019-09-18T21:32:00",
   "date_unixtime": "1568817120",
   "from": "Asian foods",
   "from_id": "channel1404403642",
   "photo": "photos/photo_5@18-09-2019_21-32-00.jpg",
   "width": 678,
   "height": 1024,
   "text": "",
   "text_entities": []
  },
  {
   "id": 13,
   "type": "message",
   "date": "2019-09-18T21:32:08",
   "date_unixtime": "1568817128",
   "from": "Asian foods",
   "from_id": "channel1404403642",
   "photo": "photos/photo_6@18-09-2019_21-32-08.jpg",
   "width": 736,
   "height": 1104,
   "text": "",
   "text_entities": []
  },
  {
   "id": 14,
   "type": "message",
   "date": "2019-09-18T21:32:12",
   "date_unixtime": "1568817132",
   "from": "Asian foods",
   "from_id": "channel1404403642",
   "photo": "photos/photo_7@18-09-2019_21-32-12.jpg",
   "width": 534,
   "height": 800,
   "text": "",
   "text_entities": []
  },
  {
   "id": 15,
   "type": "message",
   "date": "2019-09-19T10:11:55",
   "date_unixtime": "1568862715",
   "from": "Asian foods",
   "from_id": "channel1404403642",
   "photo": "photos/photo_8@19-09-2019_10-11-55.jpg",
   "width": 720,
   "height": 480,
   "text": "",
   "text_entities": []
  },
  {
   "id": 16,
   "type": "message",
   "date": "2019-09-19T11:00:14",
   "date_unixtime": "1568865614",
   "from": "Asian foods",
   "from_id": "channel1404403642",
   "photo": "photos/photo_9@19-09-2019_11-00-14.jpg",
   "width": 1200,
   "height": 760,
   "text": "",
   "text_entities": []
  },
  {
   "id": 17,
   "type": "message",
   "date": "2019-09-19T11:00:17",
   "date_unixtime": "1568865617",
   "from": "Asian foods",
   "from_id": "channel1404403642",
   "photo": "photos/photo_10@19-09-2019_11-00-17.jpg",
   "width": 1280,
   "height": 959,
   "text": "",
   "text_entities": []
  },
  {
   "id": 18,
   "type": "message",
   "date": "2019-09-19T22:04:29",
   "date_unixtime": "1568905469",
   "from": "Asian foods",
   "from_id": "channel1404403642",
   "photo": "photos/photo_11@19-09-2019_22-04-29.jpg",
   "width": 1280,
   "height": 1280,
   "text": "",
   "text_entities": []
  },
  {
   "id": 19,
   "type": "message",
   "date": "2019-09-19T22:04:37",
   "date_unixtime": "1568905477",
   "from": "Asian foods",
   "from_id": "channel1404403642",
   "photo": "photos/photo_12@19-09-2019_22-04-37.jpg",
   "width": 1280,
   "height": 1280,
   "text": "",
   "text_entities": []
  },
  {
   "id": 21,
   "type": "message",
   "date": "2019-09-19T22:06:17",
   "date_unixtime": "1568905577",
   "from": "Asian foods",
   "from_id": "channel1404403642",
   "photo": "photos/photo_13@19-09-2019_22-06-17.jpg",
   "width": 1081,
   "height": 720,
   "text": "",
   "text_entities": []
  },
  {
   "id": 23,
   "type": "message",
   "date": "2019-09-23T10:36:11",
   "date_unixtime": "1569209771",
   "from": "Asian foods",
   "from_id": "channel1404403642",
   "photo": "photos/photo_14@23-09-2019_10-36-11.jpg",
   "width": 704,
   "height": 396,
   "text": "",
   "text_entities": []
  },
  {
   "id": 26,
   "type": "message",
   "date": "2019-09-27T04:38:47",
   "date_unixtime": "1569533927",
   "from": "Asian foods",
   "from_id": "channel1404403642",
   "photo": "photos/photo_15@27-09-2019_04-38-47.jpg",
   "width": 1280,
   "height": 1280,
   "text": "",
   "text_entities": []
  },
  {
   "id": 28,
   "type": "message",
   "date": "2019-09-27T04:38:57",
   "date_unixtime": "1569533937",
   "from": "Asian foods",
   "from_id": "channel1404403642",
   "photo": "photos/photo_16@27-09-2019_04-38-57.jpg",
   "width": 1280,
   "height": 1280,
   "text": "",
   "text_entities": []
  },
  {
   "id": 29,
   "type": "message",
   "date": "2019-09-27T18:37:00",
   "date_unixtime": "1569584220",
   "from": "Asian foods",
   "from_id": "channel1404403642",
   "photo": "photos/photo_17@27-09-2019_18-37-00.jpg",
   "width": 612,
   "height": 612,
   "text": "",
   "text_entities": []
  },
  {
   "id": 30,
   "type": "message",
   "date": "2019-09-27T18:37:03",
   "date_unixtime": "1569584223",
   "from": "Asian foods",
   "from_id": "channel1404403642",
   "photo": "photos/photo_18@27-09-2019_18-37-03.jpg",
   "width": 720,
   "height": 720,
   "text": "",
   "text_entities": []
  },
  {
   "id": 32,
   "type": "message",
   "date": "2019-10-02T15:52:32",
   "date_unixtime": "1570006352",
   "from": "Asian foods",
   "from_id": "channel1404403642",
   "photo": "photos/photo_19@02-10-2019_15-52-32.jpg",
   "width": 650,
   "height": 910,
   "text": "",
   "text_entities": []
  },
  {
   "id": 35,
   "type": "message",
   "date": "2019-10-02T15:53:14",
   "date_unixtime": "1570006394",
   "from": "Asian foods",
   "from_id": "channel1404403642",
   "photo": "photos/photo_20@02-10-2019_15-53-14.jpg",
   "width": 606,
   "height": 404,
   "text": "",
   "text_entities": []
  },
  {
   "id": 36,
   "type": "message",
   "date": "2019-10-03T21:03:47",
   "date_unixtime": "1570111427",
   "from": "Asian foods",
   "from_id": "channel1404403642",
   "photo": "photos/photo_21@03-10-2019_21-03-47.jpg",
   "width": 720,
   "height": 960,
   "text": "",
   "text_entities": []
  },
  {
   "id": 37,
   "type": "message",
   "date": "2019-10-03T21:03:48",
   "date_unixtime": "1570111428",
   "from": "Asian foods",
   "from_id": "channel1404403642",
   "photo": "photos/photo_22@03-10-2019_21-03-48.jpg",
   "width": 878,
   "height": 878,
   "text": "",
   "text_entities": []
  },
  {
   "id": 38,
   "type": "message",
   "date": "2019-10-03T21:13:01",
   "date_unixtime": "1570111981",
   "from": "Asian foods",
   "from_id": "channel1404403642",
   "photo": "photos/photo_23@03-10-2019_21-13-01.jpg",
   "width": 1024,
   "height": 576,
   "text": "",
   "text_entities": []
  },
  {
   "id": 39,
   "type": "message",
   "date": "2019-10-03T21:13:05",
   "date_unixtime": "1570111985",
   "from": "Asian foods",
   "from_id": "channel1404403642",
   "photo": "photos/photo_24@03-10-2019_21-13-05.jpg",
   "width": 960,
   "height": 720,
   "text": "",
   "text_entities": []
  },
  {
   "id": 40,
   "type": "message",
   "date": "2019-10-07T22:09:57",
   "date_unixtime": "1570460997",
   "from": "Asian foods",
   "from_id": "channel1404403642",
   "photo": "photos/photo_25@07-10-2019_22-09-57.jpg",
   "width": 960,
   "height": 960,
   "text": "",
   "text_entities": []
  },
  {
   "id": 41,
   "type": "message",
   "date": "2019-10-07T22:09:58",
   "date_unixtime": "1570460998",
   "from": "Asian foods",
   "from_id": "channel1404403642",
   "photo": "photos/photo_26@07-10-2019_22-09-58.jpg",
   "width": 960,
   "height": 720,
   "text": "",
   "text_entities": []
  },
  {
   "id": 42,
   "type": "message",
   "date": "2019-10-08T18:07:46",
   "date_unixtime": "1570532866",
   "from": "Asian foods",
   "from_id": "channel1404403642",
   "photo": "photos/photo_27@08-10-2019_18-07-46.jpg",
   "width": 1280,
   "height": 1280,
   "text": "",
   "text_entities": []
  },
  {
   "id": 43,
   "type": "message",
   "date": "2019-10-08T18:07:48",
   "date_unixtime": "1570532868",
   "from": "Asian foods",
   "from_id": "channel1404403642",
   "photo": "photos/photo_28@08-10-2019_18-07-48.jpg",
   "width": 1280,
   "height": 1280,
   "text": "",
   "text_entities": []
  },
  {
   "id": 44,
   "type": "message",
   "date": "2019-10-10T11:47:01",
   "date_unixtime": "1570682821",
   "from": "Asian foods",
   "from_id": "channel1404403642",
   "photo": "photos/photo_29@10-10-2019_11-47-01.jpg",
   "width": 1280,
   "height": 903,
   "text": "",
   "text_entities": []
  },
  {
   "id": 45,
   "type": "message",
   "date": "2019-10-10T11:47:03",
   "date_unixtime": "1570682823",
   "from": "Asian foods",
   "from_id": "channel1404403642",
   "photo": "photos/photo_30@10-10-2019_11-47-03.jpg",
   "width": 1078,
   "height": 606,
   "text": "",
   "text_entities": []
  },
  {
   "id": 47,
   "type": "message",
   "date": "2019-10-10T18:57:17",
   "date_unixtime": "1570708637",
   "from": "Asian foods",
   "from_id": "channel1404403642",
   "photo": "photos/photo_31@10-10-2019_18-57-17.jpg",
   "width": 1280,
   "height": 852,
   "text": "",
   "text_entities": []
  },
  {
   "id": 48,
   "type": "message",
   "date": "2019-10-11T11:24:43",
   "date_unixtime": "1570767883",
   "from": "Asian foods",
   "from_id": "channel1404403642",
   "photo": "photos/photo_32@11-10-2019_11-24-43.jpg",
   "width": 958,
   "height": 960,
   "text": "",
   "text_entities": []
  },
  {
   "id": 50,
   "type": "message",
   "date": "2019-10-12T12:10:54",
   "date_unixtime": "1570857054",
   "from": "Asian foods",
   "from_id": "channel1404403642",
   "photo": "photos/photo_33@12-10-2019_12-10-54.jpg",
   "width": 1280,
   "height": 1280,
   "text": "",
   "text_entities": []
  },
  {
   "id": 51,
   "type": "message",
   "date": "2019-10-12T12:43:31",
   "date_unixtime": "1570859011",
   "from": "Asian foods",
   "from_id": "channel1404403642",
   "photo": "photos/photo_34@12-10-2019_12-43-31.jpg",
   "width": 1280,
   "height": 853,
   "text": "",
   "text_entities": []
  },
  {
   "id": 53,
   "type": "message",
   "date": "2019-10-12T20:54:26",
   "date_unixtime": "1570888466",
   "from": "Asian foods",
   "from_id": "channel1404403642",
   "photo": "photos/photo_35@12-10-2019_20-54-26.jpg",
   "width": 768,
   "height": 1024,
   "text": "",
   "text_entities": []
  },
  {
   "id": 54,
   "type": "message",
   "date": "2019-10-13T11:51:11",
   "date_unixtime": "1570942271",
   "from": "Asian foods",
   "from_id": "channel1404403642",
   "photo": "photos/photo_36@13-10-2019_11-51-11.jpg",
   "width": 1280,
   "height": 1280,
   "text": "",
   "text_entities": []
  },
  {
   "id": 55,
   "type": "message",
   "date": "2019-10-13T11:51:13",
   "date_unixtime": "1570942273",
   "from": "Asian foods",
   "from_id": "channel1404403642",
   "photo": "photos/photo_37@13-10-2019_11-51-13.jpg",
   "width": 1280,
   "height": 1280,
   "text": "",
   "text_entities": []
  },
  {
   "id": 56,
   "type": "message",
   "date": "2019-10-13T11:51:18",
   "date_unixtime": "1570942278",
   "from": "Asian foods",
   "from_id": "channel1404403642",
   "photo": "photos/photo_38@13-10-2019_11-51-18.jpg",
   "width": 1280,
   "height": 1280,
   "text": "",
   "text_entities": []
  },
  {
   "id": 57,
   "type": "message",
   "date": "2019-10-14T11:19:31",
   "date_unixtime": "1571026771",
   "from": "Asian foods",
   "from_id": "channel1404403642",
   "photo": "photos/photo_39@14-10-2019_11-19-31.jpg",
   "width": 1280,
   "height": 1280,
   "text": "",
   "text_entities": []
  },
  {
   "id": 62,
   "type": "message",
   "date": "2019-10-15T09:08:19",
   "date_unixtime": "1571105299",
   "from": "Asian foods",
   "from_id": "channel1404403642",
   "photo": "photos/photo_40@15-10-2019_09-08-19.jpg",
   "width": 1280,
   "height": 853,
   "text": "",
   "text_entities": []
  },
  {
   "id": 63,
   "type": "message",
   "date": "2019-10-15T09:08:24",
   "date_unixtime": "1571105304",
   "from": "Asian foods",
   "from_id": "channel1404403642",
   "photo": "photos/photo_41@15-10-2019_09-08-24.jpg",
   "width": 1280,
   "height": 853,
   "text": "",
   "text_entities": []
  },
  {
   "id": 64,
   "type": "message",
   "date": "2019-10-15T09:09:08",
   "date_unixtime": "1571105348",
   "from": "Asian foods",
   "from_id": "channel1404403642",
   "text": "Good holiday morning 😍",
   "text_entities": [
    {
     "type": "plain",
     "text": "Good holiday morning 😍"
    }
   ]
  },
  {
   "id": 66,
   "type": "message",
   "date": "2019-10-15T16:37:45",
   "date_unixtime": "1571132265",
   "from": "Asian foods",
   "from_id": "channel1404403642",
   "photo": "photos/photo_42@15-10-2019_16-37-45.jpg",
   "width": 1280,
   "height": 1280,
   "text": "",
   "text_entities": []
  },
  {
   "id": 67,
   "type": "message",
   "date": "2019-10-16T11:35:42",
   "date_unixtime": "1571200542",
   "from": "Asian foods",
   "from_id": "channel1404403642",
   "photo": "photos/photo_43@16-10-2019_11-35-42.jpg",
   "width": 1280,
   "height": 853,
   "text": "",
   "text_entities": []
  },
  {
   "id": 68,
   "type": "message",
   "date": "2019-10-16T11:36:00",
   "date_unixtime": "1571200560",
   "from": "Asian foods",
   "from_id": "channel1404403642",
   "photo": "photos/photo_44@16-10-2019_11-36-00.jpg",
   "width": 853,
   "height": 1280,
   "text": "",
   "text_entities": []
  },
  {
   "id": 69,
   "type": "message",
   "date": "2019-10-16T19:45:55",
   "date_unixtime": "1571229955",
   "from": "Asian foods",
   "from_id": "channel1404403642",
   "photo": "photos/photo_45@16-10-2019_19-45-55.jpg",
   "width": 1280,
   "height": 960,
   "text": "",
   "text_entities": []
  },
  {
   "id": 70,
   "type": "message",
   "date": "2019-10-17T15:47:02",
   "date_unixtime": "1571302022",
   "from": "Asian foods",
   "from_id": "channel1404403642",
   "photo": "photos/photo_46@17-10-2019_15-47-02.jpg",
   "width": 720,
   "height": 1033,
   "text": "",
   "text_entities": []
  },
  {
   "id": 72,
   "type": "message",
   "date": "2019-10-17T19:36:00",
   "date_unixtime": "1571315760",
   "from": "Asian foods",
   "from_id": "channel1404403642",
   "photo": "photos/photo_47@17-10-2019_19-36-00.jpg",
   "width": 1280,
   "height": 853,
   "text": "",
   "text_entities": []
  },
  {
   "id": 73,
   "type": "message",
   "date": "2019-10-17T20:54:32",
   "date_unixtime": "1571320472",
   "from": "Asian foods",
   "from_id": "channel1404403642",
   "photo": "photos/photo_48@17-10-2019_20-54-32.jpg",
   "width": 640,
   "height": 640,
   "text": "",
   "text_entities": []
  },
  {
   "id": 74,
   "type": "message",
   "date": "2019-10-17T20:54:33",
   "date_unixtime": "1571320473",
   "from": "Asian foods",
   "from_id": "channel1404403642",
   "photo": "photos/photo_49@17-10-2019_20-54-33.jpg",
   "width": 640,
   "height": 640,
   "text": "",
   "text_entities": []
  },
  {
   "id": 75,
   "type": "message",
   "date": "2019-10-17T20:54:36",
   "date_unixtime": "1571320476",
   "from": "Asian foods",
   "from_id": "channel1404403642",
   "photo": "photos/photo_50@17-10-2019_20-54-36.jpg",
   "width": 640,
   "height": 640,
   "text": "",
   "text_entities": []
  },
  {
   "id": 76,
   "type": "message",
   "date": "2019-10-18T12:16:54",
   "date_unixtime": "1571375814",
   "from": "Asian foods",
   "from_id": "channel1404403642",
   "photo": "photos/photo_51@18-10-2019_12-16-54.jpg",
   "width": 1121,
   "height": 1141,
   "text": "",
   "text_entities": []
  },
  {
   "id": 77,
   "type": "message",
   "date": "2019-10-18T12:16:56",
   "date_unixtime": "1571375816",
   "from": "Asian foods",
   "from_id": "channel1404403642",
   "photo": "photos/photo_52@18-10-2019_12-16-56.jpg",
   "width": 1126,
   "height": 1223,
   "text": "",
   "text_entities": []
  },
  {
   "id": 78,
   "type": "message",
   "date": "2019-10-18T12:17:54",
   "date_unixtime": "1571375874",
   "from": "Asian foods",
   "from_id": "channel1404403642",
   "photo": "photos/photo_53@18-10-2019_12-17-54.jpg",
   "width": 1124,
   "height": 1246,
   "text": "",
   "text_entities": []
  },
  {
   "id": 79,
   "type": "message",
   "date": "2019-10-18T16:16:29",
   "date_unixtime": "1571390189",
   "edited": "2019-10-18T16:18:34",
   "edited_unixtime": "1571390314",
   "from": "Asian foods",
   "from_id": "channel1404403642",
   "photo": "photos/photo_54@18-10-2019_16-16-29.jpg",
   "width": 853,
   "height": 1280,
   "text": "Pad Thai",
   "text_entities": [
    {
     "type": "plain",
     "text": "Pad Thai"
    }
   ]
  },
  {
   "id": 80,
   "type": "message",
   "date": "2019-10-18T16:17:21",
   "date_unixtime": "1571390241",
   "edited": "2019-10-18T16:18:27",
   "edited_unixtime": "1571390307",
   "from": "Asian foods",
   "from_id": "channel1404403642",
   "photo": "photos/photo_55@18-10-2019_16-17-21.jpg",
   "width": 960,
   "height": 720,
   "text": "Khmer Papaya salad",
   "text_entities": [
    {
     "type": "plain",
     "text": "Khmer Papaya salad"
    }
   ]
  },
  {
   "id": 81,
   "type": "message",
   "date": "2019-10-19T12:05:19",
   "date_unixtime": "1571461519",
   "from": "Asian foods",
   "from_id": "channel1404403642",
   "photo": "photos/photo_56@19-10-2019_12-05-19.jpg",
   "width": 720,
   "height": 720,
   "text": "Yassa Chicken",
   "text_entities": [
    {
     "type": "plain",
     "text": "Yassa Chicken"
    }
   ]
  },
  {
   "id": 82,
   "type": "message",
   "date": "2019-10-19T19:17:00",
   "date_unixtime": "1571487420",
   "from": "Asian foods",
   "from_id": "channel1404403642",
   "photo": "photos/photo_57@19-10-2019_19-17-00.jpg",
   "width": 720,
   "height": 497,
   "text": "",
   "text_entities": []
  },
  {
   "id": 83,
   "type": "message",
   "date": "2019-10-19T19:17:03",
   "date_unixtime": "1571487423",
   "from": "Asian foods",
   "from_id": "channel1404403642",
   "photo": "photos/photo_58@19-10-2019_19-17-03.jpg",
   "width": 720,
   "height": 540,
   "text": "",
   "text_entities": []
  },
  {
   "id": 84,
   "type": "message",
   "date": "2019-10-19T19:17:40",
   "date_unixtime": "1571487460",
   "from": "Asian foods",
   "from_id": "channel1404403642",
   "text": "Khmer Snack Food",
   "text_entities": [
    {
     "type": "plain",
     "text": "Khmer Snack Food"
    }
   ]
  },
  {
   "id": 86,
   "type": "message",
   "date": "2019-10-20T13:39:52",
   "date_unixtime": "1571553592",
   "from": "Asian foods",
   "from_id": "channel1404403642",
   "photo": "photos/photo_59@20-10-2019_13-39-52.jpg",
   "width": 1280,
   "height": 956,
   "text": "BRO HOK KHMER",
   "text_entities": [
    {
     "type": "plain",
     "text": "BRO HOK KHMER"
    }
   ]
  },
  {
   "id": 87,
   "type": "message",
   "date": "2019-10-22T18:34:20",
   "date_unixtime": "1571744060",
   "from": "Asian foods",
   "from_id": "channel1404403642",
   "photo": "photos/photo_60@22-10-2019_18-34-20.jpg",
   "width": 690,
   "height": 462,
   "text": "",
   "text_entities": []
  },
  {
   "id": 88,
   "type": "message",
   "date": "2019-10-22T18:34:27",
   "date_unixtime": "1571744067",
   "from": "Asian foods",
   "from_id": "channel1404403642",
   "photo": "photos/photo_61@22-10-2019_18-34-27.jpg",
   "width": 960,
   "height": 638,
   "text": "",
   "text_entities": []
  },
  {
   "id": 89,
   "type": "message",
   "date": "2019-10-22T18:34:30",
   "date_unixtime": "1571744070",
   "from": "Asian foods",
   "from_id": "channel1404403642",
   "photo": "photos/photo_62@22-10-2019_18-34-30.jpg",
   "width": 960,
   "height": 720,
   "text": "",
   "text_entities": []
  },
  {
   "id": 90,
   "type": "message",
   "date": "2019-10-23T08:41:49",
   "date_unixtime": "1571794909",
   "from": "Asian foods",
   "from_id": "channel1404403642",
   "photo": "photos/photo_63@23-10-2019_08-41-49.jpg",
   "width": 960,
   "height": 720,
   "text": "",
   "text_entities": []
  },
  {
   "id": 92,
   "type": "message",
   "date": "2019-10-26T23:52:22",
   "date_unixtime": "1572108742",
   "from": "Asian foods",
   "from_id": "channel1404403642",
   "photo": "photos/photo_64@26-10-2019_23-52-22.jpg",
   "width": 600,
   "height": 1200,
   "text": "",
   "text_entities": []
  },
  {
   "id": 93,
   "type": "message",
   "date": "2019-10-30T23:41:26",
   "date_unixtime": "1572453686",
   "from": "Asian foods",
   "from_id": "channel1404403642",
   "photo": "photos/photo_65@30-10-2019_23-41-26.jpg",
   "width": 960,
   "height": 960,
   "text": "",
   "text_entities": []
  },
  {
   "id": 94,
   "type": "message",
   "date": "2019-10-30T23:41:27",
   "date_unixtime": "1572453687",
   "from": "Asian foods",
   "from_id": "channel1404403642",
   "photo": "photos/photo_66@30-10-2019_23-41-27.jpg",
   "width": 960,
   "height": 960,
   "text": "",
   "text_entities": []
  },
  {
   "id": 95,
   "type": "message",
   "date": "2019-10-30T23:41:29",
   "date_unixtime": "1572453689",
   "from": "Asian foods",
   "from_id": "channel1404403642",
   "photo": "photos/photo_67@30-10-2019_23-41-29.jpg",
   "width": 960,
   "height": 960,
   "text": "",
   "text_entities": []
  },
  {
   "id": 96,
   "type": "message",
   "date": "2019-11-02T17:19:18",
   "date_unixtime": "1572689958",
   "from": "Asian foods",
   "from_id": "channel1404403642",
   "photo": "photos/photo_68@02-11-2019_17-19-18.jpg",
   "width": 1080,
   "height": 719,
   "text": "",
   "text_entities": []
  },
  {
   "id": 97,
   "type": "message",
   "date": "2019-11-02T17:19:21",
   "date_unixtime": "1572689961",
   "from": "Asian foods",
   "from_id": "channel1404403642",
   "photo": "photos/photo_69@02-11-2019_17-19-21.jpg",
   "width": 1080,
   "height": 719,
   "text": "",
   "text_entities": []
  },
  {
   "id": 98,
   "type": "message",
   "date": "2019-11-02T18:43:36",
   "date_unixtime": "1572695016",
   "from": "Asian foods",
   "from_id": "channel1404403642",
   "photo": "photos/photo_70@02-11-2019_18-43-36.jpg",
   "width": 1080,
   "height": 719,
   "text": "",
   "text_entities": []
  },
  {
   "id": 99,
   "type": "message",
   "date": "2019-11-07T12:51:43",
   "date_unixtime": "1573105903",
   "from": "Asian foods",
   "from_id": "channel1404403642",
   "photo": "photos/photo_71@07-11-2019_12-51-43.jpg",
   "width": 1080,
   "height": 607,
   "text": "",
   "text_entities": []
  },
  {
   "id": 100,
   "type": "message",
   "date": "2019-11-07T12:51:47",
   "date_unixtime": "1573105907",
   "from": "Asian foods",
   "from_id": "channel1404403642",
   "photo": "photos/photo_72@07-11-2019_12-51-47.jpg",
   "width": 1080,
   "height": 719,
   "text": "",
   "text_entities": []
  },
  {
   "id": 101,
   "type": "message",
   "date": "2019-11-15T16:06:27",
   "date_unixtime": "1573808787",
   "from": "Asian foods",
   "from_id": "channel1404403642",
   "photo": "photos/photo_73@15-11-2019_16-06-27.jpg",
   "width": 960,
   "height": 720,
   "text": "",
   "text_entities": []
  },
  {
   "id": 102,
   "type": "message",
   "date": "2019-11-15T16:06:30",
   "date_unixtime": "1573808790",
   "from": "Asian foods",
   "from_id": "channel1404403642",
   "photo": "photos/photo_74@15-11-2019_16-06-30.jpg",
   "width": 960,
   "height": 640,
   "text": "",
   "text_entities": []
  },
  {
   "id": 103,
   "type": "message",
   "date": "2019-11-15T16:06:33",
   "date_unixtime": "1573808793",
   "from": "Asian foods",
   "from_id": "channel1404403642",
   "photo": "photos/photo_75@15-11-2019_16-06-33.jpg",
   "width": 960,
   "height": 640,
   "text": "",
   "text_entities": []
  },
  {
   "id": 104,
   "type": "message",
   "date": "2019-11-15T16:07:01",
   "date_unixtime": "1573808821",
   "from": "Asian foods",
   "from_id": "channel1404403642",
   "photo": "photos/photo_76@15-11-2019_16-07-01.jpg",
   "width": 1047,
   "height": 1280,
   "text": "",
   "text_entities": []
  },
  {
   "id": 105,
   "type": "message",
   "date": "2019-11-16T08:58:12",
   "date_unixtime": "1573869492",
   "from": "Asian foods",
   "from_id": "channel1404403642",
   "photo": "photos/photo_77@16-11-2019_08-58-12.jpg",
   "width": 960,
   "height": 640,
   "text": "",
   "text_entities": []
  },
  {
   "id": 106,
   "type": "message",
   "date": "2019-11-16T08:58:16",
   "date_unixtime": "1573869496",
   "from": "Asian foods",
   "from_id": "channel1404403642",
   "photo": "photos/photo_78@16-11-2019_08-58-16.jpg",
   "width": 960,
   "height": 640,
   "text": "",
   "text_entities": []
  },
  {
   "id": 107,
   "type": "message",
   "date": "2019-11-16T13:33:51",
   "date_unixtime": "1573886031",
   "from": "Asian foods",
   "from_id": "channel1404403642",
   "photo": "photos/photo_79@16-11-2019_13-33-51.jpg",
   "width": 720,
   "height": 960,
   "text": "",
   "text_entities": []
  },
  {
   "id": 108,
   "type": "message",
   "date": "2019-11-16T13:33:53",
   "date_unixtime": "1573886033",
   "from": "Asian foods",
   "from_id": "channel1404403642",
   "photo": "photos/photo_80@16-11-2019_13-33-53.jpg",
   "width": 720,
   "height": 537,
   "text": "",
   "text_entities": []
  },
  {
   "id": 109,
   "type": "message",
   "date": "2019-11-17T12:24:33",
   "date_unixtime": "1573968273",
   "from": "Asian foods",
   "from_id": "channel1404403642",
   "photo": "photos/photo_81@17-11-2019_12-24-33.jpg",
   "width": 1080,
   "height": 580,
   "text": "",
   "text_entities": []
  },
  {
   "id": 110,
   "type": "message",
   "date": "2019-11-17T12:24:37",
   "date_unixtime": "1573968277",
   "from": "Asian foods",
   "from_id": "channel1404403642",
   "photo": "photos/photo_82@17-11-2019_12-24-37.jpg",
   "width": 1080,
   "height": 719,
   "text": "",
   "text_entities": []
  },
  {
   "id": 111,
   "type": "message",
   "date": "2019-11-18T19:04:51",
   "date_unixtime": "1574078691",
   "from": "Asian foods",
   "from_id": "channel1404403642",
   "photo": "photos/photo_83@18-11-2019_19-04-51.jpg",
   "width": 1080,
   "height": 810,
   "text": "",
   "text_entities": []
  },
  {
   "id": 112,
   "type": "message",
   "date": "2019-11-18T19:04:54",
   "date_unixtime": "1574078694",
   "from": "Asian foods",
   "from_id": "channel1404403642",
   "photo": "photos/photo_84@18-11-2019_19-04-54.jpg",
   "width": 1080,
   "height": 810,
   "text": "",
   "text_entities": []
  },
  {
   "id": 113,
   "type": "message",
   "date": "2019-11-19T18:22:01",
   "date_unixtime": "1574162521",
   "from": "Asian foods",
   "from_id": "channel1404403642",
   "photo": "photos/photo_85@19-11-2019_18-22-01.jpg",
   "width": 960,
   "height": 640,
   "text": "",
   "text_entities": []
  },
  {
   "id": 114,
   "type": "message",
   "date": "2019-11-19T18:22:37",
   "date_unixtime": "1574162557",
   "from": "Asian foods",
   "from_id": "channel1404403642",
   "photo": "photos/photo_86@19-11-2019_18-22-37.jpg",
   "width": 1080,
   "height": 720,
   "text": "",
   "text_entities": []
  },
  {
   "id": 115,
   "type": "message",
   "date": "2019-11-19T18:22:47",
   "date_unixtime": "1574162567",
   "from": "Asian foods",
   "from_id": "channel1404403642",
   "photo": "photos/photo_87@19-11-2019_18-22-47.jpg",
   "width": 1080,
   "height": 720,
   "text": "",
   "text_entities": []
  },
  {
   "id": 116,
   "type": "message",
   "date": "2019-11-20T20:19:42",
   "date_unixtime": "1574255982",
   "from": "Asian foods",
   "from_id": "channel1404403642",
   "photo": "photos/photo_88@20-11-2019_20-19-42.jpg",
   "width": 960,
   "height": 1280,
   "text": "",
   "text_entities": []
  },
  {
   "id": 117,
   "type": "message",
   "date": "2019-11-20T20:19:42",
   "date_unixtime": "1574255982",
   "from": "Asian foods",
   "from_id": "channel1404403642",
   "photo": "photos/photo_89@20-11-2019_20-19-42.jpg",
   "width": 960,
   "height": 1280,
   "text": "",
   "text_entities": []
  },
  {
   "id": 118,
   "type": "message",
   "date": "2019-11-21T20:58:20",
   "date_unixtime": "1574344700",
   "from": "Asian foods",
   "from_id": "channel1404403642",
   "photo": "photos/photo_90@21-11-2019_20-58-20.jpg",
   "width": 960,
   "height": 960,
   "text": "",
   "text_entities": []
  },
  {
   "id": 120,
   "type": "message",
   "date": "2019-11-27T11:24:13",
   "date_unixtime": "1574828653",
   "from": "Asian foods",
   "from_id": "channel1404403642",
   "photo": "photos/photo_91@27-11-2019_11-24-13.jpg",
   "width": 1080,
   "height": 1080,
   "text": "",
   "text_entities": []
  },
  {
   "id": 121,
   "type": "message",
   "date": "2019-11-27T11:24:18",
   "date_unixtime": "1574828658",
   "from": "Asian foods",
   "from_id": "channel1404403642",
   "photo": "photos/photo_92@27-11-2019_11-24-18.jpg",
   "width": 1080,
   "height": 1080,
   "text": "",
   "text_entities": []
  },
  {
   "id": 122,
   "type": "message",
   "date": "2019-11-27T18:11:43",
   "date_unixtime": "1574853103",
   "from": "Asian foods",
   "from_id": "channel1404403642",
   "photo": "photos/photo_93@27-11-2019_18-11-43.jpg",
   "width": 1040,
   "height": 1040,
   "text": "",
   "text_entities": []
  },
  {
   "id": 123,
   "type": "message",
   "date": "2019-11-27T18:11:48",
   "date_unixtime": "1574853108",
   "from": "Asian foods",
   "from_id": "channel1404403642",
   "photo": "photos/photo_94@27-11-2019_18-11-48.jpg",
   "width": 1040,
   "height": 1040,
   "text": "",
   "text_entities": []
  },
  {
   "id": 124,
   "type": "message",
   "date": "2019-11-29T20:20:35",
   "date_unixtime": "1575033635",
   "from": "Asian foods",
   "from_id": "channel1404403642",
   "photo": "photos/photo_95@29-11-2019_20-20-35.jpg",
   "width": 1080,
   "height": 1079,
   "text": "",
   "text_entities": []
  },
  {
   "id": 125,
   "type": "message",
   "date": "2019-11-29T20:20:37",
   "date_unixtime": "1575033637",
   "from": "Asian foods",
   "from_id": "channel1404403642",
   "photo": "photos/photo_96@29-11-2019_20-20-37.jpg",
   "width": 1080,
   "height": 1080,
   "text": "",
   "text_entities": []
  },
  {
   "id": 126,
   "type": "message",
   "date": "2019-12-01T11:22:40",
   "date_unixtime": "1575174160",
   "from": "Asian foods",
   "from_id": "channel1404403642",
   "photo": "photos/photo_97@01-12-2019_11-22-40.jpg",
   "width": 960,
   "height": 640,
   "text": "",
   "text_entities": []
  },
  {
   "id": 127,
   "type": "message",
   "date": "2019-12-01T11:22:42",
   "date_unixtime": "1575174162",
   "from": "Asian foods",
   "from_id": "channel1404403642",
   "photo": "photos/photo_98@01-12-2019_11-22-42.jpg",
   "width": 960,
   "height": 640,
   "text": "",
   "text_entities": []
  },
  {
   "id": 128,
   "type": "message",
   "date": "2019-12-03T17:33:15",
   "date_unixtime": "1575369195",
   "from": "Asian foods",
   "from_id": "channel1404403642",
   "photo": "photos/photo_99@03-12-2019_17-33-15.jpg",
   "width": 960,
   "height": 668,
   "text": "",
   "text_entities": []
  },
  {
   "id": 129,
   "type": "message",
   "date": "2019-12-05T21:04:53",
   "date_unixtime": "1575554693",
   "from": "Asian foods",
   "from_id": "channel1404403642",
   "photo": "photos/photo_100@05-12-2019_21-04-53.jpg",
   "width": 960,
   "height": 960,
   "text": "",
   "text_entities": []
  },
  {
   "id": 130,
   "type": "message",
   "date": "2019-12-05T21:04:58",
   "date_unixtime": "1575554698",
   "from": "Asian foods",
   "from_id": "channel1404403642",
   "photo": "photos/photo_101@05-12-2019_21-04-58.jpg",
   "width": 960,
   "height": 960,
   "text": "",
   "text_entities": []
  },
  {
   "id": 131,
   "type": "message",
   "date": "2019-12-06T19:14:09",
   "date_unixtime": "1575634449",
   "from": "Asian foods",
   "from_id": "channel1404403642",
   "photo": "photos/photo_102@06-12-2019_19-14-09.jpg",
   "width": 960,
   "height": 641,
   "text": "",
   "text_entities": []
  },
  {
   "id": 132,
   "type": "message",
   "date": "2019-12-06T19:14:12",
   "date_unixtime": "1575634452",
   "from": "Asian foods",
   "from_id": "channel1404403642",
   "photo": "photos/photo_103@06-12-2019_19-14-12.jpg",
   "width": 960,
   "height": 640,
   "text": "",
   "text_entities": []
  },
  {
   "id": 133,
   "type": "message",
   "date": "2019-12-07T18:06:10",
   "date_unixtime": "1575716770",
   "from": "Asian foods",
   "from_id": "channel1404403642",
   "photo": "photos/photo_104@07-12-2019_18-06-10.jpg",
   "width": 1080,
   "height": 720,
   "text": "",
   "text_entities": []
  },
  {
   "id": 134,
   "type": "message",
   "date": "2019-12-07T18:06:44",
   "date_unixtime": "1575716804",
   "from": "Asian foods",
   "from_id": "channel1404403642",
   "photo": "photos/photo_105@07-12-2019_18-06-44.jpg",
   "width": 1080,
   "height": 719,
   "text": "",
   "text_entities": []
  },
  {
   "id": 135,
   "type": "message",
   "date": "2019-12-11T16:29:38",
   "date_unixtime": "1576056578",
   "from": "Asian foods",
   "from_id": "channel1404403642",
   "photo": "photos/photo_106@11-12-2019_16-29-38.jpg",
   "width": 546,
   "height": 362,
   "text": "",
   "text_entities": []
  },
  {
   "id": 136,
   "type": "message",
   "date": "2019-12-11T16:29:41",
   "date_unixtime": "1576056581",
   "from": "Asian foods",
   "from_id": "channel1404403642",
   "photo": "photos/photo_107@11-12-2019_16-29-41.jpg",
   "width": 550,
   "height": 364,
   "text": "",
   "text_entities": []
  },
  {
   "id": 137,
   "type": "message",
   "date": "2019-12-18T12:17:11",
   "date_unixtime": "1576646231",
   "from": "Asian foods",
   "from_id": "channel1404403642",
   "photo": "photos/photo_108@18-12-2019_12-17-11.jpg",
   "width": 960,
   "height": 960,
   "text": "",
   "text_entities": []
  },
  {
   "id": 138,
   "type": "message",
   "date": "2019-12-19T16:06:03",
   "date_unixtime": "1576746363",
   "from": "Asian foods",
   "from_id": "channel1404403642",
   "photo": "photos/photo_109@19-12-2019_16-06-03.jpg",
   "width": 575,
   "height": 805,
   "text": "",
   "text_entities": []
  },
  {
   "id": 139,
   "type": "message",
   "date": "2019-12-22T06:54:53",
   "date_unixtime": "1576972493",
   "from": "Asian foods",
   "from_id": "channel1404403642",
   "photo": "photos/photo_110@22-12-2019_06-54-53.jpg",
   "width": 1080,
   "height": 719,
   "text": "",
   "text_entities": []
  },
  {
   "id": 140,
   "type": "message",
   "date": "2019-12-22T14:12:26",
   "date_unixtime": "1576998746",
   "from": "Asian foods",
   "from_id": "channel1404403642",
   "photo": "photos/photo_111@22-12-2019_14-12-26.jpg",
   "width": 960,
   "height": 960,
   "text": "",
   "text_entities": []
  },
  {
   "id": 141,
   "type": "message",
   "date": "2019-12-22T14:12:28",
   "date_unixtime": "1576998748",
   "from": "Asian foods",
   "from_id": "channel1404403642",
   "photo": "photos/photo_112@22-12-2019_14-12-28.jpg",
   "width": 960,
   "height": 895,
   "text": "",
   "text_entities": []
  },
  {
   "id": 142,
   "type": "message",
   "date": "2019-12-27T10:32:10",
   "date_unixtime": "1577417530",
   "from": "Asian foods",
   "from_id": "channel1404403642",
   "photo": "photos/photo_113@27-12-2019_10-32-10.jpg",
   "width": 960,
   "height": 1280,
   "text": "",
   "text_entities": []
  },
  {
   "id": 143,
   "type": "message",
   "date": "2019-12-27T20:05:49",
   "date_unixtime": "1577451949",
   "from": "Asian foods",
   "from_id": "channel1404403642",
   "photo": "photos/photo_114@27-12-2019_20-05-49.jpg",
   "width": 540,
   "height": 540,
   "text": "",
   "text_entities": []
  },
  {
   "id": 144,
   "type": "message",
   "date": "2019-12-27T20:05:50",
   "date_unixtime": "1577451950",
   "from": "Asian foods",
   "from_id": "channel1404403642",
   "photo": "photos/photo_115@27-12-2019_20-05-50.jpg",
   "width": 600,
   "height": 431,
   "text": "",
   "text_entities": []
  },
  {
   "id": 145,
   "type": "message",
   "date": "2019-12-28T13:11:53",
   "date_unixtime": "1577513513",
   "from": "Asian foods",
   "from_id": "channel1404403642",
   "photo": "photos/photo_116@28-12-2019_13-11-53.jpg",
   "width": 1079,
   "height": 720,
   "text": "",
   "text_entities": []
  },
  {
   "id": 146,
   "type": "message",
   "date": "2019-12-28T13:11:57",
   "date_unixtime": "1577513517",
   "from": "Asian foods",
   "from_id": "channel1404403642",
   "photo": "photos/photo_117@28-12-2019_13-11-57.jpg",
   "width": 1080,
   "height": 719,
   "text": "",
   "text_entities": []
  },
  {
   "id": 147,
   "type": "message",
   "date": "2020-01-03T19:34:26",
   "date_unixtime": "1578054866",
   "from": "Asian foods",
   "from_id": "channel1404403642",
   "photo": "photos/photo_118@03-01-2020_19-34-26.jpg",
   "width": 1280,
   "height": 853,
   "text": "",
   "text_entities": []
  },
  {
   "id": 148,
   "type": "message",
   "date": "2020-01-03T19:34:28",
   "date_unixtime": "1578054868",
   "from": "Asian foods",
   "from_id": "channel1404403642",
   "photo": "photos/photo_119@03-01-2020_19-34-28.jpg",
   "width": 1280,
   "height": 719,
   "text": "",
   "text_entities": []
  },
  {
   "id": 149,
   "type": "message",
   "date": "2020-01-04T20:46:36",
   "date_unixtime": "1578145596",
   "from": "Asian foods",
   "from_id": "channel1404403642",
   "photo": "photos/photo_120@04-01-2020_20-46-36.jpg",
   "width": 960,
   "height": 1280,
   "text": "",
   "text_entities": []
  },
  {
   "id": 150,
   "type": "message",
   "date": "2020-01-04T20:46:38",
   "date_unixtime": "1578145598",
   "from": "Asian foods",
   "from_id": "channel1404403642",
   "photo": "photos/photo_121@04-01-2020_20-46-38.jpg",
   "width": 1080,
   "height": 808,
   "text": "",
   "text_entities": []
  },
  {
   "id": 151,
   "type": "message",
   "date": "2020-01-06T12:25:47",
   "date_unixtime": "1578288347",
   "from": "Asian foods",
   "from_id": "channel1404403642",
   "photo": "photos/photo_122@06-01-2020_12-25-47.jpg",
   "width": 1080,
   "height": 876,
   "text": "",
   "text_entities": []
  },
  {
   "id": 152,
   "type": "message",
   "date": "2020-01-06T12:25:48",
   "date_unixtime": "1578288348",
   "from": "Asian foods",
   "from_id": "channel1404403642",
   "photo": "photos/photo_123@06-01-2020_12-25-48.jpg",
   "width": 1080,
   "height": 827,
   "text": "",
   "text_entities": []
  },
  {
   "id": 154,
   "type": "message",
   "date": "2020-01-06T16:28:16",
   "date_unixtime": "1578302896",
   "from": "Asian foods",
   "from_id": "channel1404403642",
   "photo": "photos/photo_124@06-01-2020_16-28-16.jpg",
   "width": 1080,
   "height": 720,
   "text": "",
   "text_entities": []
  },
  {
   "id": 155,
   "type": "message",
   "date": "2020-01-06T16:28:34",
   "date_unixtime": "1578302914",
   "from": "Asian foods",
   "from_id": "channel1404403642",
   "photo": "photos/photo_125@06-01-2020_16-28-34.jpg",
   "width": 1080,
   "height": 1080,
   "text": "",
   "text_entities": []
  },
  {
   "id": 156,
   "type": "message",
   "date": "2020-01-07T10:17:21",
   "date_unixtime": "1578367041",
   "from": "Asian foods",
   "from_id": "channel1404403642",
   "file": "(File not included. Change data exporting settings to download.)",
   "thumbnail": "(File not included. Change data exporting settings to download.)",
   "media_type": "video_file",
   "mime_type": "video/mp4",
   "duration_seconds": 119,
   "width": 1280,
   "height": 720,
   "text": "",
   "text_entities": []
  },
  {
   "id": 157,
   "type": "message",
   "date": "2020-01-08T18:28:37",
   "date_unixtime": "1578482917",
   "from": "Asian foods",
   "from_id": "channel1404403642",
   "photo": "photos/photo_126@08-01-2020_18-28-37.jpg",
   "width": 1080,
   "height": 773,
   "text": "",
   "text_entities": []
  },
  {
   "id": 158,
   "type": "message",
   "date": "2020-01-08T22:42:18",
   "date_unixtime": "1578498138",
   "from": "Asian foods",
   "from_id": "channel1404403642",
   "photo": "photos/photo_127@08-01-2020_22-42-18.jpg",
   "width": 960,
   "height": 720,
   "text": "Good night",
   "text_entities": [
    {
     "type": "plain",
     "text": "Good night"
    }
   ]
  },
  {
   "id": 159,
   "type": "message",
   "date": "2020-01-10T12:17:31",
   "date_unixtime": "1578633451",
   "from": "Asian foods",
   "from_id": "channel1404403642",
   "photo": "photos/photo_128@10-01-2020_12-17-31.jpg",
   "width": 738,
   "height": 738,
   "text": "",
   "text_entities": []
  },
  {
   "id": 160,
   "type": "message",
   "date": "2020-01-10T12:17:34",
   "date_unixtime": "1578633454",
   "from": "Asian foods",
   "from_id": "channel1404403642",
   "photo": "photos/photo_129@10-01-2020_12-17-34.jpg",
   "width": 706,
   "height": 960,
   "text": "",
   "text_entities": []
  },
  {
   "id": 161,
   "type": "message",
   "date": "2020-01-10T12:17:38",
   "date_unixtime": "1578633458",
   "from": "Asian foods",
   "from_id": "channel1404403642",
   "photo": "photos/photo_130@10-01-2020_12-17-38.jpg",
   "width": 720,
   "height": 960,
   "text": "",
   "text_entities": []
  },
  {
   "id": 162,
   "type": "message",
   "date": "2020-01-10T21:03:32",
   "date_unixtime": "1578665012",
   "from": "Asian foods",
   "from_id": "channel1404403642",
   "photo": "photos/photo_131@10-01-2020_21-03-32.jpg",
   "width": 960,
   "height": 720,
   "text": "",
   "text_entities": []
  },
  {
   "id": 163,
   "type": "message",
   "date": "2020-01-10T21:03:35",
   "date_unixtime": "1578665015",
   "from": "Asian foods",
   "from_id": "channel1404403642",
   "photo": "photos/photo_132@10-01-2020_21-03-35.jpg",
   "width": 1080,
   "height": 1080,
   "text": "",
   "text_entities": []
  },
  {
   "id": 164,
   "type": "message",
   "date": "2020-01-10T21:03:37",
   "date_unixtime": "1578665017",
   "from": "Asian foods",
   "from_id": "channel1404403642",
   "photo": "photos/photo_133@10-01-2020_21-03-37.jpg",
   "width": 720,
   "height": 960,
   "text": "",
   "text_entities": []
  },
  {
   "id": 165,
   "type": "message",
   "date": "2020-01-12T18:06:02",
   "date_unixtime": "1578827162",
   "from": "Asian foods",
   "from_id": "channel1404403642",
   "photo": "photos/photo_134@12-01-2020_18-06-02.jpg",
   "width": 1003,
   "height": 1280,
   "text": "",
   "text_entities": []
  },
  {
   "id": 166,
   "type": "message",
   "date": "2020-01-12T18:06:04",
   "date_unixtime": "1578827164",
   "from": "Asian foods",
   "from_id": "channel1404403642",
   "photo": "photos/photo_135@12-01-2020_18-06-04.jpg",
   "width": 1080,
   "height": 1190,
   "text": "",
   "text_entities": []
  },
  {
   "id": 167,
   "type": "message",
   "date": "2020-01-13T15:45:27",
   "date_unixtime": "1578905127",
   "from": "Asian foods",
   "from_id": "channel1404403642",
   "photo": "photos/photo_136@13-01-2020_15-45-27.jpg",
   "width": 720,
   "height": 720,
   "text": "",
   "text_entities": []
  },
  {
   "id": 168,
   "type": "message",
   "date": "2020-01-14T17:14:27",
   "date_unixtime": "1578996867",
   "from": "Asian foods",
   "from_id": "channel1404403642",
   "photo": "photos/photo_137@14-01-2020_17-14-27.jpg",
   "width": 720,
   "height": 960,
   "text": "",
   "text_entities": []
  },
  {
   "id": 169,
   "type": "message",
   "date": "2020-01-14T17:14:30",
   "date_unixtime": "1578996870",
   "from": "Asian foods",
   "from_id": "channel1404403642",
   "photo": "photos/photo_138@14-01-2020_17-14-30.jpg",
   "width": 960,
   "height": 960,
   "text": "",
   "text_entities": []
  },
  {
   "id": 170,
   "type": "message",
   "date": "2020-01-14T17:14:32",
   "date_unixtime": "1578996872",
   "from": "Asian foods",
   "from_id": "channel1404403642",
   "photo": "photos/photo_139@14-01-2020_17-14-32.jpg",
   "width": 701,
   "height": 876,
   "text": "",
   "text_entities": []
  },
  {
   "id": 171,
   "type": "message",
   "date": "2020-01-16T11:33:15",
   "date_unixtime": "1579149195",
   "from": "Asian foods",
   "from_id": "channel1404403642",
   "photo": "photos/photo_140@16-01-2020_11-33-15.jpg",
   "width": 1280,
   "height": 739,
   "text": "",
   "text_entities": []
  },
  {
   "id": 173,
   "type": "message",
   "date": "2020-01-16T15:51:23",
   "date_unixtime": "1579164683",
   "from": "Asian foods",
   "from_id": "channel1404403642",
   "photo": "photos/photo_141@16-01-2020_15-51-23.jpg",
   "width": 960,
   "height": 1280,
   "text": "",
   "text_entities": []
  },
  {
   "id": 174,
   "type": "message",
   "date": "2020-01-16T15:51:26",
   "date_unixtime": "1579164686",
   "from": "Asian foods",
   "from_id": "channel1404403642",
   "photo": "photos/photo_142@16-01-2020_15-51-26.jpg",
   "width": 1105,
   "height": 1134,
   "text": "",
   "text_entities": []
  },
  {
   "id": 176,
   "type": "message",
   "date": "2020-01-17T19:32:39",
   "date_unixtime": "1579264359",
   "from": "Asian foods",
   "from_id": "channel1404403642",
   "photo": "photos/photo_143@17-01-2020_19-32-39.jpg",
   "width": 1080,
   "height": 1080,
   "text": "",
   "text_entities": []
  },
  {
   "id": 177,
   "type": "message",
   "date": "2020-01-17T19:33:00",
   "date_unixtime": "1579264380",
   "from": "Asian foods",
   "from_id": "channel1404403642",
   "photo": "photos/photo_144@17-01-2020_19-33-00.jpg",
   "width": 960,
   "height": 960,
   "text": "",
   "text_entities": []
  },
  {
   "id": 178,
   "type": "message",
   "date": "2020-01-18T22:15:31",
   "date_unixtime": "1579360531",
   "from": "Asian foods",
   "from_id": "channel1404403642",
   "photo": "photos/photo_145@18-01-2020_22-15-31.jpg",
   "width": 1273,
   "height": 1280,
   "text": "",
   "text_entities": []
  },
  {
   "id": 179,
   "type": "message",
   "date": "2020-01-18T22:15:35",
   "date_unixtime": "1579360535",
   "from": "Asian foods",
   "from_id": "channel1404403642",
   "photo": "photos/photo_146@18-01-2020_22-15-35.jpg",
   "width": 1275,
   "height": 1280,
   "text": "",
   "text_entities": []
  },
  {
   "id": 180,
   "type": "message",
   "date": "2020-01-20T18:59:58",
   "date_unixtime": "1579521598",
   "from": "Asian foods",
   "from_id": "channel1404403642",
   "file": "(File not included. Change data exporting settings to download.)",
   "thumbnail": "(File not included. Change data exporting settings to download.)",
   "media_type": "video_file",
   "mime_type": "video/mp4",
   "duration_seconds": 80,
   "width": 1280,
   "height": 720,
   "text": "",
   "text_entities": []
  },
  {
   "id": 181,
   "type": "message",
   "date": "2020-01-27T17:33:14",
   "date_unixtime": "1580121194",
   "from": "Asian foods",
   "from_id": "channel1404403642",
   "photo": "photos/photo_147@27-01-2020_17-33-14.jpg",
   "width": 720,
   "height": 720,
   "text": "",
   "text_entities": []
  },
  {
   "id": 182,
   "type": "message",
   "date": "2020-01-27T17:33:16",
   "date_unixtime": "1580121196",
   "from": "Asian foods",
   "from_id": "channel1404403642",
   "photo": "photos/photo_148@27-01-2020_17-33-16.jpg",
   "width": 720,
   "height": 720,
   "text": "",
   "text_entities": []
  },
  {
   "id": 183,
   "type": "message",
   "date": "2020-01-28T10:52:12",
   "date_unixtime": "1580183532",
   "from": "Asian foods",
   "from_id": "channel1404403642",
   "photo": "photos/photo_149@28-01-2020_10-52-12.jpg",
   "width": 601,
   "height": 900,
   "text": "",
   "text_entities": []
  },
  {
   "id": 184,
   "type": "message",
   "date": "2020-01-28T10:52:18",
   "date_unixtime": "1580183538",
   "from": "Asian foods",
   "from_id": "channel1404403642",
   "photo": "photos/photo_150@28-01-2020_10-52-18.jpg",
   "width": 736,
   "height": 736,
   "text": "",
   "text_entities": []
  },
  {
   "id": 185,
   "type": "message",
   "date": "2020-01-28T20:19:21",
   "date_unixtime": "1580217561",
   "from": "Asian foods",
   "from_id": "channel1404403642",
   "photo": "photos/photo_151@28-01-2020_20-19-21.jpg",
   "width": 630,
   "height": 840,
   "text": "",
   "text_entities": []
  },
  {
   "id": 186,
   "type": "message",
   "date": "2020-01-28T20:19:21",
   "date_unixtime": "1580217561",
   "from": "Asian foods",
   "from_id": "channel1404403642",
   "photo": "photos/photo_152@28-01-2020_20-19-21.jpg",
   "width": 736,
   "height": 1167,
   "text": "",
   "text_entities": []
  },
  {
   "id": 187,
   "type": "message",
   "date": "2020-01-30T11:40:21",
   "date_unixtime": "1580359221",
   "from": "Asian foods",
   "from_id": "channel1404403642",
   "photo": "photos/photo_153@30-01-2020_11-40-21.jpg",
   "width": 736,
   "height": 981,
   "text": "",
   "text_entities": []
  },
  {
   "id": 188,
   "type": "message",
   "date": "2020-02-01T14:56:17",
   "date_unixtime": "1580543777",
   "from": "Asian foods",
   "from_id": "channel1404403642",
   "photo": "photos/photo_154@01-02-2020_14-56-17.jpg",
   "width": 720,
   "height": 720,
   "text": "",
   "text_entities": []
  },
  {
   "id": 189,
   "type": "message",
   "date": "2020-02-02T10:58:01",
   "date_unixtime": "1580615881",
   "from": "Asian foods",
   "from_id": "channel1404403642",
   "photo": "photos/photo_155@02-02-2020_10-58-01.jpg",
   "width": 720,
   "height": 540,
   "text": "",
   "text_entities": []
  },
  {
   "id": 190,
   "type": "message",
   "date": "2020-02-02T19:09:19",
   "date_unixtime": "1580645359",
   "from": "Asian foods",
   "from_id": "channel1404403642",
   "photo": "photos/photo_156@02-02-2020_19-09-19.jpg",
   "width": 960,
   "height": 720,
   "text": "",
   "text_entities": []
  },
  {
   "id": 191,
   "type": "message",
   "date": "2020-02-06T18:01:35",
   "date_unixtime": "1580986895",
   "from": "Asian foods",
   "from_id": "channel1404403642",
   "photo": "photos/photo_157@06-02-2020_18-01-35.jpg",
   "width": 720,
   "height": 1048,
   "text": "",
   "text_entities": []
  },
  {
   "id": 192,
   "type": "message",
   "date": "2020-02-07T21:05:58",
   "date_unixtime": "1581084358",
   "from": "Asian foods",
   "from_id": "channel1404403642",
   "photo": "photos/photo_158@07-02-2020_21-05-58.jpg",
   "width": 720,
   "height": 720,
   "text": "",
   "text_entities": []
  },
  {
   "id": 193,
   "type": "message",
   "date": "2020-02-07T21:05:59",
   "date_unixtime": "1581084359",
   "from": "Asian foods",
   "from_id": "channel1404403642",
   "photo": "photos/photo_159@07-02-2020_21-05-59.jpg",
   "width": 720,
   "height": 960,
   "text": "",
   "text_entities": []
  },
  {
   "id": 194,
   "type": "message",
   "date": "2020-02-18T20:29:44",
   "date_unixtime": "1582032584",
   "from": "Asian foods",
   "from_id": "channel1404403642",
   "photo": "photos/photo_160@18-02-2020_20-29-44.jpg",
   "width": 1080,
   "height": 720,
   "text": "",
   "text_entities": []
  },
  {
   "id": 195,
   "type": "message",
   "date": "2020-02-18T20:29:44",
   "date_unixtime": "1582032584",
   "from": "Asian foods",
   "from_id": "channel1404403642",
   "photo": "photos/photo_161@18-02-2020_20-29-44.jpg",
   "width": 1080,
   "height": 720,
   "text": "",
   "text_entities": []
  },
  {
   "id": 196,
   "type": "message",
   "date": "2020-02-18T20:29:44",
   "date_unixtime": "1582032584",
   "from": "Asian foods",
   "from_id": "channel1404403642",
   "photo": "photos/photo_162@18-02-2020_20-29-44.jpg",
   "width": 1080,
   "height": 720,
   "text": "",
   "text_entities": []
  },
  {
   "id": 197,
   "type": "message",
   "date": "2020-02-18T20:29:44",
   "date_unixtime": "1582032584",
   "from": "Asian foods",
   "from_id": "channel1404403642",
   "photo": "photos/photo_163@18-02-2020_20-29-44.jpg",
   "width": 1080,
   "height": 720,
   "text": "",
   "text_entities": []
  },
  {
   "id": 198,
   "type": "message",
   "date": "2020-02-19T18:22:16",
   "date_unixtime": "1582111336",
   "from": "Asian foods",
   "from_id": "channel1404403642",
   "photo": "photos/photo_164@19-02-2020_18-22-16.jpg",
   "width": 959,
   "height": 960,
   "text": "",
   "text_entities": []
  },
  {
   "id": 199,
   "type": "message",
   "date": "2020-02-20T11:40:14",
   "date_unixtime": "1582173614",
   "from": "Asian foods",
   "from_id": "channel1404403642",
   "photo": "photos/photo_165@20-02-2020_11-40-14.jpg",
   "width": 567,
   "height": 850,
   "text": "",
   "text_entities": []
  },
  {
   "id": 200,
   "type": "message",
   "date": "2020-02-20T11:40:16",
   "date_unixtime": "1582173616",
   "from": "Asian foods",
   "from_id": "channel1404403642",
   "photo": "photos/photo_166@20-02-2020_11-40-16.jpg",
   "width": 735,
   "height": 983,
   "text": "",
   "text_entities": []
  },
  {
   "id": 201,
   "type": "message",
   "date": "2020-02-20T22:59:52",
   "date_unixtime": "1582214392",
   "from": "Asian foods",
   "from_id": "channel1404403642",
   "photo": "photos/photo_167@20-02-2020_22-59-52.jpg",
   "width": 960,
   "height": 1280,
   "text": "",
   "text_entities": []
  },
  {
   "id": 202,
   "type": "message",
   "date": "2020-02-22T23:09:36",
   "date_unixtime": "1582387776",
   "from": "Asian foods",
   "from_id": "channel1404403642",
   "photo": "photos/photo_168@22-02-2020_23-09-36.jpg",
   "width": 1040,
   "height": 1280,
   "text": "",
   "text_entities": []
  },
  {
   "id": 203,
   "type": "message",
   "date": "2020-02-23T18:23:48",
   "date_unixtime": "1582457028",
   "from": "Asian foods",
   "from_id": "channel1404403642",
   "photo": "photos/photo_169@23-02-2020_18-23-48.jpg",
   "width": 720,
   "height": 960,
   "text": "",
   "text_entities": []
  },
  {
   "id": 204,
   "type": "message",
   "date": "2020-02-25T19:24:26",
   "date_unixtime": "1582633466",
   "from": "Asian foods",
   "from_id": "channel1404403642",
   "photo": "photos/photo_170@25-02-2020_19-24-26.jpg",
   "width": 810,
   "height": 810,
   "text": "",
   "text_entities": []
  },
  {
   "id": 205,
   "type": "message",
   "date": "2020-02-25T19:24:30",
   "date_unixtime": "1582633470",
   "from": "Asian foods",
   "from_id": "channel1404403642",
   "photo": "photos/photo_171@25-02-2020_19-24-30.jpg",
   "width": 750,
   "height": 500,
   "text": "",
   "text_entities": []
  },
  {
   "id": 206,
   "type": "message",
   "date": "2020-02-26T11:47:59",
   "date_unixtime": "1582692479",
   "from": "Asian foods",
   "from_id": "channel1404403642",
   "photo": "photos/photo_172@26-02-2020_11-47-59.jpg",
   "width": 236,
   "height": 354,
   "text": "",
   "text_entities": []
  },
  {
   "id": 207,
   "type": "message",
   "date": "2020-02-26T11:48:02",
   "date_unixtime": "1582692482",
   "from": "Asian foods",
   "from_id": "channel1404403642",
   "photo": "photos/photo_173@26-02-2020_11-48-02.jpg",
   "width": 736,
   "height": 1104,
   "text": "",
   "text_entities": []
  },
  {
   "id": 208,
   "type": "message",
   "date": "2020-02-27T18:06:40",
   "date_unixtime": "1582801600",
   "from": "Asian foods",
   "from_id": "channel1404403642",
   "photo": "photos/photo_174@27-02-2020_18-06-40.jpg",
   "width": 720,
   "height": 960,
   "text": "",
   "text_entities": []
  },
  {
   "id": 209,
   "type": "message",
   "date": "2020-02-27T18:06:42",
   "date_unixtime": "1582801602",
   "from": "Asian foods",
   "from_id": "channel1404403642",
   "photo": "photos/photo_175@27-02-2020_18-06-42.jpg",
   "width": 720,
   "height": 960,
   "text": "",
   "text_entities": []
  },
  {
   "id": 210,
   "type": "message",
   "date": "2020-02-28T10:18:24",
   "date_unixtime": "1582859904",
   "from": "Asian foods",
   "from_id": "channel1404403642",
   "photo": "photos/photo_176@28-02-2020_10-18-24.jpg",
   "width": 960,
   "height": 1280,
   "text": "",
   "text_entities": []
  },
  {
   "id": 211,
   "type": "message",
   "date": "2020-02-28T10:18:26",
   "date_unixtime": "1582859906",
   "from": "Asian foods",
   "from_id": "channel1404403642",
   "photo": "photos/photo_177@28-02-2020_10-18-26.jpg",
   "width": 1080,
   "height": 1080,
   "text": "",
   "text_entities": []
  },
  {
   "id": 212,
   "type": "message",
   "date": "2020-03-03T20:18:21",
   "date_unixtime": "1583241501",
   "from": "Asian foods",
   "from_id": "channel1404403642",
   "photo": "photos/photo_178@03-03-2020_20-18-21.jpg",
   "width": 720,
   "height": 960,
   "text": "",
   "text_entities": []
  },
  {
   "id": 213,
   "type": "message",
   "date": "2020-03-03T20:18:23",
   "date_unixtime": "1583241503",
   "from": "Asian foods",
   "from_id": "channel1404403642",
   "photo": "photos/photo_179@03-03-2020_20-18-23.jpg",
   "width": 720,
   "height": 960,
   "text": "",
   "text_entities": []
  },
  {
   "id": 214,
   "type": "message",
   "date": "2020-03-04T12:01:52",
   "date_unixtime": "1583298112",
   "from": "Asian foods",
   "from_id": "channel1404403642",
   "photo": "photos/photo_180@04-03-2020_12-01-52.jpg",
   "width": 1280,
   "height": 1280,
   "text": "",
   "text_entities": []
  },
  {
   "id": 215,
   "type": "message",
   "date": "2020-03-06T11:36:37",
   "date_unixtime": "1583469397",
   "from": "Asian foods",
   "from_id": "channel1404403642",
   "photo": "photos/photo_181@06-03-2020_11-36-37.jpg",
   "width": 375,
   "height": 500,
   "text": "",
   "text_entities": []
  },
  {
   "id": 216,
   "type": "message",
   "date": "2020-03-06T11:36:40",
   "date_unixtime": "1583469400",
   "from": "Asian foods",
   "from_id": "channel1404403642",
   "photo": "photos/photo_182@06-03-2020_11-36-40.jpg",
   "width": 736,
   "height": 1104,
   "text": "",
   "text_entities": []
  },
  {
   "id": 217,
   "type": "message",
   "date": "2020-03-06T20:39:09",
   "date_unixtime": "1583501949",
   "from": "Asian foods",
   "from_id": "channel1404403642",
   "photo": "photos/photo_183@06-03-2020_20-39-09.jpg",
   "width": 1280,
   "height": 1280,
   "text": "",
   "text_entities": []
  },
  {
   "id": 218,
   "type": "message",
   "date": "2020-03-10T11:44:35",
   "date_unixtime": "1583815475",
   "from": "Asian foods",
   "from_id": "channel1404403642",
   "photo": "photos/photo_184@10-03-2020_11-44-35.jpg",
   "width": 736,
   "height": 1116,
   "text": "",
   "text_entities": []
  },
  {
   "id": 219,
   "type": "message",
   "date": "2020-03-10T11:44:37",
   "date_unixtime": "1583815477",
   "from": "Asian foods",
   "from_id": "channel1404403642",
   "photo": "photos/photo_185@10-03-2020_11-44-37.jpg",
   "width": 736,
   "height": 1104,
   "text": "",
   "text_entities": []
  },
  {
   "id": 220,
   "type": "message",
   "date": "2020-03-10T12:13:04",
   "date_unixtime": "1583817184",
   "from": "Asian foods",
   "from_id": "channel1404403642",
   "photo": "photos/photo_186@10-03-2020_12-13-04.jpg",
   "width": 846,
   "height": 826,
   "text": "",
   "text_entities": []
  },
  {
   "id": 221,
   "type": "message",
   "date": "2020-03-10T19:00:24",
   "date_unixtime": "1583841624",
   "from": "Asian foods",
   "from_id": "channel1404403642",
   "photo": "photos/photo_187@10-03-2020_19-00-24.jpg",
   "width": 1080,
   "height": 832,
   "text": "",
   "text_entities": []
  },
  {
   "id": 222,
   "type": "message",
   "date": "2020-03-13T17:27:54",
   "date_unixtime": "1584095274",
   "from": "Asian foods",
   "from_id": "channel1404403642",
   "photo": "photos/photo_188@13-03-2020_17-27-54.jpg",
   "width": 960,
   "height": 960,
   "text": "",
   "text_entities": []
  },
  {
   "id": 223,
   "type": "message",
   "date": "2020-03-14T15:40:56",
   "date_unixtime": "1584175256",
   "from": "Asian foods",
   "from_id": "channel1404403642",
   "photo": "photos/photo_189@14-03-2020_15-40-56.jpg",
   "width": 960,
   "height": 640,
   "text": "",
   "text_entities": []
  },
  {
   "id": 224,
   "type": "message",
   "date": "2020-03-14T15:40:58",
   "date_unixtime": "1584175258",
   "from": "Asian foods",
   "from_id": "channel1404403642",
   "photo": "photos/photo_190@14-03-2020_15-40-58.jpg",
   "width": 960,
   "height": 640,
   "text": "",
   "text_entities": []
  },
  {
   "id": 225,
   "type": "message",
   "date": "2020-03-16T19:28:23",
   "date_unixtime": "1584361703",
   "from": "Asian foods",
   "from_id": "channel1404403642",
   "photo": "photos/photo_191@16-03-2020_19-28-23.jpg",
   "width": 960,
   "height": 960,
   "text": "",
   "text_entities": []
  },
  {
   "id": 226,
   "type": "message",
   "date": "2020-03-17T11:36:51",
   "date_unixtime": "1584419811",
   "from": "Asian foods",
   "from_id": "channel1404403642",
   "photo": "photos/photo_192@17-03-2020_11-36-51.jpg",
   "width": 736,
   "height": 1104,
   "text": "",
   "text_entities": []
  },
  {
   "id": 227,
   "type": "message",
   "date": "2020-03-17T11:36:54",
   "date_unixtime": "1584419814",
   "from": "Asian foods",
   "from_id": "channel1404403642",
   "photo": "photos/photo_193@17-03-2020_11-36-54.jpg",
   "width": 736,
   "height": 1104,
   "text": "",
   "text_entities": []
  },
  {
   "id": 228,
   "type": "message",
   "date": "2020-03-17T18:24:29",
   "date_unixtime": "1584444269",
   "from": "Asian foods",
   "from_id": "channel1404403642",
   "photo": "photos/photo_194@17-03-2020_18-24-29.jpg",
   "width": 960,
   "height": 720,
   "text": "",
   "text_entities": []
  },
  {
   "id": 229,
   "type": "message",
   "date": "2020-03-18T18:55:23",
   "date_unixtime": "1584532523",
   "from": "Asian foods",
   "from_id": "channel1404403642",
   "photo": "photos/photo_195@18-03-2020_18-55-23.jpg",
   "width": 720,
   "height": 960,
   "text": "",
   "text_entities": []
  },
  {
   "id": 230,
   "type": "message",
   "date": "2020-03-18T18:55:25",
   "date_unixtime": "1584532525",
   "from": "Asian foods",
   "from_id": "channel1404403642",
   "photo": "photos/photo_196@18-03-2020_18-55-25.jpg",
   "width": 720,
   "height": 960,
   "text": "",
   "text_entities": []
  },
  {
   "id": 231,
   "type": "message",
   "date": "2020-03-20T23:16:10",
   "date_unixtime": "1584720970",
   "from": "Asian foods",
   "from_id": "channel1404403642",
   "photo": "photos/photo_197@20-03-2020_23-16-10.jpg",
   "width": 1280,
   "height": 960,
   "text": "",
   "text_entities": []
  },
  {
   "id": 232,
   "type": "message",
   "date": "2020-03-21T16:55:01",
   "date_unixtime": "1584784501",
   "from": "Asian foods",
   "from_id": "channel1404403642",
   "photo": "photos/photo_198@21-03-2020_16-55-01.jpg",
   "width": 1280,
   "height": 960,
   "text": "",
   "text_entities": []
  },
  {
   "id": 233,
   "type": "message",
   "date": "2020-03-21T16:58:40",
   "date_unixtime": "1584784720",
   "from": "Asian foods",
   "from_id": "channel1404403642",
   "photo": "photos/photo_199@21-03-2020_16-58-40.jpg",
   "width": 960,
   "height": 720,
   "text": "",
   "text_entities": []
  },
  {
   "id": 234,
   "type": "message",
   "date": "2020-03-21T16:58:42",
   "date_unixtime": "1584784722",
   "from": "Asian foods",
   "from_id": "channel1404403642",
   "photo": "photos/photo_200@21-03-2020_16-58-42.jpg",
   "width": 960,
   "height": 720,
   "text": "",
   "text_entities": []
  },
  {
   "id": 235,
   "type": "message",
   "date": "2020-03-22T19:23:40",
   "date_unixtime": "1584879820",
   "from": "Asian foods",
   "from_id": "channel1404403642",
   "photo": "photos/photo_201@22-03-2020_19-23-40.jpg",
   "width": 853,
   "height": 1280,
   "text": "",
   "text_entities": []
  },
  {
   "id": 236,
   "type": "message",
   "date": "2020-03-22T19:23:49",
   "date_unixtime": "1584879829",
   "from": "Asian foods",
   "from_id": "channel1404403642",
   "photo": "photos/photo_202@22-03-2020_19-23-49.jpg",
   "width": 853,
   "height": 1280,
   "text": "",
   "text_entities": []
  },
  {
   "id": 237,
   "type": "message",
   "date": "2020-03-23T17:51:02",
   "date_unixtime": "1584960662",
   "from": "Asian foods",
   "from_id": "channel1404403642",
   "photo": "photos/photo_203@23-03-2020_17-51-02.jpg",
   "width": 630,
   "height": 840,
   "text": "",
   "text_entities": []
  },
  {
   "id": 238,
   "type": "message",
   "date": "2020-03-23T17:51:05",
   "date_unixtime": "1584960665",
   "from": "Asian foods",
   "from_id": "channel1404403642",
   "photo": "photos/photo_204@23-03-2020_17-51-05.jpg",
   "width": 630,
   "height": 840,
   "text": "",
   "text_entities": []
  },
  {
   "id": 239,
   "type": "message",
   "date": "2020-03-24T18:55:02",
   "date_unixtime": "1585050902",
   "from": "Asian foods",
   "from_id": "channel1404403642",
   "photo": "photos/photo_205@24-03-2020_18-55-02.jpg",
   "width": 1080,
   "height": 720,
   "text": "",
   "text_entities": []
  },
  {
   "id": 240,
   "type": "message",
   "date": "2020-03-24T18:55:04",
   "date_unixtime": "1585050904",
   "from": "Asian foods",
   "from_id": "channel1404403642",
   "photo": "photos/photo_206@24-03-2020_18-55-04.jpg",
   "width": 1080,
   "height": 720,
   "text": "",
   "text_entities": []
  },
  {
   "id": 241,
   "type": "message",
   "date": "2020-03-25T21:22:37",
   "date_unixtime": "1585146157",
   "from": "Asian foods",
   "from_id": "channel1404403642",
   "photo": "photos/photo_207@25-03-2020_21-22-37.jpg",
   "width": 954,
   "height": 954,
   "text": "",
   "text_entities": []
  },
  {
   "id": 242,
   "type": "message",
   "date": "2020-03-26T19:31:21",
   "date_unixtime": "1585225881",
   "from": "Asian foods",
   "from_id": "channel1404403642",
   "photo": "photos/photo_208@26-03-2020_19-31-21.jpg",
   "width": 960,
   "height": 960,
   "text": "",
   "text_entities": []
  },
  {
   "id": 243,
   "type": "message",
   "date": "2020-03-26T19:31:25",
   "date_unixtime": "1585225885",
   "from": "Asian foods",
   "from_id": "channel1404403642",
   "photo": "photos/photo_209@26-03-2020_19-31-25.jpg",
   "width": 960,
   "height": 960,
   "text": "",
   "text_entities": []
  },
  {
   "id": 244,
   "type": "message",
   "date": "2020-03-28T10:02:50",
   "date_unixtime": "1585364570",
   "from": "Asian foods",
   "from_id": "channel1404403642",
   "photo": "photos/photo_210@28-03-2020_10-02-50.jpg",
   "width": 960,
   "height": 960,
   "text": "",
   "text_entities": []
  },
  {
   "id": 245,
   "type": "message",
   "date": "2020-03-28T17:18:52",
   "date_unixtime": "1585390732",
   "from": "Asian foods",
   "from_id": "channel1404403642",
   "photo": "photos/photo_211@28-03-2020_17-18-52.jpg",
   "width": 1080,
   "height": 1080,
   "text": "",
   "text_entities": []
  },
  {
   "id": 246,
   "type": "message",
   "date": "2020-03-28T17:18:54",
   "date_unixtime": "1585390734",
   "from": "Asian foods",
   "from_id": "channel1404403642",
   "photo": "photos/photo_212@28-03-2020_17-18-54.jpg",
   "width": 1080,
   "height": 1080,
   "text": "",
   "text_entities": []
  },
  {
   "id": 247,
   "type": "message",
   "date": "2020-03-28T20:41:01",
   "date_unixtime": "1585402861",
   "from": "Asian foods",
   "from_id": "channel1404403642",
   "photo": "photos/photo_213@28-03-2020_20-41-01.jpg",
   "width": 960,
   "height": 960,
   "text": "",
   "text_entities": []
  },
  {
   "id": 248,
   "type": "message",
   "date": "2020-03-28T20:41:03",
   "date_unixtime": "1585402863",
   "from": "Asian foods",
   "from_id": "channel1404403642",
   "photo": "photos/photo_214@28-03-2020_20-41-03.jpg",
   "width": 960,
   "height": 960,
   "text": "",
   "text_entities": []
  },
  {
   "id": 249,
   "type": "message",
   "date": "2020-03-28T20:41:06",
   "date_unixtime": "1585402866",
   "from": "Asian foods",
   "from_id": "channel1404403642",
   "photo": "photos/photo_215@28-03-2020_20-41-06.jpg",
   "width": 743,
   "height": 743,
   "text": "",
   "text_entities": []
  },
  {
   "id": 250,
   "type": "message",
   "date": "2020-04-02T12:54:41",
   "date_unixtime": "1585806881",
   "from": "Asian foods",
   "from_id": "channel1404403642",
   "photo": "photos/photo_216@02-04-2020_12-54-41.jpg",
   "width": 853,
   "height": 1280,
   "text": "",
   "text_entities": []
  },
  {
   "id": 251,
   "type": "message",
   "date": "2020-04-04T17:57:53",
   "date_unixtime": "1585997873",
   "from": "Asian foods",
   "from_id": "channel1404403642",
   "photo": "photos/photo_217@04-04-2020_17-57-53.jpg",
   "width": 960,
   "height": 960,
   "text": "",
   "text_entities": []
  },
  {
   "id": 252,
   "type": "message",
   "date": "2020-04-04T17:57:55",
   "date_unixtime": "1585997875",
   "from": "Asian foods",
   "from_id": "channel1404403642",
   "photo": "photos/photo_218@04-04-2020_17-57-55.jpg",
   "width": 960,
   "height": 960,
   "text": "",
   "text_entities": []
  },
  {
   "id": 253,
   "type": "message",
   "date": "2020-04-06T19:47:40",
   "date_unixtime": "1586177260",
   "from": "Asian foods",
   "from_id": "channel1404403642",
   "photo": "photos/photo_219@06-04-2020_19-47-40.jpg",
   "width": 720,
   "height": 720,
   "text": "",
   "text_entities": []
  },
  {
   "id": 254,
   "type": "message",
   "date": "2020-04-07T08:50:05",
   "date_unixtime": "1586224205",
   "from": "Asian foods",
   "from_id": "channel1404403642",
   "photo": "photos/photo_220@07-04-2020_08-50-05.jpg",
   "width": 1024,
   "height": 640,
   "text": "",
   "text_entities": []
  },
  {
   "id": 255,
   "type": "message",
   "date": "2020-04-08T19:35:50",
   "date_unixtime": "1586349350",
   "from": "Asian foods",
   "from_id": "channel1404403642",
   "photo": "photos/photo_221@08-04-2020_19-35-50.jpg",
   "width": 1080,
   "height": 1027,
   "text": "",
   "text_entities": []
  },
  {
   "id": 256,
   "type": "message",
   "date": "2020-04-08T19:35:52",
   "date_unixtime": "1586349352",
   "from": "Asian foods",
   "from_id": "channel1404403642",
   "photo": "photos/photo_222@08-04-2020_19-35-52.jpg",
   "width": 960,
   "height": 1280,
   "text": "",
   "text_entities": []
  },
  {
   "id": 257,
   "type": "message",
   "date": "2020-04-10T19:09:15",
   "date_unixtime": "1586520555",
   "from": "Asian foods",
   "from_id": "channel1404403642",
   "photo": "photos/photo_223@10-04-2020_19-09-15.jpg",
   "width": 1080,
   "height": 1080,
   "text": "",
   "text_entities": []
  },
  {
   "id": 258,
   "type": "message",
   "date": "2020-04-12T14:23:04",
   "date_unixtime": "1586676184",
   "from": "Asian foods",
   "from_id": "channel1404403642",
   "photo": "photos/photo_224@12-04-2020_14-23-04.jpg",
   "width": 712,
   "height": 712,
   "text": "",
   "text_entities": []
  },
  {
   "id": 259,
   "type": "message",
   "date": "2020-04-12T14:23:06",
   "date_unixtime": "1586676186",
   "from": "Asian foods",
   "from_id": "channel1404403642",
   "photo": "photos/photo_225@12-04-2020_14-23-06.jpg",
   "width": 675,
   "height": 675,
   "text": "",
   "text_entities": []
  },
  {
   "id": 260,
   "type": "message",
   "date": "2020-04-15T13:05:48",
   "date_unixtime": "1586930748",
   "from": "Asian foods",
   "from_id": "channel1404403642",
   "photo": "photos/photo_226@15-04-2020_13-05-48.jpg",
   "width": 960,
   "height": 960,
   "text": "",
   "text_entities": []
  },
  {
   "id": 261,
   "type": "message",
   "date": "2020-04-15T13:05:50",
   "date_unixtime": "1586930750",
   "from": "Asian foods",
   "from_id": "channel1404403642",
   "photo": "photos/photo_227@15-04-2020_13-05-50.jpg",
   "width": 960,
   "height": 640,
   "text": "",
   "text_entities": []
  },
  {
   "id": 263,
   "type": "message",
   "date": "2020-04-17T23:11:52",
   "date_unixtime": "1587139912",
   "from": "Asian foods",
   "from_id": "channel1404403642",
   "photo": "photos/photo_228@17-04-2020_23-11-52.jpg",
   "width": 736,
   "height": 920,
   "text": "",
   "text_entities": []
  },
  {
   "id": 264,
   "type": "message",
   "date": "2020-04-17T23:12:56",
   "date_unixtime": "1587139976",
   "from": "Asian foods",
   "from_id": "channel1404403642",
   "photo": "photos/photo_229@17-04-2020_23-12-56.jpg",
   "width": 736,
   "height": 490,
   "text": "",
   "text_entities": []
  },
  {
   "id": 265,
   "type": "message",
   "date": "2020-04-22T11:42:10",
   "date_unixtime": "1587530530",
   "from": "Asian foods",
   "from_id": "channel1404403642",
   "photo": "photos/photo_230@22-04-2020_11-42-10.jpg",
   "width": 1080,
   "height": 720,
   "text": "",
   "text_entities": []
  },
  {
   "id": 266,
   "type": "message",
   "date": "2020-04-24T19:01:11",
   "date_unixtime": "1587729671",
   "from": "Asian foods",
   "from_id": "channel1404403642",
   "photo": "photos/photo_231@24-04-2020_19-01-11.jpg",
   "width": 960,
   "height": 960,
   "text": "",
   "text_entities": []
  },
  {
   "id": 267,
   "type": "message",
   "date": "2020-04-28T12:15:44",
   "date_unixtime": "1588050944",
   "from": "Asian foods",
   "from_id": "channel1404403642",
   "file": "(File not included. Change data exporting settings to download.)",
   "thumbnail": "(File not included. Change data exporting settings to download.)",
   "media_type": "video_file",
   "mime_type": "video/mp4",
   "duration_seconds": 136,
   "width": 640,
   "height": 640,
   "text": "",
   "text_entities": []
  },
  {
   "id": 268,
   "type": "message",
   "date": "2020-04-28T19:02:27",
   "date_unixtime": "1588075347",
   "from": "Asian foods",
   "from_id": "channel1404403642",
   "photo": "photos/photo_232@28-04-2020_19-02-27.jpg",
   "width": 720,
   "height": 960,
   "text": "",
   "text_entities": []
  },
  {
   "id": 269,
   "type": "message",
   "date": "2020-04-28T19:02:30",
   "date_unixtime": "1588075350",
   "from": "Asian foods",
   "from_id": "channel1404403642",
   "photo": "photos/photo_233@28-04-2020_19-02-30.jpg",
   "width": 720,
   "height": 960,
   "text": "",
   "text_entities": []
  },
  {
   "id": 270,
   "type": "message",
   "date": "2020-05-01T12:52:08",
   "date_unixtime": "1588312328",
   "from": "Asian foods",
   "from_id": "channel1404403642",
   "photo": "photos/photo_234@01-05-2020_12-52-08.jpg",
   "width": 960,
   "height": 960,
   "text": "",
   "text_entities": []
  },
  {
   "id": 271,
   "type": "message",
   "date": "2020-05-02T10:36:00",
   "date_unixtime": "1588390560",
   "from": "Asian foods",
   "from_id": "channel1404403642",
   "photo": "photos/photo_235@02-05-2020_10-36-00.jpg",
   "width": 730,
   "height": 960,
   "text": "",
   "text_entities": []
  },
  {
   "id": 272,
   "type": "message",
   "date": "2020-05-02T10:36:05",
   "date_unixtime": "1588390565",
   "from": "Asian foods",
   "from_id": "channel1404403642",
   "photo": "photos/photo_236@02-05-2020_10-36-05.jpg",
   "width": 960,
   "height": 904,
   "text": "",
   "text_entities": []
  },
  {
   "id": 273,
   "type": "message",
   "date": "2020-05-05T16:55:42",
   "date_unixtime": "1588672542",
   "from": "Asian foods",
   "from_id": "channel1404403642",
   "photo": "photos/photo_237@05-05-2020_16-55-42.jpg",
   "width": 960,
   "height": 1280,
   "text": "",
   "text_entities": []
  },
  {
   "id": 274,
   "type": "message",
   "date": "2020-05-05T16:55:44",
   "date_unixtime": "1588672544",
   "from": "Asian foods",
   "from_id": "channel1404403642",
   "photo": "photos/photo_238@05-05-2020_16-55-44.jpg",
   "width": 960,
   "height": 1280,
   "text": "",
   "text_entities": []
  },
  {
   "id": 275,
   "type": "message",
   "date": "2020-05-09T21:58:32",
   "date_unixtime": "1589036312",
   "from": "Asian foods",
   "from_id": "channel1404403642",
   "photo": "photos/photo_239@09-05-2020_21-58-32.jpg",
   "width": 1080,
   "height": 1080,
   "text": "",
   "text_entities": []
  },
  {
   "id": 276,
   "type": "message",
   "date": "2020-05-19T16:46:42",
   "date_unixtime": "1589881602",
   "from": "Asian foods",
   "from_id": "channel1404403642",
   "photo": "photos/photo_240@19-05-2020_16-46-42.jpg",
   "width": 512,
   "height": 341,
   "text": "",
   "text_entities": []
  },
  {
   "id": 277,
   "type": "message",
   "date": "2020-05-19T16:47:04",
   "date_unixtime": "1589881624",
   "from": "Asian foods",
   "from_id": "channel1404403642",
   "photo": "photos/photo_241@19-05-2020_16-47-04.jpg",
   "width": 1280,
   "height": 853,
   "text": "",
   "text_entities": []
  },
  {
   "id": 278,
   "type": "message",
   "date": "2020-05-20T18:47:13",
   "date_unixtime": "1589975233",
   "from": "Asian foods",
   "from_id": "channel1404403642",
   "photo": "photos/photo_242@20-05-2020_18-47-13.jpg",
   "width": 1280,
   "height": 1280,
   "text": "",
   "text_entities": []
  },
  {
   "id": 279,
   "type": "message",
   "date": "2020-05-21T21:59:37",
   "date_unixtime": "1590073177",
   "from": "Asian foods",
   "from_id": "channel1404403642",
   "photo": "photos/photo_243@21-05-2020_21-59-37.jpg",
   "width": 1280,
   "height": 1279,
   "text": "",
   "text_entities": []
  },
  {
   "id": 280,
   "type": "message",
   "date": "2020-05-21T21:59:37",
   "date_unixtime": "1590073177",
   "from": "Asian foods",
   "from_id": "channel1404403642",
   "photo": "photos/photo_244@21-05-2020_21-59-37.jpg",
   "width": 1280,
   "height": 1280,
   "text": "",
   "text_entities": []
  },
  {
   "id": 281,
   "type": "message",
   "date": "2020-05-27T11:48:06",
   "date_unixtime": "1590554886",
   "from": "Asian foods",
   "from_id": "channel1404403642",
   "photo": "photos/photo_245@27-05-2020_11-48-06.jpg",
   "width": 1236,
   "height": 1280,
   "text": "",
   "text_entities": []
  },
  {
   "id": 282,
   "type": "message",
   "date": "2020-06-01T16:56:57",
   "date_unixtime": "1591005417",
   "from": "Asian foods",
   "from_id": "channel1404403642",
   "photo": "photos/photo_246@01-06-2020_16-56-57.jpg",
   "width": 1280,
   "height": 1280,
   "text": "",
   "text_entities": []
  },
  {
   "id": 283,
   "type": "message",
   "date": "2020-06-07T20:41:50",
   "date_unixtime": "1591537310",
   "from": "Asian foods",
   "from_id": "channel1404403642",
   "photo": "photos/photo_247@07-06-2020_20-41-50.jpg",
   "width": 1280,
   "height": 1280,
   "text": "",
   "text_entities": []
  },
  {
   "id": 284,
   "type": "message",
   "date": "2020-06-07T20:41:53",
   "date_unixtime": "1591537313",
   "from": "Asian foods",
   "from_id": "channel1404403642",
   "photo": "photos/photo_248@07-06-2020_20-41-53.jpg",
   "width": 1280,
   "height": 1280,
   "text": "",
   "text_entities": []
  },
  {
   "id": 285,
   "type": "message",
   "date": "2020-06-08T17:26:24",
   "date_unixtime": "1591611984",
   "from": "Asian foods",
   "from_id": "channel1404403642",
   "photo": "photos/photo_249@08-06-2020_17-26-24.jpg",
   "width": 1280,
   "height": 853,
   "text": "",
   "text_entities": []
  },
  {
   "id": 286,
   "type": "message",
   "date": "2020-06-12T18:16:04",
   "date_unixtime": "1591960564",
   "from": "Asian foods",
   "from_id": "channel1404403642",
   "photo": "photos/photo_250@12-06-2020_18-16-04.jpg",
   "width": 960,
   "height": 1280,
   "text": "",
   "text_entities": []
  },
  {
   "id": 287,
   "type": "message",
   "date": "2020-06-12T18:16:06",
   "date_unixtime": "1591960566",
   "from": "Asian foods",
   "from_id": "channel1404403642",
   "photo": "photos/photo_251@12-06-2020_18-16-06.jpg",
   "width": 960,
   "height": 1280,
   "text": "",
   "text_entities": []
  },
  {
   "id": 288,
   "type": "message",
   "date": "2020-06-19T17:30:35",
   "date_unixtime": "1592562635",
   "from": "Asian foods",
   "from_id": "channel1404403642",
   "photo": "photos/photo_252@19-06-2020_17-30-35.jpg",
   "width": 1080,
   "height": 1080,
   "text": "",
   "text_entities": []
  },
  {
   "id": 289,
   "type": "message",
   "date": "2020-06-19T17:30:39",
   "date_unixtime": "1592562639",
   "from": "Asian foods",
   "from_id": "channel1404403642",
   "photo": "photos/photo_253@19-06-2020_17-30-39.jpg",
   "width": 1080,
   "height": 1080,
   "text": "",
   "text_entities": []
  },
  {
   "id": 290,
   "type": "message",
   "date": "2020-07-01T19:06:25",
   "date_unixtime": "1593605185",
   "from": "Asian foods",
   "from_id": "channel1404403642",
   "photo": "photos/photo_254@01-07-2020_19-06-25.jpg",
   "width": 960,
   "height": 1280,
   "text": "",
   "text_entities": []
  },
  {
   "id": 291,
   "type": "message",
   "date": "2020-07-10T16:33:53",
   "date_unixtime": "1594373633",
   "from": "Asian foods",
   "from_id": "channel1404403642",
   "photo": "photos/photo_255@10-07-2020_16-33-53.jpg",
   "width": 1080,
   "height": 1080,
   "text": "",
   "text_entities": []
  },
  {
   "id": 292,
   "type": "message",
   "date": "2020-07-10T16:34:04",
   "date_unixtime": "1594373644",
   "from": "Asian foods",
   "from_id": "channel1404403642",
   "photo": "photos/photo_256@10-07-2020_16-34-04.jpg",
   "width": 1080,
   "height": 1080,
   "text": "",
   "text_entities": []
  },
  {
   "id": 293,
   "type": "message",
   "date": "2020-07-10T23:02:07",
   "date_unixtime": "1594396927",
   "from": "Asian foods",
   "from_id": "channel1404403642",
   "photo": "photos/photo_257@10-07-2020_23-02-07.jpg",
   "width": 960,
   "height": 960,
   "text": "",
   "text_entities": []
  },
  {
   "id": 294,
   "type": "message",
   "date": "2020-07-17T18:47:12",
   "date_unixtime": "1594986432",
   "from": "Asian foods",
   "from_id": "channel1404403642",
   "photo": "photos/photo_258@17-07-2020_18-47-12.jpg",
   "width": 1080,
   "height": 1080,
   "text": "",
   "text_entities": []
  },
  {
   "id": 295,
   "type": "message",
   "date": "2020-07-17T18:47:14",
   "date_unixtime": "1594986434",
   "from": "Asian foods",
   "from_id": "channel1404403642",
   "photo": "photos/photo_259@17-07-2020_18-47-14.jpg",
   "width": 1080,
   "height": 1080,
   "text": "",
   "text_entities": []
  },
  {
   "id": 296,
   "type": "message",
   "date": "2020-07-24T18:19:19",
   "date_unixtime": "1595589559",
   "from": "Asian foods",
   "from_id": "channel1404403642",
   "photo": "photos/photo_260@24-07-2020_18-19-19.jpg",
   "width": 960,
   "height": 1280,
   "text": "",
   "text_entities": []
  },
  {
   "id": 297,
   "type": "message",
   "date": "2020-08-06T17:38:45",
   "date_unixtime": "1596710325",
   "from": "Asian foods",
   "from_id": "channel1404403642",
   "photo": "photos/photo_261@06-08-2020_17-38-45.jpg",
   "width": 680,
   "height": 1020,
   "text": "",
   "text_entities": []
  },
  {
   "id": 298,
   "type": "message",
   "date": "2020-08-06T18:39:31",
   "date_unixtime": "1596713971",
   "from": "Asian foods",
   "from_id": "channel1404403642",
   "photo": "photos/photo_262@06-08-2020_18-39-31.jpg",
   "width": 1080,
   "height": 1080,
   "text": "",
   "text_entities": []
  },
  {
   "id": 299,
   "type": "message",
   "date": "2020-08-10T17:17:54",
   "date_unixtime": "1597054674",
   "from": "Asian foods",
   "from_id": "channel1404403642",
   "photo": "photos/photo_263@10-08-2020_17-17-54.jpg",
   "width": 1200,
   "height": 675,
   "text": "",
   "text_entities": []
  },
  {
   "id": 300,
   "type": "message",
   "date": "2020-08-13T17:01:12",
   "date_unixtime": "1597312872",
   "from": "Asian foods",
   "from_id": "channel1404403642",
   "photo": "photos/photo_264@13-08-2020_17-01-12.jpg",
   "width": 937,
   "height": 937,
   "text": "",
   "text_entities": []
  },
  {
   "id": 301,
   "type": "message",
   "date": "2020-09-07T21:07:21",
   "date_unixtime": "1599487641",
   "from": "Asian foods",
   "from_id": "channel1404403642",
   "photo": "photos/photo_265@07-09-2020_21-07-21.jpg",
   "width": 1080,
   "height": 810,
   "text": "",
   "text_entities": []
  },
  {
   "id": 302,
   "type": "message",
   "date": "2020-09-08T23:37:56",
   "date_unixtime": "1599583076",
   "from": "Asian foods",
   "from_id": "channel1404403642",
   "photo": "photos/photo_266@08-09-2020_23-37-56.jpg",
   "width": 721,
   "height": 1280,
   "text": "",
   "text_entities": []
  },
  {
   "id": 303,
   "type": "message",
   "date": "2020-09-19T20:53:18",
   "date_unixtime": "1600523598",
   "from": "Asian foods",
   "from_id": "channel1404403642",
   "photo": "photos/photo_267@19-09-2020_20-53-18.jpg",
   "width": 1080,
   "height": 1080,
   "text": "",
   "text_entities": []
  },
  {
   "id": 304,
   "type": "message",
   "date": "2020-09-19T20:53:21",
   "date_unixtime": "1600523601",
   "from": "Asian foods",
   "from_id": "channel1404403642",
   "photo": "photos/photo_268@19-09-2020_20-53-21.jpg",
   "width": 828,
   "height": 828,
   "text": "",
   "text_entities": []
  },
  {
   "id": 305,
   "type": "message",
   "date": "2020-09-21T20:15:39",
   "date_unixtime": "1600694139",
   "from": "Asian foods",
   "from_id": "channel1404403642",
   "photo": "photos/photo_269@21-09-2020_20-15-39.jpg",
   "width": 1080,
   "height": 968,
   "text": "",
   "text_entities": []
  },
  {
   "id": 306,
   "type": "message",
   "date": "2020-10-01T08:36:56",
   "date_unixtime": "1601516216",
   "from": "Asian foods",
   "from_id": "channel1404403642",
   "photo": "photos/photo_270@01-10-2020_08-36-56.jpg",
   "width": 800,
   "height": 533,
   "text": "",
   "text_entities": []
  },
  {
   "id": 307,
   "type": "message",
   "date": "2020-10-11T20:32:09",
   "date_unixtime": "1602423129",
   "from": "Asian foods",
   "from_id": "channel1404403642",
   "author": "Seakleng Hour",
   "photo": "photos/photo_271@11-10-2020_20-32-09.jpg",
   "width": 960,
   "height": 960,
   "text": "",
   "text_entities": []
  },
  {
   "id": 308,
   "type": "message",
   "date": "2020-10-11T20:32:12",
   "date_unixtime": "1602423132",
   "from": "Asian foods",
   "from_id": "channel1404403642",
   "author": "Seakleng Hour",
   "photo": "photos/photo_272@11-10-2020_20-32-12.jpg",
   "width": 768,
   "height": 960,
   "text": "",
   "text_entities": []
  },
  {
   "id": 309,
   "type": "message",
   "date": "2020-10-15T09:03:30",
   "date_unixtime": "1602727410",
   "from": "Asian foods",
   "from_id": "channel1404403642",
   "author": "Seakleng Hour",
   "photo": "photos/photo_273@15-10-2020_09-03-30.jpg",
   "width": 720,
   "height": 900,
   "text": "",
   "text_entities": []
  },
  {
   "id": 310,
   "type": "message",
   "date": "2020-10-28T18:03:08",
   "date_unixtime": "1603882988",
   "from": "Asian foods",
   "from_id": "channel1404403642",
   "author": "Seakleng Hour",
   "photo": "photos/photo_274@28-10-2020_18-03-08.jpg",
   "width": 960,
   "height": 1280,
   "text": "",
   "text_entities": []
  },
  {
   "id": 311,
   "type": "message",
   "date": "2020-11-08T18:41:52",
   "date_unixtime": "1604835712",
   "from": "Asian foods",
   "from_id": "channel1404403642",
   "author": "Seakleng Hour",
   "photo": "photos/photo_275@08-11-2020_18-41-52.jpg",
   "width": 720,
   "height": 960,
   "text": "",
   "text_entities": []
  },
  {
   "id": 312,
   "type": "message",
   "date": "2020-11-08T18:41:55",
   "date_unixtime": "1604835715",
   "from": "Asian foods",
   "from_id": "channel1404403642",
   "author": "Seakleng Hour",
   "photo": "photos/photo_276@08-11-2020_18-41-55.jpg",
   "width": 960,
   "height": 960,
   "text": "",
   "text_entities": []
  },
  {
   "id": 313,
   "type": "message",
   "date": "2020-11-13T20:21:14",
   "date_unixtime": "1605273674",
   "from": "Asian foods",
   "from_id": "channel1404403642",
   "photo": "photos/photo_277@13-11-2020_20-21-14.jpg",
   "width": 810,
   "height": 1080,
   "text": "",
   "text_entities": []
  },
  {
   "id": 314,
   "type": "message",
   "date": "2020-11-20T21:32:25",
   "date_unixtime": "1605882745",
   "from": "Asian foods",
   "from_id": "channel1404403642",
   "photo": "photos/photo_278@20-11-2020_21-32-25.jpg",
   "width": 1080,
   "height": 607,
   "text": "",
   "text_entities": []
  },
  {
   "id": 315,
   "type": "message",
   "date": "2020-11-20T22:17:28",
   "date_unixtime": "1605885448",
   "from": "Asian foods",
   "from_id": "channel1404403642",
   "photo": "photos/photo_279@20-11-2020_22-17-28.jpg",
   "width": 1080,
   "height": 1080,
   "text": "",
   "text_entities": []
  },
  {
   "id": 316,
   "type": "message",
   "date": "2020-12-05T20:37:54",
   "date_unixtime": "1607175474",
   "from": "Asian foods",
   "from_id": "channel1404403642",
   "photo": "photos/photo_280@05-12-2020_20-37-54.jpg",
   "width": 735,
   "height": 735,
   "text": "",
   "text_entities": []
  },
  {
   "id": 317,
   "type": "message",
   "date": "2020-12-07T17:41:42",
   "date_unixtime": "1607337702",
   "from": "Asian foods",
   "from_id": "channel1404403642",
   "photo": "photos/photo_281@07-12-2020_17-41-42.jpg",
   "width": 1280,
   "height": 1280,
   "text": "",
   "text_entities": []
  },
  {
   "id": 318,
   "type": "message",
   "date": "2020-12-07T17:42:06",
   "date_unixtime": "1607337726",
   "from": "Asian foods",
   "from_id": "channel1404403642",
   "photo": "photos/photo_282@07-12-2020_17-42-06.jpg",
   "width": 1280,
   "height": 1280,
   "text": "",
   "text_entities": []
  },
  {
   "id": 319,
   "type": "message",
   "date": "2020-12-08T18:16:00",
   "date_unixtime": "1607426160",
   "from": "Asian foods",
   "from_id": "channel1404403642",
   "photo": "photos/photo_283@08-12-2020_18-16-00.jpg",
   "width": 960,
   "height": 884,
   "text": "",
   "text_entities": []
  },
  {
   "id": 320,
   "type": "message",
   "date": "2020-12-08T18:16:09",
   "date_unixtime": "1607426169",
   "from": "Asian foods",
   "from_id": "channel1404403642",
   "photo": "photos/photo_284@08-12-2020_18-16-09.jpg",
   "width": 848,
   "height": 960,
   "text": "",
   "text_entities": []
  },
  {
   "id": 321,
   "type": "message",
   "date": "2020-12-14T17:24:34",
   "date_unixtime": "1607941474",
   "from": "Asian foods",
   "from_id": "channel1404403642",
   "photo": "photos/photo_285@14-12-2020_17-24-34.jpg",
   "width": 1280,
   "height": 1280,
   "text": "",
   "text_entities": []
  },
  {
   "id": 322,
   "type": "message",
   "date": "2021-01-08T12:09:06",
   "date_unixtime": "1610082546",
   "from": "Asian foods",
   "from_id": "channel1404403642",
   "photo": "photos/photo_286@08-01-2021_12-09-06.jpg",
   "width": 800,
   "height": 532,
   "text": "",
   "text_entities": []
  },
  {
   "id": 323,
   "type": "message",
   "date": "2021-01-08T12:09:10",
   "date_unixtime": "1610082550",
   "from": "Asian foods",
   "from_id": "channel1404403642",
   "photo": "photos/photo_287@08-01-2021_12-09-10.jpg",
   "width": 800,
   "height": 599,
   "text": "",
   "text_entities": []
  },
  {
   "id": 324,
   "type": "message",
   "date": "2021-01-19T19:27:52",
   "date_unixtime": "1611059272",
   "from": "Asian foods",
   "from_id": "channel1404403642",
   "photo": "photos/photo_288@19-01-2021_19-27-52.jpg",
   "width": 1280,
   "height": 1280,
   "text": "",
   "text_entities": []
  },
  {
   "id": 325,
   "type": "message",
   "date": "2021-01-19T19:27:58",
   "date_unixtime": "1611059278",
   "from": "Asian foods",
   "from_id": "channel1404403642",
   "photo": "photos/photo_289@19-01-2021_19-27-58.jpg",
   "width": 1280,
   "height": 1280,
   "text": "",
   "text_entities": []
  },
  {
   "id": 326,
   "type": "message",
   "date": "2021-01-30T12:20:02",
   "date_unixtime": "1611984002",
   "from": "Asian foods",
   "from_id": "channel1404403642",
   "photo": "photos/photo_290@30-01-2021_12-20-02.jpg",
   "width": 960,
   "height": 720,
   "text": "",
   "text_entities": []
  },
  {
   "id": 327,
   "type": "message",
   "date": "2021-01-30T12:20:06",
   "date_unixtime": "1611984006",
   "from": "Asian foods",
   "from_id": "channel1404403642",
   "photo": "photos/photo_291@30-01-2021_12-20-06.jpg",
   "width": 960,
   "height": 838,
   "text": "",
   "text_entities": []
  },
  {
   "id": 328,
   "type": "message",
   "date": "2021-02-09T11:24:55",
   "date_unixtime": "1612844695",
   "from": "Asian foods",
   "from_id": "channel1404403642",
   "photo": "photos/photo_292@09-02-2021_11-24-55.jpg",
   "width": 1124,
   "height": 1124,
   "text": "",
   "text_entities": []
  },
  {
   "id": 329,
   "type": "message",
   "date": "2021-02-09T11:25:09",
   "date_unixtime": "1612844709",
   "from": "Asian foods",
   "from_id": "channel1404403642",
   "photo": "photos/photo_293@09-02-2021_11-25-09.jpg",
   "width": 1280,
   "height": 1280,
   "text": "",
   "text_entities": []
  },
  {
   "id": 330,
   "type": "message",
   "date": "2021-02-12T23:30:35",
   "date_unixtime": "1613147435",
   "from": "Asian foods",
   "from_id": "channel1404403642",
   "photo": "photos/photo_294@12-02-2021_23-30-35.jpg",
   "width": 1280,
   "height": 1280,
   "text": "",
   "text_entities": []
  },
  {
   "id": 331,
   "type": "message",
   "date": "2021-02-12T23:31:01",
   "date_unixtime": "1613147461",
   "from": "Asian foods",
   "from_id": "channel1404403642",
   "photo": "photos/photo_295@12-02-2021_23-31-01.jpg",
   "width": 1280,
   "height": 1280,
   "text": "",
   "text_entities": []
  },
  {
   "id": 332,
   "type": "message",
   "date": "2021-02-16T19:45:04",
   "date_unixtime": "1613479504",
   "from": "Asian foods",
   "from_id": "channel1404403642",
   "photo": "photos/photo_296@16-02-2021_19-45-04.jpg",
   "width": 1024,
   "height": 1280,
   "text": "",
   "text_entities": []
  },
  {
   "id": 334,
   "type": "message",
   "date": "2021-03-06T18:56:49",
   "date_unixtime": "1615031809",
   "from": "Asian foods",
   "from_id": "channel1404403642",
   "photo": "photos/photo_297@06-03-2021_18-56-49.jpg",
   "width": 748,
   "height": 748,
   "text": "",
   "text_entities": []
  },
  {
   "id": 335,
   "type": "message",
   "date": "2021-03-06T18:56:49",
   "date_unixtime": "1615031809",
   "from": "Asian foods",
   "from_id": "channel1404403642",
   "photo": "photos/photo_298@06-03-2021_18-56-49.jpg",
   "width": 1080,
   "height": 1080,
   "text": "",
   "text_entities": []
  },
  {
   "id": 336,
   "type": "message",
   "date": "2021-03-06T18:56:49",
   "date_unixtime": "1615031809",
   "from": "Asian foods",
   "from_id": "channel1404403642",
   "photo": "photos/photo_299@06-03-2021_18-56-49.jpg",
   "width": 1080,
   "height": 1080,
   "text": "",
   "text_entities": []
  },
  {
   "id": 337,
   "type": "message",
   "date": "2021-03-08T20:56:10",
   "date_unixtime": "1615211770",
   "from": "Asian foods",
   "from_id": "channel1404403642",
   "photo": "photos/photo_300@08-03-2021_20-56-10.jpg",
   "width": 1280,
   "height": 1280,
   "text": "",
   "text_entities": []
  },
  {
   "id": 338,
   "type": "message",
   "date": "2021-03-09T22:42:00",
   "date_unixtime": "1615304520",
   "from": "Asian foods",
   "from_id": "channel1404403642",
   "photo": "photos/photo_301@09-03-2021_22-42-00.jpg",
   "width": 1080,
   "height": 1080,
   "text": "",
   "text_entities": []
  },
  {
   "id": 339,
   "type": "message",
   "date": "2021-03-09T22:42:03",
   "date_unixtime": "1615304523",
   "from": "Asian foods",
   "from_id": "channel1404403642",
   "photo": "photos/photo_302@09-03-2021_22-42-03.jpg",
   "width": 1080,
   "height": 1080,
   "text": "",
   "text_entities": []
  },
  {
   "id": 340,
   "type": "message",
   "date": "2021-03-12T12:01:27",
   "date_unixtime": "1615525287",
   "from": "Asian foods",
   "from_id": "channel1404403642",
   "photo": "photos/photo_303@12-03-2021_12-01-27.jpg",
   "width": 1280,
   "height": 1280,
   "text": "",
   "text_entities": []
  },
  {
   "id": 341,
   "type": "message",
   "date": "2021-03-12T18:46:42",
   "date_unixtime": "1615549602",
   "from": "Asian foods",
   "from_id": "channel1404403642",
   "photo": "photos/photo_304@12-03-2021_18-46-42.jpg",
   "width": 959,
   "height": 1280,
   "text": "",
   "text_entities": []
  },
  {
   "id": 342,
   "type": "message",
   "date": "2021-03-13T23:34:32",
   "date_unixtime": "1615653272",
   "from": "Asian foods",
   "from_id": "channel1404403642",
   "photo": "photos/photo_305@13-03-2021_23-34-32.jpg",
   "width": 1080,
   "height": 810,
   "text": "",
   "text_entities": []
  },
  {
   "id": 343,
   "type": "message",
   "date": "2021-03-14T11:56:21",
   "date_unixtime": "1615697781",
   "from": "Asian foods",
   "from_id": "channel1404403642",
   "photo": "photos/photo_306@14-03-2021_11-56-21.jpg",
   "width": 960,
   "height": 960,
   "text": "",
   "text_entities": []
  },
  {
   "id": 344,
   "type": "message",
   "date": "2021-03-14T11:56:25",
   "date_unixtime": "1615697785",
   "from": "Asian foods",
   "from_id": "channel1404403642",
   "photo": "photos/photo_307@14-03-2021_11-56-25.jpg",
   "width": 768,
   "height": 960,
   "text": "",
   "text_entities": []
  },
  {
   "id": 345,
   "type": "message",
   "date": "2021-03-14T19:05:07",
   "date_unixtime": "1615723507",
   "from": "Asian foods",
   "from_id": "channel1404403642",
   "photo": "photos/photo_308@14-03-2021_19-05-07.jpg",
   "width": 960,
   "height": 960,
   "text": "",
   "text_entities": []
  },
  {
   "id": 346,
   "type": "message",
   "date": "2021-03-15T19:30:52",
   "date_unixtime": "1615811452",
   "from": "Asian foods",
   "from_id": "channel1404403642",
   "photo": "photos/photo_309@15-03-2021_19-30-52.jpg",
   "width": 960,
   "height": 960,
   "text": "",
   "text_entities": []
  },
  {
   "id": 347,
   "type": "message",
   "date": "2021-03-15T19:30:53",
   "date_unixtime": "1615811453",
   "from": "Asian foods",
   "from_id": "channel1404403642",
   "photo": "photos/photo_310@15-03-2021_19-30-53.jpg",
   "width": 1080,
   "height": 1080,
   "text": "",
   "text_entities": []
  },
  {
   "id": 348,
   "type": "message",
   "date": "2021-03-15T22:27:54",
   "date_unixtime": "1615822074",
   "from": "Asian foods",
   "from_id": "channel1404403642",
   "photo": "photos/photo_311@15-03-2021_22-27-54.jpg",
   "width": 828,
   "height": 912,
   "text": "",
   "text_entities": []
  },
  {
   "id": 349,
   "type": "message",
   "date": "2021-03-17T21:14:31",
   "date_unixtime": "1615990471",
   "from": "Asian foods",
   "from_id": "channel1404403642",
   "photo": "photos/photo_312@17-03-2021_21-14-31.jpg",
   "width": 959,
   "height": 1280,
   "text": "",
   "text_entities": []
  },
  {
   "id": 350,
   "type": "message",
   "date": "2021-03-17T21:14:31",
   "date_unixtime": "1615990471",
   "from": "Asian foods",
   "from_id": "channel1404403642",
   "photo": "photos/photo_313@17-03-2021_21-14-31.jpg",
   "width": 959,
   "height": 1280,
   "text": "",
   "text_entities": []
  },
  {
   "id": 351,
   "type": "message",
   "date": "2021-03-17T21:14:32",
   "date_unixtime": "1615990472",
   "from": "Asian foods",
   "from_id": "channel1404403642",
   "photo": "photos/photo_314@17-03-2021_21-14-32.jpg",
   "width": 959,
   "height": 1280,
   "text": "",
   "text_entities": []
  },
  {
   "id": 352,
   "type": "message",
   "date": "2021-03-18T17:41:17",
   "date_unixtime": "1616064077",
   "from": "Asian foods",
   "from_id": "channel1404403642",
   "photo": "photos/photo_315@18-03-2021_17-41-17.jpg",
   "width": 960,
   "height": 1280,
   "text": "",
   "text_entities": []
  },
  {
   "id": 353,
   "type": "message",
   "date": "2021-03-18T23:21:04",
   "date_unixtime": "1616084464",
   "from": "Asian foods",
   "from_id": "channel1404403642",
   "photo": "photos/photo_316@18-03-2021_23-21-04.jpg",
   "width": 1048,
   "height": 641,
   "text": "",
   "text_entities": []
  },
  {
   "id": 354,
   "type": "message",
   "date": "2021-03-21T12:01:56",
   "date_unixtime": "1616302916",
   "from": "Asian foods",
   "from_id": "channel1404403642",
   "photo": "photos/photo_317@21-03-2021_12-01-56.jpg",
   "width": 1170,
   "height": 1170,
   "text": "",
   "text_entities": []
  },
  {
   "id": 355,
   "type": "message",
   "date": "2021-03-22T20:40:38",
   "date_unixtime": "1616420438",
   "from": "Asian foods",
   "from_id": "channel1404403642",
   "photo": "photos/photo_318@22-03-2021_20-40-38.jpg",
   "width": 960,
   "height": 1280,
   "text": "",
   "text_entities": []
  },
  {
   "id": 356,
   "type": "message",
   "date": "2021-03-23T19:34:27",
   "date_unixtime": "1616502867",
   "from": "Asian foods",
   "from_id": "channel1404403642",
   "photo": "photos/photo_319@23-03-2021_19-34-27.jpg",
   "width": 1280,
   "height": 1280,
   "text": "",
   "text_entities": []
  },
  {
   "id": 357,
   "type": "message",
   "date": "2021-03-25T21:19:46",
   "date_unixtime": "1616681986",
   "from": "Asian foods",
   "from_id": "channel1404403642",
   "photo": "photos/photo_320@25-03-2021_21-19-46.jpg",
   "width": 787,
   "height": 1087,
   "text": "",
   "text_entities": []
  },
  {
   "id": 358,
   "type": "message",
   "date": "2021-03-25T21:19:49",
   "date_unixtime": "1616681989",
   "from": "Asian foods",
   "from_id": "channel1404403642",
   "photo": "photos/photo_321@25-03-2021_21-19-49.jpg",
   "width": 805,
   "height": 1080,
   "text": "",
   "text_entities": []
  },
  {
   "id": 359,
   "type": "message",
   "date": "2021-03-27T20:06:46",
   "date_unixtime": "1616850406",
   "from": "Asian foods",
   "from_id": "channel1404403642",
   "photo": "photos/photo_322@27-03-2021_20-06-46.jpg",
   "width": 960,
   "height": 1280,
   "text": "",
   "text_entities": []
  },
  {
   "id": 360,
   "type": "message",
   "date": "2021-03-27T20:06:46",
   "date_unixtime": "1616850406",
   "from": "Asian foods",
   "from_id": "channel1404403642",
   "photo": "photos/photo_323@27-03-2021_20-06-46.jpg",
   "width": 960,
   "height": 1280,
   "text": "",
   "text_entities": []
  },
  {
   "id": 361,
   "type": "message",
   "date": "2021-03-27T20:06:46",
   "date_unixtime": "1616850406",
   "from": "Asian foods",
   "from_id": "channel1404403642",
   "photo": "photos/photo_324@27-03-2021_20-06-46.jpg",
   "width": 960,
   "height": 1280,
   "text": "",
   "text_entities": []
  },
  {
   "id": 362,
   "type": "message",
   "date": "2021-04-01T17:45:31",
   "date_unixtime": "1617273931",
   "from": "Asian foods",
   "from_id": "channel1404403642",
   "photo": "photos/photo_325@01-04-2021_17-45-31.jpg",
   "width": 1080,
   "height": 1080,
   "text": "",
   "text_entities": []
  },
  {
   "id": 363,
   "type": "message",
   "date": "2021-04-01T17:47:34",
   "date_unixtime": "1617274054",
   "from": "Asian foods",
   "from_id": "channel1404403642",
   "photo": "photos/photo_326@01-04-2021_17-47-34.jpg",
   "width": 1080,
   "height": 1080,
   "text": "",
   "text_entities": []
  },
  {
   "id": 364,
   "type": "message",
   "date": "2021-04-03T10:46:45",
   "date_unixtime": "1617421605",
   "from": "Asian foods",
   "from_id": "channel1404403642",
   "photo": "photos/photo_327@03-04-2021_10-46-45.jpg",
   "width": 1080,
   "height": 810,
   "text": "",
   "text_entities": []
  },
  {
   "id": 365,
   "type": "message",
   "date": "2021-04-03T10:46:48",
   "date_unixtime": "1617421608",
   "from": "Asian foods",
   "from_id": "channel1404403642",
   "photo": "photos/photo_328@03-04-2021_10-46-48.jpg",
   "width": 1080,
   "height": 810,
   "text": "",
   "text_entities": []
  },
  {
   "id": 366,
   "type": "message",
   "date": "2021-04-05T22:54:34",
   "date_unixtime": "1617638074",
   "from": "Asian foods",
   "from_id": "channel1404403642",
   "photo": "photos/photo_329@05-04-2021_22-54-34.jpg",
   "width": 960,
   "height": 802,
   "text": "",
   "text_entities": []
  },
  {
   "id": 367,
   "type": "message",
   "date": "2021-04-06T18:31:07",
   "date_unixtime": "1617708667",
   "from": "Asian foods",
   "from_id": "channel1404403642",
   "photo": "photos/photo_330@06-04-2021_18-31-07.jpg",
   "width": 1080,
   "height": 720,
   "text": "",
   "text_entities": []
  },
  {
   "id": 368,
   "type": "message",
   "date": "2021-04-08T18:56:36",
   "date_unixtime": "1617882996",
   "from": "Asian foods",
   "from_id": "channel1404403642",
   "photo": "photos/photo_331@08-04-2021_18-56-36.jpg",
   "width": 945,
   "height": 709,
   "text": "",
   "text_entities": []
  },
  {
   "id": 369,
   "type": "message",
   "date": "2021-04-18T21:35:06",
   "date_unixtime": "1618756506",
   "from": "Asian foods",
   "from_id": "channel1404403642",
   "photo": "photos/photo_332@18-04-2021_21-35-06.jpg",
   "width": 900,
   "height": 900,
   "text": "",
   "text_entities": []
  },
  {
   "id": 370,
   "type": "message",
   "date": "2021-04-21T17:43:56",
   "date_unixtime": "1619001836",
   "from": "Asian foods",
   "from_id": "channel1404403642",
   "photo": "photos/photo_333@21-04-2021_17-43-56.jpg",
   "width": 1280,
   "height": 1280,
   "text": "",
   "text_entities": []
  },
  {
   "id": 371,
   "type": "message",
   "date": "2021-04-21T17:43:58",
   "date_unixtime": "1619001838",
   "from": "Asian foods",
   "from_id": "channel1404403642",
   "photo": "photos/photo_334@21-04-2021_17-43-58.jpg",
   "width": 1280,
   "height": 1280,
   "text": "",
   "text_entities": []
  },
  {
   "id": 372,
   "type": "message",
   "date": "2021-04-22T19:52:17",
   "date_unixtime": "1619095937",
   "from": "Asian foods",
   "from_id": "channel1404403642",
   "photo": "photos/photo_335@22-04-2021_19-52-17.jpg",
   "width": 720,
   "height": 720,
   "text": "",
   "text_entities": []
  },
  {
   "id": 373,
   "type": "message",
   "date": "2021-04-28T17:15:23",
   "date_unixtime": "1619604923",
   "from": "Asian foods",
   "from_id": "channel1404403642",
   "photo": "photos/photo_336@28-04-2021_17-15-23.jpg",
   "width": 1080,
   "height": 901,
   "text": "",
   "text_entities": []
  },
  {
   "id": 374,
   "type": "message",
   "date": "2021-04-28T17:15:25",
   "date_unixtime": "1619604925",
   "from": "Asian foods",
   "from_id": "channel1404403642",
   "photo": "photos/photo_337@28-04-2021_17-15-25.jpg",
   "width": 1080,
   "height": 810,
   "text": "",
   "text_entities": []
  },
  {
   "id": 376,
   "type": "message",
   "date": "2021-05-03T19:03:20",
   "date_unixtime": "1620043400",
   "from": "Asian foods",
   "from_id": "channel1404403642",
   "photo": "photos/photo_338@03-05-2021_19-03-20.jpg",
   "width": 1280,
   "height": 1280,
   "text": "",
   "text_entities": []
  },
  {
   "id": 377,
   "type": "message",
   "date": "2021-05-03T19:03:32",
   "date_unixtime": "1620043412",
   "from": "Asian foods",
   "from_id": "channel1404403642",
   "photo": "photos/photo_339@03-05-2021_19-03-32.jpg",
   "width": 1280,
   "height": 1280,
   "text": "",
   "text_entities": []
  },
  {
   "id": 378,
   "type": "message",
   "date": "2021-05-08T12:05:13",
   "date_unixtime": "1620450313",
   "from": "Asian foods",
   "from_id": "channel1404403642",
   "photo": "photos/photo_340@08-05-2021_12-05-13.jpg",
   "width": 750,
   "height": 750,
   "text": "",
   "text_entities": []
  },
  {
   "id": 379,
   "type": "message",
   "date": "2021-05-08T21:05:01",
   "date_unixtime": "1620482701",
   "from": "Asian foods",
   "from_id": "channel1404403642",
   "photo": "photos/photo_341@08-05-2021_21-05-01.jpg",
   "width": 1280,
   "height": 1280,
   "text": "",
   "text_entities": []
  },
  {
   "id": 380,
   "type": "message",
   "date": "2021-05-08T21:05:05",
   "date_unixtime": "1620482705",
   "from": "Asian foods",
   "from_id": "channel1404403642",
   "photo": "photos/photo_342@08-05-2021_21-05-05.jpg",
   "width": 960,
   "height": 1280,
   "text": "",
   "text_entities": []
  },
  {
   "id": 381,
   "type": "message",
   "date": "2021-05-15T21:06:44",
   "date_unixtime": "1621087604",
   "from": "Asian foods",
   "from_id": "channel1404403642",
   "photo": "photos/photo_343@15-05-2021_21-06-44.jpg",
   "width": 1080,
   "height": 1130,
   "text": "",
   "text_entities": []
  },
  {
   "id": 382,
   "type": "message",
   "date": "2021-05-23T17:37:08",
   "date_unixtime": "1621766228",
   "from": "Asian foods",
   "from_id": "channel1404403642",
   "photo": "photos/photo_344@23-05-2021_17-37-08.jpg",
   "width": 640,
   "height": 640,
   "text": "",
   "text_entities": []
  },
  {
   "id": 383,
   "type": "message",
   "date": "2021-05-26T22:35:31",
   "date_unixtime": "1622043331",
   "from": "Asian foods",
   "from_id": "channel1404403642",
   "photo": "photos/photo_345@26-05-2021_22-35-31.jpg",
   "width": 960,
   "height": 720,
   "text": "",
   "text_entities": []
  },
  {
   "id": 384,
   "type": "message",
   "date": "2021-06-24T18:31:30",
   "date_unixtime": "1624534290",
   "from": "Asian foods",
   "from_id": "channel1404403642",
   "photo": "photos/photo_346@24-06-2021_18-31-30.jpg",
   "width": 1080,
   "height": 1028,
   "text": "",
   "text_entities": []
  },
  {
   "id": 385,
   "type": "message",
   "date": "2021-06-24T18:37:03",
   "date_unixtime": "1624534623",
   "from": "Asian foods",
   "from_id": "channel1404403642",
   "photo": "photos/photo_347@24-06-2021_18-37-03.jpg",
   "width": 1008,
   "height": 756,
   "text": "",
   "text_entities": []
  },
  {
   "id": 386,
   "type": "message",
   "date": "2021-07-03T06:55:18",
   "date_unixtime": "1625270118",
   "from": "Asian foods",
   "from_id": "channel1404403642",
   "photo": "photos/photo_348@03-07-2021_06-55-18.jpg",
   "width": 748,
   "height": 748,
   "text": "",
   "text_entities": []
  },
  {
   "id": 387,
   "type": "message",
   "date": "2021-07-03T06:55:20",
   "date_unixtime": "1625270120",
   "from": "Asian foods",
   "from_id": "channel1404403642",
   "photo": "photos/photo_349@03-07-2021_06-55-20.jpg",
   "width": 768,
   "height": 960,
   "text": "",
   "text_entities": []
  },
  {
   "id": 388,
   "type": "message",
   "date": "2021-07-12T19:01:28",
   "date_unixtime": "1626091288",
   "from": "Asian foods",
   "from_id": "channel1404403642",
   "photo": "photos/photo_350@12-07-2021_19-01-28.jpg",
   "width": 720,
   "height": 960,
   "text": "",
   "text_entities": []
  },
  {
   "id": 389,
   "type": "message",
   "date": "2021-07-13T17:08:38",
   "date_unixtime": "1626170918",
   "from": "Asian foods",
   "from_id": "channel1404403642",
   "photo": "photos/photo_351@13-07-2021_17-08-38.jpg",
   "width": 768,
   "height": 960,
   "text": "",
   "text_entities": []
  },
  {
   "id": 390,
   "type": "message",
   "date": "2021-07-13T17:08:41",
   "date_unixtime": "1626170921",
   "from": "Asian foods",
   "from_id": "channel1404403642",
   "photo": "photos/photo_352@13-07-2021_17-08-41.jpg",
   "width": 960,
   "height": 960,
   "text": "",
   "text_entities": []
  },
  {
   "id": 391,
   "type": "message",
   "date": "2021-07-14T21:24:57",
   "date_unixtime": "1626272697",
   "from": "Asian foods",
   "from_id": "channel1404403642",
   "photo": "photos/photo_353@14-07-2021_21-24-57.jpg",
   "width": 853,
   "height": 1280,
   "text": "",
   "text_entities": []
  },
  {
   "id": 392,
   "type": "message",
   "date": "2021-07-15T18:36:18",
   "date_unixtime": "1626348978",
   "from": "Asian foods",
   "from_id": "channel1404403642",
   "photo": "photos/photo_354@15-07-2021_18-36-18.jpg",
   "width": 855,
   "height": 1280,
   "text": "",
   "text_entities": []
  },
  {
   "id": 393,
   "type": "message",
   "date": "2021-07-15T18:36:29",
   "date_unixtime": "1626348989",
   "from": "Asian foods",
   "from_id": "channel1404403642",
   "photo": "photos/photo_355@15-07-2021_18-36-29.jpg",
   "width": 854,
   "height": 1280,
   "text": "",
   "text_entities": []
  },
  {
   "id": 394,
   "type": "message",
   "date": "2021-07-27T17:38:52",
   "date_unixtime": "1627382332",
   "from": "Asian foods",
   "from_id": "channel1404403642",
   "photo": "photos/photo_356@27-07-2021_17-38-52.jpg",
   "width": 1080,
   "height": 827,
   "text": "",
   "text_entities": []
  },
  {
   "id": 395,
   "type": "message",
   "date": "2021-08-18T17:45:53",
   "date_unixtime": "1629283553",
   "from": "Asian foods",
   "from_id": "channel1404403642",
   "photo": "photos/photo_357@18-08-2021_17-45-53.jpg",
   "width": 1080,
   "height": 1080,
   "text": "",
   "text_entities": []
  },
  {
   "id": 396,
   "type": "message",
   "date": "2021-08-18T18:57:24",
   "date_unixtime": "1629287844",
   "from": "Asian foods",
   "from_id": "channel1404403642",
   "photo": "photos/photo_358@18-08-2021_18-57-24.jpg",
   "width": 960,
   "height": 960,
   "text": "",
   "text_entities": []
  },
  {
   "id": 397,
   "type": "message",
   "date": "2021-08-19T23:32:45",
   "date_unixtime": "1629390765",
   "from": "Asian foods",
   "from_id": "channel1404403642",
   "photo": "photos/photo_359@19-08-2021_23-32-45.jpg",
   "width": 1080,
   "height": 1080,
   "text": "",
   "text_entities": []
  },
  {
   "id": 398,
   "type": "message",
   "date": "2021-08-21T18:37:16",
   "date_unixtime": "1629545836",
   "from": "Asian foods",
   "from_id": "channel1404403642",
   "photo": "photos/photo_360@21-08-2021_18-37-16.jpg",
   "width": 1186,
   "height": 1190,
   "text": "",
   "text_entities": []
  },
  {
   "id": 399,
   "type": "message",
   "date": "2021-08-21T18:37:16",
   "date_unixtime": "1629545836",
   "from": "Asian foods",
   "from_id": "channel1404403642",
   "photo": "photos/photo_361@21-08-2021_18-37-16.jpg",
   "width": 1207,
   "height": 1200,
   "text": "",
   "text_entities": []
  },
  {
   "id": 400,
   "type": "message",
   "date": "2021-08-21T18:37:16",
   "date_unixtime": "1629545836",
   "from": "Asian foods",
   "from_id": "channel1404403642",
   "photo": "photos/photo_362@21-08-2021_18-37-16.jpg",
   "width": 854,
   "height": 1280,
   "text": "",
   "text_entities": []
  },
  {
   "id": 401,
   "type": "message",
   "date": "2021-08-21T18:37:16",
   "date_unixtime": "1629545836",
   "from": "Asian foods",
   "from_id": "channel1404403642",
   "photo": "photos/photo_363@21-08-2021_18-37-16.jpg",
   "width": 999,
   "height": 1280,
   "text": "",
   "text_entities": []
  },
  {
   "id": 402,
   "type": "message",
   "date": "2021-08-27T17:23:58",
   "date_unixtime": "1630059838",
   "from": "Asian foods",
   "from_id": "channel1404403642",
   "photo": "photos/photo_364@27-08-2021_17-23-58.jpg",
   "width": 1280,
   "height": 1280,
   "text": "",
   "text_entities": []
  },
  {
   "id": 404,
   "type": "message",
   "date": "2021-09-01T20:17:38",
   "date_unixtime": "1630502258",
   "from": "Asian foods",
   "from_id": "channel1404403642",
   "photo": "photos/photo_365@01-09-2021_20-17-38.jpg",
   "width": 1079,
   "height": 1079,
   "text": "",
   "text_entities": []
  },
  {
   "id": 405,
   "type": "message",
   "date": "2021-09-10T19:17:32",
   "date_unixtime": "1631276252",
   "from": "Asian foods",
   "from_id": "channel1404403642",
   "photo": "photos/photo_366@10-09-2021_19-17-32.jpg",
   "width": 720,
   "height": 901,
   "text": "",
   "text_entities": []
  },
  {
   "id": 406,
   "type": "message",
   "date": "2021-09-10T19:17:32",
   "date_unixtime": "1631276252",
   "from": "Asian foods",
   "from_id": "channel1404403642",
   "photo": "photos/photo_367@10-09-2021_19-17-32.jpg",
   "width": 720,
   "height": 901,
   "text": "",
   "text_entities": []
  },
  {
   "id": 407,
   "type": "message",
   "date": "2021-09-14T18:03:37",
   "date_unixtime": "1631617417",
   "from": "Asian foods",
   "from_id": "channel1404403642",
   "photo": "photos/photo_368@14-09-2021_18-03-37.jpg",
   "width": 1081,
   "height": 1081,
   "text": "",
   "text_entities": []
  },
  {
   "id": 408,
   "type": "message",
   "date": "2021-09-14T18:03:42",
   "date_unixtime": "1631617422",
   "from": "Asian foods",
   "from_id": "channel1404403642",
   "photo": "photos/photo_369@14-09-2021_18-03-42.jpg",
   "width": 1081,
   "height": 1081,
   "text": "",
   "text_entities": []
  },
  {
   "id": 409,
   "type": "message",
   "date": "2021-09-20T17:57:06",
   "date_unixtime": "1632135426",
   "from": "Asian foods",
   "from_id": "channel1404403642",
   "photo": "photos/photo_370@20-09-2021_17-57-06.jpg",
   "width": 960,
   "height": 960,
   "text": "",
   "text_entities": []
  },
  {
   "id": 410,
   "type": "message",
   "date": "2021-09-20T17:57:09",
   "date_unixtime": "1632135429",
   "from": "Asian foods",
   "from_id": "channel1404403642",
   "photo": "photos/photo_371@20-09-2021_17-57-09.jpg",
   "width": 960,
   "height": 960,
   "text": "",
   "text_entities": []
  },
  {
   "id": 411,
   "type": "message",
   "date": "2021-09-30T16:57:37",
   "date_unixtime": "1632995857",
   "from": "Asian foods",
   "from_id": "channel1404403642",
   "photo": "photos/photo_372@30-09-2021_16-57-37.jpg",
   "width": 960,
   "height": 641,
   "text": "",
   "text_entities": []
  },
  {
   "id": 412,
   "type": "message",
   "date": "2021-10-05T23:29:51",
   "date_unixtime": "1633451391",
   "from": "Asian foods",
   "from_id": "channel1404403642",
   "photo": "photos/photo_373@05-10-2021_23-29-51.jpg",
   "width": 720,
   "height": 960,
   "text": "",
   "text_entities": []
  },
  {
   "id": 413,
   "type": "message",
   "date": "2021-10-10T08:54:13",
   "date_unixtime": "1633830853",
   "from": "Asian foods",
   "from_id": "channel1404403642",
   "photo": "photos/photo_374@10-10-2021_08-54-13.jpg",
   "width": 1080,
   "height": 1080,
   "text": "",
   "text_entities": []
  },
  {
   "id": 414,
   "type": "message",
   "date": "2021-10-11T12:31:51",
   "date_unixtime": "1633930311",
   "from": "Asian foods",
   "from_id": "channel1404403642",
   "photo": "photos/photo_375@11-10-2021_12-31-51.jpg",
   "width": 960,
   "height": 721,
   "text": "",
   "text_entities": []
  },
  {
   "id": 415,
   "type": "message",
   "date": "2021-10-14T17:16:31",
   "date_unixtime": "1634206591",
   "from": "Asian foods",
   "from_id": "channel1404403642",
   "photo": "photos/photo_376@14-10-2021_17-16-31.jpg",
   "width": 1080,
   "height": 931,
   "text": "",
   "text_entities": []
  },
  {
   "id": 416,
   "type": "message",
   "date": "2021-10-15T09:53:09",
   "date_unixtime": "1634266389",
   "from": "Asian foods",
   "from_id": "channel1404403642",
   "photo": "photos/photo_377@15-10-2021_09-53-09.jpg",
   "width": 1080,
   "height": 1080,
   "text": "",
   "text_entities": []
  },
  {
   "id": 417,
   "type": "message",
   "date": "2021-10-15T09:53:13",
   "date_unixtime": "1634266393",
   "from": "Asian foods",
   "from_id": "channel1404403642",
   "photo": "photos/photo_378@15-10-2021_09-53-13.jpg",
   "width": 1080,
   "height": 1080,
   "text": "",
   "text_entities": []
  },
  {
   "id": 418,
   "type": "message",
   "date": "2021-10-17T19:29:50",
   "date_unixtime": "1634473790",
   "from": "Asian foods",
   "from_id": "channel1404403642",
   "photo": "photos/photo_379@17-10-2021_19-29-50.jpg",
   "width": 1080,
   "height": 1080,
   "text": "",
   "text_entities": []
  },
  {
   "id": 419,
   "type": "message",
   "date": "2021-10-18T19:05:14",
   "date_unixtime": "1634558714",
   "from": "Asian foods",
   "from_id": "channel1404403642",
   "photo": "photos/photo_380@18-10-2021_19-05-14.jpg",
   "width": 960,
   "height": 960,
   "text": "",
   "text_entities": []
  },
  {
   "id": 420,
   "type": "message",
   "date": "2021-10-26T18:58:10",
   "date_unixtime": "1635249490",
   "from": "Asian foods",
   "from_id": "channel1404403642",
   "photo": "photos/photo_381@26-10-2021_18-58-10.jpg",
   "width": 1080,
   "height": 810,
   "text": "",
   "text_entities": []
  },
  {
   "id": 421,
   "type": "message",
   "date": "2021-10-28T23:35:42",
   "date_unixtime": "1635438942",
   "from": "Asian foods",
   "from_id": "channel1404403642",
   "photo": "photos/photo_382@28-10-2021_23-35-42.jpg",
   "width": 720,
   "height": 720,
   "text": "",
   "text_entities": []
  },
  {
   "id": 422,
   "type": "message",
   "date": "2021-11-15T11:52:30",
   "date_unixtime": "1636951950",
   "from": "Asian foods",
   "from_id": "channel1404403642",
   "photo": "photos/photo_383@15-11-2021_11-52-30.jpg",
   "width": 1080,
   "height": 1080,
   "text": "",
   "text_entities": []
  },
  {
   "id": 423,
   "type": "message",
   "date": "2021-11-15T11:52:34",
   "date_unixtime": "1636951954",
   "from": "Asian foods",
   "from_id": "channel1404403642",
   "photo": "photos/photo_384@15-11-2021_11-52-34.jpg",
   "width": 1080,
   "height": 1080,
   "text": "",
   "text_entities": []
  },
  {
   "id": 424,
   "type": "message",
   "date": "2021-11-22T20:29:27",
   "date_unixtime": "1637587767",
   "from": "Asian foods",
   "from_id": "channel1404403642",
   "photo": "photos/photo_385@22-11-2021_20-29-27.jpg",
   "width": 1080,
   "height": 1080,
   "text": "",
   "text_entities": []
  },
  {
   "id": 425,
   "type": "message",
   "date": "2021-12-02T19:24:03",
   "date_unixtime": "1638447843",
   "from": "Asian foods",
   "from_id": "channel1404403642",
   "photo": "photos/photo_386@02-12-2021_19-24-03.jpg",
   "width": 853,
   "height": 1280,
   "text": "",
   "text_entities": []
  },
  {
   "id": 426,
   "type": "message",
   "date": "2021-12-13T22:20:28",
   "date_unixtime": "1639408828",
   "from": "Asian foods",
   "from_id": "channel1404403642",
   "photo": "photos/photo_387@13-12-2021_22-20-28.jpg",
   "width": 1280,
   "height": 1280,
   "text": "",
   "text_entities": []
  },
  {
   "id": 427,
   "type": "message",
   "date": "2021-12-15T20:39:03",
   "date_unixtime": "1639575543",
   "from": "Asian foods",
   "from_id": "channel1404403642",
   "photo": "photos/photo_388@15-12-2021_20-39-03.jpg",
   "width": 1280,
   "height": 1280,
   "text": "",
   "text_entities": []
  },
  {
   "id": 428,
   "type": "message",
   "date": "2021-12-18T20:02:34",
   "date_unixtime": "1639832554",
   "from": "Asian foods",
   "from_id": "channel1404403642",
   "photo": "photos/photo_389@18-12-2021_20-02-34.jpg",
   "width": 1081,
   "height": 1081,
   "text": "",
   "text_entities": []
  },
  {
   "id": 430,
   "type": "message",
   "date": "2022-01-12T20:38:04",
   "date_unixtime": "1641994684",
   "from": "Asian foods",
   "from_id": "channel1404403642",
   "photo": "photos/photo_390@12-01-2022_20-38-04.jpg",
   "width": 1280,
   "height": 853,
   "text": "",
   "text_entities": []
  },
  {
   "id": 431,
   "type": "message",
   "date": "2022-01-18T20:46:32",
   "date_unixtime": "1642513592",
   "from": "Asian foods",
   "from_id": "channel1404403642",
   "photo": "photos/photo_391@18-01-2022_20-46-32.jpg",
   "width": 800,
   "height": 960,
   "text": "Corn steam\nពោតចំហ៊ុយ",
   "text_entities": [
    {
     "type": "plain",
     "text": "Corn steam\nពោតចំហ៊ុយ"
    }
   ]
  },
  {
   "id": 432,
   "type": "message",
   "date": "2022-01-25T19:49:00",
   "date_unixtime": "1643114940",
   "from": "Asian foods",
   "from_id": "channel1404403642",
   "photo": "photos/photo_392@25-01-2022_19-49-00.jpg",
   "width": 1080,
   "height": 810,
   "text": "",
   "text_entities": []
  },
  {
   "id": 433,
   "type": "message",
   "date": "2022-02-06T17:00:14",
   "date_unixtime": "1644141614",
   "from": "Asian foods",
   "from_id": "channel1404403642",
   "photo": "photos/photo_393@06-02-2022_17-00-14.jpg",
   "width": 960,
   "height": 960,
   "text": "",
   "text_entities": []
  },
  {
   "id": 434,
   "type": "message",
   "date": "2022-02-06T17:00:17",
   "date_unixtime": "1644141617",
   "from": "Asian foods",
   "from_id": "channel1404403642",
   "photo": "photos/photo_394@06-02-2022_17-00-17.jpg",
   "width": 720,
   "height": 721,
   "text": "",
   "text_entities": []
  },
  {
   "id": 435,
   "type": "message",
   "date": "2022-02-07T17:26:33",
   "date_unixtime": "1644229593",
   "from": "Asian foods",
   "from_id": "channel1404403642",
   "photo": "photos/photo_395@07-02-2022_17-26-33.jpg",
   "width": 960,
   "height": 960,
   "text": "",
   "text_entities": []
  },
  {
   "id": 436,
   "type": "message",
   "date": "2022-02-09T17:41:17",
   "date_unixtime": "1644403277",
   "from": "Asian foods",
   "from_id": "channel1404403642",
   "photo": "photos/photo_396@09-02-2022_17-41-17.jpg",
   "width": 960,
   "height": 720,
   "text": "",
   "text_entities": []
  },
  {
   "id": 437,
   "type": "message",
   "date": "2022-02-09T23:29:46",
   "date_unixtime": "1644424186",
   "from": "Asian foods",
   "from_id": "channel1404403642",
   "photo": "photos/photo_397@09-02-2022_23-29-46.jpg",
   "width": 864,
   "height": 648,
   "text": "",
   "text_entities": []
  },
  {
   "id": 439,
   "type": "message",
   "date": "2022-02-11T18:38:17",
   "date_unixtime": "1644579497",
   "from": "Asian foods",
   "from_id": "channel1404403642",
   "photo": "photos/photo_398@11-02-2022_18-38-17.jpg",
   "width": 1280,
   "height": 853,
   "text": "",
   "text_entities": []
  },
  {
   "id": 440,
   "type": "message",
   "date": "2022-02-21T19:51:47",
   "date_unixtime": "1645447907",
   "from": "Asian foods",
   "from_id": "channel1404403642",
   "photo": "photos/photo_399@21-02-2022_19-51-47.jpg",
   "width": 960,
   "height": 1280,
   "text": "",
   "text_entities": []
  },
  {
   "id": 441,
   "type": "message",
   "date": "2022-02-22T21:44:45",
   "date_unixtime": "1645541085",
   "from": "Asian foods",
   "from_id": "channel1404403642",
   "photo": "photos/photo_400@22-02-2022_21-44-45.jpg",
   "width": 1280,
   "height": 848,
   "text": "",
   "text_entities": []
  },
  {
   "id": 442,
   "type": "message",
   "date": "2022-02-22T21:44:45",
   "date_unixtime": "1645541085",
   "from": "Asian foods",
   "from_id": "channel1404403642",
   "photo": "photos/photo_401@22-02-2022_21-44-45.jpg",
   "width": 1013,
   "height": 1023,
   "text": "",
   "text_entities": []
  },
  {
   "id": 443,
   "type": "message",
   "date": "2022-02-22T21:44:45",
   "date_unixtime": "1645541085",
   "from": "Asian foods",
   "from_id": "channel1404403642",
   "photo": "photos/photo_402@22-02-2022_21-44-45.jpg",
   "width": 1280,
   "height": 957,
   "text": "",
   "text_entities": []
  },
  {
   "id": 444,
   "type": "message",
   "date": "2022-02-25T22:53:49",
   "date_unixtime": "1645804429",
   "from": "Asian foods",
   "from_id": "channel1404403642",
   "photo": "photos/photo_403@25-02-2022_22-53-49.jpg",
   "width": 1280,
   "height": 1280,
   "text": "",
   "text_entities": []
  },
  {
   "id": 445,
   "type": "message",
   "date": "2022-03-01T22:58:44",
   "date_unixtime": "1646150324",
   "from": "Asian foods",
   "from_id": "channel1404403642",
   "photo": "photos/photo_404@01-03-2022_22-58-44.jpg",
   "width": 960,
   "height": 1280,
   "text": "",
   "text_entities": []
  },
  {
   "id": 447,
   "type": "message",
   "date": "2022-03-03T15:07:09",
   "date_unixtime": "1646294829",
   "from": "Asian foods",
   "from_id": "channel1404403642",
   "photo": "photos/photo_405@03-03-2022_15-07-09.jpg",
   "width": 960,
   "height": 960,
   "text": "",
   "text_entities": []
  },
  {
   "id": 448,
   "type": "message",
   "date": "2022-03-03T15:07:09",
   "date_unixtime": "1646294829",
   "from": "Asian foods",
   "from_id": "channel1404403642",
   "photo": "photos/photo_406@03-03-2022_15-07-09.jpg",
   "width": 960,
   "height": 960,
   "text": "",
   "text_entities": []
  },
  {
   "id": 449,
   "type": "message",
   "date": "2022-03-03T15:07:09",
   "date_unixtime": "1646294829",
   "from": "Asian foods",
   "from_id": "channel1404403642",
   "photo": "photos/photo_407@03-03-2022_15-07-09.jpg",
   "width": 960,
   "height": 960,
   "text": "",
   "text_entities": []
  },
  {
   "id": 450,
   "type": "message",
   "date": "2022-03-03T15:07:09",
   "date_unixtime": "1646294829",
   "from": "Asian foods",
   "from_id": "channel1404403642",
   "photo": "photos/photo_408@03-03-2022_15-07-09.jpg",
   "width": 960,
   "height": 960,
   "text": "",
   "text_entities": []
  },
  {
   "id": 451,
   "type": "message",
   "date": "2022-03-03T15:07:09",
   "date_unixtime": "1646294829",
   "from": "Asian foods",
   "from_id": "channel1404403642",
   "photo": "photos/photo_409@03-03-2022_15-07-09.jpg",
   "width": 960,
   "height": 918,
   "text": "",
   "text_entities": []
  },
  {
   "id": 452,
   "type": "message",
   "date": "2022-03-13T21:41:50",
   "date_unixtime": "1647182510",
   "from": "Asian foods",
   "from_id": "channel1404403642",
   "photo": "photos/photo_410@13-03-2022_21-41-50.jpg",
   "width": 1280,
   "height": 1280,
   "text": "",
   "text_entities": []
  },
  {
   "id": 453,
   "type": "message",
   "date": "2022-03-13T21:41:54",
   "date_unixtime": "1647182514",
   "from": "Asian foods",
   "from_id": "channel1404403642",
   "photo": "photos/photo_411@13-03-2022_21-41-54.jpg",
   "width": 1280,
   "height": 1280,
   "text": "",
   "text_entities": []
  },
  {
   "id": 454,
   "type": "message",
   "date": "2022-03-16T19:05:48",
   "date_unixtime": "1647432348",
   "from": "Asian foods",
   "from_id": "channel1404403642",
   "photo": "photos/photo_412@16-03-2022_19-05-48.jpg",
   "width": 960,
   "height": 960,
   "text": "",
   "text_entities": []
  },
  {
   "id": 455,
   "type": "message",
   "date": "2022-03-16T19:05:56",
   "date_unixtime": "1647432356",
   "from": "Asian foods",
   "from_id": "channel1404403642",
   "photo": "photos/photo_413@16-03-2022_19-05-56.jpg",
   "width": 835,
   "height": 960,
   "text": "",
   "text_entities": []
  },
  {
   "id": 456,
   "type": "message",
   "date": "2022-03-21T17:26:52",
   "date_unixtime": "1647858412",
   "from": "Asian foods",
   "from_id": "channel1404403642",
   "photo": "photos/photo_414@21-03-2022_17-26-52.jpg",
   "width": 768,
   "height": 960,
   "text": "",
   "text_entities": []
  },
  {
   "id": 457,
   "type": "message",
   "date": "2022-04-06T17:20:57",
   "date_unixtime": "1649240457",
   "from": "Asian foods",
   "from_id": "channel1404403642",
   "photo": "photos/photo_415@06-04-2022_17-20-57.jpg",
   "width": 1242,
   "height": 1242,
   "text": "",
   "text_entities": []
  },
  {
   "id": 458,
   "type": "message",
   "date": "2022-04-22T11:28:11",
   "date_unixtime": "1650601691",
   "from": "Asian foods",
   "from_id": "channel1404403642",
   "photo": "photos/photo_416@22-04-2022_11-28-11.jpg",
   "width": 1190,
   "height": 1191,
   "text": "",
   "text_entities": []
  },
  {
   "id": 459,
   "type": "message",
   "date": "2022-04-26T20:39:27",
   "date_unixtime": "1650980367",
   "from": "Asian foods",
   "from_id": "channel1404403642",
   "photo": "photos/photo_417@26-04-2022_20-39-27.jpg",
   "width": 720,
   "height": 960,
   "text": "",
   "text_entities": []
  },
  {
   "id": 460,
   "type": "message",
   "date": "2022-05-04T11:33:41",
   "date_unixtime": "1651638821",
   "from": "Asian foods",
   "from_id": "channel1404403642",
   "photo": "photos/photo_418@04-05-2022_11-33-41.jpg",
   "width": 843,
   "height": 1124,
   "text": "",
   "text_entities": []
  },
  {
   "id": 461,
   "type": "message",
   "date": "2022-05-11T13:03:15",
   "date_unixtime": "1652248995",
   "from": "Asian foods",
   "from_id": "channel1404403642",
   "photo": "photos/photo_419@11-05-2022_13-03-15.jpg",
   "width": 914,
   "height": 960,
   "text": "",
   "text_entities": []
  },
  {
   "id": 462,
   "type": "message",
   "date": "2022-05-30T12:56:33",
   "date_unixtime": "1653890193",
   "edited": "2022-05-30T12:58:42",
   "edited_unixtime": "1653890322",
   "from": "Asian foods",
   "from_id": "channel1404403642",
   "photo": "photos/photo_420@30-05-2022_12-56-33.jpg",
   "width": 960,
   "height": 720,
   "text": "",
   "text_entities": []
  },
  {
   "id": 464,
   "type": "message",
   "date": "2022-05-30T17:36:42",
   "date_unixtime": "1653907002",
   "edited": "2022-05-30T19:33:44",
   "edited_unixtime": "1653914024",
   "from": "Asian foods",
   "from_id": "channel1404403642",
   "photo": "photos/photo_421@30-05-2022_17-36-42.jpg",
   "width": 720,
   "height": 960,
   "text": "",
   "text_entities": []
  },
  {
   "id": 465,
   "type": "message",
   "date": "2022-06-09T16:52:26",
   "date_unixtime": "1654768346",
   "from": "Asian foods",
   "from_id": "channel1404403642",
   "photo": "photos/photo_422@09-06-2022_16-52-26.jpg",
   "width": 960,
   "height": 960,
   "text": "",
   "text_entities": []
  },
  {
   "id": 466,
   "type": "message",
   "date": "2022-06-13T21:46:50",
   "date_unixtime": "1655131610",
   "edited": "2022-06-13T22:14:11",
   "edited_unixtime": "1655133251",
   "from": "Asian foods",
   "from_id": "channel1404403642",
   "photo": "photos/photo_423@13-06-2022_21-46-50.jpg",
   "width": 960,
   "height": 1280,
   "text": "",
   "text_entities": []
  },
  {
   "id": 467,
   "type": "message",
   "date": "2022-06-15T22:19:50",
   "date_unixtime": "1655306390",
   "edited": "2022-06-16T07:44:38",
   "edited_unixtime": "1655340278",
   "from": "Asian foods",
   "from_id": "channel1404403642",
   "photo": "photos/photo_424@15-06-2022_22-19-50.jpg",
   "width": 960,
   "height": 1280,
   "text": "",
   "text_entities": []
  },
  {
   "id": 468,
   "type": "message",
   "date": "2022-06-15T22:19:50",
   "date_unixtime": "1655306390",
   "from": "Asian foods",
   "from_id": "channel1404403642",
   "photo": "photos/photo_425@15-06-2022_22-19-50.jpg",
   "width": 960,
   "height": 1280,
   "text": "",
   "text_entities": []
  },
  {
   "id": 469,
   "type": "message",
   "date": "2022-06-15T22:19:50",
   "date_unixtime": "1655306390",
   "from": "Asian foods",
   "from_id": "channel1404403642",
   "photo": "photos/photo_426@15-06-2022_22-19-50.jpg",
   "width": 960,
   "height": 1280,
   "text": "",
   "text_entities": []
  },
  {
   "id": 470,
   "type": "message",
   "date": "2022-06-15T22:19:50",
   "date_unixtime": "1655306390",
   "from": "Asian foods",
   "from_id": "channel1404403642",
   "photo": "photos/photo_427@15-06-2022_22-19-50.jpg",
   "width": 960,
   "height": 1280,
   "text": "",
   "text_entities": []
  },
  {
   "id": 472,
   "type": "message",
   "date": "2022-06-20T17:27:23",
   "date_unixtime": "1655720843",
   "from": "Asian foods",
   "from_id": "channel1404403642",
   "photo": "photos/photo_428@20-06-2022_17-27-23.jpg",
   "width": 1280,
   "height": 1280,
   "text": "",
   "text_entities": []
  },
  {
   "id": 473,
   "type": "message",
   "date": "2022-06-23T21:02:56",
   "date_unixtime": "1655992976",
   "from": "Asian foods",
   "from_id": "channel1404403642",
   "photo": "photos/photo_429@23-06-2022_21-02-56.jpg",
   "width": 1280,
   "height": 1280,
   "text": "",
   "text_entities": []
  },
  {
   "id": 474,
   "type": "message",
   "date": "2022-06-24T22:52:40",
   "date_unixtime": "1656085960",
   "from": "Asian foods",
   "from_id": "channel1404403642",
   "photo": "photos/photo_430@24-06-2022_22-52-40.jpg",
   "width": 720,
   "height": 960,
   "text": "",
   "text_entities": []
  },
  {
   "id": 475,
   "type": "message",
   "date": "2022-06-24T22:52:41",
   "date_unixtime": "1656085961",
   "from": "Asian foods",
   "from_id": "channel1404403642",
   "photo": "photos/photo_431@24-06-2022_22-52-41.jpg",
   "width": 720,
   "height": 960,
   "text": "",
   "text_entities": []
  },
  {
   "id": 476,
   "type": "message",
   "date": "2022-06-24T22:52:45",
   "date_unixtime": "1656085965",
   "edited": "2022-09-08T19:13:58",
   "edited_unixtime": "1662639238",
   "from": "Asian foods",
   "from_id": "channel1404403642",
   "photo": "photos/photo_432@24-06-2022_22-52-45.jpg",
   "width": 720,
   "height": 960,
   "text": "",
   "text_entities": []
  },
  {
   "id": 478,
   "type": "message",
   "date": "2022-07-24T16:18:10",
   "date_unixtime": "1658654290",
   "from": "Asian foods",
   "from_id": "channel1404403642",
   "photo": "photos/photo_433@24-07-2022_16-18-10.jpg",
   "width": 1242,
   "height": 1242,
   "text": "",
   "text_entities": []
  },
  {
   "id": 479,
   "type": "message",
   "date": "2022-07-24T16:18:12",
   "date_unixtime": "1658654292",
   "edited": "2022-09-01T14:09:19",
   "edited_unixtime": "1662016159",
   "from": "Asian foods",
   "from_id": "channel1404403642",
   "photo": "photos/photo_434@24-07-2022_16-18-12.jpg",
   "width": 1242,
   "height": 1242,
   "text": "",
   "text_entities": []
  },
  {
   "id": 480,
   "type": "message",
   "date": "2022-07-29T12:52:16",
   "date_unixtime": "1659073936",
   "edited": "2022-09-01T14:09:34",
   "edited_unixtime": "1662016174",
   "from": "Asian foods",
   "from_id": "channel1404403642",
   "photo": "photos/photo_435@29-07-2022_12-52-16.jpg",
   "width": 1045,
   "height": 1280,
   "text": "",
   "text_entities": []
  },
  {
   "id": 481,
   "type": "message",
   "date": "2022-07-29T12:52:18",
   "date_unixtime": "1659073938",
   "edited": "2022-09-01T14:09:42",
   "edited_unixtime": "1662016182",
   "from": "Asian foods",
   "from_id": "channel1404403642",
   "photo": "photos/photo_436@29-07-2022_12-52-18.jpg",
   "width": 924,
   "height": 960,
   "text": "",
   "text_entities": []
  },
  {
   "id": 482,
   "type": "message",
   "date": "2022-07-31T10:12:55",
   "date_unixtime": "1659237175",
   "edited": "2022-09-01T14:09:46",
   "edited_unixtime": "1662016186",
   "from": "Asian foods",
   "from_id": "channel1404403642",
   "photo": "photos/photo_437@31-07-2022_10-12-55.jpg",
   "width": 959,
   "height": 960,
   "text": "",
   "text_entities": []
  },
  {
   "id": 483,
   "type": "message",
   "date": "2022-07-31T10:12:58",
   "date_unixtime": "1659237178",
   "edited": "2022-09-01T14:09:56",
   "edited_unixtime": "1662016196",
   "from": "Asian foods",
   "from_id": "channel1404403642",
   "photo": "photos/photo_438@31-07-2022_10-12-58.jpg",
   "width": 960,
   "height": 960,
   "text": "",
   "text_entities": []
  },
  {
   "id": 485,
   "type": "message",
   "date": "2022-08-18T16:41:25",
   "date_unixtime": "1660815685",
   "edited": "2022-09-01T14:10:06",
   "edited_unixtime": "1662016206",
   "from": "Asian foods",
   "from_id": "channel1404403642",
   "photo": "photos/photo_439@18-08-2022_16-41-25.jpg",
   "width": 902,
   "height": 1280,
   "text": "",
   "text_entities": []
  },
  {
   "id": 486,
   "type": "message",
   "date": "2022-09-13T12:14:30",
   "date_unixtime": "1663046070",
   "edited": "2022-09-17T09:27:34",
   "edited_unixtime": "1663381654",
   "from": "Asian foods",
   "from_id": "channel1404403642",
   "photo": "photos/photo_440@13-09-2022_12-14-30.jpg",
   "width": 1280,
   "height": 960,
   "text": "",
   "text_entities": []
  },
  {
   "id": 487,
   "type": "message",
   "date": "2022-10-15T16:03:11",
   "date_unixtime": "1665824591",
   "edited": "2022-10-15T16:12:22",
   "edited_unixtime": "1665825142",
   "from": "Asian foods",
   "from_id": "channel1404403642",
   "photo": "photos/photo_441@15-10-2022_16-03-11.jpg",
   "width": 1280,
   "height": 1280,
   "text": "",
   "text_entities": []
  }
 ]
}